,Bill Number,Title,Link,Description,Last Action,Governor Signed,Sponsors,Subjects,Session,Types,Last Action Date
0,HB16-1001,State Contract Certify Compliance With Equal Pay Laws,/bills/hb16-1001,Concerning a requirement that a business performing work for the state pursuant to a state contract comply with equal pay standards.,"Last Action:03/30/2016 | Senate Committee on State, Veterans, & Military Affairs Postpone Indefinitely",0,"Rep. J. Danielson, Rep. J. Buckner, Sen. J. Ulibarri",Labor & EmploymentState Government,2016 Regular Session,Type:Bill,2016-03-30
1,HB16-1002,Employee Leave Attend Child's Academic Activities,/bills/hb16-1002,Concerning the ability of an employee of an employer who employs at least fifty employees to take up to eighteen hours of leave from work for purposes of attending his or her child's academic activities.,"Last Action:03/9/2016 | Senate Committee on State, Veterans, & Military Affairs Postpone Indefinitely",0,"Rep. J. Buckner, Sen. A. Kerr",Education & School Finance (Pre & K-12)Labor & Employment,2016 Regular Session,Type:Bill,2016-03-09
2,HB16-1003,Middle Class College Savings Act,/bills/hb16-1003,Concerning the state income tax deductions for contributions to and distributions of investment earnings from the qualified state tuition program established by collegeinvest.,"Last Action:05/5/2016 | Senate Committee on State, Veterans, & Military Affairs Postpone Indefinitely",0,"Rep. B. Pettersen, Rep. D. Young, Sen. M. Merrifield, Sen. N. Todd",Fiscal Policy & TaxesHigher Education,2016 Regular Session,Type:Bill,2016-05-05
3,HB16-1004,Measurable Goals Deadlines Colorado Climate Action Plan,/bills/hb16-1004,Concerning a requirement to include measurable goals that are subject to deadlines in Colorado's climate action plan.,"Last Action:03/30/2016 | Senate Committee on Agriculture, Natural Resources, & Energy Postpone Indefinitely",0,"Rep. F. Winter, Rep. J. Arndt, Sen. J. Kefalas",EnergyNatural Resources & Environment,2016 Regular Session,Type:Bill,2016-03-30
4,HB16-1005,Residential Precipitation Collection,/bills/hb16-1005,Concerning the use of rain barrels to collect precipitation from a residential rooftop for nonpotable outdoor uses.,Last Action:05/12/2016 | Governor Signed,1,"Rep. D. Esgar, Rep. J. Danielson, Sen. M. Merrifield",Water,2016 Regular Session,Type:Bill,2016-05-12
5,HB16-1006,Clarify Tax Exemptions For Housing Authorities,/bills/hb16-1006,"Concerning clarification of the scope of the exemption from government charges for property owned by or leased to a housing authority or owned by, leased to, or under construction by an entity that is wholly owned by an authority, an entity in which an authority has an ownership interest, or an entity in which an entity wholly owned by an authority or of which an authority is the sole member has an ownership interest.",Last Action:05/18/2016 | Governor Signed,1,"Rep. K. Becker, Rep. A. Garnett, Sen. O. Hill",Fiscal Policy & TaxesHousingLocal Government,2016 Regular Session,Type:Bill,2016-05-18
6,HB16-1007,Offenses Against Unborn Children,/bills/hb16-1007,Concerning offenses against an unborn child.,Last Action:02/11/2016 | House Committee on Business Affairs and Labor Postpone Indefinitely,0,Rep. J. Joshi,"Crimes, Corrections, & Enforcement",2016 Regular Session,Type:Bill,2016-02-11
7,HB16-1008,Roadway Shoulder Access For Buses,/bills/hb16-1008,Concerning authorization for the department of transportation to designate an area on a roadway not otherwise laned for traffic for use by commercial vehicles designed to transport sixteen passengers or more that are operated by a governmental entity or government-owned business that transports the general public or by a contractor on behalf of such an entity or government-owned business.,Last Action:03/9/2016 | Governor Signed,1,"Rep. F. Winter, Rep. J. Becker, Sen. J. Cooke, Sen. R. Heath",Transportation & Motor Vehicles,2016 Regular Session,Type:Bill,2016-03-09
8,HB16-1009,Fallen Heroes License Plates Local Authorities,/bills/hb16-1009,"Concerning the issuance of fallen heroes license plates, and, in connection therewith, making an appropriation.",Last Action:04/27/2016 | Senate Committee on Appropriations Postpone Indefinitely,0,"Rep. P. Buck, Sen. J. Cooke",Transportation & Motor Vehicles,2016 Regular Session,Type:Bill,2016-04-27
9,HB16-1010,Destructive Rodent Pest Release Authorization Requirements,/bills/hb16-1010,Concerning the authorization process for the release of destructive rodent pests into a county.,"Last Action:03/21/2016 | House Committee on State, Veterans, & Military Affairs Postpone Indefinitely",0,"Rep. K. Priola, Sen. J. Sonnenberg",AgricultureLocal GovernmentNatural Resources & EnvironmentState Government,2016 Regular Session,Type:Bill,2016-03-21
10,HB16-1011,Metropolitan District Authority Promote Business Development,/bills/hb16-1011,Concerning the removal of restrictions on the authority of a board of a metropolitan district to provide activities in support of business development within the district.,Last Action:04/15/2016 | Governor Signed,1,"Rep. E. Vigil, Sen. L. Garcia, Sen. K. Grantham",Local Government,2016 Regular Session,Type:Bill,2016-04-15
11,HB16-1012,Clerk File Copy Of Municipal Election Results With DOLA Department Of Local Affairs,/bills/hb16-1012,Concerning a requirement that a municipal clerk file a copy of each statement of election results with the division of local government in the department of local affairs rather than the secretary of state.,Last Action:03/16/2016 | Governor Signed,1,"Rep. S. Ryden, Sen. R. Scott",Elections & RedistrictingLocal Government,2016 Regular Session,Type:Bill,2016-03-16
12,HB16-1013,School District Crime Insurance In Lieu Of Bonds,/bills/hb16-1013,Concerning authorizing school districts to purchase crime insurance coverage in lieu of surety bonds.,Last Action:03/18/2016 | Governor Signed,1,"Rep. A. Garnett, Sen. V. Marble",Education & School Finance (Pre & K-12),2016 Regular Session,Type:Bill,2016-03-18
13,HB16-1014,SOS Secretary of State Business Intelligence Center,/bills/hb16-1014,Concerning the creation of the business intelligence center program within the department of state.,Last Action:06/10/2016 | Governor Signed,1,"Rep. A. Williams, Sen. J. Tate",Business & Economic DevelopmentState Government,2016 Regular Session,Type:Bill,2016-06-10
14,HB16-1015,Contingent Repeal Hlth Ins Laws Aligning With ACA,/bills/hb16-1015,"Concerning the repeal of certain provisions of the ""Colorado Health Care Coverage Act"" contingent on the repeal of comparable federal law provisions.","Last Action:02/3/2016 | House Committee on State, Veterans, & Military Affairs Postpone Indefinitely",0,Rep. G. Klingenschmitt,Health Care & Health InsuranceInsurance,2016 Regular Session,Type:Bill,2016-02-03
15,HB16-1016,Using Multiple Measures Of Student Academic Growth,/bills/hb16-1016,Concerning using multiple measures of student academic growth.,"Last Action:05/9/2016 | Senate Committee on State, Veterans, & Military Affairs Postpone Indefinitely",0,"Rep. D. Young, Sen. A. Kerr",Education & School Finance (Pre & K-12),2016 Regular Session,Type:Bill,2016-05-09
16,HB16-1017,Victim Impact Panel Appearances For DUI,/bills/hb16-1017,Concerning appearances before a victim impact panel.,Last Action:03/22/2016 | Governor Signed,1,"Rep. D. Pabon, Rep. P. Lawrence, Sen. J. Cooke, Sen. M. Johnston","Crimes, Corrections, & EnforcementTransportation & Motor Vehicles",2016 Regular Session,Type:Bill,2016-03-22
17,HB16-1018,Transportation Advisory Committee Procedures,/bills/hb16-1018,Concerning a requirement that the statewide transportation advisory committee provide advice and comments regarding transportation-related matters to both the department of transportation and the transportation commission rather than to the department only.,Last Action:03/2/2016 | Governor Signed,1,"Rep. T. Carver, Rep. D. Mitsch Bush, Sen. N. Todd",State GovernmentTransportation & Motor Vehicles,2016 Regular Session,Type:Bill,2016-03-02
18,HB16-1019,Broadcast Burns Watershed Protection,/bills/hb16-1019,Concerning increased authority to use broadcast burning as a tool to promote watershed restoration.,Last Action:03/22/2016 | Governor Signed,1,"Rep. K. Becker, Sen. M. Jones, Sen. E. Roberts",Natural Resources & Environment,2016 Regular Session,Type:Bill,2016-03-22
19,HB16-1020,No Drones Near Airports Or Jails,/bills/hb16-1020,Concerning prohibiting certain uses of an unmanned aircraft system.,Last Action:01/26/2016 | House Committee on Judiciary Postpone Indefinitely,0,"Rep. P. Rosenthal, Sen. J. Cooke","Crimes, Corrections, & Enforcement",2016 Regular Session,Type:Bill,2016-01-26
20,HB16-1021,Race Info ID Application,/bills/hb16-1021,Concerning providing the opportunity to collect identifying information from applicants for state-issued cards.,Last Action:06/10/2016 | Governor Signed,1,"Rep. J. Salazar, Sen. J. Ulibarri, Sen. E. Roberts",State Government,2016 Regular Session,Type:Bill,2016-06-10
21,HB16-1022,Full-day Kindergarten Funding,/bills/hb16-1022,Concerning funding for school districts to provide full-day kindergarten programs.,Last Action:05/5/2016 | House Committee on Appropriations Postpone Indefinitely,0,Rep. J. Wilson,Education & School Finance (Pre & K-12),2016 Regular Session,Type:Bill,2016-05-05
22,HB16-1023,Deadly Force Against An Intruder At A Business,/bills/hb16-1023,Concerning the use of deadly physical force against a person who has made an illegal entry into a place of business.,"Last Action:03/7/2016 | House Committee on State, Veterans, & Military Affairs Postpone Indefinitely",0,Rep. J. Everett,"Crimes, Corrections, & Enforcement",2016 Regular Session,Type:Bill,2016-03-07
23,HB16-1024,Repeal Ammo Magazine Prohibition,/bills/hb16-1024,Concerning the repeal of certain provisions concerning ammunition magazines.,"Last Action:03/7/2016 | House Committee on State, Veterans, & Military Affairs Postpone Indefinitely",0,"Rep. L. Saine, Rep. S. Humphrey, Sen. V. Marble","Crimes, Corrections, & Enforcement",2016 Regular Session,Type:Bill,2016-03-07
24,HB16-1025,Renewal Property Casualty Insurance,/bills/hb16-1025,Concerning statutory recognition that an insurance policy may be subject to renewal by an admitted insurer within the same insurance group as the insurer that issued the insurance policy.,Last Action:03/16/2016 | Governor Signed,1,"Rep. J. Arndt, Sen. J. Tate",Insurance,2016 Regular Session,Type:Bill,2016-03-16
25,HB16-1026,Repeal DOR Department of Revenue Revenue Impact Accounting Requirements,/bills/hb16-1026,Concerning the repeal of the department of revenue's revenue impact accounting requirements related to a group of bills enacted in 2010.,Last Action:03/22/2016 | Governor Signed,1,"Rep. D. Thurlow, Rep. T. Kraft-Tharp, Sen. C. Holbert",Fiscal Policy & Taxes,2016 Regular Session,Type:Bill,2016-03-22
26,HB16-1027,Criminal Deposition For At-risk Persons,/bills/hb16-1027,Concerning depositions in criminal cases in which an at-risk person may not be available for trial.,Last Action:05/19/2016 | Governor Signed,1,"Rep. J. Danielson, Sen. N. Todd, Sen. J. Sonnenberg","Courts & JudicialCrimes, Corrections, & Enforcement",2016 Regular Session,Type:Bill,2016-05-19
27,HB16-1028,FPPA Fire and Police Pension Association Statewide Death & Disability Plan Modifications,/bills/hb16-1028,Concerning modifications to the statewide death and disability plan administered by the fire and police pension association.,Last Action:03/18/2016 | Governor Signed,1,"Rep. K. Van Winkle, Sen. J. Cooke",Local Government,2016 Regular Session,Type:Bill,2016-03-18
28,HB16-1029,Kei Vehicle Roadway Registration For Use,/bills/hb16-1029,Concerning authorization to drive a kei vehicle on public roadways if the kei vehicle is registered with the state.,Last Action:02/3/2016 | House Committee on Transportation & Energy Postpone Indefinitely,0,"Rep. J. Becker, Sen. J. Cooke",Transportation & Motor Vehicles,2016 Regular Session,Type:Bill,2016-02-03
29,HB16-1030,Off-highway Vehicles Regulation And Local Government,/bills/hb16-1030,Concerning the use of off-highway vehicles.,Last Action:04/12/2016 | Governor Signed,1,"Rep. J. Brown, Rep. L. Court, Sen. K. Donovan",Natural Resources & EnvironmentTransportation & Motor Vehicles,2016 Regular Session,Type:Bill,2016-04-12
30,HB16-1031,Modify Transportation Commission Membership,/bills/hb16-1031,Concerning a requirement that legislative council staff present a study of the transportation commission districts of the state to the transportation legislation review committee.,Last Action:06/10/2016 | Governor Signed,1,"Rep. T. Carver, Sen. J. Cooke",State GovernmentTransportation & Motor Vehicles,2016 Regular Session,Type:Bill,2016-06-10
31,HB16-1032,Changes To Contents Of Criminal Summons,/bills/hb16-1032,Concerning changes to the contents of a criminal summons.,Last Action:03/22/2016 | Governor Signed,1,"Rep. S. Lontine, Sen. N. Todd, Sen. J. Cooke","Courts & JudicialCrimes, Corrections, & Enforcement",2016 Regular Session,Type:Bill,2016-03-22
32,HB16-1033,Travel Costs & Members Human Trafficking Council,/bills/hb16-1033,Concerning the Colorado human trafficking council.,Last Action:04/1/2016 | Governor Signed,1,"Rep. E. McCann, Rep. D. Nordberg, Sen. J. Kefalas, Sen. L. Newell","Crimes, Corrections, & Enforcement",2016 Regular Session,Type:Bill,2016-04-01
33,HB16-1034,Emergency Medical Responder Registration Program,/bills/hb16-1034,"Concerning emergency medical responder registration in the department of public health and environment, and, in connection therewith, making an appropriation.",Last Action:06/10/2016 | Governor Signed,1,"Rep. L. Sias, Sen. L. Garcia",Public Health,2016 Regular Session,Type:Bill,2016-06-10
34,HB16-1035,PUC Approval Of Securities Only For Gas & Electric,/bills/hb16-1035,"Concerning the scope of statutes making the issuance of securities by a public utility conditional on approval by the Colorado public utilities commission, and, in connection therewith, clarifying that the approval requirement applies only to electric and gas utilities.",Last Action:04/21/2016 | Governor Signed,1,"Rep. T. Leonard, Sen. R. Scott",Business & Economic DevelopmentEnergy,2016 Regular Session,Type:Bill,2016-04-21
35,HB16-1036,History And Culture In Civil Government,/bills/hb16-1036,"Concerning teaching civil government in public schools, including the history, culture, and contributions of American Indians, Hispanic Americans, African Americans, and Asian Americans, and, in connection therewith, making an appropriation.","Last Action:05/5/2016 | Senate Committee on State, Veterans, & Military Affairs Postpone Indefinitely",0,"Rep. J. Salazar, Sen. J. Ulibarri",Education & School Finance (Pre & K-12),2016 Regular Session,Type:Bill,2016-05-05
36,HB16-1037,Income Tax Credit Employment Of Persons With Disabilities,/bills/hb16-1037,Concerning the creation of an income tax credit to incentivize the employment of persons with disabilities.,Last Action:02/17/2016 | House Committee on Finance Postpone Indefinitely,0,"Rep. J. Windholz, Sen. I. Aguilar",Fiscal Policy & Taxes,2016 Regular Session,Type:Bill,2016-02-17
37,HB16-1038,County Sheriff Optional Affiliation With FPPA Fire and Police Pension Association,/bills/hb16-1038,Concerning optional affiliation with the fire and police pension association by a county sheriff department that does not participate in social security.,Last Action:04/1/2016 | Governor Signed,1,"Rep. J. Melton, Rep. J. Salazar, Sen. M. Jones",Local Government,2016 Regular Session,Type:Bill,2016-04-01
38,HB16-1039,Interstate 70 Motor Vehicle Traction Equipment,/bills/hb16-1039,Concerning a requirement that noncommercial motor vehicles be appropriately equipped when driving on the interstate 70 mountain corridor during winter storm conditions.,Last Action:03/24/2016 | Senate Committee on Transportation Postpone Indefinitely,0,"Rep. D. Mitsch Bush, Rep. B. Rankin, Sen. N. Todd, Sen. K. Donovan",Transportation & Motor Vehicles,2016 Regular Session,Type:Bill,2016-03-24
39,HB16-1040,Auxiliary Emergency Communications,/bills/hb16-1040,"Concerning auxiliary emergency communications in the state, and, in connection therewith, establishing the auxiliary emergency communications unit in the office of emergency management in the department of public safety, and making an appropriation.",Last Action:06/6/2016 | Governor Signed,1,"Rep. J. Singer, Sen. C. Holbert",State Government,2016 Regular Session,Type:Bill,2016-06-06
40,HB16-1041,Repeal Bonding Requirement Marijuana Businesses,/bills/hb16-1041,Concerning the removal of unreasonably impracticable financial requirements applicable to marijuana businesses that are required to be licensed.,Last Action:03/11/2016 | Governor Signed,1,"Rep. S. Lebsock, Sen. C. Holbert","Liquor, Tobacco, & Marijuana",2016 Regular Session,Type:Bill,2016-03-11
41,HB16-1042,Liquor License Exemption Higher Education Brewing Program,/bills/hb16-1042,Concerning an exemption from liquor licensing laws for a brewing program offered by a state institution of higher education.,Last Action:03/18/2016 | Governor Signed,1,"Rep. J. Arndt, Sen. J. Sonnenberg","Higher EducationLiquor, Tobacco, & Marijuana",2016 Regular Session,Type:Bill,2016-03-18
42,HB16-1043,JTC Joint Technology Committee Authority To Approve Requests For Waivers,/bills/hb16-1043,Concerning the joint technology committee's authority to approve the request for a waiver of certain deadlines after moneys for a project have been appropriated.,Last Action:03/18/2016 | Governor Signed,1,"Rep. J. Brown, Sen. R. Baumgardner",Capital ConstructionFiscal Policy & Taxes,2016 Regular Session,Type:Bill,2016-03-18
43,HB16-1044,Extend Repeal Dates Petroleum Storage Tank Fund,/bills/hb16-1044,Concerning the extension of dates related to the petroleum storage tank fund.,Last Action:03/2/2016 | Governor Signed,1,"Rep. J. Becker, Sen. O. Hill",Labor & EmploymentNatural Resources & Environment,2016 Regular Session,Type:Bill,2016-03-02
44,HB16-1045,Starting The Child Tax Credit,/bills/hb16-1045,Concerning the start of the child tax credit.,Last Action:03/2/2016 | House Committee on Finance Postpone Indefinitely,0,"Rep. J. Singer, Sen. M. Merrifield, Sen. J. Kefalas",Fiscal Policy & Taxes,2016 Regular Session,Type:Bill,2016-03-02
45,HB16-1046,Designated Emergency Response Authorities,/bills/hb16-1046,Concerning the response to hazardous substance incidents under designated emergency response authority responsibility.,Last Action:03/31/2016 | Governor Signed,1,"Rep. T. Kraft-Tharp, Sen. R. Baumgardner",Natural Resources & Environment,2016 Regular Session,Type:Bill,2016-03-31
46,HB16-1047,Interstate Medical Licensure Compact,/bills/hb16-1047,"Concerning the adoption of an interstate compact to allow physicians to become licensed in multiple states through an expedited licensure process, and, in connection therewith, making an appropriation.",Last Action:06/8/2016 | Governor Signed,1,"Rep. P. Buck, Rep. F. Winter, Sen. L. Newell, Sen. E. Roberts",Health Care & Health Insurance,2016 Regular Session,Type:Bill,2016-06-08
47,HB16-1048,Expand Scope Business Enterprise Program,/bills/hb16-1048,Concerning modifications to the business enterprise program to be administered by the department of labor and employment under its authority to administer vocational rehabilitation programs.,Last Action:05/4/2016 | Governor Signed,1,"Rep. D. Primavera, Sen. K. Lundberg",Business & Economic DevelopmentHuman ServicesLabor & Employment,2016 Regular Session,Type:Bill,2016-05-04
48,HB16-1049,Crowdfunding Escrow In Depository Institution,/bills/hb16-1049,Concerning an escrow account held by a depository institution on behalf of an issuer of an intrastate offering of securities.,Last Action:03/9/2016 | Governor Signed,1,"Rep. P. Lee, Sen. M. Scheffel, Sen. O. Hill",Financial Services & Commerce,2016 Regular Session,Type:Bill,2016-03-09
49,HB16-1050,Low-income Parents Education Child Care,/bills/hb16-1050,"Concerning a task force to address the child care needs of low-income parents of young children as the parents seek to advance their education, and, in connection therewith, making an appropriation.","Last Action:04/27/2016 | Senate Committee on State, Veterans, & Military Affairs Postpone Indefinitely",0,"Rep. B. Pettersen, Sen. M. Merrifield",Higher EducationHuman ServicesLabor & Employment,2016 Regular Session,Type:Bill,2016-04-27
50,HB16-1051,Forms To Transfer Vehicle Ownership Upon Death,/bills/hb16-1051,Concerning the issuance of beneficiary designation forms to facilitate the transfer of ownership of a vehicle upon the death of an owner.,Last Action:03/23/2016 | Governor Signed,1,"Rep. K. Van Winkle, Sen. C. Holbert",Transportation & Motor Vehicles,2016 Regular Session,Type:Bill,2016-03-23
51,HB16-1052,Wildfire Mitigation Income Tax Credit,/bills/hb16-1052,Concerning changing the wildfire mitigation income tax deduction to the wildfire mitigation income tax credit.,Last Action:01/20/2016 | House Committee on Finance Postpone Indefinitely,0,Rep. K. Becker,Fiscal Policy & Taxes,2016 Regular Session,Type:Bill,2016-01-20
52,HB16-1053,Retail Hydrogen Fuel Systems Regulation,/bills/hb16-1053,Concerning the regulation of retail hydrogen fuel systems for vehicles.,Last Action:03/9/2016 | Governor Signed,1,"Rep. T. Kraft-Tharp, Sen. O. Hill",EnergyTransportation & Motor Vehicles,2016 Regular Session,Type:Bill,2016-03-09
53,HB16-1054,End-of-life Options For Terminally Ill Individuals,/bills/hb16-1054,Concerning end-of-life options for individuals with a terminal illness.,Last Action:02/24/2016 | House Second Reading Laid Over to 6/1/2016 - No Amendments,0,"Rep. L. Court, Rep. J. Ginal, Sen. M. Merrifield",Health Care & Health InsurancePublic Health,2016 Regular Session,Type:Bill,2016-02-24
54,HB16-1055,No State Prerequisites To Sue United States Federal Torts,/bills/hb16-1055,Concerning the ability of Coloradans to sue the United States for its tortious conduct.,"Last Action:01/27/2016 | House Committee on State, Veterans, & Military Affairs Postpone Indefinitely",0,Rep. D. Coram,Courts & Judicial,2016 Regular Session,Type:Bill,2016-01-27
55,HB16-1056,Tow Operator Abandoned Vehicle Title Search,/bills/hb16-1056,"Concerning a requirement that the holder of an abandoned motor vehicle use the records of a national title search to notify persons with an interest in the motor vehicle that the vehicle has been towed and is subject to sale, and, in connection therewith, making an appropriation.",Last Action:06/10/2016 | Governor Signed,1,"Rep. M. Tyler, Sen. R. Baumgardner, Sen. N. Todd",Transportation & Motor Vehicles,2016 Regular Session,Type:Bill,2016-06-10
56,HB16-1057,Seven Day Court Time Intervals,/bills/hb16-1057,Concerning statutorily established time periods that are multiples of seven days.,Last Action:03/18/2016 | Governor Signed,1,"Rep. K. Ransom, Sen. M. Merrifield",Courts & Judicial,2016 Regular Session,Type:Bill,2016-03-18
57,HB16-1058,Misuse Of Electronic Images By A Juvenile,/bills/hb16-1058,Concerning creating the crime of misuse of electronic images by a juvenile.,Last Action:04/25/2016 | House Committee on Public Health Care & Human Services Postpone Indefinitely,0,"Rep. Y. Willett, Rep. R. Fields, Sen. L. Newell, Sen. J. Cooke","Crimes, Corrections, & Enforcement",2016 Regular Session,Type:Bill,2016-04-25
58,HB16-1059,Retaliation Against A Judge,/bills/hb16-1059,"Concerning the definition of ""judge"" for the crime of retaliation against a judge, and, in connection therewith, making an appropriation.",Last Action:04/27/2016 | Senate Committee on Appropriations Postpone Indefinitely,0,"Rep. P. Lawrence, Sen. N. Todd","Courts & JudicialCrimes, Corrections, & Enforcement",2016 Regular Session,Type:Bill,2016-04-27
59,HB16-1060,Colorado State Patrol Roadside Memorials,/bills/hb16-1060,Concerning roadside memorials for fallen state patrol officers.,Last Action:04/21/2016 | Governor Signed,1,"Rep. M. Tyler, Sen. R. Baumgardner",Transportation & Motor Vehicles,2016 Regular Session,Type:Bill,2016-04-21
60,HB16-1061,Military Installation Transportation Needs Planning,/bills/hb16-1061,Concerning a requirement that the transportation infrastructure needs of federal military installations be given full consideration during the preparation of the comprehensive statewide transportation plan.,Last Action:03/31/2016 | Governor Signed,1,"Rep. T. Carver, Rep. D. Nordberg, Sen. N. Todd",Military & VeteransTransportation & Motor Vehicles,2016 Regular Session,Type:Bill,2016-03-31
61,HB16-1062,Limitation On Mental Health Disciplinary Actions,/bills/hb16-1062,Concerning a limitation on when certain disciplinary actions may be commenced against a mental health professional.,Last Action:02/2/2016 | House Committee on Judiciary Postpone Indefinitely,0,Rep. J. Melton,Business & Economic Development,2016 Regular Session,Type:Bill,2016-02-02
62,HB16-1063,Mental Hlth Professional Disclosure School Safety,/bills/hb16-1063,Concerning an exception to the prohibition against disclosing confidential communications with a mental health professional when school safety is at risk.,Last Action:05/18/2016 | Governor Signed,1,"Rep. M. Foote, Rep. C. Duran, Sen. M. Scheffel, Sen. B. Cadman",Civil LawEducation & School Finance (Pre & K-12)Health Care & Health InsuranceHigher Education,2016 Regular Session,Type:Bill,2016-05-18
63,HB16-1064,Medical Marijuana Testing Facility Local Licensing,/bills/hb16-1064,Concerning local licensing of medical marijuana testing facilities.,Last Action:03/23/2016 | Governor Signed,1,"Rep. J. Brown, Sen. E. Roberts","Liquor, Tobacco, & Marijuana",2016 Regular Session,Type:Bill,2016-03-23
64,HB16-1065,Income Tax Credit For Home Health Care,/bills/hb16-1065,Concerning the creation of an income tax credit for home health care.,Last Action:02/24/2016 | House Committee on Finance Postpone Indefinitely,0,Rep. K. Conti,Fiscal Policy & Taxes,2016 Regular Session,Type:Bill,2016-02-24
65,HB16-1066,Habitual Domestic Violence Offenders,/bills/hb16-1066,Concerning an habitual domestic violence offender.,Last Action:04/15/2016 | Governor Signed,1,"Rep. C. Roupe, Sen. L. Newell","Crimes, Corrections, & Enforcement",2016 Regular Session,Type:Bill,2016-04-15
66,HB16-1067,Regional Transportation Authority Mill Levy,/bills/hb16-1067,Concerning extension of the authorization for a regional transportation authority to impose a uniform mill levy on all taxable property within its territory.,Last Action:03/8/2016 | Senate Committee on Transportation Postpone Indefinitely,0,"Rep. D. Mitsch Bush, Sen. K. Donovan",Fiscal Policy & TaxesLocal GovernmentTransportation & Motor Vehicles,2016 Regular Session,Type:Bill,2016-03-08
67,HB16-1068,Regulation Of Methadone Treatment Facilities,/bills/hb16-1068,Concerning the regulation of methadone treatment facilities.,"Last Action:01/27/2016 | House Committee on State, Veterans, & Military Affairs Postpone Indefinitely",0,"Rep. P. Lundeen, Sen. K. Lambert",Human Services,2016 Regular Session,Type:Bill,2016-01-27
68,HB16-1069,Allow City To Set Housing Authority Commission Term Length,/bills/hb16-1069,Concerning the ability of a city's governing body to determine the length of terms for its housing authority commissioners.,Last Action:03/9/2016 | Governor Signed,1,"Rep. B. Rankin, Rep. D. Moreno, Sen. K. Grantham",Local Government,2016 Regular Session,Type:Bill,2016-03-09
69,HB16-1070,Signature Verification In Municipal Mail Ballot Election,/bills/hb16-1070,"Concerning a signature verification requirement for municipal mail ballot elections, and, in connection therewith, making an appropriation.",Last Action:04/22/2016 | Governor Signed,1,"Rep. P. Neville, Sen. T. Neville",Elections & RedistrictingLocal Government,2016 Regular Session,Type:Bill,2016-04-22
70,HB16-1071,County Initiative Powers,/bills/hb16-1071,Concerning initiative powers granted to the registered electors of county governments.,"Last Action:02/1/2016 | House Committee on State, Veterans, & Military Affairs Postpone Indefinitely",0,Rep. J. Windholz,Elections & RedistrictingLocal Government,2016 Regular Session,Type:Bill,2016-02-01
71,HB16-1072,No Statute Limitations Sexual Assault,/bills/hb16-1072,Concerning the elimination of the statute of limitations for a sexual assault.,Last Action:02/11/2016 | House Committee on Judiciary Postpone Indefinitely,0,"Rep. R. Fields, Sen. J. Cooke","Capital ConstructionCrimes, Corrections, & Enforcement",2016 Regular Session,Type:Bill,2016-02-11
72,HB16-1073,Electrical Industry Safety And Training Act,/bills/hb16-1073,Concerning the qualifications of licensed electricians.,Last Action:04/15/2016 | Governor Signed,1,"Rep. C. Duran, Rep. B. DelGrosso, Sen. L. Guzman, Sen. M. Scheffel","Business & Economic DevelopmentGaming, Lottery, & Racing",2016 Regular Session,Type:Bill,2016-04-15
73,HB16-1074,Limited Gaming Revenue For Online Supplemental Education,/bills/hb16-1074,Concerning the reallocation of limited gaming revenue to increase funding for supplemental online education courses in public schools.,"Last Action:01/27/2016 | House Committee on State, Veterans, & Military Affairs Postpone Indefinitely",0,"Rep. T. Dore, Sen. O. Hill","Education & School Finance (Pre & K-12)Fiscal Policy & TaxesGaming, Lottery, & Racing",2016 Regular Session,Type:Bill,2016-01-27
74,HB16-1075,Reestablish Alzheimer's Association Tax Check-off,/bills/hb16-1075,Concerning reestablishment of the voluntary contribution designation benefiting the Alzheimer's Association fund that appears on the state individual income tax return forms.,Last Action:04/7/2016 | House Committee on Finance Postpone Indefinitely,0,"Rep. D. Primavera, Rep. L. Landgraf, Sen. M. Johnston, Sen. B. Martinez Humenik",Fiscal Policy & Taxes,2016 Regular Session,Type:Bill,2016-04-07
75,HB16-1076,Retired Architects,/bills/hb16-1076,Concerning the status of a retired architect.,Last Action:03/16/2016 | Governor Signed,1,"Rep. M. Hamner, Sen. J. Tate",Labor & Employment,2016 Regular Session,Type:Bill,2016-03-16
76,HB16-1077,Recreate Statutory Revision Committee,/bills/hb16-1077,"Concerning the recreation of the statutory revision committee, and, in connection therewith, making an appropriation.",Last Action:06/10/2016 | Governor Signed,1,"Rep. D. Moreno, Sen. B. Martinez Humenik",State Government,2016 Regular Session,Type:Bill,2016-06-10
77,HB16-1078,Local Government Employee Whistleblower Protection,/bills/hb16-1078,Concerning the establishment of whistleblower protection for public employees not employed by the state.,"Last Action:04/27/2016 | Senate Committee on State, Veterans, & Military Affairs Postpone Indefinitely",0,"Rep. D. Kagan, Sen. M. Hodge",Local Government,2016 Regular Session,Type:Bill,2016-04-27
78,HB16-1079,Pesticide-free Cannabis Certification Program,/bills/hb16-1079,"Concerning a certification program for cannabis that is pesticide-free, and, in connection therewith, making an appropriation.","Last Action:05/3/2016 | Senate Committee on Business, Labor, & Technology Postpone Indefinitely",0,"Rep. K. Becker, Rep. J. Singer, Sen. P. Steadman","Liquor, Tobacco, & Marijuana",2016 Regular Session,Type:Bill,2016-05-03
79,HB16-1080,Assault By Strangulation,/bills/hb16-1080,"Concerning assault by strangulation, and, in connection therewith, making an appropriation.",Last Action:06/10/2016 | Governor Signed,1,"Rep. M. Foote, Rep. L. Landgraf, Sen. J. Cooke, Sen. M. Johnston","Crimes, Corrections, & Enforcement",2016 Regular Session,Type:Bill,2016-06-10
80,HB16-1081,Obsolete Reporting Department of Health Care Policy And Financing,/bills/hb16-1081,Concerning removing obsolete reporting provisions in title 25.5 of the Colorado Revised Statutes.,Last Action:03/18/2016 | Governor Signed,1,"Rep. K. Ransom, Rep. D. Esgar, Sen. K. Lundberg, Sen. L. Newell",Health Care & Health Insurance,2016 Regular Session,Type:Bill,2016-03-18
81,HB16-1082,Change Name Area Vocational Schools,/bills/hb16-1082,"Concerning area vocational schools, and, in connection therewith, changing the name of area vocational schools to area technical colleges and adding representation for area technical colleges to certain boards.",Last Action:03/31/2016 | Governor Signed,1,"Rep. A. Garnett, Rep. Y. Willett, Sen. N. Todd",Higher Education,2016 Regular Session,Type:Bill,2016-03-31
82,HB16-1083,Western State Colorado University Role And Mission,/bills/hb16-1083,Concerning the role and mission of Western state Colorado university.,Last Action:04/1/2016 | Governor Signed,1,"Rep. J. Brown, Rep. M. Hamner, Sen. K. Donovan, Sen. K. Grantham",Higher Education,2016 Regular Session,Type:Bill,2016-04-01
83,HB16-1084,Home Brewing By Adult For Personal Use,/bills/hb16-1084,"Concerning a modification to the exemption from the ""Colorado Liquor Code"" for home brewers to permit an adult other than the head of a family to engage in home brewing activities for personal use without obtaining a liquor license.",Last Action:03/18/2016 | Governor Signed,1,"Rep. S. Lebsock, Sen. C. Holbert","Liquor, Tobacco, & Marijuana",2016 Regular Session,Type:Bill,2016-03-18
84,HB16-1085,Simplified Name Change After Divorce,/bills/hb16-1085,Concerning simplifying the process for returning to a prior name after a decree of dissolution or legal separation has been entered.,Last Action:03/31/2016 | Governor Signed,1,"Rep. D. Thurlow, Sen. J. Tate",Children & Domestic Matters,2016 Regular Session,Type:Bill,2016-03-31
85,HB16-1086,Performance Audit Of DPA Department of Personnel & State Personnel Board,/bills/hb16-1086,Concerning a modification of the dates on which the required performance audits of certain governmental entities are due.,Last Action:03/18/2016 | Governor Signed,1,"Rep. S. Ryden, Rep. D. Nordberg, Sen. C. Holbert",State Government,2016 Regular Session,Type:Bill,2016-03-18
86,HB16-1087,Increase Vendor Fee For Collecting State Sales Tax,/bills/hb16-1087,Concerning an increase in the amount of sales tax revenue that may be retained by a retailer to cover the retailer's expense in collecting and remitting the tax.,Last Action:03/16/2016 | House Committee on Finance Postpone Indefinitely,0,Rep. J. Becker,Fiscal Policy & Taxes,2016 Regular Session,Type:Bill,2016-03-16
87,HB16-1088,Fire Protection District Impact Fee On New Development,/bills/hb16-1088,"Concerning the authorization for a fire protection district to impose an impact fee on new development, and, in connection therewith, enacting the ""Public Safety Fairness Act"".",Last Action:06/8/2016 | Governor Signed,1,"Rep. T. Dore, Sen. E. Roberts",Local Government,2016 Regular Session,Type:Bill,2016-06-08
88,HB16-1089,Endowment Or Institutional Fund Gift Tax Credit,/bills/hb16-1089,Concerning an income tax credit for charitable contributions to an eligible endowment or institutional fund.,Last Action:05/5/2016 | House Committee on Appropriations Postpone Indefinitely,0,"Rep. D. Moreno, Sen. C. Holbert",Fiscal Policy & Taxes,2016 Regular Session,Type:Bill,2016-05-05
89,HB16-1090,Excess Foreclosure Proceeds Limit Finder's Fees,/bills/hb16-1090,Concerning the conditions under which a person may assist another for compensation in obtaining the proceeds of a foreclosure sale after all liens have been satisfied.,Last Action:04/15/2016 | Governor Signed,1,"Rep. E. McCann, Sen. C. Jahn","Civil LawCourts & JudicialCrimes, Corrections, & EnforcementHousingState Government",2016 Regular Session,Type:Bill,2016-04-15
90,HB16-1091,Change Due Dates For Electric Utility Transmission Plans,/bills/hb16-1091,"Concerning a change to the biennial filing date for rate-regulated electric utilities to submit their plans for transmission facilities to the public utilities commission, and, in connection therewith, deleting the requirement that the commission issue a final order within one hundred eighty days after an application for the construction or expansion of transmission facilities is filed.",Last Action:03/23/2016 | Governor Signed,1,"Rep. D. Thurlow, Rep. D. Mitsch Bush, Sen. J. Sonnenberg",Business & Economic DevelopmentEnergy,2016 Regular Session,Type:Bill,2016-03-23
91,HB16-1092,Authorize Retail Marijuana Special Event Permit,/bills/hb16-1092,Concerning the authorization of a retail marijuana special event permit.,Last Action:02/16/2016 | House Committee on Public Health Care & Human Services Postpone Indefinitely,0,"Rep. D. Moreno, Sen. V. Marble","Liquor, Tobacco, & Marijuana",2016 Regular Session,Type:Bill,2016-02-16
92,HB16-1093,Election List Maintenance Procedures,/bills/hb16-1093,"Concerning the use of the national change of address database to maintain voter registration records, and, in connection therewith, clarifying terminology and consolidating procedures for county clerks and recorders to follow when it appears that an elector has moved within the state.",Last Action:04/21/2016 | Governor Signed,1,"Rep. K. Ransom, Rep. S. Ryden, Sen. J. Tate",Elections & Redistricting,2016 Regular Session,Type:Bill,2016-04-21
93,HB16-1094,Make References To Attorney General Gender Neutral,/bills/hb16-1094,Concerning making references to the attorney general in the Colorado Revised Statutes gender neutral.,Last Action:04/14/2016 | Governor Signed,1,"Rep. T. Dore, Sen. E. Roberts",State Government,2016 Regular Session,Type:Bill,2016-04-14
94,HB16-1095,Health Insurance For Prescription Eye Drop Refills,/bills/hb16-1095,Concerning health insurance coverage for early refills of prescription eye drops.,Last Action:03/9/2016 | Governor Signed,1,"Rep. E. McCann, Sen. L. Crowder",Health Care & Health Insurance,2016 Regular Session,Type:Bill,2016-03-09
95,HB16-1096,Foreclosure Overbid Amount Return To Homeowner,/bills/hb16-1096,Concerning the eligibility of junior lienors to receive foreclosure overbid funds.,Last Action:03/3/2016 | House Committee on Business Affairs and Labor Postpone Indefinitely,0,"Rep. A. Williams, Sen. J. Tate",Civil LawCourts & JudicialHousing,2016 Regular Session,Type:Bill,2016-03-03
96,HB16-1097,Public Utilities Commission Permit For Medicaid Transportation Providers,/bills/hb16-1097,"Concerning regulation of medicaid nonemergency transportation providers, and, in connection therewith, making and reducing an appropriation.",Last Action:05/20/2016 | Governor Signed,1,"Rep. D. Coram, Rep. D. Moreno, Sen. R. Scott",Health Care & Health Insurance,2016 Regular Session,Type:Bill,2016-05-20
97,HB16-1098,School Discipline Reporting Requirements,/bills/hb16-1098,Concerning updates to provisions related to school discipline reporting.,Last Action:04/15/2016 | Governor Signed,1,"Rep. P. Lawrence, Sen. L. Newell",Education & School Finance (Pre & K-12),2016 Regular Session,Type:Bill,2016-04-15
98,HB16-1099,Repeal Of Mutual Consent Teacher Assignment Requirement,/bills/hb16-1099,Concerning the repeal of the requirement for mutual consent assignments of nonprobationary teachers.,Last Action:04/18/2016 | House Committee on Education Postpone Indefinitely,0,Rep. J. Salazar,Education & School Finance (Pre & K-12),2016 Regular Session,Type:Bill,2016-04-18
99,HB16-1100,Define Tuition Status Unaccompanied Homeless Youth,/bills/hb16-1100,Concerning the ability of unaccompanied homeless youth to determine domicile for purposes of in-state tuition status at institutions of higher education.,Last Action:05/17/2016 | Governor Signed,1,"Rep. B. Pettersen, Rep. D. Esgar, Sen. J. Cooke",Higher Education,2016 Regular Session,Type:Bill,2016-05-17
100,HB16-1101,Medical Decisions For Unrepresented Patients,/bills/hb16-1101,Concerning medical decisions for unrepresented patients.,Last Action:05/18/2016 | Governor Signed,1,"Rep. D. Young, Sen. K. Lundberg",Civil LawHealth Care & Health Insurance,2016 Regular Session,Type:Bill,2016-05-18
101,HB16-1102,Drug Production Costs Transparency Requirements,/bills/hb16-1102,Concerning a requirement that drug manufacturers report production costs for certain high-cost prescription drugs.,"Last Action:03/10/2016 | House Committee on Health, Insurance, & Environment Postpone Indefinitely",0,"Rep. J. Ginal, Sen. L. Newell, Sen. E. Roberts",Health Care & Health Insurance,2016 Regular Session,Type:Bill,2016-03-10
102,HB16-1103,License Pathways For Mental Health Workforce,/bills/hb16-1103,Concerning clarifying license pathways for the mental health professional workforce.,Last Action:04/15/2016 | Governor Signed,1,"Rep. T. Kraft-Tharp, Rep. L. Landgraf, Sen. B. Martinez Humenik, Sen. N. Todd",Health Care & Health Insurance,2016 Regular Session,Type:Bill,2016-04-15
103,HB16-1104,Summons In Lieu Of Warrant For Non-violent Crimes,/bills/hb16-1104,Concerning the issuance of a summons in lieu of a warrant for certain non-violent offenders.,Last Action:04/21/2016 | Governor Signed,1,"Rep. C. Roupe, Sen. J. Cooke","Courts & JudicialCrimes, Corrections, & Enforcement",2016 Regular Session,Type:Bill,2016-04-21
104,HB16-1105,Reestablish Make-a-wish Foundation Tax Check-off,/bills/hb16-1105,Concerning reestablishment of the voluntary contribution designation benefiting the Make-A-Wish Foundation of Colorado fund that appears on the state individual income tax return forms.,Last Action:04/7/2016 | House Committee on Finance Postpone Indefinitely,0,"Rep. J. Wilson, Sen. R. Baumgardner",Fiscal Policy & Taxes,2016 Regular Session,Type:Bill,2016-04-07
105,HB16-1106,County Authority To Designate Pioneer Trail,/bills/hb16-1106,Concerning the authority of a county to designate public roads as a section of a pioneer trail.,Last Action:04/15/2016 | Governor Signed,1,"Rep. J. Wilson, Sen. K. Grantham, Sen. L. Garcia",Local GovernmentTransportation & Motor Vehicles,2016 Regular Session,Type:Bill,2016-04-15
106,HB16-1107,DORA Administrative Complaint Time Frames,/bills/hb16-1107,Concerning time frames for disciplinary proceedings within the department of regulatory agencies.,"Last Action:02/22/2016 | House Committee on State, Veterans, & Military Affairs Postpone Indefinitely",0,Rep. J. Joshi,Business & Economic DevelopmentCivil LawState Government,2016 Regular Session,Type:Bill,2016-02-22
107,HB16-1108,Residential Real Estate Disclose Large Plant Grow,/bills/hb16-1108,Concerning the obligation of the seller of residential real property to disclose the prior use of the property for indoor horticultural operations.,Last Action:02/4/2016 | House Committee on Business Affairs and Labor Postpone Indefinitely,0,Rep. K. Conti,"Civil LawHousingLiquor, Tobacco, & MarijuanaPublic Health",2016 Regular Session,Type:Bill,2016-02-04
108,HB16-1109,Application Of State Water Law To Federal Agencies,/bills/hb16-1109,Concerning limits that the basic tenets of Colorado water law place on the ability of certain federal agencies to impose conditions on a water right owner in exchange for permission to use federal land.,Last Action:04/21/2016 | Governor Signed,1,"Rep. J. Becker, Rep. K. Becker, Sen. J. Sonnenberg, Sen. K. Donovan",Water,2016 Regular Session,Type:Bill,2016-04-21
109,HB16-1110,Parent's Bill Of Rights,/bills/hb16-1110,Concerning a parent's bill of rights.,"Last Action:03/28/2016 | House Committee on State, Veterans, & Military Affairs Postpone Indefinitely",0,"Rep. P. Neville, Sen. T. Neville",Children & Domestic Matters,2016 Regular Session,Type:Bill,2016-03-28
110,HB16-1111,Same Day Voter Registration With Photo ID Identification,/bills/hb16-1111,Concerning a requirement that voters registering to vote immediately prior to or on election day provide a form of identification that shows a photograph of the voter.,"Last Action:03/2/2016 | House Committee on State, Veterans, & Military Affairs Postpone Indefinitely",0,Rep. D. Coram,Elections & Redistricting,2016 Regular Session,Type:Bill,2016-03-02
111,HB16-1112,Training Veterans To Train Service Dogs Pilot Program,/bills/hb16-1112,"Concerning the creation of the training veterans to train their own service dogs pilot program, and, in connection therewith, making an appropriation.",Last Action:06/10/2016 | Governor Signed,1,"Rep. L. Landgraf, Sen. L. Crowder",Health Care & Health InsuranceMilitary & Veterans,2016 Regular Session,Type:Bill,2016-06-10
112,HB16-1113,Protect Human Life At Conception,/bills/hb16-1113,Concerning the protection of human life beginning at conception.,"Last Action:02/11/2016 | House Committee on Health, Insurance, & Environment Postpone Indefinitely",0,"Rep. S. Humphrey, Sen. K. Lundberg","Crimes, Corrections, & Enforcement",2016 Regular Session,Type:Bill,2016-02-11
113,HB16-1114,Repeal Duplicate Reporting Requirements,/bills/hb16-1114,Concerning the repeal of duplicate reporting requirements.,Last Action:06/8/2016 | Governor Signed,1,"Rep. B. DelGrosso, Sen. J. Ulibarri",Labor & Employment,2016 Regular Session,Type:Bill,2016-06-08
114,HB16-1115,No Record Sealing Municipal Domestic Violence,/bills/hb16-1115,Concerning the prohibition of sealing municipal domestic violence convictions.,"Last Action:02/8/2016 | House Committee on State, Veterans, & Military Affairs Postpone Indefinitely",0,Rep. K. Van Winkle,Courts & Judicial,2016 Regular Session,Type:Bill,2016-02-08
115,HB16-1116,Public Forum On Micro-credentialing,/bills/hb16-1116,Concerning a public forum to discuss a model for micro-credentialing.,Last Action:03/28/2016 | House Committee on Education Postpone Indefinitely,0,Rep. R. Fields,Education & School Finance (Pre & K-12)Higher Education,2016 Regular Session,Type:Bill,2016-03-28
116,HB16-1117,Record Custodial Interrogations,/bills/hb16-1117,"Concerning a requirement that custodial interrogations related to investigations for certain serious felonies be electronically recorded, and, in connection therewith, making an appropriation.",Last Action:06/10/2016 | Governor Signed,1,"Rep. D. Kagan, Rep. L. Saine, Sen. I. Aguilar, Sen. J. Cooke","Courts & JudicialCrimes, Corrections, & Enforcement",2016 Regular Session,Type:Bill,2016-06-10
117,HB16-1118,Agreement For Local Government To Repay Sales Tax To State,/bills/hb16-1118,Concerning a local taxing jurisdiction's repayment to the state for a prior sales and use tax distribution.,Last Action:03/3/2016 | House Second Reading Laid Over to 06/01/2016 - No Amendments,0,Rep. L. Court,Fiscal Policy & TaxesLocal Government,2016 Regular Session,Type:Bill,2016-03-03
118,HB16-1119,Modify Sales & Use Tax Exemption For Aircraft,/bills/hb16-1119,Concerning a modification to the number of days that an aircraft may remain in the state after it is purchased for purposes of the sales and use tax exemption on the purchase of certain aircraft.,Last Action:03/23/2016 | Governor Signed,1,"Rep. D. Thurlow, Sen. C. Holbert",Fiscal Policy & Taxes,2016 Regular Session,Type:Bill,2016-03-23
119,HB16-1120,Rabies Vaccinations For Dogs And Cats,/bills/hb16-1120,Concerning the requirement that domestic pets be vaccinated against rabies.,"Last Action:03/17/2016 | Senate Committee on Agriculture, Natural Resources, & Energy Postpone Indefinitely",0,"Rep. J. Ginal, Sen. J. Tate",Public Health,2016 Regular Session,Type:Bill,2016-03-17
120,HB16-1121,Performance Evaluation National Board Certified Teacher,/bills/hb16-1121,Concerning exempting national board certified teachers from annual requirements of the licensed personnel evaluation system for a period not to exceed three years.,Last Action:02/22/2016 | House Committee on Education Postpone Indefinitely,0,"Rep. J. Arndt, Sen. M. Merrifield, Sen. N. Todd",Education & School Finance (Pre & K-12),2016 Regular Session,Type:Bill,2016-02-22
121,HB16-1122,Remote Starter Systems,/bills/hb16-1122,Concerning the use of remote starter systems on unattended vehicles.,Last Action:03/31/2016 | Governor Signed,1,"Rep. J. Everett, Sen. O. Hill, Sen. V. Marble",Transportation & Motor Vehicles,2016 Regular Session,Type:Bill,2016-03-31
122,HB16-1123,Religious Freedom Of Certain Religious Persons,/bills/hb16-1123,Concerning an exemption from public accommodations law requirements for certain religiously affiliated persons.,"Last Action:02/8/2016 | House Committee on State, Veterans, & Military Affairs Postpone Indefinitely",0,"Rep. G. Klingenschmitt, Sen. K. Lundberg",Civil Law,2016 Regular Session,Type:Bill,2016-02-08
123,HB16-1124,Registered Equine Brand Inspections,/bills/hb16-1124,Concerning the elimination of brand inspections for registered equine livestock.,"Last Action:02/3/2016 | House Committee on Agriculture, Livestock, & Natural Resources Postpone Indefinitely",0,Rep. C. Navarro,Agriculture,2016 Regular Session,Type:Bill,2016-02-03
124,HB16-1125,Aligning Definition Of Veteran With Federal Law,/bills/hb16-1125,"Concerning creating a Colorado statutory reference to conform with the federal definition of ""veteran"".",Last Action:03/22/2016 | Governor Signed,1,"Rep. C. Roupe, Sen. R. Baumgardner",Military & Veterans,2016 Regular Session,Type:Bill,2016-03-22
125,HB16-1126,Election Watchers,/bills/hb16-1126,Concerning the role of election watchers in connection with the conduct of elections.,"Last Action:03/14/2016 | House Committee on State, Veterans, & Military Affairs Postpone Indefinitely",0,Rep. J. Windholz,Elections & Redistricting,2016 Regular Session,Type:Bill,2016-03-14
126,HB16-1127,Audits Of CCBs By OSA,/bills/hb16-1127,Concerning a requirement that community-centered boards within the state be audited by the office of the state auditor.,Last Action:04/12/2016 | House Committee on Public Health Care & Human Services Postpone Indefinitely,0,Rep. L. Sias,Human ServicesState Government,2016 Regular Session,Type:Bill,2016-04-12
127,HB16-1128,Extending Concurrent Enrollment Statewide,/bills/hb16-1128,Concerning equalizing student access to concurrent enrollment.,Last Action:04/6/2016 | House Committee on Education Postpone Indefinitely,0,Rep. P. Lundeen,Education & School Finance (Pre & K-12),2016 Regular Session,Type:Bill,2016-04-06
128,HB16-1129,Charitable Fraud Enhanced Enforcement Measures,/bills/hb16-1129,Concerning measures for enhanced enforcement against acts of charitable fraud.,Last Action:06/8/2016 | Governor Signed,1,"Rep. P. Lawrence, Rep. E. McCann, Sen. L. Crowder, Sen. R. Heath","Business & Economic DevelopmentCourts & JudicialCrimes, Corrections, & EnforcementState Government",2016 Regular Session,Type:Bill,2016-06-08
129,HB16-1130,Changes To Colorado Department Of Education Reports,/bills/hb16-1130,Concerning changes to annual reports prepared by the department of education.,Last Action:03/22/2016 | Governor Signed,1,"Rep. K. Priola, Sen. M. Johnston",Education & School Finance (Pre & K-12),2016 Regular Session,Type:Bill,2016-03-22
130,HB16-1131,Public Education Standards and Assessments,/bills/hb16-1131,Concerning accountability measures in the elementary and secondary public education system.,Last Action:03/7/2016 | House Committee on Education Postpone Indefinitely,0,Rep. T. Carver,Education & School Finance (Pre & K-12),2016 Regular Session,Type:Bill,2016-03-07
131,HB16-1132,Residential Storage Condo Unit As Real Property,/bills/hb16-1132,Concerning the inclusion of a residential storage condominium unit in the definition of a residential improvement for purposes of the property tax.,"Last Action:02/3/2016 | House Committee on State, Veterans, & Military Affairs Postpone Indefinitely",0,"Rep. K. Van Winkle, Rep. J. Melton, Sen. K. Grantham, Sen. C. Jahn",Fiscal Policy & TaxesLocal Government,2016 Regular Session,Type:Bill,2016-02-03
132,HB16-1133,HOA Managers Professional Responsibility And Disclosure,/bills/hb16-1133,"Concerning the regulation of community association managers, and, in connection therewith, strengthening disclosure requirements regarding amounts payable for management services and upon transfer of property, reducing license fees and continuing education requirements for managers of small associations, and authorizing disciplinary action against managers who fail to comply with applicable laws and rules.","Last Action:02/22/2016 | House Committee on State, Veterans, & Military Affairs Postpone Indefinitely",0,Rep. J. Windholz,HousingState Government,2016 Regular Session,Type:Bill,2016-02-22
133,HB16-1134,Service-disabled Veteran-owned Business In Procurement,/bills/hb16-1134,Concerning modifications to the service-disabled veteran-owned small businesses preference in state procurement.,Last Action:03/10/2016 | House Committee on Business Affairs and Labor Postpone Indefinitely,0,"Rep. T. Carver, Sen. N. Todd",Military & VeteransState Government,2016 Regular Session,Type:Bill,2016-03-10
134,HB16-1135,Change Columbus Day To Indigenous Peoples' Day,/bills/hb16-1135,Concerning the renaming of the Columbus day holiday to the Indigenous Peoples' day holiday.,"Last Action:04/25/2016 | House Committee on State, Veterans, & Military Affairs Postpone Indefinitely",0,"Rep. J. Salazar, Sen. J. Ulibarri",State Government,2016 Regular Session,Type:Bill,2016-04-25
135,HB16-1136,Multiple Crew Members Required For Freight Trains,/bills/hb16-1136,Concerning a requirement that a common carrier engaged in the transportation of property by railroad have at least two crew members aboard a freight train while the freight train is moving.,"Last Action:03/28/2016 | Senate Committee on State, Veterans, & Military Affairs Postpone Indefinitely",0,"Rep. D. Esgar, Sen. L. Garcia",Transportation & Motor Vehicles,2016 Regular Session,Type:Bill,2016-03-28
136,HB16-1137,Nicotine Products Warning Label,/bills/hb16-1137,Concerning a requirement that certain packaged nicotine products offered for sale in this state have a conspicuously placed warning label on the package stating that the product contains nicotine.,"Last Action:02/11/2016 | House Committee on Health, Insurance, & Environment Postpone Indefinitely",0,"Rep. G. Klingenschmitt, Sen. K. Lundberg","Liquor, Tobacco, & MarijuanaPublic Health",2016 Regular Session,Type:Bill,2016-02-11
137,HB16-1138,General Fund Transfers For State Infrastructure,/bills/hb16-1138,Concerning transfers from the general fund to cash funds for state infrastructure.,"Last Action:02/24/2016 | House Committee on State, Veterans, & Military Affairs Postpone Indefinitely",0,Rep. J. Brown,Capital ConstructionState Revenue & BudgetTransportation & Motor Vehicles,2016 Regular Session,Type:Bill,2016-02-24
138,HB16-1139,Allow Electronic Committee Participation During Interim,/bills/hb16-1139,Concerning electronic participation in committee meetings during the legislative interim.,Last Action:03/9/2016 | Senate Second Reading Lost with Amendments - Committee,0,"Rep. Y. Willett, Rep. J. Arndt, Sen. R. Scott",State Government,2016 Regular Session,Type:Bill,2016-03-09
139,HB16-1140,Campaign Contribution Limits For School District Director Elections,/bills/hb16-1140,"Concerning the establishment of contribution limits under the ""Fair Campaign Practices Act"" for candidates for school district director.","Last Action:03/21/2016 | House Committee on State, Veterans, & Military Affairs Postpone Indefinitely",0,"Rep. L. Court, Rep. D. Pabon",Elections & Redistricting,2016 Regular Session,Type:Bill,2016-03-21
140,HB16-1141,Radon Exposure In Buildings,/bills/hb16-1141,"Concerning the protection of Colorado residents from the hazards associated with naturally occurring radioactive materials in buildings, and in connection therewith, making an appropriation.",Last Action:04/21/2016 | Governor Signed,1,"Rep. K. Becker, Rep. D. Coram, Sen. C. Jahn, Sen. E. Roberts",HousingPublic Health,2016 Regular Session,Type:Bill,2016-04-21
141,HB16-1142,Rural & Frontier Health Care Preceptor Tax Credit,/bills/hb16-1142,Concerning the creation of a credit against the state income tax for rural primary care preceptors training students matriculating at Colorado institutions of higher education.,Last Action:06/6/2016 | Governor Signed,1,"Rep. P. Buck, Rep. J. Ginal, Sen. L. Crowder, Sen. J. Cooke",Fiscal Policy & TaxesHealth Care & Health Insurance,2016 Regular Session,Type:Bill,2016-06-06
142,HB16-1143,Prohibit Red Light Cameras Photo Radar Automated Identification System,/bills/hb16-1143,Concerning the elimination of the use of automated vehicle identification systems for traffic law enforcement.,"Last Action:03/9/2016 | House Committee on State, Veterans, & Military Affairs Postpone Indefinitely",0,"Rep. S. Humphrey, Rep. K. Van Winkle, Sen. T. Neville","Crimes, Corrections, & EnforcementTransportation & Motor Vehicles",2016 Regular Session,Type:Bill,2016-03-09
143,HB16-1144,Transparency College Courses High School Students,/bills/hb16-1144,Concerning transparency in postsecondary courses offered to high school students.,Last Action:03/31/2016 | Governor Signed,1,"Rep. J. Becker, Rep. B. Pettersen, Sen. K. Grantham",Education & School Finance (Pre & K-12)Higher Education,2016 Regular Session,Type:Bill,2016-03-31
144,HB16-1145,Documentary Fee For Residential Real Property,/bills/hb16-1145,Concerning the determination of the documentary fee imposed for recording a grant or conveyance of residential real property.,Last Action:04/15/2016 | Governor Signed,1,"Rep. S. Lebsock, Sen. J. Tate",Local Government,2016 Regular Session,Type:Bill,2016-04-15
145,HB16-1146,Born Alive Infant Protection Act,/bills/hb16-1146,Concerning statutory definitions related to human beings to include every infant human being who is born alive at any stage of development.,"Last Action:02/29/2016 | House Committee on State, Veterans, & Military Affairs Postpone Indefinitely",0,"Rep. L. Landgraf, Rep. L. Sias",Children & Domestic MattersState Government,2016 Regular Session,Type:Bill,2016-02-29
146,HB16-1147,Reduce C-SEAP Colorado State Employee Assistance Program Wait Times For Services,/bills/hb16-1147,Concerning the reduction of wait times for state employees to receive services through the Colorado state employee assistance program.,"Last Action:02/10/2016 | House Committee on State, Veterans, & Military Affairs Postpone Indefinitely",0,Rep. C. Navarro,State Government,2016 Regular Session,Type:Bill,2016-02-10
147,HB16-1148,Health Benefit Exchange Rules and Policies,/bills/hb16-1148,Concerning the oversight authority of the health insurance exchange oversight committee with regard to policies that affect consumers proposed by the health benefit exchange.,Last Action:03/22/2016 | Governor Signed,1,"Rep. L. Sias, Sen. E. Roberts, Sen. J. Kefalas",Health Care & Health Insurance,2016 Regular Session,Type:Bill,2016-03-22
148,HB16-1149,Remove Budget Reporting Exemption HOAs Predate Act,/bills/hb16-1149,"Concerning a requirement that the executive board of a common interest community created in Colorado before July 1, 1992, comply with the budget reporting provision of the ""Colorado Common Interest Ownership Act"".",Last Action:04/15/2016 | Governor Signed,1,"Rep. J. Melton, Sen. L. Newell",Housing,2016 Regular Session,Type:Bill,2016-04-15
149,HB16-1150,Counties Prohibit Underage Nicotine Possession,/bills/hb16-1150,Concerning a clarification of the prohibition against the possession of nicotine products by persons under eighteen years of age by explicitly allowing a county to enact its own prohibition.,Last Action:02/29/2016 | House Second Reading Laid Over to 06/01/2016 - No Amendments,0,Rep. K. Conti,"Liquor, Tobacco, & MarijuanaLocal Government",2016 Regular Session,Type:Bill,2016-02-29
150,HB16-1151,Alcohol Beverage Expand Penalty Mitigation,/bills/hb16-1151,"Concerning the expansion of penalty mitigation under the alcohol beverage laws for vendors meeting the definition of a ""responsible vendor"" as provided by law.",Last Action:03/31/2016 | Governor Signed,1,"Rep. D. Pabon, Sen. C. Holbert","Business & Economic DevelopmentCivil LawLiquor, Tobacco, & Marijuana",2016 Regular Session,Type:Bill,2016-03-31
151,HB16-1152,Department Of Corrections Medication Distribution,/bills/hb16-1152,Concerning the authority of the department of corrections to distribute medication.,Last Action:04/7/2016 | Governor Signed,1,"Rep. M. Foote, Sen. J. Cooke","Crimes, Corrections, & Enforcement",2016 Regular Session,Type:Bill,2016-04-07
152,HB16-1153,Change Due Date For State Board Of Parole Report,/bills/hb16-1153,Concerning the annual date by which the general assembly receives a report regarding outcomes of decisions made by the state board of parole.,Last Action:04/21/2016 | Governor Signed,1,"Rep. J. Melton, Sen. J. Cooke","Crimes, Corrections, & Enforcement",2016 Regular Session,Type:Bill,2016-04-21
153,HB16-1154,Employer Definition Clarify Franchisee Status,/bills/hb16-1154,"Concerning clarification of the construction of the definition of ""employer"" dealing with the employer-employee relationship to include a requirement that an employer must exert a level of control over an employee, and, in connection therewith, providing that a franchisor is not an employer of a franchisee or a franchisee's employees.",Last Action:03/16/2016 | House Committee on Local Government Postpone Indefinitely,0,Rep. B. DelGrosso,Business & Economic DevelopmentLabor & Employment,2016 Regular Session,Type:Bill,2016-03-16
154,HB16-1155,Controlled-access Highway As County Primary Road,/bills/hb16-1155,"Concerning authorization for a county to designate a four-lane controlled-access highway that is located in the county as a primary road of the county highway system, and, in connection therewith, specifying the jurisdiction, control, and duties of the county and of a municipality through which the highway passes with respect to such a highway.",Last Action:04/22/2016 | Governor Signed,1,"Rep. L. Saine, Rep. D. Mitsch Bush, Sen. J. Sonnenberg",Local GovernmentTransportation & Motor Vehicles,2016 Regular Session,Type:Bill,2016-04-22
155,HB16-1156,Extend Pay Transparency Protection All Employees,/bills/hb16-1156,Concerning the prohibition of an action against an employee for sharing wage information.,Last Action:04/19/2016 | Senate Third Reading Lost - No Amendments,0,"Rep. J. Danielson, Rep. J. Salazar, Sen. K. Donovan, Sen. R. Heath",Labor & Employment,2016 Regular Session,Type:Bill,2016-04-19
156,HB16-1157,Sunset Review Skolnik Medical Transparency Act,/bills/hb16-1157,"Concerning the establishment of a future sunset review of the functions delegated to the director of the division of professions and occupations under the ""Michael Skolnik Medical Transparency Act of 2010"" to implement the recommendation of the department of regulatory agencies as contained in its 2015 sunset report pertaining to the division of professions and occupations.",Last Action:04/14/2016 | Governor Signed,1,"Rep. A. Garnett, Rep. T. Kraft-Tharp, Sen. J. Tate",Health Care & Health InsuranceState Government,2016 Regular Session,Type:Bill,2016-04-14
157,HB16-1158,Sunset Identity Theft And Financial Fraud Board,/bills/hb16-1158,Concerning continuation under the sunset law of the identity theft and financial fraud board.,Last Action:05/4/2016 | Governor Signed,1,"Rep. P. Lee, Sen. C. Holbert","Crimes, Corrections, & Enforcement",2016 Regular Session,Type:Bill,2016-05-04
158,HB16-1159,Sunset Colorado Fraud Investigators Unit,/bills/hb16-1159,Concerning continuation under the sunset law of the Colorado fraud investigators unit.,Last Action:05/4/2016 | Governor Signed,1,"Rep. P. Lee, Sen. C. Holbert","Crimes, Corrections, & Enforcement",2016 Regular Session,Type:Bill,2016-05-04
159,HB16-1160,Sunset Surgical Assistants Surgical Technicians,/bills/hb16-1160,"Concerning the continuation of the surgical assistant and surgical technologist registration program, and, in connection therewith, making an appropriation.",Last Action:06/10/2016 | Governor Signed,1,"Rep. J. Ginal, Rep. S. Lontine, Sen. J. Tate",Health Care & Health Insurance,2016 Regular Session,Type:Bill,2016-06-10
160,HB16-1161,Allocate Senior Property Tax Exemption Money,/bills/hb16-1161,Concerning the allocation of certain money that exceeds the total amount of all warrants issued by the state treasurer to reimburse local governmental entities for property tax revenues lost as a result of the application of a certain property tax exemption.,Last Action:03/22/2016 | Governor Signed,1,"Rep. D. Young, Sen. K. Lambert",Fiscal Policy & TaxesState Revenue & Budget,2016 Regular Session,Type:Bill,2016-03-22
161,HB16-1162,Low-performing Schools Administrative Salary Increases,/bills/hb16-1162,Concerning requiring advance public notice of salary increases for administrators of low-performing public education entities.,Last Action:03/14/2016 | House Committee on Education Postpone Indefinitely,0,Rep. C. Navarro,Education & School Finance (Pre & K-12),2016 Regular Session,Type:Bill,2016-03-14
162,HB16-1163,Appropriations From Noxious Weed Management Fund,/bills/hb16-1163,Concerning appropriations from the noxious weed management fund.,Last Action:04/12/2016 | Governor Signed,1,"Rep. B. Rankin, Sen. K. Grantham",State Revenue & Budget,2016 Regular Session,Type:Bill,2016-04-12
163,HB16-1164,Transfer Immunization Exemption Duties To CDPHE,/bills/hb16-1164,Concerning the transfer of responsibilities related to exemptions from immunization requirements from schools to the department of public health and environment.,Last Action:04/25/2016 | House Second Reading Laid Over to 06/01/2016 - No Amendments,0,"Rep. D. Pabon, Sen. I. Aguilar",Education & School Finance (Pre & K-12)Public Health,2016 Regular Session,Type:Bill,2016-04-25
164,HB16-1165,CO Child Support Commission Statutory Changes,/bills/hb16-1165,Concerning statutory changes based on the recommendations in the report of the 2013-2015 Colorado child support commission.,Last Action:05/4/2016 | Governor Signed,1,"Rep. K. Becker, Rep. L. Landgraf, Sen. L. Crowder",Children & Domestic Matters,2016 Regular Session,Type:Bill,2016-05-04
165,HB16-1166,Prohibit Seeking Salary History For Job Applicants,/bills/hb16-1166,Concerning making it an unfair employment practice for an employer to seek salary history about an applicant for employment.,"Last Action:03/30/2016 | Senate Committee on State, Veterans, & Military Affairs Postpone Indefinitely",0,"Rep. B. Pettersen, Rep. F. Winter, Sen. K. Donovan",Labor & Employment,2016 Regular Session,Type:Bill,2016-03-30
166,HB16-1167,Colorado Family First Employer Act,/bills/hb16-1167,"Concerning the creation of the ""Colorado Family First Employer Act"", and, in connection therewith, establishing a program that recognizes Colorado employers that meet certain family-friendly requirements, and making an appropriation.","Last Action:05/2/2016 | Senate Committee on State, Veterans, & Military Affairs Postpone Indefinitely",0,"Rep. F. Winter, Rep. B. Pettersen, Sen. N. Todd, Sen. K. Donovan",Labor & Employment,2016 Regular Session,Type:Bill,2016-05-02
167,HB16-1168,Sunset Rural Alcohol & Substance Abuse Treatment Program,/bills/hb16-1168,Concerning the continuation of the rural alcohol and substance abuse prevention and treatment program.,Last Action:04/14/2016 | Governor Signed,1,"Rep. J. Ginal, Rep. J. Danielson, Sen. R. Scott",Health Care & Health InsurancePublic Health,2016 Regular Session,Type:Bill,2016-04-14
168,HB16-1169,Ute Representatives For Transportation Advisory Committee,/bills/hb16-1169,Concerning the appointment of representatives of the Southern Ute and Ute Mountain Ute tribes as voting members of the statewide transportation advisory committee.,Last Action:04/14/2016 | Governor Signed,1,"Rep. D. Coram, Sen. E. Roberts",State GovernmentTransportation & Motor Vehicles,2016 Regular Session,Type:Bill,2016-04-14
169,HB16-1170,Sunset Division Racing Events,/bills/hb16-1170,"Concerning the continuation of the division of racing events in the department of revenue, and, in connection therewith, implementing recommendation 1 of the 2015 sunset report of the department of regulatory agencies.",Last Action:04/15/2016 | Governor Signed,1,"Rep. E. Vigil, Rep. D. Coram, Sen. J. Sonnenberg, Sen. L. Garcia",AgricultureBusiness & Economic Development,2016 Regular Session,Type:Bill,2016-04-15
170,HB16-1171,Sunset Colorado Special Education Fiscal Advisory Committee,/bills/hb16-1171,Concerning continuation of the Colorado special education fiscal advisory committee.,Last Action:06/8/2016 | Governor Signed,1,"Rep. B. Pettersen, Rep. R. Fields, Sen. L. Woods",Education & School Finance (Pre & K-12),2016 Regular Session,Type:Bill,2016-06-08
171,HB16-1172,CDOT Department of Transportation Efficiency And Accountability Committee,/bills/hb16-1172,"Concerning the reestablishment of a standing efficiency and accountability committee by the state transportation commission, and, in connection therewith, expanding the membership and responsibilities of the committee, subjecting the committee to sunset review, requiring a committee member to disclose a personal or private interest that could be affected by a proposed committee recommendation and abstain from any committee vote to adopt or reject the recommendation, and making an appropriation.",Last Action:06/10/2016 | Governor Signed,1,"Rep. L. Saine, Rep. D. Primavera, Sen. C. Holbert, Sen. T. Neville",State GovernmentTransportation & Motor Vehicles,2016 Regular Session,Type:Bill,2016-06-10
172,HB16-1173,Sunset Continue Water Vessel Registration,/bills/hb16-1173,Concerning the continuation of the regulation of vessels by the department of natural resources.,Last Action:04/21/2016 | Governor Signed,1,"Rep. D. Mitsch Bush, Sen. R. Scott",Natural Resources & EnvironmentTransportation & Motor Vehicles,2016 Regular Session,Type:Bill,2016-04-21
173,HB16-1174,Conservation Easement Tax Credit Landowner Relief,/bills/hb16-1174,Concerning a perpetual conservation easement in gross granted for property in Colorado for which a tax credit claim has been rejected.,Last Action:04/15/2016 | House Committee on Appropriations Postpone Indefinitely,0,"Rep. J. Becker, Sen. J. Sonnenberg",Fiscal Policy & Taxes,2016 Regular Session,Type:Bill,2016-04-15
174,HB16-1175,Property Tax Exemption Administration,/bills/hb16-1175,"Concerning the administration of the property tax exemptions for qualifying seniors and disabled veterans, and, in connection therewith, making an appropriation.",Last Action:06/10/2016 | Governor Signed,1,"Rep. D. Primavera, Rep. D. Nordberg, Sen. C. Jahn, Sen. T. Neville",Fiscal Policy & TaxesLocal GovernmentState Government,2016 Regular Session,Type:Bill,2016-06-10
175,HB16-1176,Wine And Spirits Wholesalers Employee Purchase Program,/bills/hb16-1176,Concerning the authority of a licensed wholesaler to establish an employee purchase program under which its employees may purchase directly from the wholesaler alcohol beverage products sold by that wholesaler.,Last Action:04/14/2016 | Governor Signed,1,"Rep. S. Lebsock, Sen. J. Tate","Liquor, Tobacco, & Marijuana",2016 Regular Session,Type:Bill,2016-04-14
176,HB16-1177,Sunset Council Of Higher Education Representatives,/bills/hb16-1177,Concerning the continuation of the council of higher education representatives.,Last Action:06/6/2016 | Governor Signed,1,"Rep. J. Buckner, Rep. B. Pettersen, Sen. O. Hill",Higher Education,2016 Regular Session,Type:Bill,2016-06-06
177,HB16-1178,In-state Tuition American Indian Tribes Ties To Colorado,/bills/hb16-1178,"Concerning in-state tuition for American Indians from tribes with historical ties to Colorado, and, in connection therewith, making and reducing an appropriation.","Last Action:05/4/2016 | Senate Committee on State, Veterans, & Military Affairs Postpone Indefinitely",0,"Rep. J. Salazar, Sen. J. Ulibarri",Higher Education,2016 Regular Session,Type:Bill,2016-05-04
178,HB16-1179,Concealed Carry For Military Personnel,/bills/hb16-1179,Concerning the possession of concealed handguns by active duty military personnel.,"Last Action:03/7/2016 | House Committee on State, Veterans, & Military Affairs Postpone Indefinitely",0,"Rep. P. Buck, Sen. J. Sonnenberg","Crimes, Corrections, & EnforcementMilitary & Veterans",2016 Regular Session,Type:Bill,2016-03-07
179,HB16-1180,Free Exercise Of Religion,/bills/hb16-1180,Concerning a person's free exercise of religion.,"Last Action:03/16/2016 | House Committee on State, Veterans, & Military Affairs Postpone Indefinitely",0,"Rep. S. Humphrey, Sen. T. Neville",Civil Law,2016 Regular Session,Type:Bill,2016-03-16
180,HB16-1181,Local Government Fracking Ban Liable Royalties,/bills/hb16-1181,Concerning a requirement that a local government that bans hydraulic fracturing compensate oil and gas mineral interest owners affected by the ban.,"Last Action:02/24/2016 | House Committee on State, Veterans, & Military Affairs Postpone Indefinitely",0,Rep. P. Buck,Local GovernmentNatural Resources & Environment,2016 Regular Session,Type:Bill,2016-02-24
181,HB16-1182,Sunset Commodity Metals Theft Task Force,/bills/hb16-1182,Concerning the continuation of the commodity metals theft task force.,Last Action:04/12/2016 | Governor Signed,1,"Rep. L. Court, Rep. C. Duran, Sen. J. Cooke, Sen. R. Heath","Crimes, Corrections, & Enforcement",2016 Regular Session,Type:Bill,2016-04-12
182,HB16-1183,Aligning Federal Changes To Child Care Assistance Program,/bills/hb16-1183,Concerning aligning changes made to the federal child care and development block grant reauthorization of 2014 to the Colorado child care assistance program.,Last Action:05/11/2016 | Senate Considered House Adherence - Result was to Adhere,0,"Rep. J. Buckner, Sen. L. Crowder",Children & Domestic MattersHuman Services,2016 Regular Session,Type:Bill,2016-05-11
183,HB16-1184,High Cost Support Mechanism Fund Transfers To Broadband Fund,/bills/hb16-1184,Concerning the administration of money that is required under existing law to be transferred from the high cost support mechanism to the broadband fund.,Last Action:04/12/2016 | Governor Signed,1,"Rep. B. Rankin, Sen. K. Grantham",Telecommunications & Information Technology,2016 Regular Session,Type:Bill,2016-04-12
184,HB16-1185,Gender Identification On Birth Certificates,/bills/hb16-1185,Concerning the issuance of a new birth certificate with a gender designation that differs from the gender designated on the person's original birth certificate.,"Last Action:03/21/2016 | Senate Committee on State, Veterans, & Military Affairs Postpone Indefinitely",0,"Rep. D. Moreno, Sen. J. Ulibarri",Public Health,2016 Regular Session,Type:Bill,2016-03-21
185,HB16-1186,Moving Ahead For Progress In The 21st Century Act Rail Fixed Guideway Safety Fund Grant Match,/bills/hb16-1186,"Concerning the allocation of a portion of fee revenues collected from public utilities to meet Colorado's grant match obligations under federal law governing the funding of fixed rail guideway safety oversight programs, and, in connection therewith, making an appropriation.",Last Action:06/6/2016 | Governor Signed,1,"Rep. M. Tyler, Sen. R. Baumgardner",Fiscal Policy & TaxesState GovernmentState Revenue & BudgetTransportation & Motor Vehicles,2016 Regular Session,Type:Bill,2016-06-06
186,HB16-1187,Sales & Use Tax Exemption Retirement Communities Food,/bills/hb16-1187,Concerning a sales and use tax exemption for meals provided in certain retirement communities.,Last Action:06/1/2016 | Governor Signed,1,"Rep. T. Kraft-Tharp, Sen. C. Holbert",Fiscal Policy & Taxes,2016 Regular Session,Type:Bill,2016-06-01
187,HB16-1188,Separate Governmental Entity Transparency,/bills/hb16-1188,Concerning requirements for the provision of additional public information by a separate legal entity established by contract by a combination of political subdivisions of the state.,Last Action:04/14/2016 | Governor Signed,1,"Rep. P. Rosenthal, Sen. B. Martinez Humenik",Local Government,2016 Regular Session,Type:Bill,2016-04-14
188,HB16-1189,Bingo-raffle License Regulation Secretary Of State,/bills/hb16-1189,Concerning the regulation of bingo-raffle licensees.,Last Action:04/15/2016 | Governor Signed,1,"Rep. C. Wist, Sen. E. Roberts","Business & Economic DevelopmentGaming, Lottery, & Racing",2016 Regular Session,Type:Bill,2016-04-15
189,HB16-1190,Exclude Detention Facilities From Deadly Force Law,/bills/hb16-1190,Concerning the use of deadly force in a detention facility.,Last Action:04/14/2016 | Governor Signed,1,"Rep. T. Dore, Sen. J. Cooke","Crimes, Corrections, & Enforcement",2016 Regular Session,Type:Bill,2016-04-14
190,HB16-1191,Bill Of Rights For Persons Who Are Homeless,/bills/hb16-1191,Concerning the creation of a bill of rights for persons experiencing homelessness.,Last Action:02/24/2016 | House Committee on Local Government Postpone Indefinitely,0,"Rep. J. Salazar, Rep. J. Melton",HousingLocal Government,2016 Regular Session,Type:Bill,2016-02-24
191,HB16-1192,Recodification Of Sunset Provisions,/bills/hb16-1192,Concerning a nonsubstantive recodification of the sunset review provisions.,Last Action:04/14/2016 | Governor Signed,1,Sen. P. Steadman,State Government,2016 Regular Session,Type:Bill,2016-04-14
192,HB16-1193,Electronic Access Office Respondent Parents' Counsel,/bills/hb16-1193,Concerning granting electronic access to court information to attorneys under contract with the office of the respondent parents' counsel.,Last Action:04/14/2016 | Governor Signed,1,"Rep. M. Hamner, Sen. K. Lambert",Children & Domestic MattersCourts & Judicial,2016 Regular Session,Type:Bill,2016-04-14
193,HB16-1194,Income Tax Deduction For Leasing Out Agricultural Asset,/bills/hb16-1194,Concerning a temporary income tax deduction for a portion of lease payments received by a qualified taxpayer for leasing the taxpayer's agricultural asset to an eligible beginning farmer or rancher.,Last Action:06/8/2016 | Governor Signed,1,"Rep. D. Mitsch Bush, Rep. J. Becker, Sen. J. Sonnenberg",Fiscal Policy & Taxes,2016 Regular Session,Type:Bill,2016-06-08
194,HB16-1195,Home Modification Services In Medicaid Waivers,/bills/hb16-1195,"Concerning home modification services in medicaid home- and community-based services waivers, and, in connection therewith, making an appropriation.",Last Action:04/29/2016 | Senate Committee on Appropriations Postpone Indefinitely,0,"Rep. L. Landgraf, Rep. D. Young, Sen. L. Crowder, Sen. P. Steadman",Health Care & Health Insurance,2016 Regular Session,Type:Bill,2016-04-29
195,HB16-1196,Aspire To College Colorado Pilot Program,/bills/hb16-1196,"Concerning the creation of the aspire to college Colorado pilot program for college savings for preschool children, and, in connection therewith, making an appropriation.","Last Action:05/2/2016 | Senate Committee on State, Veterans, & Military Affairs Postpone Indefinitely",0,"Rep. B. Pettersen, Rep. B. Rankin, Sen. M. Johnston",Higher EducationHuman Services,2016 Regular Session,Type:Bill,2016-05-02
196,HB16-1197,Military Veteran Occupational Credentials,/bills/hb16-1197,"Concerning a requirement that state agencies implement a program to streamline the granting of occupational credentials to veterans based on military training, and, in connection therewith, making an appropriation.",Last Action:05/20/2016 | Governor Signed,1,"Rep. T. Carver, Rep. J. Melton, Sen. N. Todd, Sen. L. Crowder",Business & Economic DevelopmentMilitary & Veterans,2016 Regular Session,Type:Bill,2016-05-20
197,HB16-1198,Computer Courses Fulfill Graduation Requirements,/bills/hb16-1198,Concerning computer science courses fulfilling certain graduation requirements.,Last Action:04/21/2016 | Governor Signed,1,"Rep. D. Pabon, Rep. J. Wilson, Sen. J. Tate, Sen. A. Kerr",Education & School Finance (Pre & K-12),2016 Regular Session,Type:Bill,2016-04-21
198,HB16-1199,Eliminate Bill Limit Exemption Interim Committee Bills,/bills/hb16-1199,Concerning elimination of the exemption from bill limitations established by the joint rules of the Colorado general assembly for legislation recommended by certain committees that meet during the legislative interim.,"Last Action:03/9/2016 | House Committee on State, Veterans, & Military Affairs Postpone Indefinitely",0,"Rep. J. Everett, Sen. V. Marble",State Government,2016 Regular Session,Type:Bill,2016-03-09
199,HB16-1200,Attorney General Authority Over Fetal Tissue Transfers,/bills/hb16-1200,Concerning providing enforcement authority to the attorney general over unlawful transfers of fetal tissue from an induced termination of pregnancy.,"Last Action:04/4/2016 | House Committee on State, Veterans, & Military Affairs Postpone Indefinitely",0,"Rep. K. Ransom, Sen. K. Lundberg",Health Care & Health InsuranceState Government,2016 Regular Session,Type:Bill,2016-04-04
200,HB16-1201,Health Professionals Companion Animals,/bills/hb16-1201,Concerning the requirement that certain medical professionals make a finding regarding the disability of a patient who requests the use of an animal as a reasonable accommodation in housing when that animal does not meet the definition of a service animal.,"Last Action:03/3/2016 | House Committee on Health, Insurance, & Environment Postpone Indefinitely",0,Rep. Y. Willett,Business & Economic DevelopmentHousing,2016 Regular Session,Type:Bill,2016-03-03
201,HB16-1202,Mandatory Employer Electronic Verify Participation,/bills/hb16-1202,Concerning the requirement that all employers in the state verify the work eligibility status of new employees through the federal electronic verification program.,"Last Action:03/9/2016 | House Committee on State, Veterans, & Military Affairs Postpone Indefinitely",0,"Rep. C. Wist, Sen. J. Tate",Labor & Employment,2016 Regular Session,Type:Bill,2016-03-09
202,HB16-1203,Women's Health Protection Act,/bills/hb16-1203,"Concerning the adoption of the ""Women's Health Protection Act"".","Last Action:04/7/2016 | House Committee on Health, Insurance, & Environment Postpone Indefinitely",0,Rep. P. Neville,Health Care & Health InsuranceState Government,2016 Regular Session,Type:Bill,2016-04-07
203,HB16-1204,Allow Concealed Carry On Public School Grounds,/bills/hb16-1204,Concerning permitting the carrying of concealed handguns on public elementary and secondary school properties.,"Last Action:03/7/2016 | House Committee on State, Veterans, & Military Affairs Postpone Indefinitely",0,"Rep. P. Neville, Sen. T. Neville","Crimes, Corrections, & EnforcementEducation & School Finance (Pre & K-12)",2016 Regular Session,Type:Bill,2016-03-07
204,HB16-1205,Motorcycle Lane-splitting,/bills/hb16-1205,Concerning an exception to the prohibitions against driving a motorcycle around motor vehicles blocking the lanes of traffic moving in the same direction.,Last Action:02/17/2016 | House Committee on Transportation & Energy Postpone Indefinitely,0,"Rep. G. Klingenschmitt, Sen. J. Cooke",Transportation & Motor Vehicles,2016 Regular Session,Type:Bill,2016-02-17
205,HB16-1206,Allow Service Members Keep Location Info Private,/bills/hb16-1206,"Concerning the ability of persons with certain connections to post-September 11, 2001, military service to make their current location information exempt from electronic disclosure under the ""Colorado Open Records Act"".","Last Action:03/14/2016 | House Committee on State, Veterans, & Military Affairs Postpone Indefinitely",0,Rep. D. Nordberg,Military & VeteransState Government,2016 Regular Session,Type:Bill,2016-03-14
206,HB16-1207,PERA Public Employees' Retirement Association Investments In Renewable Energy Companies,/bills/hb16-1207,Concerning a requirement that the public employees' retirement association invest a certain percentage of moneys in renewable energy companies.,Last Action:02/24/2016 | House Committee on Finance Postpone Indefinitely,0,Rep. P. Rosenthal,State Government,2016 Regular Session,Type:Bill,2016-02-24
207,HB16-1208,Create Data Privacy Subcommittee,/bills/hb16-1208,"Concerning the creation of a subcommittee to address information security, and, in connection therewith, charging the subcommittee to consider strategies for protecting data and other information resources of the state against unauthorized access, disclosure, use, modification, or destruction.","Last Action:03/21/2016 | House Committee on State, Veterans, & Military Affairs Postpone Indefinitely",0,"Rep. T. Carver, Sen. K. Lundberg, Sen. L. Newell",State GovernmentTelecommunications & Information Technology,2016 Regular Session,Type:Bill,2016-03-21
208,HB16-1209,Working Group To Study Program Evaluation,/bills/hb16-1209,Concerning the creation of a results first working group to examine ways to build program evaluation capacity for state and local programs.,Last Action:05/6/2016 | House Committee on Legislative Council Postpone Indefinitely,0,"Rep. B. Rankin, Rep. K. Becker",State Government,2016 Regular Session,Type:Bill,2016-05-06
209,HB16-1210,Prohibit Conversion Therapy Mental Health Provider,/bills/hb16-1210,Concerning a prohibition on conversion therapy by a licensed mental health provider.,"Last Action:04/11/2016 | Senate Committee on State, Veterans, & Military Affairs Postpone Indefinitely",0,"Rep. P. Rosenthal, Sen. P. Steadman",Health Care & Health Insurance,2016 Regular Session,Type:Bill,2016-04-11
210,HB16-1211,Marijuana Transporter License,/bills/hb16-1211,"Concerning licensing marijuana transporters, and, in connection therewith, making an appropriation.",Last Action:06/10/2016 | Governor Signed,1,"Rep. J. Melton, Sen. R. Baumgardner, Sen. C. Jahn","Liquor, Tobacco, & Marijuana",2016 Regular Session,Type:Bill,2016-06-10
211,HB16-1212,Temporary Tax Incentive For Unreimbursed Medicaid Fees,/bills/hb16-1212,Concerning a temporary tax incentive for the unreimbursed fees charged by health care providers for providing services to medicaid clients.,"Last Action:04/13/2016 | House Committee on State, Veterans, & Military Affairs Postpone Indefinitely",0,Rep. C. Roupe,Fiscal Policy & TaxesHealth Care & Health InsurancePublic Health,2016 Regular Session,Type:Bill,2016-04-13
212,HB16-1213,Civil Action For Intrusion With Electronic Device,/bills/hb16-1213,Concerning a civil remedy for certain damages caused by an intrusion committed through the use of a device.,Last Action:03/24/2016 | House Committee on Judiciary Postpone Indefinitely,0,"Rep. P. Lawrence, Sen. K. Lundberg, Sen. L. Newell",Civil Law,2016 Regular Session,Type:Bill,2016-03-24
213,HB16-1214,Marijuana,/bills/hb16-1214,Concerning measures related to marijuana.,Last Action:02/25/2016 | House Committee on Judiciary Postpone Indefinitely,0,Rep. K. Conti,"Liquor, Tobacco, & Marijuana",2016 Regular Session,Type:Bill,2016-02-25
214,HB16-1215,Purposes Of Parole,/bills/hb16-1215,Concerning changing the statutory purposes of parole to successfully reintegrate parolees into society by providing enhanced supportive services.,Last Action:04/21/2016 | Governor Signed,1,"Rep. E. McCann, Rep. D. Kagan, Sen. L. Guzman","Crimes, Corrections, & Enforcement",2016 Regular Session,Type:Bill,2016-04-21
215,HB16-1216,Facilitate Administration IEC,/bills/hb16-1216,"Concerning measures to facilitate the administration of the independent ethics commission, and, in connection therewith, making and reducing an appropriation.","Last Action:05/9/2016 | Senate Committee on State, Veterans, & Military Affairs Postpone Indefinitely",0,"Rep. E. McCann, Sen. P. Steadman",State Government,2016 Regular Session,Type:Bill,2016-05-09
216,HB16-1217,Implement Homeowners Association Information Office Study Recommendations,/bills/hb16-1217,Concerning the implementation of certain recommendations set forth in the 2013 study of comparable HOA information and resource centers prepared by the Colorado division of real estate pursuant to House Bill 13-1134.,"Last Action:05/2/2016 | Senate Committee on State, Veterans, & Military Affairs Postpone Indefinitely",0,"Rep. S. Ryden, Sen. M. Carroll",HousingState Government,2016 Regular Session,Type:Bill,2016-05-02
217,HB16-1218,A Woman's Right To Accurate Health Care Information,/bills/hb16-1218,"Concerning the creation of the ""Women's Reproductive Information Guarantee for Health and Transparency (RIGHT) Act"".","Last Action:04/21/2016 | House Committee on Health, Insurance, & Environment Postpone Indefinitely",0,"Rep. L. Saine, Sen. T. Neville",Health Care & Health Insurance,2016 Regular Session,Type:Bill,2016-04-21
218,HB16-1219,Motor Vehicle-related Services Consolidation,/bills/hb16-1219,Concerning the assumption of the functions of state drivers' license offices by county vehicle titling and registration offices.,"Last Action:04/11/2016 | House Committee on State, Veterans, & Military Affairs Postpone Indefinitely",0,"Rep. K. Priola, Sen. L. Woods",Local GovernmentState GovernmentTransportation & Motor Vehicles,2016 Regular Session,Type:Bill,2016-04-11
219,HB16-1220,Black Bear Hunting August,/bills/hb16-1220,Concerning changing the legal starting date for the black bear hunting season.,"Last Action:03/28/2016 | House Committee on State, Veterans, & Military Affairs Postpone Indefinitely",0,"Rep. Y. Willett, Rep. E. Vigil",Natural Resources & Environment,2016 Regular Session,Type:Bill,2016-03-28
220,HB16-1221,Budget Cuts To Increase Medicaid Provider Rates,/bills/hb16-1221,Concerning using savings from reductions in funding for an executive state agency's subordinate activities to increase medicaid provider rates.,"Last Action:03/14/2016 | House Committee on State, Veterans, & Military Affairs Postpone Indefinitely",0,Rep. J. Joshi,Health Care & Health InsuranceState GovernmentState Revenue & Budget,2016 Regular Session,Type:Bill,2016-03-14
221,HB16-1222,Supplemental Online Education And Blended Learning Resources,/bills/hb16-1222,"Concerning increasing the availability of supplemental online education resources, and, in connection therewith, creating the statewide supplemental online and blended learning program and making an appropriation.",Last Action:06/10/2016 | Governor Signed,1,"Rep. B. Rankin, Rep. M. Tyler, Sen. N. Todd, Sen. O. Hill",Education & School Finance (Pre & K-12),2016 Regular Session,Type:Bill,2016-06-10
222,HB16-1223,High Cost Support Mechanism Funds,/bills/hb16-1223,Concerning an exception to the application of a statutory reduction in the amount of contributions that the public utilities commission requires telecommunications companies to pay to fund the high cost support mechanism if the amount of the contributions assessed by the public utilities commission would be reduced by an amount greater than that reflected in the statutory reduction when compared to the amount of contributions from the previous year.,Last Action:02/24/2016 | House Committee on Transportation & Energy Postpone Indefinitely,0,"Rep. B. Rankin, Sen. K. Grantham",Telecommunications & Information Technology,2016 Regular Session,Type:Bill,2016-02-24
223,HB16-1224,Treat Trafficking Of Children As Child Abuse,/bills/hb16-1224,Concerning child abuse involving human trafficking of minors.,Last Action:04/15/2016 | Governor Signed,1,"Rep. P. Lundeen, Sen. L. Woods","Children & Domestic MattersCrimes, Corrections, & EnforcementHuman Services",2016 Regular Session,Type:Bill,2016-04-15
224,HB16-1225,School Districts Must Post Director Candidate Information,/bills/hb16-1225,Concerning a requirement that school districts with a certain minimum number of enrolled pupils post information online that is submitted by director candidates prior to the election.,Last Action:06/10/2016 | Governor Signed,1,"Rep. K. Priola, Sen. J. Tate",Education & School Finance (Pre & K-12)Elections & Redistricting,2016 Regular Session,Type:Bill,2016-06-10
225,HB16-1226,Agricultural Innovation Grants,/bills/hb16-1226,"Concerning a program for funding the development of agricultural businesses, and, in connection therewith, making an appropriation.",Last Action:05/5/2016 | House Committee on Appropriations Postpone Indefinitely,0,"Rep. D. Young, Rep. J. Arndt, Sen. K. Grantham",AgricultureBusiness & Economic Development,2016 Regular Session,Type:Bill,2016-05-05
226,HB16-1227,Exemptions Child Support Requirements Child Care Assistance,/bills/hb16-1227,"Concerning exemptions from child support enforcement requirements as a condition of receipt of child care assistance under the Colorado child care assistance program, and, in connection therewith, making an appropriation.",Last Action:05/19/2016 | Governor Signed,1,"Rep. B. DelGrosso, Sen. L. Crowder, Sen. O. Hill",Human Services,2016 Regular Session,Type:Bill,2016-05-19
227,HB16-1228,Agriculture Protection Water Right Transfer Mechanism,/bills/hb16-1228,Concerning an alternative transfer mechanism for water rights that protects the agricultural use for which a water right was originally decreed while permitting renewable one-year transfers of a portion of the water subject to the water right.,Last Action:05/18/2016 | Governor Signed,1,"Rep. J. Arndt, Rep. J. Becker, Sen. K. Donovan, Sen. J. Sonnenberg",Water,2016 Regular Session,Type:Bill,2016-05-18
228,HB16-1229,Higher Education Financial Obligation Repayment,/bills/hb16-1229,Concerning modification of the means of repayment for certain ongoing financial obligations incurred by the state in order to fund capital construction projects for state-supported institutions of higher education.,Last Action:04/14/2016 | Governor Signed,1,"Rep. B. Rankin, Sen. P. Steadman",Capital ConstructionHigher EducationState Government,2016 Regular Session,Type:Bill,2016-04-14
229,HB16-1230,Transparency Online Project Include County Information,/bills/hb16-1230,"Concerning the inclusion of a county's financial information in the state's financial information database, which is known as the transparency online project.",Last Action:04/21/2016 | Governor Signed,1,"Rep. T. Dore, Sen. J. Cooke",Local Government,2016 Regular Session,Type:Bill,2016-04-21
230,HB16-1231,Restricting The Use Of Red Light Cameras,/bills/hb16-1231,Concerning the limited use of automated vehicle identification systems designed to detect disobedience to a traffic signal.,Last Action:06/2/2016 | Governor Vetoed,0,"Rep. S. Lebsock, Sen. M. Carroll","Crimes, Corrections, & EnforcementTransportation & Motor Vehicles",2016 Regular Session,Type:Bill,2016-06-02
231,HB16-1232,Sunset DOR Department Of Revenue Private Letter Ruling & General Information Letter,/bills/hb16-1232,Concerning continuation of the authority of the executive director of the department of revenue to issue written responses upon the request of a taxpayer.,Last Action:06/10/2016 | Governor Signed,1,"Rep. T. Kraft-Tharp, Sen. R. Baumgardner",Fiscal Policy & Taxes,2016 Regular Session,Type:Bill,2016-06-10
232,HB16-1233,Changes To Death Penalty Trials,/bills/hb16-1233,Concerning modifying the procedure for sentencing in class 1 felonies when the death penalty is sought.,"Last Action:02/29/2016 | House Committee on State, Veterans, & Military Affairs Postpone Indefinitely",0,Rep. K. Ransom,"Crimes, Corrections, & Enforcement",2016 Regular Session,Type:Bill,2016-02-29
233,HB16-1234,State Assessment Selection & Local Flexibility,/bills/hb16-1234,"Concerning the consideration of methods for selecting state assessment alternatives that maintain the existing state assessment requirements, and, in connection therewith, making an appropriation.",Last Action:06/10/2016 | Governor Signed,1,"Rep. G. Klingenschmitt, Rep. J. Singer, Sen. M. Merrifield, Sen. V. Marble",Education & School Finance (Pre & K-12),2016 Regular Session,Type:Bill,2016-06-10
234,HB16-1235,Commissions Evaluating State Judicial Performance,/bills/hb16-1235,Concerning a representational state judicial performance commission to increase the flow of information between judicial performance commissions to enhance the commissions' ability to make informed judicial retention recommendations.,"Last Action:04/4/2016 | House Committee on State, Veterans, & Military Affairs Postpone Indefinitely",0,"Rep. K. Van Winkle, Sen. J. Kefalas, Sen. K. Lundberg",Courts & Judicial,2016 Regular Session,Type:Bill,2016-04-04
235,HB16-1236,Sunset Infection Control Advisory Committee,/bills/hb16-1236,Concerning continuation of the infection control advisory committee.,Last Action:04/15/2016 | Governor Signed,1,"Rep. D. Primavera, Sen. L. Crowder",Public Health,2016 Regular Session,Type:Bill,2016-04-15
236,HB16-1237,Supplemental Appropriation Department Of Agriculture,/bills/hb16-1237,Concerning a supplemental appropriation to the department of agriculture.,Last Action:03/11/2016 | Governor Signed,1,"Rep. M. Hamner, Sen. K. Lambert",AgricultureState Revenue & Budget,2016 Regular Session,Type:Bill,2016-03-11
237,HB16-1238,Supplemental Appropriation Department Of Corrections,/bills/hb16-1238,Concerning a supplemental appropriation to the department of corrections.,Last Action:03/11/2016 | Governor Signed,1,"Rep. M. Hamner, Sen. K. Lambert","Crimes, Corrections, & EnforcementState Revenue & Budget",2016 Regular Session,Type:Bill,2016-03-11
238,HB16-1239,"Supplemental Appropriation Department Of Governor,+ Lt Govenor, & Office of State Planning and Budgeting",/bills/hb16-1239,"Concerning a supplemental appropriation to the offices of the governor, lieutenant governor, and state planning and budgeting.",Last Action:03/11/2016 | Governor Signed,1,"Rep. M. Hamner, Sen. K. Lambert",State GovernmentState Revenue & Budget,2016 Regular Session,Type:Bill,2016-03-11
239,HB16-1240,Supplemental Appropriation Department Of Health Care Policy & Financing,/bills/hb16-1240,Concerning a supplemental appropriation to the department of health care policy and financing.,Last Action:03/11/2016 | Governor Signed,1,"Rep. M. Hamner, Sen. K. Lambert",Health Care & Health InsuranceState Revenue & Budget,2016 Regular Session,Type:Bill,2016-03-11
240,HB16-1241,Supplemental Appropriation Department Of Higher Education,/bills/hb16-1241,Concerning a supplemental appropriation to the department of higher education.,Last Action:03/22/2016 | Governor Signed,1,"Rep. M. Hamner, Sen. K. Lambert",Higher EducationState Revenue & Budget,2016 Regular Session,Type:Bill,2016-03-22
241,HB16-1242,Supplemental Appropriation Department Of Human Services,/bills/hb16-1242,Concerning a supplemental appropriation to the department of human services.,Last Action:03/11/2016 | Governor Signed,1,"Rep. M. Hamner, Sen. K. Lambert",Human ServicesState Revenue & Budget,2016 Regular Session,Type:Bill,2016-03-11
242,HB16-1243,Supplemental Appropriation Judicial Department,/bills/hb16-1243,Concerning a supplemental appropriation to the judicial department.,Last Action:03/11/2016 | Governor Signed,1,"Rep. M. Hamner, Sen. K. Lambert",Courts & JudicialState Revenue & Budget,2016 Regular Session,Type:Bill,2016-03-11
243,HB16-1244,Supplemental Appropriation Department Of Law,/bills/hb16-1244,Concerning a supplemental appropriation to the department of law.,Last Action:03/11/2016 | Governor Signed,1,"Rep. M. Hamner, Sen. K. Lambert",State GovernmentState Revenue & Budget,2016 Regular Session,Type:Bill,2016-03-11
244,HB16-1245,Supplemental Appropriation Department Of Military Affairs,/bills/hb16-1245,Concerning a supplemental appropriation to the department of military and veterans affairs.,Last Action:03/11/2016 | Governor Signed,1,"Rep. M. Hamner, Sen. K. Lambert",Military & VeteransState Revenue & Budget,2016 Regular Session,Type:Bill,2016-03-11
245,HB16-1246,Supplemental Appropriation Department Of Personnel,/bills/hb16-1246,Concerning a supplemental appropriation to the department of personnel.,Last Action:03/11/2016 | Governor Signed,1,"Rep. M. Hamner, Sen. K. Lambert",State GovernmentState Revenue & Budget,2016 Regular Session,Type:Bill,2016-03-11
246,HB16-1247,Supplemental Appropriation Department Of Public Health & Environment,/bills/hb16-1247,Concerning a supplemental appropriation to the department of public health and environment.,Last Action:04/14/2016 | Governor Signed,1,"Rep. M. Hamner, Sen. K. Lambert",Public HealthState Revenue & Budget,2016 Regular Session,Type:Bill,2016-04-14
247,HB16-1248,Supplemental Appropriation Department Of Public Safety,/bills/hb16-1248,Concerning a supplemental appropriation to the department of public safety.,Last Action:03/11/2016 | Governor Signed,1,"Rep. M. Hamner, Sen. K. Lambert","Crimes, Corrections, & EnforcementState GovernmentState Revenue & Budget",2016 Regular Session,Type:Bill,2016-03-11
248,HB16-1249,Supplemental Appropriation Department Of Regulatory Agencies,/bills/hb16-1249,Concerning a supplemental appropriation to the department of regulatory agencies.,Last Action:03/11/2016 | Governor Signed,1,"Rep. M. Hamner, Sen. K. Lambert",State GovernmentState Revenue & Budget,2016 Regular Session,Type:Bill,2016-03-11
249,HB16-1250,Supplemental Appropriation Department Of Revenue,/bills/hb16-1250,Concerning a supplemental appropriation to the department of revenue.,Last Action:03/11/2016 | Governor Signed,1,"Rep. M. Hamner, Sen. K. Lambert",State GovernmentState Revenue & Budget,2016 Regular Session,Type:Bill,2016-03-11
250,HB16-1251,Supplemental Appropriation Department Of Treasury,/bills/hb16-1251,Concerning a supplemental appropriation to the department of the treasury.,Last Action:03/11/2016 | Governor Signed,1,"Rep. M. Hamner, Sen. K. Lambert",State GovernmentState Revenue & Budget,2016 Regular Session,Type:Bill,2016-03-11
251,HB16-1252,Supplemental Appropriation Department Of Capital Construction,/bills/hb16-1252,"Concerning funding for capital construction, and making supplemental appropriations in connection therewith.",Last Action:03/11/2016 | Governor Signed,1,"Rep. M. Hamner, Sen. K. Lambert",Capital ConstructionState Revenue & Budget,2016 Regular Session,Type:Bill,2016-03-11
252,HB16-1253,Current Year Adjustments To School Finance,/bills/hb16-1253,"Concerning adjustments in the amount of total program funding for public schools for the 2015-16 budget year, and, in connection therewith, making and reducing an appropriation.",Last Action:03/9/2016 | Governor Signed,1,"Rep. M. Hamner, Sen. P. Steadman",Education & School Finance (Pre & K-12),2016 Regular Session,Type:Bill,2016-03-09
253,HB16-1254,Peace Officers Standards And Training Board Training Persons With Disabilities,/bills/hb16-1254,concerning wrongs to persons with intellectual and developmental disabilities.,Last Action:03/9/2016 | Governor Signed,1,"Rep. D. Young, Sen. K. Grantham","Crimes, Corrections, & Enforcement",2016 Regular Session,Type:Bill,2016-03-09
254,HB16-1255,Manage Forests To Improve Water Supply Conditions,/bills/hb16-1255,Concerning additional methods to manage forests to secure favorable conditions for water supply.,Last Action:04/21/2016 | Governor Signed,1,"Rep. D. Coram, Rep. E. Vigil, Sen. R. Baumgardner",Natural Resources & EnvironmentWater,2016 Regular Session,Type:Bill,2016-04-21
255,HB16-1256,South Platte Water Storage Study,/bills/hb16-1256,"Concerning a study regarding the creation of additional water storage in the South Platte river basin, and, in connection therewith, making an appropriation.",Last Action:06/6/2016 | Governor Signed,1,"Rep. J. Brown, Sen. J. Sonnenberg",Water,2016 Regular Session,Type:Bill,2016-06-06
256,HB16-1257,Rule Review Bill,/bills/hb16-1257,Concerning implementation of recommendations of the committee on legal services in connection with legislative review of rules and regulations of state agencies.,Last Action:05/9/2016 | Governor Signed,1,"Rep. E. McCann, Sen. M. Scheffel",State Government,2016 Regular Session,Type:Bill,2016-05-09
257,HB16-1258,Court Clerks Posting Of Service,/bills/hb16-1258,Concerning the posting by court clerks of process when a respondent is served by publication.,Last Action:04/21/2016 | Governor Signed,1,"Rep. J. Melton, Sen. K. Lundberg",Children & Domestic MattersCourts & Judicial,2016 Regular Session,Type:Bill,2016-04-21
258,HB16-1259,Changes To Local District College Statutes,/bills/hb16-1259,"Concerning local district junior colleges, and, in connection therewith, changing the term local district junior college to local district college.",Last Action:04/21/2016 | Governor Signed,1,"Rep. D. Mitsch Bush, Rep. J. Wilson, Sen. J. Cooke, Sen. K. Donovan",Higher Education,2016 Regular Session,Type:Bill,2016-04-21
259,HB16-1260,Extend Statute Of Limitations Sexual Assault,/bills/hb16-1260,Concerning extending the criminal statute of limitations for a sexual assault to twenty years.,Last Action:06/10/2016 | Governor Signed,1,"Rep. R. Fields, Sen. J. Cooke, Sen. M. Johnston","Courts & JudicialCrimes, Corrections, & Enforcement",2016 Regular Session,Type:Bill,2016-06-10
260,HB16-1261,Retail Marijuana Sunset,/bills/hb16-1261,"Concerning continuation of the Colorado retail marijuana code, and, in connection therewith, implementing the recommendations of the 2015 sunset report issued by the department of regulatory agencies and making an appropriation.",Last Action:06/10/2016 | Governor Signed,1,"Rep. D. Pabon, Sen. C. Jahn, Sen. R. Baumgardner","Liquor, Tobacco, & Marijuana",2016 Regular Session,Type:Bill,2016-06-10
261,HB16-1262,Law Enforcement Background Check Employment Waiver,/bills/hb16-1262,"Concerning measures to improve peace officer hiring, and, in connection therewith, requiring employment waivers as part of the background check process for a person applying for a position as a peace officer who has worked as an officer and giving the P.O.S.T. board the authority to deny certification to an applicant who entered into a deferred agreement.",Last Action:06/10/2016 | Governor Signed,1,"Rep. A. Williams, Sen. J. Cooke","Crimes, Corrections, & EnforcementState Government",2016 Regular Session,Type:Bill,2016-06-10
262,HB16-1263,Racial Profiling Prohibition,/bills/hb16-1263,Concerning updates to the statutory prohibition on profiling by peace officers.,Last Action:06/10/2016 | Governor Signed,1,"Rep. A. Williams, Sen. J. Ulibarri","Crimes, Corrections, & EnforcementState Government",2016 Regular Session,Type:Bill,2016-06-10
263,HB16-1264,Ban Law Enforcement Use Of Chokehold,/bills/hb16-1264,Concerning prohibiting the use of a chokehold by a peace officer.,Last Action:06/10/2016 | Governor Signed,1,"Rep. J. Melton, Sen. M. Johnston","Crimes, Corrections, & Enforcement",2016 Regular Session,Type:Bill,2016-06-10
264,HB16-1265,Expunge Arrest Records Based On Mistaken Identity,/bills/hb16-1265,Concerning expungement of arrest records based on mistaken identity.,Last Action:06/10/2016 | Governor Signed,1,"Rep. J. Melton, Rep. D. Esgar, Sen. M. Johnston, Sen. J. Cooke","Crimes, Corrections, & EnforcementState Government",2016 Regular Session,Type:Bill,2016-06-10
265,HB16-1266,Department Of Revenue Seize Destroy Marijuana Unauthorized Pesticide,/bills/hb16-1266,"Concerning the department of revenue's authority over marijuana that contains chemical contaminants, and, in connection therewith, making an appropriation.","Last Action:04/27/2016 | Senate Committee on State, Veterans, & Military Affairs Postpone Indefinitely",0,"Rep. K. Becker, Sen. J. Cooke","Liquor, Tobacco, & Marijuana",2016 Regular Session,Type:Bill,2016-04-27
266,HB16-1267,Colorado Veterans' Service-To-Career Pilot Program,/bills/hb16-1267,"Concerning the ""Colorado Veterans' Service-to-Career Pilot Program"", and, in connection therewith, creating a grant program through the department of labor and employment to aid work force centers in supporting veterans and their spouses seeking new employment and careers, and making an appropriation.",Last Action:05/20/2016 | Governor Signed,1,"Rep. P. Lee, Rep. R. Fields, Sen. L. Woods, Sen. M. Carroll",Labor & Employment,2016 Regular Session,Type:Bill,2016-05-20
267,HB16-1268,District Attorney Representation Interstate Offender Compacts,/bills/hb16-1268,Concerning district attorneys representation in certain hearings arising from interstate supervision compacts.,Last Action:05/4/2016 | Governor Signed,1,"Rep. M. Foote, Sen. J. Cooke","Crimes, Corrections, & Enforcement",2016 Regular Session,Type:Bill,2016-05-04
268,HB16-1269,Electronic And Mail Application For Identification Cards,/bills/hb16-1269,Concerning the ability of the department of revenue to allow additional application methods for identification cards.,Last Action:04/12/2016 | Governor Signed,1,"Rep. J. Melton, Sen. J. Cooke",State GovernmentTransportation & Motor Vehicles,2016 Regular Session,Type:Bill,2016-04-12
269,HB16-1270,Security Interest Owner's Interest In Business Entity,/bills/hb16-1270,Concerning the limitation of laws governing security interests to an owner's interest in a business entity.,Last Action:04/21/2016 | Governor Signed,1,"Rep. P. Lee, Sen. M. Scheffel, Sen. R. Heath",Financial Services & Commerce,2016 Regular Session,Type:Bill,2016-04-21
270,HB16-1271,Limited Winery Direct Delivery Personal Consumers,/bills/hb16-1271,Concerning the ability of a limited winery that has a winery direct shipper's permit to deliver vinous liquors of its own manufacture directly to a personal consumer without the use of a common carrier.,Last Action:04/21/2016 | Governor Signed,1,"Rep. J. Singer, Rep. D. Nordberg, Sen. C. Jahn, Sen. K. Lundberg","Liquor, Tobacco, & Marijuana",2016 Regular Session,Type:Bill,2016-04-21
271,HB16-1272,Disconnection Of Land From A Municipality,/bills/hb16-1272,Concerning procedures to be followed in connection with the disconnection by ordinance of land from a municipality.,Last Action:04/14/2016 | Governor Signed,1,"Rep. T. Kraft-Tharp, Sen. J. Tate",Local Government,2016 Regular Session,Type:Bill,2016-04-14
272,HB16-1273,Authorize Parking Fees At CDOT Colorado Department of Transportation Parking Facilities,/bills/hb16-1273,Concerning limited authority for the department of transportation to enforce parking fines for violations of rules governing parking at department parking facilities.,"Last Action:04/27/2016 | Senate Committee on State, Veterans, & Military Affairs Postpone Indefinitely",0,"Rep. J. Arndt, Sen. N. Todd",Transportation & Motor Vehicles,2016 Regular Session,Type:Bill,2016-04-27
273,HB16-1274,Identification Documents Unlawful Presence,/bills/hb16-1274,"Concerning the issuance of identification documents to individuals who cannot demonstrate lawful presence in the United States, and, in connection therewith, making an appropriation.","Last Action:05/4/2016 | Senate Committee on State, Veterans, & Military Affairs Postpone Indefinitely",0,"Rep. J. Singer, Sen. J. Ulibarri",State GovernmentTransportation & Motor Vehicles,2016 Regular Session,Type:Bill,2016-05-04
274,HB16-1275,Taxation Of Corp Income Sheltered In Tax Haven,/bills/hb16-1275,Concerning the taxation of a corporation's state income that is sheltered in a foreign jurisdiction for purposes of tax avoidance.,"Last Action:03/28/2016 | Senate Committee on State, Veterans, & Military Affairs Postpone Indefinitely",0,"Rep. M. Foote, Rep. B. Pettersen, Sen. M. Jones, Sen. K. Donovan",Fiscal Policy & Taxes,2016 Regular Session,Type:Bill,2016-03-28
275,HB16-1276,Conduct Emergency Responses At Legacy Mining Sites,/bills/hb16-1276,"Concerning the division of reclamation, mining, and safety's ability to conduct emergency responses at legacy hard rock mining sites.",Last Action:05/17/2016 | Governor Signed,1,"Rep. M. Hamner, Rep. D. Coram, Sen. E. Roberts, Sen. K. Donovan",Natural Resources & Environment,2016 Regular Session,Type:Bill,2016-05-17
276,HB16-1277,Appeal Process For Changes To Medicaid Benefits,/bills/hb16-1277,"Concerning the appeal process for medical assistance benefits, and, in connection therewith, making an appropriation.",Last Action:06/1/2016 | Governor Signed,1,"Rep. S. Lontine, Rep. L. Landgraf, Sen. J. Kefalas, Sen. E. Roberts",Health Care & Health Insurance,2016 Regular Session,Type:Bill,2016-06-01
277,HB16-1278,Residential Drug Treatment For Probationers,/bills/hb16-1278,Concerning residential drug treatment for persons on probation.,Last Action:05/20/2016 | Governor Signed,1,"Rep. P. Lee, Sen. J. Cooke","Crimes, Corrections, & Enforcement",2016 Regular Session,Type:Bill,2016-05-20
278,HB16-1279,Creation Of Sister-state Relationship Program,/bills/hb16-1279,Concerning the creation of an international sister-state relationship program by the Colorado office of economic development.,"Last Action:05/2/2016 | Senate Committee on State, Veterans, & Military Affairs Postpone Indefinitely",0,"Rep. P. Rosenthal, Sen. L. Newell",State Government,2016 Regular Session,Type:Bill,2016-05-02
279,HB16-1280,Update Air Ambulance Regulation,/bills/hb16-1280,"Concerning the regulation of air ambulance service, and, in connection therewith, making an appropriation.",Last Action:06/1/2016 | Governor Signed,1,"Rep. F. Winter, Sen. K. Lambert",Health Care & Health InsuranceState GovernmentTransportation & Motor Vehicles,2016 Regular Session,Type:Bill,2016-06-01
280,HB16-1281,Twice Monthly Payroll System For State Employees,/bills/hb16-1281,Concerning modifications to the implementation of the state's payroll system that will allow all state employees to be paid twice a month.,Last Action:04/28/2016 | Senate Committee on Finance Postpone Indefinitely,0,"Rep. D. Young, Sen. J. Tate",State Government,2016 Regular Session,Type:Bill,2016-04-28
281,HB16-1282,Align Regular Biennial School Elections & FCPA Fair Campaign Practices Act,/bills/hb16-1282,"Concerning the alignment of regular biennial school elections with disclosure requirements governing other election races under the ""Fair Campaign Practices Act"", and, in connection therewith, making an appropriation.",Last Action:06/8/2016 | Governor Signed,1,"Rep. K. Becker, Rep. B. Pettersen, Sen. N. Todd, Sen. J. Tate",Elections & Redistricting,2016 Regular Session,Type:Bill,2016-06-08
282,HB16-1283,Water Loss Audit Report Performance Standards,/bills/hb16-1283,Concerning measures to decrease water loss by domestic water suppliers.,"Last Action:04/4/2016 | House Committee on Agriculture, Livestock, & Natural Resources Postpone Indefinitely",0,Rep. K. Becker,Local GovernmentWater,2016 Regular Session,Type:Bill,2016-04-04
283,HB16-1284,Divest From Companies With Prohibitions Against Israel,/bills/hb16-1284,Concerning divestment by the public employees' retirement association from companies that have economic prohibitions against the state of Israel.,Last Action:03/18/2016 | Governor Signed,1,"Rep. D. Nordberg, Rep. D. Moreno, Sen. O. Hill, Sen. L. Garcia",State Government,2016 Regular Session,Type:Bill,2016-03-18
284,HB16-1285,Privatizing Public Safety Driving Test Retake,/bills/hb16-1285,Concerning a procedure by which an applicant for a driver's license may use a private vendor to readminister the driving test after the applicant fails on the first attempt.,"Last Action:04/25/2016 | Senate Committee on State, Veterans, & Military Affairs Postpone Indefinitely",0,"Rep. D. Pabon, Sen. L. Crowder",State GovernmentTelecommunications & Information Technology,2016 Regular Session,Type:Bill,2016-04-25
285,HB16-1286,Increase Wildfire Mitigation Income Tax Deduction,/bills/hb16-1286,Concerning an increase in the percentage of a landowner's costs incurred in performing wildfire mitigation measures that may be claimed by the landowner for purposes of the wildfire mitigation income tax deduction.,Last Action:06/10/2016 | Governor Signed,1,"Rep. K. Becker, Sen. J. Tate",Fiscal Policy & Taxes,2016 Regular Session,Type:Bill,2016-06-10
286,HB16-1287,CDLE Pre-apprenticeship And Apprenticeship Study,/bills/hb16-1287,Concerning a requirement that the department of labor and employment study the integration of alternative training by Colorado businesses.,Last Action:06/6/2016 | Governor Signed,1,"Rep. P. Rosenthal, Rep. J. Wilson, Sen. J. Cooke, Sen. J. Kefalas",Business & Economic Development,2016 Regular Session,Type:Bill,2016-06-06
287,HB16-1288,Industry Infrastructure Grant Program,/bills/hb16-1288,Concerning the creation of an industry infrastructure grant program within the state work force development council.,Last Action:05/20/2016 | Governor Signed,1,"Rep. T. Kraft-Tharp, Rep. C. Wist, Sen. J. Tate, Sen. M. Merrifield",Business & Economic Development,2016 Regular Session,Type:Bill,2016-05-20
288,HB16-1289,Incentives To Complete Career Development Courses,/bills/hb16-1289,Concerning incentives for local education providers to encourage high school students to successfully complete career development course work.,Last Action:05/27/2016 | Governor Signed,1,"Rep. C. Duran, Rep. D. Esgar, Sen. L. Garcia, Sen. L. Crowder",Education & School Finance (Pre & K-12)Labor & Employment,2016 Regular Session,Type:Bill,2016-05-27
289,HB16-1290,Extend Transitional Jobs Program,/bills/hb16-1290,"Concerning an extension of the transitional jobs program, and, in connection therewith, making an appropriation.",Last Action:05/20/2016 | Governor Signed,1,"Rep. D. Esgar, Rep. T. Kraft-Tharp, Sen. A. Kerr, Sen. O. Hill",Labor & Employment,2016 Regular Session,Type:Bill,2016-05-20
290,HB16-1291,Modern Technology Education In Public Schools,/bills/hb16-1291,"Concerning developing additional resources for modern technology education in public schools, and, in connection therewith, making an appropriation.",Last Action:05/3/2016 | Senate Committee on Appropriations Postpone Indefinitely,0,"Rep. C. Duran, Rep. S. Lontine, Sen. O. Hill, Sen. M. Johnston",Education & School Finance (Pre & K-12),2016 Regular Session,Type:Bill,2016-05-03
291,HB16-1292,Income Tax Credit For Sandwich Generation,/bills/hb16-1292,Concerning an income tax credit for certain qualifying taxpayers with both child and relative dependents.,Last Action:04/13/2016 | House Committee on Finance Postpone Indefinitely,0,"Rep. D. Kagan, Sen. K. Donovan",Fiscal Policy & Taxes,2016 Regular Session,Type:Bill,2016-04-13
292,HB16-1293,Total Loss Brand Title Motor Vehicle,/bills/hb16-1293,"Concerning the addition of a brand to designate a certificate of title to a motor vehicle that has been the subject of an insurance claim, and, in connection therewith, making an appropriation.","Last Action:04/27/2016 | Senate Committee on State, Veterans, & Military Affairs Postpone Indefinitely",0,"Rep. J. Melton, Sen. C. Holbert",Business & Economic DevelopmentTransportation & Motor Vehicles,2016 Regular Session,Type:Bill,2016-04-27
293,HB16-1294,Contraception Coverage Public And Private Insurance,/bills/hb16-1294,Concerning health care coverage for contraceptives for women.,"Last Action:04/11/2016 | Senate Committee on State, Veterans, & Military Affairs Postpone Indefinitely",0,"Rep. S. Lontine, Rep. D. Esgar, Sen. L. Guzman",Health Care & Health InsuranceInsurancePublic Health,2016 Regular Session,Type:Bill,2016-04-11
294,HB16-1295,Chicano Special License Plate,/bills/hb16-1295,"Concerning the creation of a Chicana/o special license plate, and, in connection therewith, making an appropriation.",Last Action:05/3/2016 | Senate Committee on Finance Postpone Indefinitely,0,"Rep. J. Salazar, Sen. J. Ulibarri",Transportation & Motor Vehicles,2016 Regular Session,Type:Bill,2016-05-03
295,HB16-1296,Penalties For Unlicensed Automobile Sales,/bills/hb16-1296,Concerning the unlicensed selling of automobiles.,"Last Action:04/13/2016 | Senate Committee on State, Veterans, & Military Affairs Postpone Indefinitely",0,"Rep. J. Melton, Sen. J. Tate",Business & Economic DevelopmentTransportation & Motor Vehicles,2016 Regular Session,Type:Bill,2016-04-13
296,HB16-1297,Reestablish Check-offs Excluded From 2015 Tax Form,/bills/hb16-1297,"Concerning the immediate reestablishment of the voluntary contributions excluded from the 2015 Colorado income tax return form for not receiving the requisite minimum dollar amount of contributions by the statutory deadline, and, in connection therewith, expanding the number of voluntary contributions that may appear on the income tax return form and lowering the minimum amount of donations that must be received by every fund appearing on the form.",Last Action:04/14/2016 | Governor Signed,1,"Rep. L. Court, Sen. B. Martinez Humenik",Fiscal Policy & Taxes,2016 Regular Session,Type:Bill,2016-04-14
297,HB16-1298,"Vehicle Height, Length, And Weight",/bills/hb16-1298,Concerning changes in permissible vehicle dimensions.,Last Action:05/4/2016 | Governor Signed,1,"Rep. J. Melton, Sen. J. Cooke",Transportation & Motor Vehicles,2016 Regular Session,Type:Bill,2016-05-04
298,HB16-1299,Attorney Fees And Costs In Employment Discrimination Cases,/bills/hb16-1299,Concerning the standard for awarding a defendant litigation costs in employment discrimination cases.,"Last Action:03/28/2016 | House Committee on State, Veterans, & Military Affairs Postpone Indefinitely",0,"Rep. C. Wist, Sen. C. Jahn",Civil LawCourts & JudicialLabor & Employment,2016 Regular Session,Type:Bill,2016-03-28
299,HB16-1300,Mail Ballot Return Options Requirements & Procedures,/bills/hb16-1300,"Concerning the return of voted mail ballots, and, in connection therewith, removing the requirement that electors provide postage on mail ballot return envelopes and encouraging the use of state-owned and convenient commercial properties for stand-alone drop-off locations for deposit of mail ballots.","Last Action:04/27/2016 | Senate Committee on State, Veterans, & Military Affairs Postpone Indefinitely",0,"Rep. S. Ryden, Sen. J. Ulibarri, Sen. K. Donovan",Elections & Redistricting,2016 Regular Session,Type:Bill,2016-04-27
300,HB16-1301,Business Income Tax Credit Offer Apprenticeships,/bills/hb16-1301,"Concerning an income tax credit for Colorado businesses that offer high-quality apprenticeships for top jobs, and, in connection therewith, making an appropriation.",Last Action:05/6/2016 | Senate Committee on Finance Postpone Indefinitely,0,"Rep. A. Garnett, Sen. M. Scheffel",Fiscal Policy & Taxes,2016 Regular Session,Type:Bill,2016-05-06
301,HB16-1302,Align With Workforce Innovation & Opportunity Act,/bills/hb16-1302,"Concerning the alignment of the Colorado statutes with the federal ""Workforce Innovation and Opportunity Act"" through the ""Colorado Career Advancement Act"".",Last Action:05/19/2016 | Governor Signed,1,"Rep. C. Duran, Rep. B. DelGrosso, Sen. L. Newell",Labor & Employment,2016 Regular Session,Type:Bill,2016-05-19
302,HB16-1303,Regional Transportation Authority Annexed Vacant Land Sales Tax,/bills/hb16-1303,Concerning prohibiting a regional transportation authority from levying sales tax on vacant land annexed by a nonmember jurisdiction.,Last Action:05/3/2016 | House Committee on Judiciary Postpone Indefinitely,0,"Rep. L. Landgraf, Sen. K. Grantham",Fiscal Policy & TaxesLocal GovernmentTransportation & Motor Vehicles,2016 Regular Session,Type:Bill,2016-05-03
303,HB16-1304,Transportation Priorities Community Conversations,/bills/hb16-1304,Concerning community conversations on transportation priorities and preferred funding options.,"Last Action:05/4/2016 | Senate Committee on State, Veterans, & Military Affairs Postpone Indefinitely",0,"Rep. M. Tyler, Sen. R. Heath",Local GovernmentState GovernmentTransportation & Motor Vehicles,2016 Regular Session,Type:Bill,2016-05-04
304,HB16-1305,Educator Training To Assist Students In Crisis,/bills/hb16-1305,Concerning training for educators in school district procedures for assisting students in crisis.,Last Action:05/4/2016 | Senate Committee on Education Postpone Indefinitely,0,"Rep. R. Fields, Sen. L. Newell",Education & School Finance (Pre & K-12),2016 Regular Session,Type:Bill,2016-05-04
305,HB16-1306,Mortgage Loan Originators Secure And Fair Enforcement For Mortgage Licensing Act Of 2008,/bills/hb16-1306,"Concerning revision of the state statutes governing mortgage loan originators to conform more closely to applicable federal law, and, in connection therewith, amending, relocating, and repealing provisions in accordance with the federal ""Secure and Fair Enforcement for Mortgage Licensing Act of 2008"".",Last Action:04/21/2016 | Governor Signed,1,"Rep. A. Williams, Sen. C. Holbert",Civil LawFinancial Services & CommerceHousingState Government,2016 Regular Session,Type:Bill,2016-04-21
306,HB16-1307,Threats To Persons At Postsecondary Institutions,/bills/hb16-1307,Concerning threats against persons at postsecondary educational institutions.,Last Action:04/7/2016 | House Committee on Judiciary Postpone Indefinitely,0,"Rep. J. Melton, Sen. J. Cooke","Crimes, Corrections, & EnforcementHigher Education",2016 Regular Session,Type:Bill,2016-04-07
307,HB16-1308,Fraudulent Misrepresentation Of A Service Animal,/bills/hb16-1308,Concerning the offense of intentional misrepresentation of a service animal.,Last Action:04/11/2016 | Senate Committee on Judiciary Postpone Indefinitely,0,"Rep. D. Kagan, Sen. L. Newell","Crimes, Corrections, & Enforcement",2016 Regular Session,Type:Bill,2016-04-11
308,HB16-1309,Right To Counsel In Municipal Court,/bills/hb16-1309,Concerning a defendant's right to counsel in certain cases considered by municipal courts.,Last Action:06/10/2016 | Governor Became Law,0,"Rep. S. Lontine, Sen. V. Marble","Courts & JudicialCrimes, Corrections, & EnforcementLocal Government",2016 Regular Session,Type:Bill,2016-06-10
309,HB16-1310,Operators Liable For Oil And Gas Operations,/bills/hb16-1310,Concerning liability for the conduct of oil and gas operations.,"Last Action:04/28/2016 | Senate Committee on Agriculture, Natural Resources, & Energy Postpone Indefinitely",0,"Rep. J. Salazar, Sen. M. Carroll",Natural Resources & Environment,2016 Regular Session,Type:Bill,2016-04-28
310,HB16-1311,Procedures When Orders Require Monetary Payments,/bills/hb16-1311,Concerning court orders requiring payment of monetary amounts.,Last Action:06/10/2016 | Governor Signed,1,"Rep. J. Salazar, Sen. M. Carroll, Sen. V. Marble","Crimes, Corrections, & Enforcement",2016 Regular Session,Type:Bill,2016-06-10
311,HB16-1312,Licensed Professional Redundant Disciplinary Action,/bills/hb16-1312,Concerning a time limitation for resolving redundant disciplinary actions arising from the same event by multiple state disciplinary authorities against a licensed professional with multiple professional licenses.,"Last Action:05/4/2016 | House Committee on State, Veterans, & Military Affairs Postpone Indefinitely",0,"Rep. C. Wist, Sen. J. Tate",Business & Economic DevelopmentCivil LawState Government,2016 Regular Session,Type:Bill,2016-05-04
312,HB16-1313,Authority Local Government Master Plans Include Water Plan Goals,/bills/hb16-1313,Concerning the authority of local government master plans to include policies to implement       water plan goals.,"Last Action:05/2/2016 | Senate Committee on State, Veterans, & Military Affairs Postpone Indefinitely",0,"Rep. J. Arndt, Rep. D. Coram, Sen. K. Donovan",Local GovernmentWater,2016 Regular Session,Type:Bill,2016-05-02
313,HB16-1314,Treat Preexisting Groundwater Depletions Replaced,/bills/hb16-1314,Concerning treatment of rising groundwater levels as replacing groundwater depletions in water division 1.,"Last Action:04/4/2016 | House Committee on Agriculture, Livestock, & Natural Resources Postpone Indefinitely",0,"Rep. L. Saine, Rep. S. Humphrey, Sen. V. Marble",Water,2016 Regular Session,Type:Bill,2016-04-04
314,HB16-1315,Allow Seaplanes In State Parks Like Motorboats,/bills/hb16-1315,Concerning an authorization for seaplanes to operate where motorboats may be operated.,Last Action:04/13/2016 | House Committee on Transportation & Energy Postpone Indefinitely,0,"Rep. J. Melton, Sen. N. Todd",Natural Resources & EnvironmentWater,2016 Regular Session,Type:Bill,2016-04-13
315,HB16-1316,Change Venue Children In Out-of-home Placement,/bills/hb16-1316,Concerning the procedures for changing venue for proceedings relating to a child placed in the legal custody of a county department of social or human services.,Last Action:04/21/2016 | Governor Signed,1,"Rep. P. Rosenthal, Sen. J. Cooke",Children & Domestic Matters,2016 Regular Session,Type:Bill,2016-04-21
316,HB16-1317,Motor Vehicle Service Contract Products And Services,/bills/hb16-1317,Concerning clarifying the types of transactions that may be included in a motor vehicle service contract.,Last Action:05/4/2016 | Governor Signed,1,"Rep. A. Williams, Sen. C. Holbert",Business & Economic DevelopmentTransportation & Motor Vehicles,2016 Regular Session,Type:Bill,2016-05-04
317,HB16-1318,Charitable Solicitations Regulation,/bills/hb16-1318,"Concerning the regulation of charitable solicitations by the secretary of state, and, in connection therewith, modifying and clarifying filing requirements and enforcement of the ""Colorado Charitable Solicitations Act"" and making an appropriation.",Last Action:04/27/2016 | Senate Committee on Appropriations Postpone Indefinitely,0,"Rep. C. Wist, Sen. L. Newell",Civil LawState Government,2016 Regular Session,Type:Bill,2016-04-27
318,HB16-1319,Prohibit Coal Rolling In Diesel Vehicles,/bills/hb16-1319,Concerning a prohibition against intentionally increasing a diesel-powered vehicle's particulate emissions for the purpose of a visual exhibition of smoke.,Last Action:04/26/2016 | Senate Committee on Transportation Postpone Indefinitely,0,"Rep. J. Ginal, Rep. M. Tyler, Sen. J. Kefalas","Crimes, Corrections, & EnforcementTransportation & Motor Vehicles",2016 Regular Session,Type:Bill,2016-04-26
319,HB16-1320,Regulation of Massage Therapy,/bills/hb16-1320,Concerning the regulation of massage therapy to modify practices that are linked to criminal behavior.,Last Action:06/8/2016 | Governor Signed,1,"Rep. M. Foote, Rep. T. Carver, Sen. J. Cooke",Public Health,2016 Regular Session,Type:Bill,2016-06-08
320,HB16-1321,Medicaid Buy-in Certain Medicaid Waivers,/bills/hb16-1321,"Concerning medicaid buy-in for persons eligible for certain medicaid waivers, and, in connection therewith, making an appropriation.",Last Action:06/10/2016 | Governor Signed,1,"Rep. D. Young, Sen. M. Merrifield, Sen. J. Tate",Health Care & Health Insurance,2016 Regular Session,Type:Bill,2016-06-10
321,HB16-1322,Health Coverage Prescription Contraceptives Supply,/bills/hb16-1322,Concerning a requirement that health benefit plans required to cover contraception reimburse dispensers for dispensing a multiple-months' supply of prescription contraceptives.,"Last Action:05/5/2016 | Senate Committee on State, Veterans, & Military Affairs Postpone Indefinitely",0,"Rep. B. Pettersen, Rep. D. Coram, Sen. K. Donovan",Health Care & Health InsuranceInsurance,2016 Regular Session,Type:Bill,2016-05-05
322,HB16-1323,Division Of Labor Name Change,/bills/hb16-1323,Concerning changing the name of the division of labor to the division of labor standards and statistics.,Last Action:04/22/2016 | Governor Signed,1,"Rep. T. Kraft-Tharp, Sen. J. Cooke",Labor & Employment,2016 Regular Session,Type:Bill,2016-04-22
323,HB16-1324,Veterinary Access Compounded Pharmaceutical Drugs,/bills/hb16-1324,"Concerning the availability of compounded pharmaceutical drugs for use by a veterinarian to treat a patient's emergency condition, and, in connection therewith, making an appropriation.",Last Action:06/10/2016 | Governor Signed,1,"Rep. J. Ginal, Sen. J. Sonnenberg",AgricultureHealth Care & Health Insurance,2016 Regular Session,Type:Bill,2016-06-10
324,HB16-1325,Caucus & Election Dates On Variable Message Signs,/bills/hb16-1325,Concerning a requirement that the department of transportation post messages about precinct caucus and statewide election dates on its variable messaging signs.,Last Action:04/14/2016 | House Committee on Transportation & Energy Postpone Indefinitely,0,Rep. A. Garnett,Elections & RedistrictingTransportation & Motor Vehicles,2016 Regular Session,Type:Bill,2016-04-14
325,HB16-1326,Consumer Access To Physical Rehabilitation Services,/bills/hb16-1326,Concerning changes in the requirements for the coverage of health care benefits for physical rehabilitation services to allow for increased consumer access to services.,"Last Action:05/4/2016 | Senate Committee on State, Veterans, & Military Affairs Postpone Indefinitely",0,"Rep. D. Primavera, Rep. Y. Willett, Sen. L. Crowder",Health Care & Health Insurance,2016 Regular Session,Type:Bill,2016-05-04
326,HB16-1327,Financial Responsibility For Dental Hygienists,/bills/hb16-1327,Concerning the Colorado dental board's authority to promulgate rules implementing financial responsibility requirements for dental care providers.,Last Action:04/21/2016 | Governor Signed,1,"Rep. J. Ginal, Sen. K. Grantham",Health Care & Health Insurance,2016 Regular Session,Type:Bill,2016-04-21
327,HB16-1328,Use Of Restraint And Seclusion On Individuals,/bills/hb16-1328,"Concerning statutory provisions related to the use of seclusion on individuals, and, in connection therewith, making an appropriation.",Last Action:06/10/2016 | Governor Signed,1,"Rep. P. Lee, Rep. E. McCann, Sen. K. Lambert, Sen. K. Lundberg","Children & Domestic MattersCrimes, Corrections, & EnforcementHuman Services",2016 Regular Session,Type:Bill,2016-06-10
328,HB16-1329,Limited Liability Companies Governing Law,/bills/hb16-1329,Concerning laws governing limited liability companies codified in article 80 of title 7 of the Colorado Revised Statutes.,Last Action:06/6/2016 | Governor Signed,1,"Rep. P. Lee, Sen. M. Scheffel, Sen. R. Heath",Financial Services & Commerce,2016 Regular Session,Type:Bill,2016-06-06
329,HB16-1330,Correction Statement Secretary Of State Erroneous Filed Document,/bills/hb16-1330,Concerning authority to file a correction statement with the secretary of state if a document previously filed was delivered to the secretary of state for filing in error.,Last Action:06/6/2016 | Governor Signed,1,"Rep. P. Lee, Sen. M. Scheffel, Sen. R. Heath",Financial Services & CommerceState Government,2016 Regular Session,Type:Bill,2016-06-06
330,HB16-1331,Policies On Juvenile Shackling In Court,/bills/hb16-1331,Concerning the use of restraints on a juvenile during a court proceeding.,Last Action:04/18/2016 | Senate Committee on Judiciary Postpone Indefinitely,0,"Rep. S. Lontine, Sen. M. Merrifield",Courts & Judicial,2016 Regular Session,Type:Bill,2016-04-18
331,HB16-1332,Alternative Fuel Motor Vehicle Income Tax Credits,/bills/hb16-1332,"Concerning modifications to the income tax credits for alternative fuel motor vehicles, and, in connection therewith, fixing specified dollar amounts for the credits, allowing the credit to be assigned to a financing entity, requiring vehicle identification number tracking of the motor vehicle for which a credit is claimed, and making an appropriation.",Last Action:06/6/2016 | Governor Signed,1,"Rep. C. Duran, Rep. B. Rankin, Sen. R. Scott, Sen. M. Johnston",Fiscal Policy & Taxes,2016 Regular Session,Type:Bill,2016-06-06
332,HB16-1333,Partnerships Statute Of Frauds Governing Law,/bills/hb16-1333,Concerning laws governing partnerships codified in title 7 of the Colorado Revised Statutes.,Last Action:06/6/2016 | Governor Signed,1,"Rep. P. Lee, Sen. M. Scheffel, Sen. R. Heath",Civil LawFinancial Services & Commerce,2016 Regular Session,Type:Bill,2016-06-06
333,HB16-1334,Inclusionary Zoning County Unincorporated Areas,/bills/hb16-1334,Concerning the ability of county governments to promote inclusionary zoning programs in the unincorporated areas of a county.,"Last Action:04/25/2016 | Senate Committee on State, Veterans, & Military Affairs Postpone Indefinitely",0,"Rep. F. Winter, Sen. M. Hodge",HousingLocal Government,2016 Regular Session,Type:Bill,2016-04-25
334,HB16-1335,Unlawful Sale Of Public Services And Appointments,/bills/hb16-1335,Concerning the unlawful sale of certain publicly provided government services.,Last Action:06/8/2016 | Governor Signed,1,"Rep. D. Pabon, Rep. J. Melton, Sen. P. Steadman","Crimes, Corrections, & EnforcementState GovernmentTransportation & Motor Vehicles",2016 Regular Session,Type:Bill,2016-06-08
335,HB16-1336,Study Single Geographic Area Individual Health Plans,/bills/hb16-1336,Concerning the creation of a single geographic rating area for health insurers to use when establishing rates for individual health insurance plans.,Last Action:05/17/2016 | Governor Signed,1,"Rep. M. Hamner, Rep. B. Rankin, Sen. K. Donovan",Health Care & Health InsuranceInsurance,2016 Regular Session,Type:Bill,2016-05-17
336,HB16-1337,Appellate Process For Decisions About Groundwater,/bills/hb16-1337,Concerning the appellate process governing a district court's review of final agency actions concerning groundwater.,Last Action:04/26/2016 | Senate Committee on Judiciary Postpone Indefinitely,0,"Rep. E. Vigil, Rep. D. Coram, Sen. R. Scott",Courts & JudicialWater,2016 Regular Session,Type:Bill,2016-04-26
337,HB16-1338,Extend Repeal Of Early Childhood Leadership Commission,/bills/hb16-1338,Concerning extending the repeal date for the early childhood leadership commission.,Last Action:03/21/2016 | House Committee on Education Postpone Indefinitely,0,Rep. B. Pettersen,Education & School Finance (Pre & K-12)Human Services,2016 Regular Session,Type:Bill,2016-03-21
338,HB16-1339,Agricultural Property Foreclosures,/bills/hb16-1339,Concerning agricultural property foreclosures.,Last Action:06/10/2016 | Governor Signed,1,"Rep. P. Buck, Rep. J. Ginal, Sen. R. Baumgardner",Agriculture,2016 Regular Session,Type:Bill,2016-06-10
339,HB16-1340,County Planning Commission Approval Requirement Exemption,/bills/hb16-1340,Concerning an exemption for certain proposed public projects from the requirement that the location of a public project be reviewed by a county planning commission if the proposed location of the public project is in the unincorporated territory of the county.,Last Action:04/26/2016 | Senate Committee on Local Government Postpone Indefinitely,0,"Rep. M. Tyler, Sen. R. Scott",Local Government,2016 Regular Session,Type:Bill,2016-04-26
340,HB16-1341,Protection Endangered Animals Poaching Trafficking,/bills/hb16-1341,Concerning protecting animal species threatened with extinction by prohibiting trafficking.,"Last Action:05/4/2016 | Senate Committee on State, Veterans, & Military Affairs Postpone Indefinitely",0,"Rep. J. Ginal, Rep. E. McCann, Sen. J. Ulibarri",Civil LawNatural Resources & Environment,2016 Regular Session,Type:Bill,2016-05-04
341,HB16-1342,Reporting Database For Motor Vehicle Sales,/bills/hb16-1342,Concerning the sale of motor vehicles that are required to be issued certain branded certificates of title.,Last Action:05/5/2016 | House Committee on Appropriations Postpone Indefinitely,0,Rep. D. Moreno,"Crimes, Corrections, & EnforcementTransportation & Motor Vehicles",2016 Regular Session,Type:Bill,2016-05-05
342,HB16-1343,Waivers For Charter Schools,/bills/hb16-1343,Concerning the waiver of laws for charter schools.,Last Action:05/10/2016 | House Second Reading Special Order - Laid Over to 05/12/2016 - No Amendments,0,Rep. D. Moreno,Education & School Finance (Pre & K-12),2016 Regular Session,Type:Bill,2016-05-10
343,HB16-1344,Special Offender When Death Results After Use,/bills/hb16-1344,Concerning creating a drug special offender offense when the use of the drug results in death.,Last Action:04/19/2016 | House Committee on Judiciary Postpone Indefinitely,0,"Rep. M. Foote, Sen. J. Cooke","Crimes, Corrections, & Enforcement",2016 Regular Session,Type:Bill,2016-04-19
344,HB16-1345,Sunset Treatment Program For Sex Offenders,/bills/hb16-1345,"Concerning the continuation of the sex offender management board, and, in connection therewith, implementing the recommendations of the 2015 sunset report issued by the department of regulatory agencies.",Last Action:06/10/2016 | Governor Signed,1,"Rep. D. Kagan, Sen. J. Cooke","Crimes, Corrections, & Enforcement",2016 Regular Session,Type:Bill,2016-06-10
345,HB16-1346,Open Records Subject To Inspection Denial,/bills/hb16-1346,Concerning public records that are subject to denial of inspection.,"Last Action:04/6/2016 | House Committee on State, Veterans, & Military Affairs Postpone Indefinitely",0,Rep. P. Lawrence,Courts & JudicialState Government,2016 Regular Session,Type:Bill,2016-04-06
346,HB16-1347,Employer Information Concerning Wage Law Violation,/bills/hb16-1347,Concerning the release of information concerning an employer's violation of wage laws by the division of labor in the department of labor and employment.,"Last Action:05/6/2016 | Senate Committee on Business, Labor, & Technology Postpone Indefinitely",0,"Rep. J. Danielson, Sen. J. Ulibarri",Labor & Employment,2016 Regular Session,Type:Bill,2016-05-06
347,HB16-1348,Crime Of Cruelty To Law Enforcement Service Animal,/bills/hb16-1348,Concerning a specific crime of cruelty to a certified police working dog.,Last Action:06/6/2016 | Governor Signed,1,"Rep. S. Ryden, Sen. N. Todd","Crimes, Corrections, & Enforcement",2016 Regular Session,Type:Bill,2016-06-06
348,HB16-1349,Continue Military Family Relief Fund Tax Check-off,/bills/hb16-1349,Concerning continuation of the voluntary contribution to the military family relief fund.,Last Action:06/6/2016 | Governor Signed,1,"Rep. S. Ryden, Rep. D. Nordberg, Sen. M. Carroll",Fiscal Policy & TaxesMilitary & Veterans,2016 Regular Session,Type:Bill,2016-06-06
349,HB16-1350,Higher Education Transfers Fee-for-service Contracts,/bills/hb16-1350,Concerning the department of higher education's authority to make transfers relating to a governing board's fee-for-service contracts for specialty education.,Last Action:04/22/2016 | Governor Signed,1,"Rep. D. Young, Sen. K. Grantham",Higher Education,2016 Regular Session,Type:Bill,2016-04-22
350,HB16-1351,Land Transfers For Veterans Housing,/bills/hb16-1351,"Concerning a requirement that the executive director of the department of human services convey real property at the Fitzsimons campus to the housing authority of the city of Aurora, Colorado, for the purpose of helping homeless veterans and veterans with disabilities by developing transitional housing for both groups of such veterans and housing with domiciliary care for veterans with disabilities.","Last Action:03/28/2016 | House Committee on State, Veterans, & Military Affairs Postpone Indefinitely",0,"Rep. J. Windholz, Sen. L. Crowder",Capital ConstructionHealth Care & Health InsuranceHuman ServicesMilitary & Veterans,2016 Regular Session,Type:Bill,2016-03-28
351,HB16-1352,History Colorado Cash Fund,/bills/hb16-1352,"Concerning the appropriation of moneys from the state museum cash fund for the benefit of facilities owned and operated by the state historical society, and, in connection therewith, making an appropriation.",Last Action:04/22/2016 | Governor Signed,1,"Rep. M. Hamner, Sen. K. Grantham",State Revenue & Budget,2016 Regular Session,Type:Bill,2016-04-22
352,HB16-1353,FY Fiscal Year 2016-17 Legislative Appropriation Bill,/bills/hb16-1353,Concerning payment of expenses of the legislative department.,Last Action:04/7/2016 | Governor Signed,1,"Rep. C. Duran, Rep. B. DelGrosso, Sen. M. Scheffel, Sen. L. Guzman",State Revenue & Budget,2016 Regular Session,Type:Bill,2016-04-07
353,HB16-1354,Debt-free Schools Act,/bills/hb16-1354,"Concerning authorization for a school district to impose an additional mill levy for the sole purpose of funding capital construction, new technology, existing technology upgrade, and maintenance needs of the district without borrowing money.",Last Action:05/17/2016 | Governor Signed,1,"Rep. D. Mitsch Bush, Rep. J. Becker, Sen. J. Sonnenberg",Capital ConstructionEducation & School Finance (Pre & K-12)Fiscal Policy & Taxes,2016 Regular Session,Type:Bill,2016-05-17
354,HB16-1355,Affirm Local Government Siting Authority Oil And Gas Facilities,/bills/hb16-1355,Concerning the ability of local governments to exercise land use authority over oil and gas facilities used in oil and gas operations in a manner analogous to the siting of other industrial facilities.,Last Action:04/4/2016 | House Second Reading Lost with Amendments - Floor,0,"Rep. M. Foote, Rep. S. Ryden, Sen. J. Ulibarri, Sen. M. Jones",Local GovernmentNatural Resources & Environment,2016 Regular Session,Type:Bill,2016-04-04
355,HB16-1356,Debts Secured By Liens On Real Property,/bills/hb16-1356,Concerning requirements related to the satisfaction of indebtedness secured by real property.,Last Action:06/10/2016 | Governor Signed,1,"Rep. T. Kraft-Tharp, Rep. D. Nordberg, Sen. C. Jahn, Sen. C. Holbert",Business & Economic DevelopmentFinancial Services & Commerce,2016 Regular Session,Type:Bill,2016-06-10
356,HB16-1357,Implement St-elevation myocardial infarctions STEMI Task Force Recommendations,/bills/hb16-1357,Concerning implementation of the STEMI task force recommendations for the development of a system to improve the quality of care to patients who suffer heart attacks.,"Last Action:04/27/2016 | Senate Committee on State, Veterans, & Military Affairs Postpone Indefinitely",0,"Rep. D. Primavera, Sen. L. Garcia, Sen. J. Cooke",Health Care & Health InsurancePublic Health,2016 Regular Session,Type:Bill,2016-04-27
357,HB16-1358,Protect Privacy Of Substance Use Disorder Patients,/bills/hb16-1358,Concerning protecting the privacy of persons who seek treatment for substance use disorders.,Last Action:05/5/2016 | House Committee on Appropriations Postpone Indefinitely,0,"Rep. J. Singer, Rep. K. Conti, Sen. K. Lundberg, Sen. C. Jahn",Human ServicesPublic Health,2016 Regular Session,Type:Bill,2016-05-05
358,HB16-1359,Use Of Medical Marijuana While On Probation,/bills/hb16-1359,Concerning the use of medical marijuana while on probation.,Last Action:06/10/2016 | Governor Signed,1,"Rep. J. Salazar, Sen. L. Guzman","Crimes, Corrections, & EnforcementLiquor, Tobacco, & Marijuana",2016 Regular Session,Type:Bill,2016-06-10
359,HB16-1360,Continue Regulation Direct-entry Midwives,/bills/hb16-1360,"Concerning the continuation of the regulation of direct-entry midwives by the director of the division of professions and occupations in the department of regulatory agencies, and, in connection therewith, implementing the recommendations contained in the sunset report prepared by the department.",Last Action:06/10/2016 | Governor Signed,1,"Rep. L. Landgraf, Rep. S. Lontine, Sen. K. Lundberg",Health Care & Health Insurance,2016 Regular Session,Type:Bill,2016-06-10
360,HB16-1361,Patient Choice In Pharmacy,/bills/hb16-1361,Concerning the ability of a person eligible for prescription drug benefits to choose the pharmacy at which to fill a prescription drug order.,Last Action:05/6/2016 | Senate Committee on Finance Postpone Indefinitely,0,"Rep. D. Primavera, Rep. J. Becker, Sen. J. Sonnenberg, Sen. L. Newell",Health Care & Health Insurance,2016 Regular Session,Type:Bill,2016-05-06
361,HB16-1362,License Plate Auction Transfer Disability Benefit,/bills/hb16-1362,"Concerning the transfer of the functions of the license plate auction group to the Colorado disability funding committee, and, in connection therewith, making an appropriation.",Last Action:06/10/2016 | Governor Signed,1,"Rep. D. Young, Sen. B. Martinez Humenik",Human ServicesState GovernmentTransportation & Motor Vehicles,2016 Regular Session,Type:Bill,2016-06-10
362,HB16-1363,Medical Marijuana Advertising Rule-making Authority,/bills/hb16-1363,Concerning rule-making authority for medical marijuana advertising directed at underage persons.,Last Action:06/10/2016 | Governor Signed,1,"Rep. J. Singer, Sen. L. Newell, Sen. J. Tate","Liquor, Tobacco, & Marijuana",2016 Regular Session,Type:Bill,2016-06-10
363,HB16-1364,Military Special And Standard License Plate Exchange,/bills/hb16-1364,"Concerning the issuance of a standard license plate for a motor vehicle to a person who has been issued a military license plate, and, in connection therewith, making an appropriation.",Last Action:04/26/2016 | Senate Committee on Finance Postpone Indefinitely,0,"Rep. S. Ryden, Rep. J. Brown, Sen. J. Cooke",Military & VeteransTransportation & Motor Vehicles,2016 Regular Session,Type:Bill,2016-04-26
364,HB16-1365,High School Diploma Endorsement In Biliteracy,/bills/hb16-1365,Concerning a high school diploma endorsement for biliteracy.,"Last Action:05/6/2016 | Senate Committee on State, Veterans, & Military Affairs Postpone Indefinitely",0,"Rep. D. Moreno, Rep. J. Wilson, Sen. L. Woods",Education & School Finance (Pre & K-12),2016 Regular Session,Type:Bill,2016-05-06
365,HB16-1366,Hearing Aid Users Enhanced Protections,/bills/hb16-1366,Concerning enhanced protections for purchasers of hearing aids.,"Last Action:05/4/2016 | Senate Committee on Business, Labor, & Technology Postpone Indefinitely",0,"Rep. D. Primavera, Sen. P. Steadman",Civil LawHealth Care & Health InsurancePublic HealthState Government,2016 Regular Session,Type:Bill,2016-05-04
366,HB16-1367,County Categories For Officers For Salary Purposes,/bills/hb16-1367,Concerning the re-categorization of certain counties for the purpose of determining salaries paid to county officers in those counties.,Last Action:06/10/2016 | Governor Signed,1,"Rep. M. Hamner, Rep. B. Rankin, Sen. M. Hodge, Sen. V. Marble",Local Government,2016 Regular Session,Type:Bill,2016-06-10
367,HB16-1368,Management Of Records In The State Archives,/bills/hb16-1368,Concerning the codification of current practice for the management of records of governmental agencies.,Last Action:06/6/2016 | Governor Signed,1,"Rep. M. Tyler, Sen. B. Martinez Humenik",State Government,2016 Regular Session,Type:Bill,2016-06-06
368,HB16-1369,Eliminate Criminal Penalty Self-disclosure Ballot,/bills/hb16-1369,Concerning the elimination of the criminal penalty imposed upon an elector for disclosing the contents of the elector's ballot.,"Last Action:04/11/2016 | House Committee on State, Veterans, & Military Affairs Postpone Indefinitely",0,Rep. P. Rosenthal,Elections & Redistricting,2016 Regular Session,Type:Bill,2016-04-11
369,HB16-1370,Nicotine Product Retailers Registry,/bills/hb16-1370,Concerning the regulation of nicotine product retailers.,Last Action:04/28/2016 | House Committee on Business Affairs and Labor Postpone Indefinitely,0,"Rep. J. Singer, Rep. D. Coram, Sen. J. Cooke","Liquor, Tobacco, & MarijuanaLocal GovernmentPublic Health",2016 Regular Session,Type:Bill,2016-04-28
370,HB16-1371,Multiple Methods For Receipt Of Income Tax Refunds,/bills/hb16-1371,"Concerning the opportunity for a taxpayer to specify multiple methods by which to receive an income tax refund, and, in connection therewith, making an appropriation.","Last Action:05/5/2016 | Senate Committee on State, Veterans, & Military Affairs Postpone Indefinitely",0,"Rep. D. Kagan, Sen. J. Kefalas",Fiscal Policy & Taxes,2016 Regular Session,Type:Bill,2016-05-05
371,HB16-1372,Colorado Work Opportunity Income Tax Credit,/bills/hb16-1372,Concerning the creation of the Colorado work opportunity income tax credit.,Last Action:04/20/2016 | House Committee on Finance Postpone Indefinitely,0,Rep. D. Primavera,Fiscal Policy & Taxes,2016 Regular Session,Type:Bill,2016-04-20
372,HB16-1373,Student Medical Marijuana Use At School,/bills/hb16-1373,Concerning requiring school districts to adopt a policy permitting the use of medical marijuana by students authorized to use medical marijuana.,Last Action:06/6/2016 | Governor Signed,1,"Rep. J. Singer, Sen. C. Holbert, Sen. V. Marble","Liquor, Tobacco, & Marijuana",2016 Regular Session,Type:Bill,2016-06-06
373,HB16-1374,Required Notice And Disclosures Freestanding ERs,/bills/hb16-1374,Concerning disclosure requirements applicable to a licensed community clinic providing emergency services to patients at a site that is not attached to a hospital.,"Last Action:05/5/2016 | Senate Committee on State, Veterans, & Military Affairs Postpone Indefinitely",0,"Rep. E. McCann, Sen. J. Kefalas",Health Care & Health Insurance,2016 Regular Session,Type:Bill,2016-05-05
374,HB16-1375,Due Dates For Reports Involving Department Of Higher Education,/bills/hb16-1375,Concerning changes to dates for submitting reports that involve the department of higher education.,Last Action:06/6/2016 | Governor Signed,1,"Rep. J. Arndt, Rep. J. Wilson, Sen. N. Todd, Sen. O. Hill",Higher Education,2016 Regular Session,Type:Bill,2016-06-06
375,HB16-1376,Expand Authority Office Of Consumer Counsel,/bills/hb16-1376,"Concerning increasing the authority of the office of consumer counsel to advocate on behalf of consumers of public utility services, and, in connection therewith, making an appropriation.","Last Action:05/5/2016 | Senate Committee on State, Veterans, & Military Affairs Postpone Indefinitely",0,"Rep. D. Esgar, Rep. F. Winter, Sen. M. Carroll",Civil LawEnergyState GovernmentTelecommunications & Information TechnologyTransportation & Motor Vehicles,2016 Regular Session,Type:Bill,2016-05-05
376,HB16-1377,Task Force Digital Images Of Child Abuse Neglect,/bills/hb16-1377,Concerning the creation of a task force on the collection and security of digital images of evidence of child abuse or neglect.,Last Action:06/8/2016 | Governor Signed,1,"Rep. D. Primavera, Sen. K. Lambert",Children & Domestic Matters,2016 Regular Session,Type:Bill,2016-06-08
377,HB16-1378,Court To Collect And Transfer Costs Of DUI Tests,/bills/hb16-1378,Concerning requiring courts to collect money from DUI offenders for the purpose of reimbursing law enforcement agencies for the cost of performing chemical tests.,Last Action:06/10/2016 | Governor Signed,1,"Rep. J. Ginal, Sen. L. Crowder","Courts & JudicialCrimes, Corrections, & Enforcement",2016 Regular Session,Type:Bill,2016-06-10
378,HB16-1379,Psychologists Continuing Professional Development Program,/bills/hb16-1379,Concerning the criteria under which the state board of psychologist examiners may award professional development credit for specific activities currently included in the continuing professional development program for licensed psychologists.,Last Action:05/4/2016 | Governor Signed,1,"Rep. T. Kraft-Tharp, Sen. B. Martinez Humenik",Health Care & Health InsuranceState Government,2016 Regular Session,Type:Bill,2016-05-04
379,HB16-1380,Add In-home Support Services Certain Medicaid Waivers,/bills/hb16-1380,"Concerning permitting persons receiving home- and community-based services under certain medicaid waivers to receive in-home support services, and, in connection therewith, making an appropriation.",Last Action:05/5/2016 | Senate Committee on Finance Postpone Indefinitely,0,"Rep. D. Young, Sen. B. Martinez Humenik",Health Care & Health Insurance,2016 Regular Session,Type:Bill,2016-05-05
380,HB16-1381,Health Care Coverage For Cancer Screening,/bills/hb16-1381,Concerning health insurance coverage for the early detection of cancer.,"Last Action:05/2/2016 | Senate Committee on State, Veterans, & Military Affairs Postpone Indefinitely",0,"Rep. D. Primavera, Sen. N. Todd",Health Care & Health Insurance,2016 Regular Session,Type:Bill,2016-05-02
381,HB16-1382,Divert Water Piscatorial Aesthetic Beneficial Use,/bills/hb16-1382,Concerning the confirmation of certain uses of water as being beneficial.,"Last Action:04/4/2016 | House Committee on Agriculture, Livestock, & Natural Resources Postpone Indefinitely",0,Rep. K. Becker,Water,2016 Regular Session,Type:Bill,2016-04-04
382,HB16-1383,Child Welfare Predictive Analytic Pilot Program,/bills/hb16-1383,"Concerning a predictive data analytic technology for child welfare pilot program, and, in connection therewith, making an appropriation.",Last Action:05/6/2016 | Senate Third Reading Lost - No Amendments,0,"Rep. J. Singer, Rep. R. Fields, Sen. K. Grantham",Children & Domestic MattersHuman Services,2016 Regular Session,Type:Bill,2016-05-06
383,HB16-1384,Testimony Legal Privilege Consent Disability Advocate,/bills/hb16-1384,Concerning establishing a legal privilege related to testifying without consent for disability advocates.,Last Action:04/21/2016 | House Committee on Judiciary Postpone Indefinitely,0,Rep. J. Danielson,Courts & Judicial,2016 Regular Session,Type:Bill,2016-04-21
384,HB16-1385,Definition Child Abuse Substance Exposure,/bills/hb16-1385,"Concerning the definition of child abuse or neglect in the ""Colorado Children's Code"" as it relates to the use of or exposure to substances, and, in connection therewith, making an appropriation.",Last Action:05/6/2016 | Senate Committee on Appropriations Postpone Indefinitely,0,"Rep. J. Singer, Sen. L. Newell",Children & Domestic MattersHuman Services,2016 Regular Session,Type:Bill,2016-05-06
385,HB16-1386,Necessary Document Program,/bills/hb16-1386,"Concerning a program to cover vulnerable populations' costs of acquiring necessary documents, and, in connection therewith, making an appropriation.",Last Action:06/10/2016 | Governor Signed,1,"Rep. T. Kraft-Tharp, Sen. P. Steadman",Public Health,2016 Regular Session,Type:Bill,2016-06-10
386,HB16-1387,Health Insurance For Protein Allergic Conditions,/bills/hb16-1387,Concerning health insurance coverage for severe protein allergic conditions.,Last Action:06/1/2016 | Governor Signed,1,"Rep. D. Primavera, Sen. L. Woods",Health Care & Health Insurance,2016 Regular Session,Type:Bill,2016-06-01
387,HB16-1388,Employer Hiring Criminal History Employee,/bills/hb16-1388,Concerning the timing of inquiring into a job applicant's criminal history.,"Last Action:05/4/2016 | Senate Committee on State, Veterans, & Military Affairs Postpone Indefinitely",0,"Rep. E. McCann, Sen. M. Merrifield, Sen. L. Guzman",Business & Economic DevelopmentLabor & Employment,2016 Regular Session,Type:Bill,2016-05-04
388,HB16-1389,Safety Procedures Photos As Evidence Child Abuse,/bills/hb16-1389,Concerning safety procedures for children during the collection of photographic evidence of child abuse or neglect.,"Last Action:04/13/2016 | House Committee on State, Veterans, & Military Affairs Postpone Indefinitely",0,Rep. J. Joshi,Children & Domestic Matters,2016 Regular Session,Type:Bill,2016-04-13
389,HB16-1390,Immunity When Overdoses Reported,/bills/hb16-1390,Concerning immunity for certain persons who are involved with a reported overdose event.,Last Action:05/19/2016 | Governor Signed,1,"Rep. D. Moreno, Sen. L. Guzman","Crimes, Corrections, & Enforcement",2016 Regular Session,Type:Bill,2016-05-19
390,HB16-1391,Immigration Consultants Deceptive Trade Practice,/bills/hb16-1391,Concerning a prohibition against nonattorneys providing legal services related to immigration matters.,Last Action:06/10/2016 | Governor Signed,1,"Rep. D. Pabon, Sen. K. Lundberg",Civil LawImmigration,2016 Regular Session,Type:Bill,2016-06-10
391,HB16-1392,Water Banks Administration,/bills/hb16-1392,Concerning the administration of water banks.,"Last Action:04/11/2016 | House Committee on Agriculture, Livestock, & Natural Resources Postpone Indefinitely",0,"Rep. J. Arndt, Rep. E. Vigil, Sen. L. Crowder",Water,2016 Regular Session,Type:Bill,2016-04-11
392,HB16-1393,Search Warrant For Communicable Disease Testing,/bills/hb16-1393,Concerning procedures for ordered testing for communicable diseases.,Last Action:06/10/2016 | Governor Signed,1,"Rep. D. Esgar, Rep. M. Foote, Sen. J. Cooke","Crimes, Corrections, & Enforcement",2016 Regular Session,Type:Bill,2016-06-10
393,HB16-1394,Aligning Issues Around At-risk Persons,/bills/hb16-1394,Concerning clarifying definitions related to at-risk persons.,Last Action:05/18/2016 | Governor Signed,1,"Rep. D. Young, Sen. K. Grantham","Crimes, Corrections, & EnforcementHealth Care & Health InsuranceHuman Services",2016 Regular Session,Type:Bill,2016-05-18
394,HB16-1395,Juvenile Delinquency Record Expungement,/bills/hb16-1395,Concerning juvenile delinquency record expungement.,Last Action:05/5/2016 | House Committee on Judiciary Postpone Indefinitely,0,Rep. P. Lee,Children & Domestic MattersCourts & Judicial,2016 Regular Session,Type:Bill,2016-05-05
395,HB16-1396,Replace Alien With Undocumented Immigrant CRS,/bills/hb16-1396,Concerning changing outdated references to aliens in the Colorado Revised Statutes with respect to Colorado programs.,"Last Action:04/18/2016 | Senate Committee on State, Veterans, & Military Affairs Postpone Indefinitely",0,"Rep. S. Lebsock, Sen. M. Hodge",State Government,2016 Regular Session,Type:Bill,2016-04-18
396,HB16-1397,Completion Fitzsimons Veterans Community Living,/bills/hb16-1397,Concerning the completion of the Fitzsimons state veterans community living center to provide a continuum of residential care options.,Last Action:06/1/2016 | Governor Signed,1,"Rep. S. Ryden, Rep. J. Windholz, Sen. M. Hodge, Sen. L. Crowder",HousingMilitary & Veterans,2016 Regular Session,Type:Bill,2016-06-01
397,HB16-1398,Implement Respite Care Task Force Recommendations,/bills/hb16-1398,"Concerning the requirement that the department of human services use a request-for-proposal process to contract with an entity to implement recommendations of the respite care task force, and, in connection therewith, making an appropriation.",Last Action:06/10/2016 | Governor Signed,1,"Rep. D. Young, Rep. L. Landgraf, Sen. B. Martinez Humenik, Sen. P. Steadman",Health Care & Health Insurance,2016 Regular Session,Type:Bill,2016-06-10
398,HB16-1399,Workers' Compensation For Post-Traumatic Stress Disorder,/bills/hb16-1399,"Concerning a prohibition on the denial of a workers' compensation claim for mental impairment based on the occupation of a worker, and, in connection therewith, making an appropriation.","Last Action:04/27/2016 | Senate Committee on State, Veterans, & Military Affairs Postpone Indefinitely",0,"Rep. J. Singer, Sen. L. Newell",Health Care & Health InsuranceLabor & Employment,2016 Regular Session,Type:Bill,2016-04-27
399,HB16-1400,Protection Against Retaliation By Homeowner Association,/bills/hb16-1400,Concerning the prohibition of retaliatory action against a homeowner in relation to the homeowners' association to which the homeowner belongs.,"Last Action:05/2/2016 | Senate Committee on State, Veterans, & Military Affairs Postpone Indefinitely",0,"Rep. S. Ryden, Sen. N. Todd",Civil LawHousing,2016 Regular Session,Type:Bill,2016-05-02
400,HB16-1401,Retail Food Establishment Licensure And Inspection,/bills/hb16-1401,Concerning the regulation of retail food establishments.,Last Action:06/9/2016 | Governor Became Law,0,"Rep. K. Becker, Rep. K. Priola, Sen. L. Woods, Sen. M. Hodge",Business & Economic DevelopmentPublic Health,2016 Regular Session,Type:Bill,2016-06-09
401,HB16-1402,Prohibit Device Wager Previous Sporting Event,/bills/hb16-1402,Concerning a prohibition on the use of a device to allow a person to place a wager on a previously run sporting event.,Last Action:06/10/2016 | Governor Signed,1,"Rep. K. Becker, Rep. P. Lawrence, Sen. C. Holbert, Sen. L. Garcia","Gaming, Lottery, & Racing",2016 Regular Session,Type:Bill,2016-06-10
402,HB16-1403,Colorado Secure Savings Plan,/bills/hb16-1403,Concerning the creation of the Colorado secure savings plan.,Last Action:05/4/2016 | House Committee on Finance Postpone Indefinitely,0,"Rep. B. Pettersen, Rep. J. Buckner, Sen. N. Todd, Sen. K. Donovan",State Government,2016 Regular Session,Type:Bill,2016-05-04
403,HB16-1404,Regulate Fantasy Contests,/bills/hb16-1404,"Concerning the regulation of fantasy contests, and in connection therewith, making an appropriation.",Last Action:06/10/2016 | Governor Signed,1,"Rep. C. Duran, Rep. C. Wist, Sen. J. Cooke, Sen. L. Guzman",Financial Services & Commerce,2016 Regular Session,Type:Bill,2016-06-10
404,HB16-1405,2016-17 Long Appropriation Bill,/bills/hb16-1405,"Concerning the provision for payment of the expenses of the executive, legislative, and judicial departments of the state of Colorado, and of its agencies and institutions, for and during the fiscal year beginning July 1, 2016, except as otherwise noted.",Last Action:05/3/2016 | Governor Signed,1,"Rep. M. Hamner, Sen. K. Lambert",State GovernmentState Revenue & Budget,2016 Regular Session,Type:Bill,2016-05-03
405,HB16-1406,County Coroners Reimbursement By Department Of Corrections,/bills/hb16-1406,"Concerning department of corrections reimbursements of expenses of county coroners, and, in connection therewith, making an appropriation.",Last Action:05/4/2016 | Governor Signed,1,"Rep. D. Young, Sen. K. Grantham","Crimes, Corrections, & EnforcementLocal Government",2016 Regular Session,Type:Bill,2016-05-04
406,HB16-1407,Extend Medicaid Payment Reform And Innovation Pilot,/bills/hb16-1407,"Concerning the continuation of the medicaid payment reform and innovation pilot program, and, in connection therewith, changing the time frames, eliminating the repeal date of the pilot program, enhancing the reporting requirements of the department of health care policy and financing, and making an appropriation.",Last Action:05/4/2016 | Governor Signed,1,"Rep. D. Young, Sen. P. Steadman",Health Care & Health Insurance,2016 Regular Session,Type:Bill,2016-05-04
407,HB16-1408,Cash Fund Allocations For Health-related Programs,/bills/hb16-1408,"Concerning the allocation of cash fund revenues to health-related programs, and, in connection therewith, modifying and streamlining the allocation of tobacco litigation settlement moneys by replacing the current two-tier allocation system that includes both percentage-based and fixed amount allocations of settlement moneys with a single set of exclusively percentage-based allocations and replacing settlement moneys funding for specified programs with marijuana tax cash fund funding; allocating additional settlement moneys to the university of Colorado health sciences center for cancer research only; transferring a specified amount from the children's basic health plan trust to a newly created primary care provider sustainability fund on July 1, 2016; and making and reducing appropriations.",Last Action:05/4/2016 | Governor Signed,1,"Rep. B. Rankin, Sen. P. Steadman","Health Care & Health InsuranceLiquor, Tobacco, & MarijuanaPublic HealthState Government",2016 Regular Session,Type:Bill,2016-05-04
408,HB16-1409,Unclaimed Property Fund Transfer For State Programs,/bills/hb16-1409,"Concerning the transfer of forty-two million eight hundred thousand dollars on June 30, 2016, from the unclaimed property trust fund for state programs.",Last Action:05/4/2016 | Governor Signed,1,"Rep. M. Hamner, Sen. K. Lambert",State Revenue & Budget,2016 Regular Session,Type:Bill,2016-05-04
409,HB16-1410,Competency Evaluation Location,/bills/hb16-1410,"Concerning matters related to the location where a competency evaluation is conducted, and, in connection therewith, making and reducing appropriations.",Last Action:05/4/2016 | Governor Signed,1,"Rep. D. Young, Sen. K. Grantham","Courts & JudicialCrimes, Corrections, & Enforcement",2016 Regular Session,Type:Bill,2016-05-04
410,HB16-1411,Fort Lyon Residential Community Study,/bills/hb16-1411,"Concerning the supportive residential community program operated at the Fort Lyon property, and, in connection therewith, requiring a longitudinal evaluation of the program; and making an appropriation.",Last Action:05/4/2016 | Governor Signed,1,"Rep. B. Rankin, Sen. P. Steadman",HousingState Government,2016 Regular Session,Type:Bill,2016-05-04
411,HB16-1412,Fund Address Confidentiality Program,/bills/hb16-1412,Concerning an allocation of money for the address confidentiality program.,Last Action:03/31/2016 | House Second Reading Laid Over to 06/01/2016 - No Amendments,0,"Rep. M. Hamner, Sen. K. Grantham",State Government,2016 Regular Session,Type:Bill,2016-03-31
412,HB16-1413,Refinance Water Pollution Control Program,/bills/hb16-1413,"Concerning the financing of the water pollution control program, and, in connection therewith, making an appropriation.",Last Action:05/4/2016 | Governor Signed,1,"Rep. B. Rankin, Sen. K. Grantham",Natural Resources & EnvironmentPublic Health,2016 Regular Session,Type:Bill,2016-05-04
413,HB16-1414,Funding Base For Telecom Relay Services,/bills/hb16-1414,"Concerning the assessment of a monthly surcharge on customers of voice telecommunications providers to fund telecommunications relay services for telephone users with disabilities, and, in connection therewith, making an appropriation.",Last Action:05/4/2016 | Governor Signed,1,"Rep. B. Rankin, Sen. P. Steadman",Telecommunications & Information Technology,2016 Regular Session,Type:Bill,2016-05-04
414,HB16-1415,Driver & Motor Vehicle Services,/bills/hb16-1415,"Concerning the manner in which the state funds driver and vehicle services by the division of motor vehicles in the department of revenue, and, in connection therewith, making and reducing an appropriation.",Last Action:05/4/2016 | Governor Signed,1,"Rep. M. Hamner, Sen. P. Steadman",State Revenue & BudgetTransportation & Motor Vehicles,2016 Regular Session,Type:Bill,2016-05-04
415,HB16-1416,State Infrastructure General Fund Transfers,/bills/hb16-1416,Concerning the transfer of money from the general fund to cash funds that are used for the state's infrastructure.,Last Action:04/14/2016 | Governor Signed,1,"Rep. M. Hamner, Sen. K. Lambert",Capital ConstructionState Revenue & BudgetTransportation & Motor Vehicles,2016 Regular Session,Type:Bill,2016-04-14
416,HB16-1417,Capital-related Transfers Of Moneys,/bills/hb16-1417,Concerning capital-related transfers of moneys.,Last Action:05/4/2016 | Governor Signed,1,"Rep. M. Hamner, Sen. K. Lambert",Capital ConstructionState Revenue & Budget,2016 Regular Session,Type:Bill,2016-05-04
417,HB16-1418,Marijuana Tax Cash Fund Transfer To General Fund,/bills/hb16-1418,Concerning a transfer from the marijuana tax cash fund to the general fund.,Last Action:05/4/2016 | Governor Signed,1,"Rep. B. Rankin, Sen. P. Steadman","Liquor, Tobacco, & MarijuanaState Revenue & Budget",2016 Regular Session,Type:Bill,2016-05-04
418,HB16-1419,FY Fiscal Year 2015-16 Statutory Reserve Reduction,/bills/hb16-1419,Concerning a reduction in the amount of the general fund reserve required for the fiscal year 2015-16.,Last Action:05/4/2016 | Governor Signed,1,"Rep. M. Hamner, Sen. K. Lambert",State Revenue & Budget,2016 Regular Session,Type:Bill,2016-05-04
419,HB16-1420,CO Colorado Healthcare Affordability and Sustainability Enterprise,/bills/hb16-1420,"Concerning the creation of an enterprise that is exempt from the requirements of section 20 of article X of the state constitution and related statutory provisions to administer a fee-based healthcare affordability and sustainability program for hospitals, and, in connection therewith, making an appropriation.",Last Action:05/10/2016 | Senate Committee on Finance Postpone Indefinitely,0,"Rep. D. Hullinghorst, Sen. L. Crowder",Health Care & Health InsuranceState GovernmentState Revenue & Budget,2016 Regular Session,Type:Bill,2016-05-10
420,HB16-1421,Allocate Additional FY Fiscal Year 2016-17 General Fund Revenues,/bills/hb16-1421,"Concerning the allocation of additional general fund revenues made available for expenditure in fiscal year 2016-17 due to the enactment of legislation to end the state collection of hospital provider fee revenues that are counted against the state fiscal year spending limit, and, in connection therewith, prioritizing the allocation of such revenues, in order, for the highway users tax fund, repayment of the state severance tax trust fund and the local government severance tax fund of money diverted from those funds to the general fund in fiscal year 2014-15, reduction in the amount of fiscal year 2016-17 public school finance negative factor, and mitigation of tuition increases at state-supported institutions of higher education.",Last Action:05/11/2016 | House Second Reading Laid Over to 05/12/2016 - No Amendments,0,Rep. D. Hullinghorst,State Revenue & Budget,2016 Regular Session,Type:Bill,2016-05-11
421,HB16-1422,Financing Public Schools,/bills/hb16-1422,"Concerning financing public schools, and, in connection therewith, making an appropriation.",Last Action:06/10/2016 | Governor Signed,1,"Rep. M. Hamner, Rep. B. Rankin, Sen. K. Lambert, Sen. P. Steadman",Education & School Finance (Pre & K-12),2016 Regular Session,Type:Bill,2016-06-10
422,HB16-1423,Student Data Collection Use Security,/bills/hb16-1423,Concerning measures to maximize trust in the use of student data in the elementary and secondary education system.,Last Action:06/10/2016 | Governor Signed,1,"Rep. P. Lundeen, Rep. A. Garnett, Sen. O. Hill",Education & School Finance (Pre & K-12),2016 Regular Session,Type:Bill,2016-06-10
423,HB16-1424,Qualified Medication Administration Personnel,/bills/hb16-1424,"Concerning qualifications for the administration of medications in facilities, and, in connection therewith, making an appropriation.",Last Action:06/10/2016 | Governor Signed,1,"Rep. E. Vigil, Sen. L. Garcia",Health Care & Health Insurance,2016 Regular Session,Type:Bill,2016-06-10
424,HB16-1425,Immunization Records For Temporary Child Care,/bills/hb16-1425,Concerning the requirement for a licensed child care center to obtain records for a child enrolled in the center on a short-term basis.,Last Action:06/10/2016 | Governor Signed,1,"Rep. M. Hamner, Sen. E. Roberts",Public Health,2016 Regular Session,Type:Bill,2016-06-10
425,HB16-1426,Intentional Misrepresentation Assistance Animal,/bills/hb16-1426,Concerning intentional misrepresentation of entitlement to an assistance animal.,Last Action:06/10/2016 | Governor Signed,1,"Rep. D. Primavera, Rep. Y. Willett, Sen. J. Tate, Sen. C. Jahn","Civil LawCrimes, Corrections, & Enforcement",2016 Regular Session,Type:Bill,2016-06-10
426,HB16-1427,Multi-serving Liquid Marijuana Products,/bills/hb16-1427,Concerning exempting multi-serving liquid retail marijuana products from the sales equivalency limitation.,Last Action:06/10/2016 | Governor Signed,1,"Rep. D. Pabon, Sen. O. Hill","Liquor, Tobacco, & Marijuana",2016 Regular Session,Type:Bill,2016-06-10
427,HB16-1428,Depress Stock Value Direct Selling (DS) Pub Co,/bills/hb16-1428,"Concerning a prohibition against knowingly making materially false statements to depress the stock value of publicly traded direct selling companies, and, in connection therewith, making it a misdemeanor crime to knowingly engage in this conduct.",Last Action:04/14/2016 | House Committee on Business Affairs and Labor Postpone Indefinitely,0,Rep. D. Moreno,Business & Economic DevelopmentFinancial Services & Commerce,2016 Regular Session,Type:Bill,2016-04-14
428,HB16-1429,Alternative Education Campus Criteria And Pilot Program,/bills/hb16-1429,"Concerning alternative education campuses, and, in connection therewith, making an appropriation.",Last Action:06/8/2016 | Governor Signed,1,"Rep. B. Pettersen, Rep. J. Wilson, Sen. A. Kerr",Education & School Finance (Pre & K-12),2016 Regular Session,Type:Bill,2016-06-08
429,HB16-1430,Require Oil And Gas Operators Consult With Local Government,/bills/hb16-1430,Concerning the implementation of a recommendation of the oil and gas task force regarding the sharing of oil and gas operators' development plans with affected local governments.,"Last Action:04/28/2016 | Senate Committee on Agriculture, Natural Resources, & Energy Postpone Indefinitely",0,"Rep. S. Lebsock, Sen. M. Hodge",Local GovernmentNatural Resources & Environment,2016 Regular Session,Type:Bill,2016-04-28
430,HB16-1431,OED Office Of Economic Development Small Business Endeavor Program,/bills/hb16-1431,Concerning the creation of a small business endeavor program in the Colorado office of economic development.,Last Action:04/19/2016 | House Committee on Business Affairs and Labor Postpone Indefinitely,0,"Rep. F. Winter, Rep. C. Wist",State Government,2016 Regular Session,Type:Bill,2016-04-19
431,HB16-1432,Personnel Files Employee Inspection Right,/bills/hb16-1432,Concerning the rights of private sector employees to inspect their personnel files.,Last Action:06/10/2016 | Governor Signed,1,"Rep. F. Winter, Sen. A. Kerr",Business & Economic DevelopmentCivil LawCourts & Judicial,2016 Regular Session,Type:Bill,2016-06-10
432,HB16-1433,Retain & Spend Severance Tax Revenues For Reserve Fund,/bills/hb16-1433,"Concerning the creation of a reserve that includes state severance tax revenue that is a voter-approved revenue change to the constitutional limitation on state fiscal year spending, and, in connection therewith, creating the severance tax reserve fund; requiring severance tax revenue that exceeds an annual cap to be deposited in the reserve; seeking voter approval to retain and spend the severance tax revenue deposited in the reserve; permitting the general assembly to use money from the reserve if there is insufficient money to pay for programs supported by the severance tax; and requiring any money in the reserve that exceeds a reserve cap to be transferred to the Colorado water conservation board construction fund.",Last Action:04/27/2016 | House Committee on Finance Postpone Indefinitely,0,"Rep. M. Hamner, Rep. B. Rankin, Sen. P. Steadman",EnergyFiscal Policy & TaxesState Revenue & Budget,2016 Regular Session,Type:Bill,2016-04-27
433,HB16-1434,Disclosure Political Party Communication Activity,/bills/hb16-1434,"Concerning disclosure under the ""Fair Campaign Practices Act"" of political communication that refers to a political party, and, in connection therewith, making an appropriation.","Last Action:05/2/2016 | Senate Committee on State, Veterans, & Military Affairs Postpone Indefinitely",0,"Rep. K. Becker, Rep. D. Kagan, Sen. M. Carroll",Elections & Redistricting,2016 Regular Session,Type:Bill,2016-05-02
434,HB16-1435,Low-wage Employer Corporate Responsibility Act,/bills/hb16-1435,"Concerning the creation of an employment-related public benefits enterprise as a government-owned business for the purpose of providing business services that benefit covered employers by improving publicly subsidized health care program services for low-wage employees and their families, and, in connection therewith, authorizing the enterprise to fund the business services that it provides by imposing, collecting, and distributing an employment-related public benefits fee on covered employers, and making an appropriation.","Last Action:05/10/2016 | Senate Committee on State, Veterans, & Military Affairs Postpone Indefinitely",0,"Rep. C. Duran, Rep. K. Becker, Sen. J. Kefalas, Sen. J. Ulibarri",Business & Economic DevelopmentHealth Care & Health InsuranceLabor & Employment,2016 Regular Session,Type:Bill,2016-05-10
435,HB16-1436,No Edible Marijuana Products Shaped To Entice Kids,/bills/hb16-1436,Concerning a prohibition on edible marijuana products that are shaped in a manner to entice a child.,Last Action:06/10/2016 | Governor Signed,1,"Rep. D. Pabon, Rep. J. Ginal, Sen. L. Newell, Sen. R. Baumgardner","Liquor, Tobacco, & Marijuana",2016 Regular Session,Type:Bill,2016-06-10
436,HB16-1437,School Bus Stop Arm Safety Enforcement,/bills/hb16-1437,Concerning the assessment of penalties for school bus stop arm violations.,"Last Action:05/4/2016 | Senate Committee on State, Veterans, & Military Affairs Postpone Indefinitely",0,"Rep. D. Mitsch Bush, Rep. J. Wilson, Sen. N. Todd","Crimes, Corrections, & EnforcementTransportation & Motor Vehicles",2016 Regular Session,Type:Bill,2016-05-04
437,HB16-1438,Employer Accommodations Related To Pregnancy,/bills/hb16-1438,Concerning the provision of reasonable accommodations by an employer for persons who have a condition related to pregnancy.,Last Action:06/1/2016 | Governor Signed,1,"Rep. F. Winter, Sen. B. Martinez Humenik",Labor & Employment,2016 Regular Session,Type:Bill,2016-06-01
438,HB16-1439,Lodging And Entertainment Facility Liquor License,/bills/hb16-1439,"Concerning the creation of a new alcohol beverage license under the ""Colorado Liquor Code"" to permit a lodging and entertainment facility to sell alcohol beverages by the drink for consumption on the licensed premises, and, in connection therewith, allowing the holder of a tavern license to convert the tavern license to a lodging and entertainment license or other appropriate license under specified conditions.",Last Action:06/10/2016 | Governor Signed,1,"Rep. A. Garnett, Sen. C. Holbert","Liquor, Tobacco, & Marijuana",2016 Regular Session,Type:Bill,2016-06-10
439,HB16-1440,Administrative Flexibility For School Districts And Schools,/bills/hb16-1440,Concerning reducing administrative requirements that pertain to the elementary and secondary public education system.,Last Action:06/10/2016 | Governor Signed,1,"Rep. J. Wilson, Rep. B. Pettersen, Sen. M. Johnston, Sen. C. Holbert",Education & School Finance (Pre & K-12),2016 Regular Session,Type:Bill,2016-06-10
440,HB16-1441,Public Utilities Commission Consider Full Cost Carbon For Electricity Generation,/bills/hb16-1441,"Concerning a requirement that the public utilities commission consider the full cost of greenhouse gas emissions from electric generation when considering a utility's proposal for electric resource planning, and, in connection therewith, making an appropriation.","Last Action:05/5/2016 | Senate Committee on State, Veterans, & Military Affairs Postpone Indefinitely",0,"Rep. M. Tyler, Sen. M. Jones",Energy,2016 Regular Session,Type:Bill,2016-05-05
441,HB16-1442,Various Updates To Local Government Election Code,/bills/hb16-1442,Concerning technical modifications to laws enacted in 2014 governing the administration of nonpartisan elections conducted by a local government that are not coordinated by a county clerk and recorder.,Last Action:06/10/2016 | Governor Signed,1,"Rep. S. Ryden, Sen. J. Ulibarri",Elections & RedistrictingLocal Government,2016 Regular Session,Type:Bill,2016-06-10
442,HB16-1443,Youth Sports Organizations Background Check Notice,/bills/hb16-1443,Concerning requiring youth sports organizations to inform parents whether the organizations have conducted criminal background checks of persons who work with children.,"Last Action:05/5/2016 | Senate Committee on State, Veterans, & Military Affairs Postpone Indefinitely",0,"Rep. J. Singer, Sen. R. Heath","Children & Domestic MattersCrimes, Corrections, & Enforcement",2016 Regular Session,Type:Bill,2016-05-05
443,HB16-1444,Definition Qualifying Disabled Veteran Property Tax,/bills/hb16-1444,"Concerning the definition of a ""qualifying disabled veteran"" as it relates to a property tax exemption for such individuals.",Last Action:05/27/2016 | Governor Signed,1,"Rep. S. Ryden, Rep. T. Carver, Sen. J. Kefalas, Sen. L. Crowder",Military & Veterans,2016 Regular Session,Type:Bill,2016-05-27
444,HB16-1445,Prohibit Persons Under 21 Twenty-One At Liquor Stores,/bills/hb16-1445,"Concerning restrictions on persons licensed under the ""Colorado Liquor Code"" to sell alcohol beverages in sealed containers for off-premises consumption, and, in connection therewith, prohibiting persons under twenty-one years of age from entering a licensed premises unless accompanied by a person who is at least twenty-one years of age.",Last Action:05/3/2016 | House Committee on Business Affairs and Labor Postpone Indefinitely,0,Rep. S. Ryden,"Liquor, Tobacco, & Marijuana",2016 Regular Session,Type:Bill,2016-05-03
445,HB16-1446,K-3 English Learner Reading Assessment Language,/bills/hb16-1446,Concerning authorizing a local education provider to determine the language in which a student who is an English language learner takes reading assessments in kindergarten through third grade.,"Last Action:05/4/2016 | Senate Committee on State, Veterans, & Military Affairs Postpone Indefinitely",0,"Rep. M. Hamner, Sen. V. Marble",Education & School Finance (Pre & K-12),2016 Regular Session,Type:Bill,2016-05-04
446,HB16-1447,State Fair Funding,/bills/hb16-1447,"Concerning a 2016-17 state fiscal year general fund transfer to the Colorado state fair authority cash fund to improve the Colorado state fair's horse show arena area, and, in connection therewith, making an appropriation.",Last Action:05/9/2016 | Senate Committee on Finance Postpone Indefinitely,0,"Rep. D. Esgar, Sen. L. Garcia",Business & Economic DevelopmentState GovernmentState Revenue & Budget,2016 Regular Session,Type:Bill,2016-05-09
447,HB16-1448,Relative Guardianship Assistance Program Criteria,/bills/hb16-1448,Concerning the relative guardianship assistance program.,Last Action:06/10/2016 | Governor Signed,1,"Rep. J. Singer, Sen. J. Kefalas, Sen. K. Lundberg",Children & Domestic MattersHuman Services,2016 Regular Session,Type:Bill,2016-06-10
448,HB16-1449,Safe Contracting For School District Services,/bills/hb16-1449,Concerning safe contracting for school district services.,Last Action:05/2/2016 | House Committee on Education Postpone Indefinitely,0,Rep. J. Danielson,Education & School Finance (Pre & K-12),2016 Regular Session,Type:Bill,2016-05-02
449,HB16-1450,Allocate Additional Available State Revenues,/bills/hb16-1450,Concerning the allocation of additional state revenue made available for expenditure due to the enactment of legislation during the 2016 regular legislative session.,Last Action:05/10/2016 | Senate Committee on Finance Postpone Indefinitely,0,"Rep. D. Hullinghorst, Sen. P. Steadman, Sen. L. Guzman",State Revenue & Budget,2016 Regular Session,Type:Bill,2016-05-10
450,HB16-1451,Procurement Code Working Group,/bills/hb16-1451,"Concerning a requirement that the department of personnel create a procurement code working group to study ways to improve the state's ""Procurement Code"".",Last Action:06/10/2016 | Governor Signed,1,"Rep. S. Ryden, Rep. B. Rankin, Sen. R. Scott, Sen. R. Heath",State Government,2016 Regular Session,Type:Bill,2016-06-10
451,HB16-1452,Hotel Wine Permitted Sales,/bills/hb16-1452,"Concerning the creation of a wine-expanded permit for hotels licensed to sell alcohol beverages, and, in connection therewith, allowing hotels to sell sealed containers of vinous liquors for on- and off- premises consumption.",Last Action:05/10/2016 | House Committee on Business Affairs and Labor Postpone Indefinitely,0,"Rep. J. Melton, Sen. R. Scott","Liquor, Tobacco, & Marijuana",2016 Regular Session,Type:Bill,2016-05-10
452,HB16-1453,Colorado Cybersecurity Initiative,/bills/hb16-1453,"Concerning measures to enhance cybersecurity, and, in connection therewith, making an appropriation.",Last Action:05/20/2016 | Governor Signed,1,"Rep. M. Hamner, Sen. K. Lambert",State GovernmentTelecommunications & Information Technology,2016 Regular Session,Type:Bill,2016-05-20
453,HB16-1454,Primary Participation Act,/bills/hb16-1454,"Concerning primary elections, and, in connection therewith, restoring a presidential primary election in Colorado, allowing unaffiliated voters to temporarily affiliate with a political party in order to vote in primary elections in which the political party is participating, and making an appropriation.","Last Action:05/10/2016 | Senate Committee on State, Veterans, & Military Affairs Postpone Indefinitely",0,"Rep. D. Moreno, Rep. T. Dore, Sen. L. Guzman",Elections & Redistricting,2016 Regular Session,Type:Bill,2016-05-10
454,HB16-1455,Metropolitan Football Stadium District Administration,/bills/hb16-1455,Concerning the administration of the metropolitan football stadium district.,"Last Action:05/5/2016 | Senate Committee on State, Veterans, & Military Affairs Postpone Indefinitely",0,"Rep. D. Pabon, Sen. V. Marble, Sen. A. Kerr",Local Government,2016 Regular Session,Type:Bill,2016-05-05
455,HB16-1456,Sale Of State Land For Fort Logan National Cemetery,/bills/hb16-1456,Concerning the sale of a portion of land at the Colorado mental health institute at Fort Logan to the United States department of veterans affairs for the expansion of Fort Logan national cemetery.,Last Action:06/1/2016 | Governor Signed,1,"Rep. S. Lontine, Sen. L. Crowder",Capital Construction,2016 Regular Session,Type:Bill,2016-06-01
456,HB16-1457,Sales & Use Tax Exemption Residential Energy,/bills/hb16-1457,Concerning a clarification of the existing sales and use tax exemption for residential energy sources.,Last Action:06/10/2016 | Governor Signed,1,"Rep. A. Garnett, Rep. J. Wilson, Sen. T. Neville, Sen. L. Garcia",Fiscal Policy & Taxes,2016 Regular Session,Type:Bill,2016-06-10
457,HB16-1458,Species Conservation Trust Fund Projects,/bills/hb16-1458,"Concerning measures to effectuate the conservation of native species in Colorado, and, in connection therewith, making appropriations from the species conservation trust fund for purposes recommended by the department of natural resources.",Last Action:06/6/2016 | Governor Signed,1,"Rep. E. Vigil, Rep. D. Coram, Sen. J. Sonnenberg, Sen. L. Garcia",Natural Resources & Environment,2016 Regular Session,Type:Bill,2016-06-06
458,HB16-1459,Submission Threshold For Higher Education Cash Projects,/bills/hb16-1459,Concerning an increase in the dollar threshold for the review of capital construction or capital renewal projects that are not for new construction or new acquisitions of real property for auxiliary and academic facilities to be funded solely from cash funds held by an institution of higher education.,Last Action:06/10/2016 | Governor Signed,1,"Rep. K. Becker, Rep. J. Brown, Sen. J. Sonnenberg, Sen. J. Kefalas",Capital ConstructionHigher Education,2016 Regular Session,Type:Bill,2016-06-10
459,HB16-1460,DOA Department Of Agriculture Authority To Sell & Buy Property For Consolidation,/bills/hb16-1460,Concerning the authority of the commissioner of agriculture to dispose of and acquire specified real property in furtherance of the department of agriculture's office consolidation.,Last Action:06/10/2016 | Governor Signed,1,"Rep. K. Becker, Rep. E. Vigil, Sen. R. Baumgardner",Capital Construction,2016 Regular Session,Type:Bill,2016-06-10
460,HB16-1461,Tenancies One Month To One Year,/bills/hb16-1461,Concerning tenancies of one month or longer but less than one year.,"Last Action:05/9/2016 | Senate Committee on State, Veterans, & Military Affairs Postpone Indefinitely",0,"Rep. D. Pabon, Sen. M. Johnston",Housing,2016 Regular Session,Type:Bill,2016-05-09
461,HB16-1462,Lieutenant Governor As Governor's Office Appointee,/bills/hb16-1462,Concerning a modification to the provisions enacted in House Bill 11-1155 to authorize combining the full-time equivalent employment of the lieutenant governor and the state chief operating officer.,Last Action:05/26/2016 | Governor Signed,1,"Rep. D. Hullinghorst, Sen. L. Guzman, Sen. C. Jahn",State Government,2016 Regular Session,Type:Bill,2016-05-26
462,HB16-1463,Breakfast After The Bell Authority To Charge,/bills/hb16-1463,Concerning the option for certain public schools to charge for breakfast after the bell for a student who is not eligible for free or reduced-cost lunch under the national school lunch program.,Last Action:05/9/2016 | Senate Second Reading Special Order - Lost - No Amendments,0,"Rep. D. Moreno, Rep. J. Joshi, Sen. A. Kerr, Sen. O. Hill",Education & School Finance (Pre & K-12),2016 Regular Session,Type:Bill,2016-05-09
463,HB16-1464,Civil Action For Taking Newspapers,/bills/hb16-1464,Concerning a civil action for the taking of newspapers.,"Last Action:05/9/2016 | Senate Committee on State, Veterans, & Military Affairs Postpone Indefinitely",0,"Rep. D. Pabon, Sen. B. Martinez Humenik",Civil Law,2016 Regular Session,Type:Bill,2016-05-09
464,HB16-1465,Modifications Low-income Housing Tax Credit,/bills/hb16-1465,"Concerning modifications to the Colorado low-income housing tax credit, and, in connection therewith, extending the period during which the Colorado housing and finance authority may allocate low-income housing tax credits.",Last Action:06/6/2016 | Governor Signed,1,"Rep. C. Duran, Rep. J. Becker, Sen. J. Ulibarri, Sen. J. Cooke",Fiscal Policy & TaxesHousing,2016 Regular Session,Type:Bill,2016-06-06
465,HB16-1466,Promoting Affordable Housing,/bills/hb16-1466,Concerning the use of moneys from the unclaimed property trust fund to promote the provision of affordable housing.,Last Action:05/9/2016 | Senate Committee on Appropriations Postpone Indefinitely,0,"Rep. M. Tyler, Rep. K. Becker, Sen. J. Ulibarri",HousingState Government,2016 Regular Session,Type:Bill,2016-05-09
466,HB16-1467,First-time Home Buyer Savings Accountt Tax Deduction,/bills/hb16-1467,Concerning a state income tax deduction for amounts earned on the investment of money in a first-time home buyer savings account.,Last Action:06/10/2016 | Governor Signed,1,"Rep. C. Duran, Rep. J. Salazar, Sen. M. Scheffel, Sen. B. Martinez Humenik",Fiscal Policy & Taxes,2016 Regular Session,Type:Bill,2016-06-10
467,HB16-1468,Oil & Gas Transportation Manufacturing & Processing Cost Deductions,/bills/hb16-1468,"Concerning costs that may be deducted by a taxpayer as transportation, manufacturing, and processing costs for purposes of calculating the net amount realized by the taxpayer for the sale of oil and gas.",Last Action:05/10/2016 | House Second Reading Special Order - Laid Over to 05/12/2016 - No Amendments,0,"Rep. K. Becker, Rep. D. Hullinghorst, Sen. P. Steadman",EnergyFiscal Policy & Taxes,2016 Regular Session,Type:Bill,2016-05-10
468,HB17-1001,Employee Leave Attend Child's Academic Activities,/bills/hb17-1001,Concerning the ability of an employee of an employer who employs at least fifty employees to take up to eighteen hours of leave from work for purposes of attending his or her child's academic activities.,"Last Action:03/15/2017 | Senate Committee on State, Veterans, & Military Affairs Postpone Indefinitely",0,"Rep. J. Buckner, Sen. A. Kerr",Labor & Employment,2017 Regular Session,Type:Bill,2017-03-15
469,HB17-1002,Child Care Expenses Income Tax Credit Extension,/bills/hb17-1002,Concerning the extension of the income tax credit for child care expenses paid by a resident individual with a federal adjusted gross income of twenty-five thousand dollars or less.,Last Action:06/2/2017 | Governor Signed,1,"Rep. B. Pettersen, Rep. T. Exum, Sen. J. Kefalas, Sen. B. Martinez Humenik",Fiscal Policy & Taxes,2017 Regular Session,Type:Bill,2017-06-02
470,HB17-1003,Strategic Plan To Address Teacher Shortages,/bills/hb17-1003,Concerning a strategic action plan to address teacher shortages in Colorado.,Last Action:05/21/2017 | Governor Signed,1,"Rep. B. McLachlan, Sen. D. Coram",Education & School Finance (Pre & K-12),2017 Regular Session,Type:Bill,2017-05-21
471,HB17-1004,College Credit For Military Education And Training,/bills/hb17-1004,Concerning a statewide policy for awarding college credit for military education and training.,Last Action:06/1/2017 | Governor Signed,1,"Rep. D. Michaelson Jenet, Rep. J. Danielson, Sen. O. Hill, Sen. L. Garcia",Higher EducationMilitary & Veterans,2017 Regular Session,Type:Bill,2017-06-01
472,HB17-1005,Modernize Laws Relating To Office Of State Auditor,/bills/hb17-1005,Concerning modernization of various laws relating to the office of the state auditor.,Last Action:03/1/2017 | Governor Signed,1,"Rep. J. Arndt, Sen. J. Tate",State Government,2017 Regular Session,Type:Bill,2017-03-01
473,HB17-1006,Correct Statutory Citation In Rule Without Hearing,/bills/hb17-1006,Concerning the authorization of a process to correct statutory citations contained in executive branch agency rules published in the code of Colorado regulations without the requirement to follow rule-making procedures.,Last Action:03/16/2017 | Governor Signed,1,"Rep. M. Foote, Sen. D. Kagan",State Government,2017 Regular Session,Type:Bill,2017-03-16
474,HB17-1007,Tax Benefit Employer Collegeinvest Contribution,/bills/hb17-1007,"Concerning a tax benefit for an employer who contributes to an employee's collegeinvest account, and, in connection therewith, enacting the ""Increase College Savings Act"".",Last Action:04/12/2017 | House Committee on Education Postpone Indefinitely,0,"Rep. A. Garnett, Sen. B. Gardner",Fiscal Policy & Taxes,2017 Regular Session,Type:Bill,2017-04-12
475,HB17-1008,Graywater Regulation Exemption For Scientific Research,/bills/hb17-1008,Concerning an exemption from the water quality control commission's graywater control regulations for graywater used for the purpose of scientific research involving human exposure.,Last Action:05/8/2017 | Governor Signed,1,"Rep. J. Arndt, Sen. J. Sonnenberg",AgricultureWater,2017 Regular Session,Type:Bill,2017-05-08
476,HB17-1009,Restore Nonessential Articles Tax Exemptions,/bills/hb17-1009,Concerning the reinstatement of the exemptions from state sales and use taxes for nonessential articles sold to sellers of items intended for human consumption that are furnished by the sellers to their customers with the items without the addition of a separate charge that were eliminated by House Bill 10-1194.,"Last Action:01/26/2017 | House Committee on State, Veterans, & Military Affairs Postpone Indefinitely",0,Rep. K. Van Winkle,Fiscal Policy & Taxes,2017 Regular Session,Type:Bill,2017-01-26
477,HB17-1010,Dental Practice Act And Dental Hygiene,/bills/hb17-1010,Concerning the authority of the Colorado dental board to promulgate rules based on clarifications to existing laws that relate to collaborative dental agreements.,Last Action:03/1/2017 | Governor Signed,1,"Rep. J. Ginal, Sen. L. Crowder",Public HealthState Government,2017 Regular Session,Type:Bill,2017-03-01
478,HB17-1011,Statute Of Limitation Discipline Mental Health Professional,/bills/hb17-1011,"Concerning a limitation on when certain disciplinary actions may be commenced against a mental health professional, and, in connection therewith, requiring that a mental health professional provide notice to former clients regarding record retention and that all complaints be resolved by the agency within two years after the date the complaint was filed.",Last Action:03/16/2017 | Governor Signed,1,"Rep. J. Melton, Sen. J. Tate",State Government,2017 Regular Session,Type:Bill,2017-03-16
479,HB17-1012,Pueblo Chile Vehicle License Plate,/bills/hb17-1012,Concerning the creation of a Pueblo chile license plate.,Last Action:04/18/2017 | Governor Signed,1,"Rep. D. Esgar, Sen. L. Garcia",Transportation & Motor Vehicles,2017 Regular Session,Type:Bill,2017-04-18
480,HB17-1013,Free Exercise Of Religion,/bills/hb17-1013,Concerning a person's free exercise of religion.,"Last Action:01/25/2017 | House Committee on State, Veterans, & Military Affairs Postpone Indefinitely",0,"Rep. S. Humphrey, Rep. D. Williams, Sen. V. Marble, Sen. T. Neville",State Government,2017 Regular Session,Type:Bill,2017-01-25
481,HB17-1014,Election Offenses Committed By A Voter,/bills/hb17-1014,Concerning the elimination of the criminal penalty imposed upon an elector for disclosing the contents of the elector's voted ballot.,Last Action:03/16/2017 | Governor Signed,1,"Rep. P. Rosenthal, Rep. D. Williams, Sen. O. Hill, Sen. K. Donovan",Elections & Redistricting,2017 Regular Session,Type:Bill,2017-03-16
482,HB17-1015,Clarify Good Time Sentence Reductions In Jails,/bills/hb17-1015,Concerning clarifying the manner in which reductions of inmates' sentences are administered in county jails.,Last Action:03/23/2017 | Governor Signed,1,"Rep. E. Hooton, Sen. J. Cooke","Crimes, Corrections, & Enforcement",2017 Regular Session,Type:Bill,2017-03-23
483,HB17-1016,Exclude Value Mineral Resources Tax Increment Financing Division,/bills/hb17-1016,Concerning the ability of an urban renewal authority to exclude the valuation attributable to the extraction of mineral resources located within an urban renewal area from the total amount of taxable property subject to division for the purpose of financing urban renewal projects.,Last Action:03/8/2017 | Governor Signed,1,"Rep. L. Saine, Rep. M. Gray, Sen. B. Martinez Humenik, Sen. R. Zenzinger",Fiscal Policy & TaxesLocal Government,2017 Regular Session,Type:Bill,2017-03-08
484,HB17-1017,County Surveyor Duties,/bills/hb17-1017,Concerning county surveyors.,Last Action:03/8/2017 | Governor Signed,1,"Rep. C. Kennedy, Sen. R. Baumgardner, Sen. C. Jahn",Local Government,2017 Regular Session,Type:Bill,2017-03-08
485,HB17-1018,Extend Voter Approval Window For RTA Regional Transportation Authority Mill Levy,/bills/hb17-1018,Concerning extension of the authorization for a regional transportation authority to seek voter approval for a uniform mill levy on all taxable property within its territory.,Last Action:03/1/2017 | Governor Signed,1,"Rep. D. Mitsch Bush, Rep. L. Liston, Sen. B. Gardner",Fiscal Policy & TaxesLocal Government,2017 Regular Session,Type:Bill,2017-03-01
486,HB17-1019,Property Tax Redemption Third Party Costs,/bills/hb17-1019,Concerning the amounts collected by a county treasurer upon redemption of specified property interests from a tax sale.,Last Action:03/8/2017 | Governor Signed,1,"Rep. D. Valdez, Sen. D. Coram",Fiscal Policy & TaxesLocal Government,2017 Regular Session,Type:Bill,2017-03-08
487,HB17-1020,Staffing Task Force Mental Illness Justice Systems,/bills/hb17-1020,concerning treatment of persons with mental illness in the criminal and juvenile justice systems.,Last Action:03/8/2017 | Governor Signed,1,"Rep. J. Singer, Sen. B. Martinez Humenik",State Government,2017 Regular Session,Type:Bill,2017-03-08
488,HB17-1021,Wage Theft Transparency Act,/bills/hb17-1021,concerning an employer's violation of wage laws.,Last Action:04/13/2017 | Governor Signed,1,"Rep. J. Danielson, Sen. J. Cooke",Labor & Employment,2017 Regular Session,Type:Bill,2017-04-13
489,HB17-1022,Teaching Competent History In Public Schools,/bills/hb17-1022,"Concerning teaching civil government in public schools, including the history, culture, and contributions of American Indians, Hispanic Americans, African Americans, and Asian Americans, and, in connection therewith, making an appropriation.","Last Action:05/3/2017 | Senate Committee on State, Veterans, & Military Affairs Postpone Indefinitely",0,"Rep. J. Salazar, Sen. D. Moreno",Education & School Finance (Pre & K-12),2017 Regular Session,Type:Bill,2017-05-03
490,HB17-1023,Clarifying Deceptive Trade Practice Subpoenas,/bills/hb17-1023,Concerning a clarification of procedures for subpoenas for deceptive trade practices.,Last Action:03/20/2017 | Governor Signed,1,"Rep. T. Kraft-Tharp, Rep. C. Wist, Sen. L. Court, Sen. C. Holbert",Business & Economic DevelopmentState Government,2017 Regular Session,Type:Bill,2017-03-20
491,HB17-1024,Nonsubstantive Relocation Commission On Family Medicine,/bills/hb17-1024,Concerning the nonsubstantive relocation of laws pertaining to the commission on family medicine.,Last Action:03/1/2017 | Governor Signed,1,"Rep. D. Thurlow, Sen. D. Moreno",State Government,2017 Regular Session,Type:Bill,2017-03-01
492,HB17-1025,Repeal Obsolete State Legislative District Laws,/bills/hb17-1025,Concerning the repeal of obsolete laws relating to reapportionment of state legislative districts.,Last Action:03/8/2017 | Governor Signed,1,"Rep. J. Arndt, Sen. C. Holbert",State Government,2017 Regular Session,Type:Bill,2017-03-08
493,HB17-1026,Reverse Mortgage Repayment When Home Uninhabitable,/bills/hb17-1026,"Concerning the suspension of a borrower's obligation to repay a reverse mortgage when a force majeure renders the subject property uninhabitable as a principal residence, and, in connection therewith, directing the wildfire matters review committee to study this issue in 2017.","Last Action:04/24/2017 | Senate Committee on State, Veterans, & Military Affairs Postpone Indefinitely",0,"Rep. J. Singer, Sen. M. Jones",Housing,2017 Regular Session,Type:Bill,2017-04-24
494,HB17-1027,Remove Fund Repeal & Clarify Organ Donor Process,/bills/hb17-1027,"Concerning the Emily Maureen Ellen Keyes organ and tissue donation awareness fund, and, in connection therewith, changing the name of the fund, extending the repeal date of the fund, requiring an annual report on the use of donated funds, clarifying that an organ and tissue donor designation is effective unless revoked by the donor, and making an appropriation.",Last Action:06/5/2017 | Governor Signed,1,"Rep. J. Becker, Rep. J. Buckner, Sen. B. Gardner, Sen. L. Garcia",State Government,2017 Regular Session,Type:Bill,2017-06-05
495,HB17-1028,Uniform Unsworn Declarations Act Include Domestic,/bills/hb17-1028,"Concerning the ""Uniform Unsworn Declarations Act"".",Last Action:01/24/2017 | House Committee on Judiciary Postpone Indefinitely,0,"Rep. Y. Willett, Sen. B. Gardner",State Government,2017 Regular Session,Type:Bill,2017-01-24
496,HB17-1029,Open Records Subject To Inspection Denial,/bills/hb17-1029,Concerning public records that are subject to denial of inspection.,"Last Action:02/2/2017 | House Committee on State, Veterans, & Military Affairs Postpone Indefinitely",0,"Rep. P. Lawrence, Sen. B. Gardner",State Government,2017 Regular Session,Type:Bill,2017-02-02
497,HB17-1030,Update 1921 Irrigation District Law,/bills/hb17-1030,Concerning updates to the 1921 law governing irrigation districts.,Last Action:03/8/2017 | Governor Signed,1,"Rep. J. Arndt, Rep. J. Becker, Sen. J. Sonnenberg, Sen. R. Baumgardner",Water,2017 Regular Session,Type:Bill,2017-03-08
498,HB17-1031,Hearings On Transportation Commission Districts,/bills/hb17-1031,Concerning a requirement that the transportation legislation review committee conduct hearings throughout the state regarding state transportation commission districts.,Last Action:04/28/2017 | Senate Committee on Legislative Council Postpone Indefinitely,0,"Rep. T. Carver, Sen. J. Cooke, Sen. N. Todd",Transportation & Motor Vehicles,2017 Regular Session,Type:Bill,2017-04-28
499,HB17-1032,First Responder Peer Support Testimony Privilege,/bills/hb17-1032,Concerning the evidentiary privilege for communications made during the provision of certain peer support services.,Last Action:03/16/2017 | Governor Signed,1,"Rep. J. Arndt, Sen. J. Cooke",Courts & Judicial,2017 Regular Session,Type:Bill,2017-03-16
500,HB17-1033,Colorado Water Conservation Board Grants Loans Dredge South Platte Basin Reservoirs,/bills/hb17-1033,Concerning an authorization for the Colorado water conservation board to finance South Platte river basin reservoir dredging projects.,"Last Action:03/13/2017 | House Committee on Agriculture, Livestock, & Natural Resources Postpone Indefinitely",0,"Rep. J. Becker, Sen. J. Sonnenberg",Water,2017 Regular Session,Type:Bill,2017-03-13
501,HB17-1034,Medical Marijuana License Issues,/bills/hb17-1034,Concerning licensing changes to the medical marijuana code to conform with the retail marijuana code.,Last Action:03/16/2017 | Governor Signed,1,"Rep. D. Pabon, Sen. R. Baumgardner","Liquor, Tobacco, & Marijuana",2017 Regular Session,Type:Bill,2017-03-16
502,HB17-1035,Sex Assault And Stalking Victims May Break Leases,/bills/hb17-1035,Concerning allowing certain crime victims to break their rental agreements under certain circumstances.,Last Action:06/1/2017 | Governor Signed,1,"Rep. D. Jackson, Sen. J. Cooke","Crimes, Corrections, & EnforcementHousing",2017 Regular Session,Type:Bill,2017-06-01
503,HB17-1036,Concealed Carry In Public Schools,/bills/hb17-1036,Concerning permitting the carrying of concealed handguns on public school grounds.,"Last Action:02/8/2017 | House Committee on State, Veterans, & Military Affairs Postpone Indefinitely",0,"Rep. P. Neville, Rep. K. Ransom, Sen. T. Neville",Education & School Finance (Pre & K-12),2017 Regular Session,Type:Bill,2017-02-08
504,HB17-1037,Deadly Force Against An Intruder At A Business,/bills/hb17-1037,Concerning the use of deadly physical force against a person who has made an illegal entry into a place of business.,"Last Action:02/8/2017 | House Committee on State, Veterans, & Military Affairs Postpone Indefinitely",0,"Rep. J. Everett, Sen. V. Marble","Crimes, Corrections, & Enforcement",2017 Regular Session,Type:Bill,2017-02-08
505,HB17-1038,Prohibit Corporal Punishment Of Children,/bills/hb17-1038,Concerning prohibiting corporal punishment of children in certain public settings.,Last Action:03/13/2017 | Senate Committee on Judiciary Postpone Indefinitely,0,"Rep. S. Lontine, Sen. R. Zenzinger",Children & Domestic MattersEducation & School Finance (Pre & K-12),2017 Regular Session,Type:Bill,2017-03-13
506,HB17-1039,Restorative Justice Communication Issues,/bills/hb17-1039,Concerning communication issues related to restorative justice.,Last Action:03/20/2017 | Governor Signed,1,"Rep. P. Lee, Sen. D. Kagan",Courts & Judicial,2017 Regular Session,Type:Bill,2017-03-20
507,HB17-1040,Interception Of Human Trafficking Communications,/bills/hb17-1040,Concerning authorizing the interception of communication relating to a crime of human trafficking.,Last Action:03/23/2017 | Governor Signed,1,"Rep. P. Lundeen, Rep. M. Foote, Sen. K. Priola, Sen. C. Jahn",Courts & JudicialTelecommunications & Information Technology,2017 Regular Session,Type:Bill,2017-03-23
508,HB17-1041,Inform Students And Parents Of Education Leading To Jobs,/bills/hb17-1041,Concerning measures to inform students of education opportunities leading to jobs.,Last Action:03/20/2017 | Governor Signed,1,"Rep. P. Covarrubias, Sen. K. Priola",Education & School Finance (Pre & K-12),2017 Regular Session,Type:Bill,2017-03-20
509,HB17-1042,Increasing Funding For Full-day Kindergarten,/bills/hb17-1042,Concerning increasing the supplemental kindergarten enrollment for purposes of calculating public school finance.,Last Action:01/23/2017 | House Committee on Education Refer Unamended to Appropriations,0,Rep. J. Wilson,Education & School Finance (Pre & K-12),2017 Regular Session,Type:Bill,2017-01-23
510,HB17-1043,Continue Funding Fraud Investigators Unit,/bills/hb17-1043,Concerning an extension of the scheduled repeal date for uniform commercial code filing fees to provide funding for the Colorado fraud investigators unit.,Last Action:06/6/2017 | Governor Signed,1,"Rep. M. Gray, Sen. K. Priola, Sen. A. Williams",State Government,2017 Regular Session,Type:Bill,2017-06-06
511,HB17-1044,Autocycle Characteristics & Safety Requirements,/bills/hb17-1044,"Concerning autocycles, and, in connection therewith, clarifying that an autocycle is a type of motorcycle and requiring autocycle drivers and passengers to use safety belts and, if applicable, child safety restraints.",Last Action:03/23/2017 | Governor Signed,1,Sen. N. Todd,Transportation & Motor Vehicles,2017 Regular Session,Type:Bill,2017-03-23
512,HB17-1045,Extend Home Care Allowance Grant Program,/bills/hb17-1045,"Concerning the home care allowance grant program, and, in connection therewith, making and reducing appropriations.",Last Action:06/5/2017 | Governor Signed,1,"Rep. D. Young, Sen. K. Lambert",Health Care & Health InsuranceHuman ServicesState Government,2017 Regular Session,Type:Bill,2017-06-05
513,HB17-1046,Update Outdated Statutes Persons With Disabilities,/bills/hb17-1046,Concerning updating statutory references to certain limited outdated terms relating to people with disabilities.,Last Action:03/16/2017 | Governor Signed,1,"Rep. S. Lebsock, Sen. K. Donovan",State Government,2017 Regular Session,Type:Bill,2017-03-16
514,HB17-1047,Reporting Requirements By Department of Local Affairs To General Assembly,/bills/hb17-1047,Concerning the scheduled repeal of reports by the department of local affairs to the general assembly.,Last Action:03/8/2017 | Governor Signed,1,"Rep. D. Thurlow, Sen. J. Tate",State Government,2017 Regular Session,Type:Bill,2017-03-08
515,HB17-1048,Prosecution Of Insurance Fraud,/bills/hb17-1048,Concerning the prosecution of insurance fraud.,Last Action:03/23/2017 | Governor Signed,1,"Rep. M. Foote, Sen. J. Smallwood","Crimes, Corrections, & EnforcementInsurance",2017 Regular Session,Type:Bill,2017-03-23
516,HB17-1049,Eliminate Property Tax Abatement Refund Interest,/bills/hb17-1049,Concerning the elimination of refund interest related to a property tax abatement.,Last Action:04/24/2017 | Governor Signed,1,"Rep. D. Thurlow, Rep. M. Gray, Sen. D. Coram",Fiscal Policy & Taxes,2017 Regular Session,Type:Bill,2017-04-24
517,HB17-1050,Annual In-service Training For County Sheriffs,/bills/hb17-1050,Concerning the annual in-service training required for a county sheriff.,Last Action:03/16/2017 | Governor Signed,1,"Rep. H. McKean, Sen. D. Kagan",Local Government,2017 Regular Session,Type:Bill,2017-03-16
518,HB17-1051,Procurement Code Modernization,/bills/hb17-1051,"Concerning modernization of the Colorado ""Procurement Code"".",Last Action:04/4/2017 | Governor Signed,1,"Rep. B. Rankin, Rep. A. Garnett, Sen. D. Coram, Sen. A. Kerr",State Government,2017 Regular Session,Type:Bill,2017-04-04
519,HB17-1052,Child Welfare Allocation Formula Factors,/bills/hb17-1052,Concerning factors to take into consideration in determining the child welfare allocation formula in a given fiscal year.,Last Action:03/16/2017 | Governor Signed,1,"Rep. S. Beckman, Sen. J. Smallwood",Children & Domestic MattersHuman Services,2017 Regular Session,Type:Bill,2017-03-16
520,HB17-1053,Warrant Or Order For Electronic Communications,/bills/hb17-1053,Concerning orders for electronic communications.,Last Action:02/21/2017 | House Committee on Judiciary Postpone Indefinitely,0,Rep. L. Landgraf,Courts & JudicialTelecommunications & Information Technology,2017 Regular Session,Type:Bill,2017-02-21
521,HB17-1054,Community-military Cooperation,/bills/hb17-1054,"Concerning partnerships between local governments and military installations, and, in connection therewith, identifying shared-service opportunities to reduce costs and increase efficiencies.",Last Action:03/16/2017 | Governor Signed,1,"Rep. T. Carver, Rep. D. Nordberg, Sen. N. Todd",Local GovernmentMilitary & Veterans,2017 Regular Session,Type:Bill,2017-03-16
522,HB17-1055,Create New Tax Check-off For Urban Peak,/bills/hb17-1055,Concerning a voluntary contribution designation benefiting the Urban Peak Housing and Support Services for Youth Experiencing Homelessness fund that appears on the state individual tax return forms.,Last Action:03/16/2017 | Governor Signed,1,"Rep. L. Herod, Sen. B. Gardner",Fiscal Policy & Taxes,2017 Regular Session,Type:Bill,2017-03-16
523,HB17-1056,Criminal Sentencing Community Service Veterans Organizations,/bills/hb17-1056,Concerning the eligibility of a veterans' service organization to accept public service assignments offered in connection with misdemeanor sentencing.,Last Action:03/20/2017 | Governor Signed,1,"Rep. M. Weissman, Sen. J. Kefalas, Sen. B. Gardner",Courts & JudicialMilitary & Veterans,2017 Regular Session,Type:Bill,2017-03-20
524,HB17-1057,Interstate Physical Therapy Licensure Compact,/bills/hb17-1057,"Concerning the adoption of an interstate compact to allow persons authorized to practice physical therapy in a state to obtain the privilege to practice physical therapy in other member states, and, in connection therewith, making an appropriation.",Last Action:05/10/2017 | Governor Signed,1,"Rep. F. Winter, Rep. L. Liston, Sen. A. Kerr, Sen. B. Gardner",Public Health,2017 Regular Session,Type:Bill,2017-05-10
525,HB17-1058,Reporting Requirements By Department Of Personnel And Administration To General Assembly,/bills/hb17-1058,Concerning the scheduled repeal of reports by the department of personnel to the general assembly.,Last Action:03/8/2017 | Governor Signed,1,"Rep. D. Thurlow, Sen. A. Kerr",State Government,2017 Regular Session,Type:Bill,2017-03-08
526,HB17-1059,Reporting Requirements By Department Of Public Safety To General Assembly,/bills/hb17-1059,Concerning the scheduled repeal of reports by the department of public safety to the general assembly.,Last Action:03/30/2017 | Governor Signed,1,"Rep. D. Thurlow, Sen. J. Tate",State Government,2017 Regular Session,Type:Bill,2017-03-30
527,HB17-1060,Reporting Requirements By Health Care Policy & Financing To General Assembly,/bills/hb17-1060,Concerning the scheduled repeal of reports by the department of health care policy and financing to the general assembly.,Last Action:03/1/2017 | Governor Signed,1,"Rep. D. Thurlow, Sen. J. Tate",State Government,2017 Regular Session,Type:Bill,2017-03-01
528,HB17-1061,Modify Definition Of Commercial Vehicle,/bills/hb17-1061,Concerning modification of the class of vehicles that is subject to regulation as commercial vehicles.,Last Action:03/20/2017 | Governor Signed,1,"Rep. J. Becker, Rep. J. Melton, Sen. R. Scott, Sen. N. Todd",Transportation & Motor Vehicles,2017 Regular Session,Type:Bill,2017-03-20
529,HB17-1062,Making Certain State Assessments Optional,/bills/hb17-1062,Concerning allowing local education providers to choose whether to administer certain state assessments to students enrolled in specified grades.,Last Action:02/13/2017 | House Committee on Education Postpone Indefinitely,0,"Rep. P. Buck, Sen. M. Merrifield, Sen. V. Marble",Education & School Finance (Pre & K-12),2017 Regular Session,Type:Bill,2017-02-13
530,HB17-1063,Reduce Business Personal Property Taxes,/bills/hb17-1063,Concerning a reduction in the personal property taxes paid by a business.,"Last Action:02/1/2017 | House Committee on State, Veterans, & Military Affairs Postpone Indefinitely",0,"Rep. T. Leonard, Sen. T. Neville, Sen. L. Crowder",Business & Economic DevelopmentFiscal Policy & Taxes,2017 Regular Session,Type:Bill,2017-02-01
531,HB17-1064,Misuse Of Electronic Images By A Juvenile,/bills/hb17-1064,Concerning creating the crime of misuse of electronic images by a juvenile.,Last Action:04/20/2017 | House Committee on Judiciary Postpone Indefinitely,0,"Rep. Y. Willett, Sen. R. Fields","Children & Domestic MattersCrimes, Corrections, & Enforcement",2017 Regular Session,Type:Bill,2017-04-20
532,HB17-1065,Clarify Requirements Formation Metropolitan District,/bills/hb17-1065,"Concerning a clarification of requirements governing the formation of metropolitan districts, and, in connection therewith, limiting the inclusion of agricultural land within a metropolitan district providing park and recreational services and clarifying signature requirements governing judicial approval of a petition for organization of a proposed special district.",Last Action:03/23/2017 | Governor Signed,1,"Rep. K. Lewis, Sen. V. Marble",Local Government,2017 Regular Session,Type:Bill,2017-03-23
533,HB17-1066,Conservation Easement Tax Credit Landowner Relief,/bills/hb17-1066,Concerning a perpetual conservation easement in gross granted for property in Colorado for which a tax credit claim has been rejected.,"Last Action:02/1/2017 | House Committee on State, Veterans, & Military Affairs Postpone Indefinitely",0,"Rep. J. Becker, Rep. K. Lewis",Courts & JudicialFiscal Policy & Taxes,2017 Regular Session,Type:Bill,2017-02-01
534,HB17-1067,Update National Standards Citations Accessible Housing,/bills/hb17-1067,Concerning updating references to a national standard setting forth technical criteria for accessible housing.,Last Action:03/8/2017 | Governor Signed,1,"Rep. D. Thurlow, Sen. A. Kerr",State Government,2017 Regular Session,Type:Bill,2017-03-08
535,HB17-1068,Prevailing Wages For CDOT Colorado Department Of Transportation Public-private Initiatives,/bills/hb17-1068,Concerning a requirement that the department of transportation consider only proposals for public-private initiatives that will pay prevailing wages for construction labor.,Last Action:02/21/2017 | Senate Committee on Transportation Postpone Indefinitely,0,"Rep. A. Benavidez, Sen. D. Moreno",Transportation & Motor Vehicles,2017 Regular Session,Type:Bill,2017-02-21
536,HB17-1069,Subcommittee On Data Privacy,/bills/hb17-1069,"Concerning the creation of a subcommittee to address information security, and, in connection therewith, charging the subcommittee to consider strategies for protecting data and other information resources of the state against unauthorized access, disclosure, use, modification, or destruction.","Last Action:02/9/2017 | House Committee on State, Veterans, & Military Affairs Postpone Indefinitely",0,"Rep. T. Carver, Rep. J. Melton, Sen. K. Lundberg",State GovernmentTelecommunications & Information Technology,2017 Regular Session,Type:Bill,2017-02-09
537,HB17-1070,Study Drone Use By Public Safety Agencies,/bills/hb17-1070,"Concerning the use of unmanned aircraft systems to perform government functions relating to certain public-safety functions, and, in connection therewith, requiring the center of excellence within the department of public safety to perform a study and operate a pilot program.",Last Action:06/5/2017 | Governor Signed,1,"Rep. J. Wilson, Sen. D. Coram, Sen. K. Donovan",State Government,2017 Regular Session,Type:Bill,2017-06-05
538,HB17-1071,Refund Monetary Amounts After Vacated Conviction,/bills/hb17-1071,Concerning a process for repayment of certain criminal monetary amounts ordered by the court to be paid following conviction.,Last Action:03/23/2017 | Governor Signed,1,"Rep. C. Wist, Rep. P. Lee, Sen. B. Gardner, Sen. D. Kagan","Courts & JudicialCrimes, Corrections, & Enforcement",2017 Regular Session,Type:Bill,2017-03-23
539,HB17-1072,Human Trafficking Sexual Servitude,/bills/hb17-1072,Concerning human trafficking for sexual servitude.,Last Action:05/25/2017 | Governor Signed,1,"Rep. L. Landgraf, Rep. P. Lawrence, Sen. J. Cooke","Crimes, Corrections, & Enforcement",2017 Regular Session,Type:Bill,2017-05-25
540,HB17-1073,Enactment of CRS 2016,/bills/hb17-1073,Concerning the enactment of Colorado Revised Statutes 2016 as the positive and statutory law of the state of Colorado.,Last Action:03/1/2017 | Governor Signed,1,"Rep. M. Foote, Sen. R. Scott",State Government,2017 Regular Session,Type:Bill,2017-03-01
541,HB17-1074,Repeal Obsolete Law Colorado Congressional Districts,/bills/hb17-1074,Concerning the repeal of obsolete laws relating to redistricting of congressional districts.,Last Action:03/8/2017 | Governor Signed,1,"Rep. J. Arndt, Sen. C. Holbert",State Government,2017 Regular Session,Type:Bill,2017-03-08
542,HB17-1075,Arrest Of An Offender On A Deferred Sentence,/bills/hb17-1075,Concerning the conditions under which a probation officer may arrest certain defendants.,Last Action:02/16/2017 | House Committee on Judiciary Postpone Indefinitely,0,Rep. M. Gray,"Courts & JudicialCrimes, Corrections, & Enforcement",2017 Regular Session,Type:Bill,2017-02-16
543,HB17-1076,Artificial Recharge Nontributary Aquifer Rules,/bills/hb17-1076,Concerning rule-making by the state engineer regarding permits for the use of water artificially recharged into nontributary groundwater aquifers.,Last Action:03/30/2017 | Governor Signed,1,"Rep. J. Arndt, Sen. D. Coram, Sen. S. Fenberg",Water,2017 Regular Session,Type:Bill,2017-03-30
544,HB17-1077,Useful Public Service Cash Fund,/bills/hb17-1077,Concerning the useful public service cash fund.,Last Action:05/21/2017 | Governor Signed,1,"Rep. D. Valdez, Sen. D. Coram","Courts & JudicialCrimes, Corrections, & Enforcement",2017 Regular Session,Type:Bill,2017-05-21
545,HB17-1078,Transfer Funds From Family Support Loan Program,/bills/hb17-1078,"Concerning the repeal of the Colorado family support loan program, and, in connection therewith, transferring funds from the Colorado family support loan program to the family support services program to provide services for families of persons with intellectual and developmental disabilities.",Last Action:03/8/2017 | Governor Signed,1,"Rep. L. Landgraf, Sen. D. Coram",Human Services,2017 Regular Session,Type:Bill,2017-03-08
546,HB17-1079,Continue Fees Wholesale Food Manufacture And Storage,/bills/hb17-1079,"Concerning the continued collection of fees for wholesale food manufacturing and storage, and, in connection therewith, making an appropriation.",Last Action:06/6/2017 | Governor Signed,1,"Rep. C. Kennedy, Sen. D. Coram, Sen. C. Jahn",State Government,2017 Regular Session,Type:Bill,2017-06-06
547,HB17-1080,Requirements Durable Medical Equipment Suppliers,/bills/hb17-1080,"Concerning affidavit requirements for durable medical equipment suppliers, and, in connection therewith, making an appropriation.","Last Action:04/24/2017 | Senate Committee on State, Veterans, & Military Affairs Postpone Indefinitely",0,"Rep. D. Young, Sen. L. Crowder",Health Care & Health Insurance,2017 Regular Session,Type:Bill,2017-04-24
548,HB17-1081,Olympic Athletes Colorado In-state Tuition,/bills/hb17-1081,Concerning authority to offer in-state tuition classification at state-supported institutions of higher education for athletes training in Colorado in programs approved by the United States olympic committee.,Last Action:04/13/2017 | Governor Signed,1,"Rep. D. Nordberg, Sen. S. Fenberg",Higher Education,2017 Regular Session,Type:Bill,2017-04-13
549,HB17-1082,BEST Building Excellent Schools Today Act Technology Grant Funding,/bills/hb17-1082,"Concerning clarification that financial assistance under the ""Building Excellent Schools Today Act"" includes technology grants.",Last Action:06/6/2017 | Governor Signed,1,"Rep. D. Pabon, Sen. J. Tate","Capital ConstructionEducation & School Finance (Pre & K-12)Liquor, Tobacco, & Marijuana",2017 Regular Session,Type:Bill,2017-06-06
550,HB17-1083,Municipal Judge Advisement For Traffic Offenses,/bills/hb17-1083,Concerning an exemption for certain traffic violations of the requirement that a municipal judge inform a defendant of certain rights.,Last Action:04/13/2017 | Governor Signed,1,"Rep. L. Liston, Sen. B. Gardner",Courts & JudicialTransportation & Motor Vehicles,2017 Regular Session,Type:Bill,2017-04-13
551,HB17-1084,Hotel Wine Alcohol Sales,/bills/hb17-1084,Concerning the creation of a wine-expanded permit that allows hotels licensed to sell alcohol beverages to also sell sealed containers of vinous liquors in the restaurant for on- and off-premises consumption.,Last Action:02/9/2017 | House Committee on Business Affairs and Labor Postpone Indefinitely,0,Rep. J. Melton,"Liquor, Tobacco, & Marijuana",2017 Regular Session,Type:Bill,2017-02-09
552,HB17-1085,Women's Health Protection Act,/bills/hb17-1085,"Concerning the adoption of the ""Women's Health Protection Act"".","Last Action:02/9/2017 | House Committee on Health, Insurance, & Environment Postpone Indefinitely",0,Rep. P. Neville,Health Care & Health Insurance,2017 Regular Session,Type:Bill,2017-02-09
553,HB17-1086,Abortion Pill Reversal Information Act,/bills/hb17-1086,"Concerning creation of the ""Abortion Pill Reversal Information Act"".","Last Action:02/9/2017 | House Committee on Health, Insurance, & Environment Postpone Indefinitely",0,"Rep. J. Everett, Rep. D. Nordberg, Sen. V. Marble",Health Care & Health InsuranceHuman Services,2017 Regular Session,Type:Bill,2017-02-09
554,HB17-1087,Office Of Public Guardianship Pilot Program,/bills/hb17-1087,Concerning an office of public guardianship.,Last Action:06/5/2017 | Governor Signed,1,"Rep. D. Young, Sen. K. Lundberg",Courts & Judicial,2017 Regular Session,Type:Bill,2017-06-05
555,HB17-1088,Voter Signature Verification & Electronic Petition Pilot,/bills/hb17-1088,Concerning signature verification for candidate petitions filed with the secretary of state.,Last Action:06/8/2017 | Governor Signed,1,"Rep. P. Neville, Sen. T. Neville",Elections & Redistricting,2017 Regular Session,Type:Bill,2017-06-08
556,HB17-1089,Parent Choice In Low-performing School Districts,/bills/hb17-1089,Concerning measures that apply to chronically low-performing school districts.,Last Action:02/13/2017 | House Committee on Education Postpone Indefinitely,0,Rep. P. Lundeen,Education & School Finance (Pre & K-12),2017 Regular Session,Type:Bill,2017-02-13
557,HB17-1090,Advanced Industry Investment Tax Credit Extension,/bills/hb17-1090,"Concerning the advanced industry investment tax credit, and, in connection therewith, making an appropriation.",Last Action:06/6/2017 | Governor Signed,1,"Rep. T. Kraft-Tharp, Rep. J. Wilson, Sen. B. Gardner, Sen. J. Kefalas",Business & Economic DevelopmentFiscal Policy & Taxes,2017 Regular Session,Type:Bill,2017-06-06
558,HB17-1091,Tax Credit Employer-assisted Housing Projects,/bills/hb17-1091,Concerning the creation of a credit against the state income tax to promote employer-assisted housing projects in rural areas.,Last Action:05/9/2017 | Senate Committee on Finance Postpone Indefinitely,0,"Rep. J. Wilson, Rep. B. McLachlan, Sen. D. Coram, Sen. K. Donovan",Fiscal Policy & Taxes,2017 Regular Session,Type:Bill,2017-05-09
559,HB17-1092,Retail Establishment And Performing Rights,/bills/hb17-1092,Concerning contracts involving license royalties with proprietors of retail establishments that publicly perform music.,Last Action:03/23/2017 | Governor Signed,1,"Rep. S. Lebsock, Sen. J. Tate",Business & Economic DevelopmentCivil Law,2017 Regular Session,Type:Bill,2017-03-23
560,HB17-1093,Increase Exemption For Life Insurance Cash Value,/bills/hb17-1093,Concerning an increase in the exemption for the cash surrender value of life insurance.,Last Action:03/20/2017 | Governor Signed,1,"Rep. K. Ransom, Sen. D. Kagan",Insurance,2017 Regular Session,Type:Bill,2017-03-20
561,HB17-1094,Telehealth Coverage Under Health Benefit Plans,/bills/hb17-1094,Concerning modifications to the requirements for health benefit plans to cover health care services delivered via telehealth.,Last Action:03/16/2017 | Governor Signed,1,"Rep. P. Buck, Rep. D. Valdez, Sen. L. Crowder, Sen. K. Donovan",Health Care & Health Insurance,2017 Regular Session,Type:Bill,2017-03-16
562,HB17-1095,Service Of Process To Secured Dwellings,/bills/hb17-1095,Concerning the service of process to individuals who live in secured residential communities.,"Last Action:05/4/2017 | Senate Committee on State, Veterans, & Military Affairs Postpone Indefinitely",0,"Rep. J. Melton, Sen. D. Kagan",Courts & Judicial,2017 Regular Session,Type:Bill,2017-05-04
563,HB17-1096,Endowment Care Cemetery Authority,/bills/hb17-1096,Concerning endowment care funds administered for cemetery authorities.,Last Action:03/20/2017 | Governor Signed,1,"Rep. L. Liston, Sen. J. Smallwood",Business & Economic Development,2017 Regular Session,Type:Bill,2017-03-20
564,HB17-1097,Repeal Ammunition Magazine Prohibition,/bills/hb17-1097,Concerning the repeal of certain provisions concerning ammunition magazines.,"Last Action:02/8/2017 | House Committee on State, Veterans, & Military Affairs Postpone Indefinitely",0,"Rep. L. Saine, Rep. S. Humphrey, Sen. V. Marble, Sen. T. Neville","Crimes, Corrections, & Enforcement",2017 Regular Session,Type:Bill,2017-02-08
565,HB17-1098,Damages For Loss Of Use Of Rental Motor Vehicles,/bills/hb17-1098,Concerning damages for loss of use of a rental motor vehicle.,Last Action:02/21/2017 | House Committee on Business Affairs and Labor Postpone Indefinitely,0,"Rep. L. Liston, Rep. D. Pabon, Sen. J. Kefalas, Sen. K. Lundberg",Business & Economic DevelopmentFinancial Services & CommerceTransportation & Motor Vehicles,2017 Regular Session,Type:Bill,2017-02-21
566,HB17-1099,No Funding Trafficking Aborted Human Body Parts,/bills/hb17-1099,Concerning the termination of state funding for higher education institutions that engage in the trafficking of aborted human body parts.,"Last Action:02/15/2017 | House Committee on State, Veterans, & Military Affairs Postpone Indefinitely",0,Rep. T. Leonard,Higher EducationState Revenue & Budget,2017 Regular Session,Type:Bill,2017-02-15
567,HB17-1100,Owner Tax Obligation For District Voter Eligibility,/bills/hb17-1100,Concerning the qualification of an elector for specified local government elections by virtue of a contract to purchase taxable property.,Last Action:02/15/2017 | House Committee on Local Government Postpone Indefinitely,0,Rep. M. Gray,Elections & RedistrictingLocal Government,2017 Regular Session,Type:Bill,2017-02-15
568,HB17-1101,Division Of Youth Corrections Monetary Incentives Award Program,/bills/hb17-1101,Concerning the creation of the youth corrections monetary incentives award program in the division of youth corrections.,Last Action:04/4/2017 | Governor Signed,1,"Rep. P. Rosenthal, Sen. K. Priola, Sen. N. Todd","Children & Domestic MattersCrimes, Corrections, & Enforcement",2017 Regular Session,Type:Bill,2017-04-04
569,HB17-1102,Prohibit Nuisance Exhibition Motor Vehicle Exhaust,/bills/hb17-1102,Concerning a prohibition against engaging in a nuisance exhibition of motor vehicle exhaust.,"Last Action:03/8/2017 | Senate Committee on State, Veterans, & Military Affairs Postpone Indefinitely",0,"Rep. J. Ginal, Sen. D. Coram",Transportation & Motor Vehicles,2017 Regular Session,Type:Bill,2017-03-08
570,HB17-1103,Sales And Use Tax Exemption For Historic Aircraft,/bills/hb17-1103,Concerning a state sales and use tax exemption for historic aircraft on loan for public display.,Last Action:04/4/2017 | Governor Signed,1,"Rep. D. Nordberg, Rep. D. Pabon, Sen. B. Gardner, Sen. D. Moreno",Fiscal Policy & Taxes,2017 Regular Session,Type:Bill,2017-04-04
571,HB17-1104,Exclude Olympic Medal Income From Taxable Income,/bills/hb17-1104,"Concerning the exclusion from state taxable income of the monetary value of any medal won by an athlete while competing for the United States of America at the olympic games, so long as the athlete's federal adjusted gross income does not exceed a specified amount.",Last Action:05/22/2017 | Governor Signed,1,Sen. K. Priola,Fiscal Policy & Taxes,2017 Regular Session,Type:Bill,2017-05-22
572,HB17-1105,Vehicle Titling And Registration Inspection Requirements,/bills/hb17-1105,Concerning narrowing the circumstances in which physical inspection of a vehicle is required before issuing legal documentation identifying the vehicle.,Last Action:03/16/2017 | Governor Signed,1,"Rep. J. Becker, Sen. R. Baumgardner",Transportation & Motor Vehicles,2017 Regular Session,Type:Bill,2017-03-16
573,HB17-1106,Extend Early Childhood Leadership Commission,/bills/hb17-1106,Concerning the early childhood leadership commission.,Last Action:06/5/2017 | Governor Signed,1,"Rep. B. Pettersen, Rep. J. Wilson, Sen. B. Martinez Humenik, Sen. N. Todd",Human Services,2017 Regular Session,Type:Bill,2017-06-05
574,HB17-1107,Division Of Motor Vehicles Colorado Driver's License Record Identification And Vehicle Enterprise System,/bills/hb17-1107,Concerning the implementation of a new computer system by the division of motor vehicles to facilitate the division's administration of the operation of motor vehicles in the state.,Last Action:04/4/2017 | Governor Signed,1,"Rep. D. Thurlow, Rep. J. Bridges, Sen. B. Martinez Humenik",Transportation & Motor Vehicles,2017 Regular Session,Type:Bill,2017-04-04
575,HB17-1108,Protect Human Life At Conception,/bills/hb17-1108,Concerning the protection of human life beginning at conception.,"Last Action:02/9/2017 | House Committee on Health, Insurance, & Environment Postpone Indefinitely",0,"Rep. S. Humphrey, Rep. K. Ransom, Sen. T. Neville","Crimes, Corrections, & Enforcement",2017 Regular Session,Type:Bill,2017-02-09
576,HB17-1109,Child Sex Assault Pattern Offense Place Of Trial,/bills/hb17-1109,Concerning prosecuting in one jurisdiction a person who has committed sexual assaults against a child in different jurisdictions.,Last Action:04/4/2017 | Governor Signed,1,"Rep. T. Carver, Rep. J. Danielson, Sen. R. Fields, Sen. J. Cooke","Children & Domestic MattersCourts & JudicialCrimes, Corrections, & Enforcement",2017 Regular Session,Type:Bill,2017-04-04
577,HB17-1110,Jurisdiction Juvenile Court Parental Responsibilities,/bills/hb17-1110,Concerning juvenile court jurisdiction regarding matters related to parental responsibilities in a juvenile delinquency case.,Last Action:04/18/2017 | Governor Signed,1,"Rep. S. Beckman, Sen. N. Todd",Children & Domestic MattersCourts & Judicial,2017 Regular Session,Type:Bill,2017-04-18
578,HB17-1111,Dependency And Neglect Civil Protection Orders,/bills/hb17-1111,Concerning allowing juvenile courts to enter civil protection orders in dependency and neglect cases.,Last Action:04/4/2017 | Governor Signed,1,"Rep. S. Beckman, Sen. R. Fields",Children & Domestic MattersCourts & Judicial,2017 Regular Session,Type:Bill,2017-04-04
579,HB17-1112,Immunity Unauthorized Practice Of Profession,/bills/hb17-1112,Concerning immunity from penalties for the unauthorized practice of a profession regulated by the department of regulatory agencies for individuals who meet certain requirements.,Last Action:02/21/2017 | House Committee on Judiciary Postpone Indefinitely,0,Rep. K. Van Winkle,Labor & EmploymentState Government,2017 Regular Session,Type:Bill,2017-02-21
580,HB17-1113,Allow Electronic Committee Participation During Interim,/bills/hb17-1113,Concerning electronic participation in committee meetings during the legislative interim.,Last Action:05/24/2017 | Governor Signed,1,"Rep. Y. Willett, Rep. J. Arndt, Sen. R. Scott",State Government,2017 Regular Session,Type:Bill,2017-05-24
581,HB17-1114,State Treasurer's Authority To Access PERA Public Employees' Retirement Association Information,/bills/hb17-1114,Concerning the authority of the state treasurer to access information kept by the public employees' retirement association in the treasurer's capacity as a member of the board of trustees of the association.,"Last Action:03/1/2017 | House Committee on State, Veterans, & Military Affairs Postpone Indefinitely",0,"Rep. J. Everett, Sen. J. Tate",State Government,2017 Regular Session,Type:Bill,2017-03-01
582,HB17-1115,Direct Primary Health Care Services,/bills/hb17-1115,Concerning the establishment of direct primary health care agreements to operate without regulation by the division of insurance.,Last Action:04/24/2017 | Governor Signed,1,"Rep. P. Buck, Rep. J. Ginal, Sen. J. Kefalas, Sen. J. Tate",Health Care & Health Insurance,2017 Regular Session,Type:Bill,2017-04-24
583,HB17-1116,Continue Low-income Household Energy Assistance,/bills/hb17-1116,Concerning the continuation of energy-related assistance to low-income households.,Last Action:06/6/2017 | Governor Signed,1,"Rep. M. Hamner, Rep. T. Exum, Sen. B. Martinez Humenik",State Revenue & Budget,2017 Regular Session,Type:Bill,2017-06-06
584,HB17-1117,Repeal Assessments In 9th Grade And Social Studies,/bills/hb17-1117,Concerning eliminating certain state assessments in public schools.,Last Action:02/13/2017 | House Committee on Education Postpone Indefinitely,0,"Rep. T. Leonard, Sen. T. Neville",Education & School Finance (Pre & K-12),2017 Regular Session,Type:Bill,2017-02-13
585,HB17-1118,Exempt State From Daylight Saving Time,/bills/hb17-1118,Concerning an exemption from daylight saving time.,"Last Action:02/8/2017 | House Committee on Agriculture, Livestock, & Natural Resources Postpone Indefinitely",0,"Rep. P. Covarrubias, Rep. D. Pabon",State Government,2017 Regular Session,Type:Bill,2017-02-08
586,HB17-1119,Payment Of Workers' Compensation Benefits,/bills/hb17-1119,"Concerning the payment of workers' compensation benefits to injured employees of uninsured employers, and, in connection therewith, making an appropriation.",Last Action:06/5/2017 | Governor Signed,1,"Rep. T. Kraft-Tharp, Sen. C. Jahn, Sen. J. Tate",InsuranceLabor & Employment,2017 Regular Session,Type:Bill,2017-06-05
587,HB17-1120,Alcohol Beverage License Higher Education Campus,/bills/hb17-1120,"Concerning the designation of a campus liquor complex on the campus of an institution of higher education that is licensed to serve alcohol beverages for consumption on the licensed premises to allow the institution to obtain permits to serve alcohol beverages at other facilities within its campus liquor complex, and, in connection therewith, making an appropriation.",Last Action:04/24/2017 | Governor Signed,1,"Rep. Y. Willett, Sen. D. Coram","Higher EducationLiquor, Tobacco, & Marijuana",2017 Regular Session,Type:Bill,2017-04-24
588,HB17-1121,Patient Safety Act,/bills/hb17-1121,"Concerning certain health care professions regulated by the department of regulatory agencies, and, in connection therewith, requiring criminal history record checks for individuals with prescriptive authority and certified nurse aides, repealing the nurse licensure compact,       enacting the enhanced nurse licensure compact, and, making an appropriation.","Last Action:05/4/2017 | Senate Committee on State, Veterans, & Military Affairs Postpone Indefinitely",0,"Rep. J. Buckner, Sen. N. Todd",Health Care & Health Insurance,2017 Regular Session,Type:Bill,2017-05-04
589,HB17-1122,Gender Identification On Birth Certificates,/bills/hb17-1122,Concerning the issuance of a new birth certificate with a gender designation that differs from the gender designated on the person's original birth certificate.,"Last Action:03/27/2017 | Senate Committee on State, Veterans, & Military Affairs Postpone Indefinitely",0,"Rep. D. Esgar, Sen. D. Moreno",Public Health,2017 Regular Session,Type:Bill,2017-03-27
590,HB17-1123,Extend On-premises Retail Alcohol Beverages Sales Hours,/bills/hb17-1123,Concerning the ability of a local government to extend the hours during which alcohol beverages may be sold for consumption on a licensed premises.,Last Action:04/24/2017 | Senate Second Reading Laid Over to 05/11/2017 - No Amendments,0,"Rep. S. Lebsock, Rep. D. Thurlow, Sen. V. Marble","Liquor, Tobacco, & MarijuanaLocal Government",2017 Regular Session,Type:Bill,2017-04-24
591,HB17-1124,Local Government Liable Fracking Ban Oil And Gas Moratorium,/bills/hb17-1124,Concerning a requirement that a local government that interferes with oil and gas operations compensate persons damaged by the interference.,"Last Action:02/22/2017 | House Committee on State, Veterans, & Military Affairs Postpone Indefinitely",0,"Rep. P. Buck, Sen. T. Neville",Local GovernmentNatural Resources & Environment,2017 Regular Session,Type:Bill,2017-02-22
592,HB17-1125,Services In Correctional Facilities,/bills/hb17-1125,Concerning eliminating the duty of the division of correctional industries to provide certain services for the state's correctional facilities.,Last Action:04/13/2017 | Governor Signed,1,"Rep. D. Nordberg, Rep. F. Winter, Sen. C. Jahn, Sen. J. Smallwood","Crimes, Corrections, & Enforcement",2017 Regular Session,Type:Bill,2017-04-13
593,HB17-1126,Medicaid Appeal Review Legal Notice Requirements,/bills/hb17-1126,Concerning the review of legal sufficiency of medicaid appeals.,Last Action:04/6/2017 | Governor Signed,1,"Rep. J. Danielson, Rep. D. Michaelson Jenet, Sen. L. Crowder",Health Care & Health Insurance,2017 Regular Session,Type:Bill,2017-04-06
594,HB17-1127,Exempt Feminine Hygiene Products From Sales Tax,/bills/hb17-1127,Concerning a sales tax exemption for feminine hygiene products.,Last Action:05/5/2017 | House Committee on Appropriations Postpone Indefinitely,0,"Rep. S. Lontine, Sen. B. Martinez Humenik",Fiscal Policy & Taxes,2017 Regular Session,Type:Bill,2017-05-05
595,HB17-1128,Salary Adjustment For Lake County Officials,/bills/hb17-1128,Concerning the salary categorization of locally elected officials in Lake county.,Last Action:03/8/2017 | Governor Signed,1,"Rep. M. Hamner, Sen. K. Donovan",Local Government,2017 Regular Session,Type:Bill,2017-03-08
596,HB17-1129,Technical Issues Filing Medicaid Appeals,/bills/hb17-1129,Concerning technical issues relating to the filing of medicaid appeals.,Last Action:02/14/2017 | House Committee on Public Health Care & Human Services Postpone Indefinitely,0,"Rep. J. Danielson, Sen. L. Crowder",Health Care & Health Insurance,2017 Regular Session,Type:Bill,2017-02-14
597,HB17-1130,Reimburse Expenses Restorative Justice Council,/bills/hb17-1130,Concerning allowing reimbursement for expenses for members of the restorative justice coordinating council.,Last Action:03/9/2017 | Senate Committee on Finance Postpone Indefinitely,0,"Rep. J. Arndt, Sen. D. Kagan","Courts & JudicialCrimes, Corrections, & Enforcement",2017 Regular Session,Type:Bill,2017-03-09
598,HB17-1131,Authority To Contract Administration College Opportunity Fund,/bills/hb17-1131,Concerning contracting by the Colorado student loan program for the administration of the college opportunity fund program.,Last Action:03/8/2017 | Governor Signed,1,"Rep. T. Kraft-Tharp, Rep. L. Saine, Sen. J. Smallwood, Sen. K. Donovan",Higher Education,2017 Regular Session,Type:Bill,2017-03-08
599,HB17-1132,Judicial Disqualification In Civil Actions,/bills/hb17-1132,Concerning judicial disqualification in civil actions.,Last Action:05/1/2017 | Senate Committee on Judiciary Postpone Indefinitely,0,"Rep. P. Lundeen, Sen. B. Gardner",Courts & Judicial,2017 Regular Session,Type:Bill,2017-05-01
600,HB17-1133,Repeal SOS Secretary of State Annual Report UCC Uniform Commericial Code Filing-office Rules,/bills/hb17-1133,Concerning the annual report on filing-office rules by the secretary of state.,Last Action:03/23/2017 | Governor Signed,1,"Rep. D. Nordberg, Rep. E. Hooton, Sen. J. Tate, Sen. D. Moreno",State Government,2017 Regular Session,Type:Bill,2017-03-23
601,HB17-1134,Hold Colorado Government Accountable Sanctuary Jurisdictions,/bills/hb17-1134,Concerning holding Colorado government accountable for creating sanctuary jurisdiction policies.,"Last Action:02/22/2017 | House Committee on State, Veterans, & Military Affairs Postpone Indefinitely",0,"Rep. D. Williams, Sen. V. Marble",Immigration,2017 Regular Session,Type:Bill,2017-02-22
602,HB17-1135,Portability Background Checks Child Care Workers,/bills/hb17-1135,Concerning the portability of employment background checks for a child care worker who works for the same common ownership entity.,Last Action:03/20/2017 | Governor Signed,1,"Rep. J. Bridges, Sen. K. Priola",Children & Domestic MattersHuman Services,2017 Regular Session,Type:Bill,2017-03-20
603,HB17-1136,Consistent Statutes For Electronic Filing Of Taxes,/bills/hb17-1136,Concerning consistent statutory language for electronic filing of taxes.,Last Action:03/23/2017 | Governor Signed,1,"Rep. M. Foote, Sen. B. Gardner",Fiscal Policy & Taxes,2017 Regular Session,Type:Bill,2017-03-23
604,HB17-1137,Reporting Requirements By Department Of Revenue To General Assembly,/bills/hb17-1137,Concerning the scheduled repeal of reports by the department of revenue to the general assembly.,Last Action:03/16/2017 | Governor Signed,1,"Rep. D. Thurlow, Rep. E. Hooton, Sen. J. Tate, Sen. D. Moreno",State Government,2017 Regular Session,Type:Bill,2017-03-16
605,HB17-1138,Hate Crime Reporting By Law Enforcement,/bills/hb17-1138,Concerning the reporting of hate crimes by law enforcement agencies.,Last Action:04/18/2017 | Governor Signed,1,"Rep. J. Salazar, Sen. A. Williams","Crimes, Corrections, & EnforcementState Government",2017 Regular Session,Type:Bill,2017-04-18
606,HB17-1139,Medicaid Provider Compliance Billing Safety Rules,/bills/hb17-1139,Concerning improving medicaid client protections through effective enforcement of medicaid provider requirements.,Last Action:06/6/2017 | Governor Signed,1,"Rep. L. Landgraf, Rep. D. Michaelson Jenet, Sen. B. Martinez Humenik, Sen. J. Kefalas",Health Care & Health Insurance,2017 Regular Session,Type:Bill,2017-06-06
607,HB17-1140,Enhance Student Support Colorado School of Mines Fee-for-service Funds,/bills/hb17-1140,Concerning permitted uses of fee-for-service contract money by the Colorado school of mines.,Last Action:03/16/2017 | Governor Signed,1,"Rep. J. Danielson, Sen. T. Neville",Higher Education,2017 Regular Session,Type:Bill,2017-03-16
608,HB17-1141,Equal Protection From Federal Employee Personal Attack,/bills/hb17-1141,Concerning the malicious deprivation of constitutional rights by a federal employee related to public lands.,"Last Action:02/22/2017 | House Committee on State, Veterans, & Military Affairs Postpone Indefinitely",0,Rep. K. Lewis,"AgricultureCrimes, Corrections, & EnforcementState Government",2017 Regular Session,Type:Bill,2017-02-22
609,HB17-1142,Electronic Court Hearing Notices,/bills/hb17-1142,Concerning notices of certain court proceedings.,Last Action:03/20/2017 | Governor Signed,1,"Rep. D. Jackson, Sen. B. Gardner",Courts & Judicial,2017 Regular Session,Type:Bill,2017-03-20
610,HB17-1143,Audits of Medicaid Client Correspondence,/bills/hb17-1143,Concerning audits of correspondence sent to medicaid clients.,Last Action:03/20/2017 | Governor Signed,1,"Rep. L. Landgraf, Sen. L. Crowder",Health Care & Health Insurance,2017 Regular Session,Type:Bill,2017-03-20
611,HB17-1144,Amend Capital Construction Automatic Funding Mechanism,/bills/hb17-1144,Concerning amendments to the automatic cash fund funding mechanism for payment of future costs attributable to certain of the state's capital assets.,Last Action:04/13/2017 | Governor Signed,1,"Rep. D. Esgar, Sen. R. Baumgardner",Capital Construction,2017 Regular Session,Type:Bill,2017-04-13
612,HB17-1145,Amateur Winemaker Tastings Contests & Judgings,/bills/hb17-1145,Concerning authorization for amateur winemakers to enter wines in organized events.,Last Action:04/13/2017 | Governor Signed,1,"Rep. L. Herod, Sen. B. Gardner",Business & Economic Development,2017 Regular Session,Type:Bill,2017-04-13
613,HB17-1146,Parents' Rights Related To Minors,/bills/hb17-1146,Concerning parents' rights for children.,"Last Action:02/23/2017 | House Committee on Health, Insurance, & Environment Postpone Indefinitely",0,Rep. P. Neville,Education & School Finance (Pre & K-12),2017 Regular Session,Type:Bill,2017-02-23
614,HB17-1147,Purpose Of Community Corrections,/bills/hb17-1147,Concerning defining the purposes of community corrections programs.,Last Action:03/30/2017 | Governor Signed,1,"Rep. L. Sias, Sen. D. Kagan","Crimes, Corrections, & Enforcement",2017 Regular Session,Type:Bill,2017-03-30
615,HB17-1148,Registration Of Industrial Hemp Cultivators,/bills/hb17-1148,Concerning applications for registration to cultivate industrial hemp.,Last Action:03/23/2017 | Governor Signed,1,"Rep. J. Arndt, Sen. J. Cooke",Agriculture,2017 Regular Session,Type:Bill,2017-03-23
616,HB17-1149,Army Special Forces License Plate,/bills/hb17-1149,Concerning special license plates issued to members of the United States military who served in the United States Army special forces.,Last Action:04/4/2017 | Governor Signed,1,"Rep. T. Exum, Rep. D. Michaelson Jenet, Sen. B. Gardner",Transportation & Motor Vehicles,2017 Regular Session,Type:Bill,2017-04-04
617,HB17-1150,No Bail For Stalking And Domestic Violence Offenders,/bills/hb17-1150,Concerning disallowing a court from granting bail after conviction to offenders who have committed certain felony crimes.,Last Action:05/3/2017 | Governor Signed,1,Sen. O. Hill,"Courts & JudicialCrimes, Corrections, & Enforcement",2017 Regular Session,Type:Bill,2017-05-03
618,HB17-1151,Electrical Assisted Bicycles Regulation Operation,/bills/hb17-1151,Concerning the regulation of electrical assisted bicycles.,Last Action:04/4/2017 | Governor Signed,1,"Rep. C. Hansen, Rep. Y. Willett, Sen. A. Kerr, Sen. O. Hill",Transportation & Motor Vehicles,2017 Regular Session,Type:Bill,2017-04-04
619,HB17-1152,Federal Mineral Lease District Investment Authority,/bills/hb17-1152,Concerning the authority of a federal mineral lease district to manage a portion of the direct distribution of money from the local government mineral impact fund to counties for the benefit of impacted areas.,Last Action:04/4/2017 | Governor Signed,1,"Rep. Y. Willett, Sen. R. Scott",Fiscal Policy & TaxesNatural Resources & Environment,2017 Regular Session,Type:Bill,2017-04-04
620,HB17-1153,Highway Congestion Mitigation,/bills/hb17-1153,"Concerning the expansion of interstate highway 25 in conjunction with the mitigation of traffic congestion by clarifying that a high occupancy vehicle lane or a high occupancy toll lane is reserved for toll-free use by a vehicle carrying two or more individuals, including the driver.",Last Action:03/8/2017 | House Committee on Transportation & Energy Postpone Indefinitely,0,"Rep. D. Williams, Rep. H. McKean, Sen. B. Gardner",Transportation & Motor Vehicles,2017 Regular Session,Type:Bill,2017-03-08
621,HB17-1154,Creation Of A Sister-state Relationship Program,/bills/hb17-1154,Concerning the creation of an international sister-state relationship program by the Colorado office of economic development.,"Last Action:03/1/2017 | Senate Committee on State, Veterans, & Military Affairs Postpone Indefinitely",0,"Rep. P. Rosenthal, Sen. N. Todd",Business & Economic DevelopmentState Government,2017 Regular Session,Type:Bill,2017-03-01
622,HB17-1155,Cure Campaign Finance Reporting Deficiencies,/bills/hb17-1155,Concerning the ability to cure campaign finance reporting deficiencies without penalty.,Last Action:05/24/2017 | Governor Signed,1,"Rep. D. Thurlow, Sen. B. Gardner",Elections & Redistricting,2017 Regular Session,Type:Bill,2017-05-24
623,HB17-1156,Prohibits Conversion Therapy Mental Health Provider,/bills/hb17-1156,Concerning a prohibition on conversion therapy by a licensed mental health care provider.,"Last Action:03/22/2017 | Senate Committee on State, Veterans, & Military Affairs Postpone Indefinitely",0,"Rep. P. Rosenthal, Sen. S. Fenberg",Health Care & Health Insurance,2017 Regular Session,Type:Bill,2017-03-22
624,HB17-1157,Bank And Credit Union Reliance On A Certificate Of Trust,/bills/hb17-1157,Concerning reliance by a financial institution on a certificate of trust.,Last Action:03/23/2017 | Governor Signed,1,"Rep. T. Kraft-Tharp, Rep. D. Nordberg, Sen. K. Priola",Financial Services & Commerce,2017 Regular Session,Type:Bill,2017-03-23
625,HB17-1158,Charitable Solicitations Regulation,/bills/hb17-1158,"Concerning the regulation of charitable solicitations by the secretary of state, and, in connection therewith, modifying and clarifying filing requirements and enforcement of the ""Colorado Charitable Solicitations Act"".",Last Action:04/28/2017 | Governor Signed,1,"Rep. H. McKean, Sen. J. Smallwood, Sen. B. Martinez Humenik",Business & Economic Development,2017 Regular Session,Type:Bill,2017-04-28
626,HB17-1159,Remedies For Forcible Entry And Detainer,/bills/hb17-1159,Concerning actions related to forcible entry and detainer.,Last Action:04/27/2017 | House Committee on Judiciary Postpone Indefinitely,0,"Rep. J. Becker, Sen. J. Cooke",Civil Law,2017 Regular Session,Type:Bill,2017-04-27
627,HB17-1160,Kindergarten Through Third Grade English Learner Reading Assessment Language,/bills/hb17-1160,Concerning authorizing a local education provider to determine the language in which a student who is an English language learner takes reading assessments in kindergarten through third grade.,Last Action:06/6/2017 | Governor Signed,1,"Rep. M. Hamner, Rep. J. Wilson, Sen. K. Priola, Sen. R. Fields",Education & School Finance (Pre & K-12),2017 Regular Session,Type:Bill,2017-06-06
628,HB17-1161,TIF Tax Increment Financing Transparency,/bills/hb17-1161,Concerning measures to promote transparency in connection with urban renewal projects allocating tax revenues.,Last Action:02/21/2017 | House Committee on Business Affairs and Labor Postpone Indefinitely,0,Rep. S. Beckman,Local Government,2017 Regular Session,Type:Bill,2017-02-21
629,HB17-1162,Outstanding Judgments And Driver's Licenses,/bills/hb17-1162,"Concerning action that can be taken against an individual based on the individual's failure to pay for a traffic violation, and, in connection therewith, making an appropriation.",Last Action:05/18/2017 | Governor Signed,1,"Rep. M. Gray, Sen. B. Gardner",Transportation & Motor Vehicles,2017 Regular Session,Type:Bill,2017-05-18
630,HB17-1163,Candidate Petition Filing Deadlines And Signatures,/bills/hb17-1163,"Concerning certain requirements affecting candidates seeking access to the ballot by means of a petition, and, in connection therewith, altering the deadlines by which candidate petitions are required to be filed and increasing the number of signatures needed to qualify petitions for candidates for the general assembly.","Last Action:03/3/2017 | House Committee on State, Veterans, & Military Affairs Postpone Indefinitely",0,"Rep. J. Everett, Sen. T. Neville, Sen. V. Marble",Elections & Redistricting,2017 Regular Session,Type:Bill,2017-03-03
631,HB17-1164,Higher Education Review Degree Program Costs And Outcomes,/bills/hb17-1164,Concerning the review of degree programs offered by state institutions of higher education.,Last Action:03/6/2017 | House Committee on Education Postpone Indefinitely,0,"Rep. J. Everett, Sen. V. Marble",Higher Education,2017 Regular Session,Type:Bill,2017-03-06
632,HB17-1165,Department Of Regulatory Agencies Boards Disciplinary Action Resolution Process,/bills/hb17-1165,"Concerning the resolution of disciplinary actions by agencies within the department of regulatory agencies, and, in connection therewith, making an appropriation.",Last Action:06/6/2017 | Governor Signed,1,"Rep. S. Lebsock, Sen. I. Aguilar",Health Care & Health Insurance,2017 Regular Session,Type:Bill,2017-06-06
633,HB17-1166,Access Between Highways And Adjoining Businesses,/bills/hb17-1166,Concerning prioritization of access to and from public highways and adjoining businesses.,Last Action:02/22/2017 | House Committee on Transportation & Energy Postpone Indefinitely,0,Sen. K. Grantham,Transportation & Motor Vehicles,2017 Regular Session,Type:Bill,2017-02-22
634,HB17-1167,Existing Businesses In Business Improvement District,/bills/hb17-1167,Concerning a requirement that a business improvement district include existing businesses.,Last Action:02/21/2017 | House Committee on Business Affairs and Labor Postpone Indefinitely,0,"Rep. T. Leonard, Sen. T. Neville",Business & Economic Development,2017 Regular Session,Type:Bill,2017-02-21
635,HB17-1168,Criminal Court Procedures For Military Defendants,/bills/hb17-1168,Concerning criminal court procedures for defendants who have served in the armed forces.,Last Action:03/14/2017 | House Committee on Judiciary Postpone Indefinitely,0,"Rep. L. Landgraf, Rep. P. Lee","Courts & JudicialCrimes, Corrections, & EnforcementMilitary & Veterans",2017 Regular Session,Type:Bill,2017-03-14
636,HB17-1169,Construction Defect Litigation Builder's Right To Repair,/bills/hb17-1169,"Concerning a construction professional's statutory right to repair under the ""Construction Defect Action Reform Act"".","Last Action:03/1/2017 | House Committee on State, Veterans, & Military Affairs Postpone Indefinitely",0,"Rep. T. Leonard, Sen. J. Tate",Civil LawCourts & Judicial,2017 Regular Session,Type:Bill,2017-03-01
637,HB17-1170,State Housing Board Rules Eliminate Double Inspections,/bills/hb17-1170,Concerning a requirement that rules be promulgated that will result in the reduction of duplicative inspections required by low-income housing programs.,Last Action:03/15/2017 | House Committee on Local Government Postpone Indefinitely,0,Rep. C. Kennedy,Housing,2017 Regular Session,Type:Bill,2017-03-15
638,HB17-1171,Authorize New Transportation Revenue Anticipation Notes,/bills/hb17-1171,"Concerning infrastructure funding, and, in connection therewith, requiring the transportation commission to submit a ballot question to the voters of the state at the November 2017 statewide election which, if approved, would authorize the state, with no increase in any taxes, to issue additional transportation revenue anticipation notes for the purpose of addressing critical priority transportation needs in the state by financing transportation projects and would exclude note proceeds and investment earnings on note proceeds from state fiscal year spending limits; and dedicating ten percent of state sales and use tax net revenue for state transportation purposes and one percent of such revenue less ten million dollars for other capital construction purposes.","Last Action:03/29/2017 | House Committee on State, Veterans, & Military Affairs Postpone Indefinitely",0,"Rep. P. Buck, Rep. T. Carver",Fiscal Policy & TaxesTransportation & Motor Vehicles,2017 Regular Session,Type:Bill,2017-03-29
639,HB17-1172,Penalties For Child Sex Traffickers,/bills/hb17-1172,Concerning criminal penalties for persons who commit human trafficking of a minor for sexual servitude.,Last Action:04/28/2017 | Governor Signed,1,"Rep. T. Carver, Sen. J. Cooke","Crimes, Corrections, & Enforcement",2017 Regular Session,Type:Bill,2017-04-28
640,HB17-1173,Health Care Providers And Carriers Contracts,/bills/hb17-1173,concerning medical communications regarding disagreements in health care decisions.,Last Action:04/6/2017 | Governor Signed,1,"Rep. C. Hansen, Sen. T. Neville",Health Care & Health Insurance,2017 Regular Session,Type:Bill,2017-04-06
641,HB17-1174,Exempt Rural Telecommunications Local Improvement District Requirements,/bills/hb17-1174,Concerning the establishment of an exception for rural counties from the limitations on the establishment of a local improvement district to fund the construction of a telecommunications service improvement for advanced service.,Last Action:04/18/2017 | Governor Signed,1,"Rep. J. Wilson, Sen. L. Crowder, Sen. L. Guzman",Local GovernmentTelecommunications & Information Technology,2017 Regular Session,Type:Bill,2017-04-18
642,HB17-1175,Domestic Violence Awareness Barbers Cosmetologists,/bills/hb17-1175,"Concerning domestic violence awareness training under the ""Barber and Cosmetologist Act"".","Last Action:04/12/2017 | Senate Committee on State, Veterans, & Military Affairs Postpone Indefinitely",0,"Rep. E. Hooton, Sen. R. Fields",Business & Economic Development,2017 Regular Session,Type:Bill,2017-04-12
643,HB17-1176,PERA Public Employees' Retirement Association Retirees Employed By Rural School Districts,/bills/hb17-1176,Concerning an extension of the employment after retirement limitations for retirees of the public employees' retirement association employed by a rural school district after retirement.,Last Action:06/6/2017 | Governor Signed,1,"Rep. J. Becker, Rep. B. McLachlan, Sen. J. Sonnenberg",Local GovernmentState Government,2017 Regular Session,Type:Bill,2017-06-06
644,HB17-1177,Mediation For Disputes Arising Under CORA Colorado Open Records Act,/bills/hb17-1177,"Concerning the use of alternative methods of resolving disputes that arise under the ""Colorado Open Records Act"".",Last Action:05/4/2017 | Governor Signed,1,"Rep. C. Wist, Rep. A. Garnett, Sen. J. Cooke",State Government,2017 Regular Session,Type:Bill,2017-05-04
645,HB17-1178,Administrative Flexibility For School Districts,/bills/hb17-1178,Concerning measures to increase flexibility for local public education entities in the elementary and secondary public education system.,Last Action:03/20/2017 | House Committee on Education Postpone Indefinitely,0,Rep. J. Wilson,Education & School Finance (Pre & K-12),2017 Regular Session,Type:Bill,2017-03-20
646,HB17-1179,Immunity For Emergency Rescue From Locked Vehicle,/bills/hb17-1179,Concerning immunity for a person who renders emergency assistance from a locked vehicle.,Last Action:04/13/2017 | Governor Signed,1,"Rep. L. Saine, Rep. J. Ginal, Sen. V. Marble, Sen. L. Court","Crimes, Corrections, & Enforcement",2017 Regular Session,Type:Bill,2017-04-13
647,HB17-1180,Tuition Assistance For Certificate Programs,/bills/hb17-1180,Concerning requirements for the tuition assistance program for students enrolled in career and technical education certificate programs.,Last Action:03/30/2017 | Governor Signed,1,"Rep. F. Winter, Rep. P. Lawrence, Sen. T. Neville, Sen. A. Kerr",Higher Education,2017 Regular Session,Type:Bill,2017-03-30
648,HB17-1181,Required State Assessment For Ninth-grade Students,/bills/hb17-1181,"Concerning requiring a single statewide end-of-year assessment for students enrolled in ninth grade that is aligned with the tenth-grade state assessment, and, in connection therewith, reducing an appropriation.",Last Action:06/6/2017 | Governor Signed,1,"Rep. B. Pettersen, Rep. P. Lundeen, Sen. K. Priola, Sen. N. Todd",Education & School Finance (Pre & K-12),2017 Regular Session,Type:Bill,2017-06-06
649,HB17-1182,Charter School And District Student Revenue True Up,/bills/hb17-1182,Concerning reimbursement of student revenue for students who move between a charter school and a non-charter school within the same budget year.,Last Action:03/27/2017 | House Committee on Education Postpone Indefinitely,0,Rep. A. Benavidez,Education & School Finance (Pre & K-12),2017 Regular Session,Type:Bill,2017-03-27
650,HB17-1183,Mental Health Professional Disclosures Repeal Effect Clause,/bills/hb17-1183,Concerning the repeal of the condition required to be satisfied for a provision of law governing the disclosure of communications with mental health professionals to take effect.,Last Action:04/6/2017 | Governor Signed,1,"Rep. M. Foote, Sen. B. Gardner",Health Care & Health Insurance,2017 Regular Session,Type:Bill,2017-04-06
651,HB17-1184,Modern Technology Education In Public Schools,/bills/hb17-1184,Concerning developing additional resources for modern technology education in public schools.,Last Action:04/24/2017 | Governor Signed,1,"Rep. C. Duran, Sen. K. Grantham",Education & School Finance (Pre & K-12),2017 Regular Session,Type:Bill,2017-04-24
652,HB17-1185,Reports Of Suspected Child Abuse Or Neglect,/bills/hb17-1185,Concerning reports of suspected child abuse or neglect.,Last Action:05/3/2017 | Governor Signed,1,"Rep. J. Singer, Sen. J. Smallwood",Human Services,2017 Regular Session,Type:Bill,2017-05-03
653,HB17-1186,Health Coverage Prescription Contraceptives Supply,/bills/hb17-1186,Concerning a requirement that health benefit plans required to cover contraception reimburse dispensers for dispensing a multiple-months' supply of prescription contraceptives.,Last Action:06/5/2017 | Governor Signed,1,"Rep. B. Pettersen, Rep. L. Landgraf, Sen. D. Coram",Children & Domestic MattersHealth Care & Health InsuranceInsurance,2017 Regular Session,Type:Bill,2017-06-05
654,HB17-1187,Change Excess State Revenues Cap Growth Factor,/bills/hb17-1187,Concerning a change to the growth factor in the excess state revenues cap.,"Last Action:03/20/2017 | Senate Committee on State, Veterans, & Military Affairs Postpone Indefinitely",0,"Rep. D. Thurlow, Sen. L. Crowder",Fiscal Policy & Taxes,2017 Regular Session,Type:Bill,2017-03-20
655,HB17-1188,Harassment Sexual Orientation Or Disability,/bills/hb17-1188,Concerning bias-motivated harassment.,Last Action:05/3/2017 | Governor Signed,1,"Rep. M. Foote, Sen. D. Coram, Sen. D. Moreno","Crimes, Corrections, & Enforcement",2017 Regular Session,Type:Bill,2017-05-03
656,HB17-1189,Colorado Wine Development Board Term Limits,/bills/hb17-1189,Concerning the limit on the number of terms a member of the Colorado wine industry development board may serve.,Last Action:04/28/2017 | Governor Signed,1,"Rep. J. Danielson, Rep. D. Thurlow, Sen. R. Scott",Agriculture,2017 Regular Session,Type:Bill,2017-04-28
657,HB17-1190,Limited Applicability Of St. Jude's Co. Water Case,/bills/hb17-1190,"Concerning the limited applicability of the Colorado supreme court's decision in St. Jude's Co. v. Roaring Fork Club, LLC, 351 P.3d 442 (Colo. 2015).",Last Action:05/25/2017 | Governor Signed,1,"Rep. K. Becker, Sen. J. Sonnenberg",Water,2017 Regular Session,Type:Bill,2017-05-25
658,HB17-1191,Demographic Notes For Certain Legislative Bills,/bills/hb17-1191,"Concerning a requirement that staff of the legislative council prepare demographic notes on certain legislative bills, and, in connection therewith, making an appropriation.",Last Action:05/4/2017 | Senate Committee on Finance Postpone Indefinitely,0,"Rep. K. Becker, Rep. L. Herod, Sen. K. Donovan",State Government,2017 Regular Session,Type:Bill,2017-05-04
659,HB17-1192,Colorado Food Systems Advisory Council,/bills/hb17-1192,"Concerning the Colorado food systems advisory council, and, in connection therewith, making an appropriation.","Last Action:05/4/2017 | Senate Committee on State, Veterans, & Military Affairs Postpone Indefinitely",0,"Rep. C. Duran, Rep. B. McLachlan, Sen. D. Coram, Sen. R. Fields",Agriculture,2017 Regular Session,Type:Bill,2017-05-04
660,HB17-1193,Small Cell Facilities Permitting And Installation,/bills/hb17-1193,"Concerning the installation of small wireless service infrastructure within a local government's jurisdiction, and, in connection therewith, clarifying that an expedited permitting process applies to small cell facilities and small cell networks and that the rights-of-way access afforded telecommunications providers extends to broadband providers and to small cell facilities and small cell networks.",Last Action:04/18/2017 | Governor Signed,1,"Rep. T. Kraft-Tharp, Rep. J. Becker, Sen. J. Tate, Sen. A. Kerr",Telecommunications & Information Technology,2017 Regular Session,Type:Bill,2017-04-18
661,HB17-1194,Technical Changes For P-tech Schools,/bills/hb17-1194,Concerning technical changes relating to the operation of pathways in technology early college high schools.,Last Action:04/13/2017 | Governor Signed,1,"Rep. M. Foote, Sen. J. Cooke",Education & School Finance (Pre & K-12)Higher Education,2017 Regular Session,Type:Bill,2017-04-13
662,HB17-1195,Create State Sales Tax Exemption For Diapers,/bills/hb17-1195,Concerning the sales tax imposed on diapers.,Last Action:05/5/2017 | House Committee on Appropriations Postpone Indefinitely,0,"Rep. F. Winter, Sen. B. Martinez Humenik",Fiscal Policy & Taxes,2017 Regular Session,Type:Bill,2017-05-05
663,HB17-1196,Credit Hours Required For Barbers Cosmetologists,/bills/hb17-1196,"Concerning changes to the training requirements for applicants for licensure under the ""Barber and Cosmetologist Act"".",Last Action:04/13/2017 | Governor Signed,1,"Rep. J. Arndt, Sen. K. Priola",Labor & EmploymentState Government,2017 Regular Session,Type:Bill,2017-04-13
664,HB17-1197,Exclude Marijuana From Farm Products Definition,/bills/hb17-1197,"Concerning the exclusion of marijuana from the definition of ""farm products"" with regard to regulation of farm products under the ""Farm Products Act"".",Last Action:04/6/2017 | Governor Signed,1,"Rep. J. Ginal, Sen. D. Coram","AgricultureLiquor, Tobacco, & Marijuana",2017 Regular Session,Type:Bill,2017-04-06
665,HB17-1198,Increasing Special District Board To Seven Members,/bills/hb17-1198,Concerning the authority for a special district to increase the number of board members from five to seven.,Last Action:04/6/2017 | Governor Signed,1,"Rep. M. Gray, Sen. B. Gardner",Local Government,2017 Regular Session,Type:Bill,2017-04-06
666,HB17-1199,Foreclosure Sale Processes,/bills/hb17-1199,Concerning processes that directly relate to the actual sale of a property in a foreclosure action.,Last Action:03/8/2017 | House Committee on Local Government Postpone Indefinitely,0,"Rep. P. Rosenthal, Sen. J. Cooke",Local Government,2017 Regular Session,Type:Bill,2017-03-08
667,HB17-1200,Update Public Benefit Corporation Requirements,/bills/hb17-1200,"Concerning modification of the laws regulating public benefit corporations, and, in connection therewith, making an appropriation.",Last Action:06/6/2017 | Governor Signed,1,"Rep. C. Wist, Rep. M. Gray, Sen. J. Tate, Sen. J. Kefalas",Business & Economic Development,2017 Regular Session,Type:Bill,2017-06-06
668,HB17-1201,Science Technology Engineering Math Diploma Endorsement,/bills/hb17-1201,"Concerning authorization for granting a high school diploma endorsement in the combined disciplines of science, technology, engineering, and mathematics.",Last Action:05/18/2017 | Governor Signed,1,"Rep. J. Coleman, Sen. R. Zenzinger, Sen. K. Priola",Education & School Finance (Pre & K-12),2017 Regular Session,Type:Bill,2017-05-18
669,HB17-1202,Plumber Qualifications Supervision,/bills/hb17-1202,Concerning the qualifications of plumbers.,Last Action:04/25/2017 | House Committee on Business Affairs and Labor Postpone Indefinitely,0,"Rep. L. Herod, Rep. P. Covarrubias, Sen. J. Smallwood",Labor & Employment,2017 Regular Session,Type:Bill,2017-04-25
670,HB17-1203,Local Government Special Sales Tax On Retail Marijuana,/bills/hb17-1203,Concerning the authority of certain local governments to levy a special sales tax on retail marijuana in certain circumstances subject to voter approval by the eligible electors of the local government.,Last Action:05/4/2017 | Governor Signed,1,"Rep. S. Lebsock, Sen. B. Martinez Humenik, Sen. L. Crowder",Fiscal Policy & Taxes,2017 Regular Session,Type:Bill,2017-05-04
671,HB17-1204,Juvenile Delinquency Record Expungement,/bills/hb17-1204,"Concerning juvenile delinquency record expungement, and, in connection therewith, making an appropriation.",Last Action:05/18/2017 | Sent to the Governor,0,"Rep. P. Lee, Sen. J. Cooke","Courts & JudicialCrimes, Corrections, & Enforcement",2017 Regular Session,Type:Bill,2017-05-18
672,HB17-1205,Motor Vehicle Total Loss Title Insurance,/bills/hb17-1205,"Concerning changing the definition of ""salvage vehicle"".",Last Action:04/28/2017 | Governor Signed,1,"Rep. J. Melton, Sen. B. Martinez Humenik",Transportation & Motor Vehicles,2017 Regular Session,Type:Bill,2017-04-28
673,HB17-1206,Eligibility Colorado Road & Community Safety Act,/bills/hb17-1206,"Concerning the issuance of identification documents under the ""Colorado Road and Community Safety act,"" and in connection therewith, making an appropriation.",Last Action:04/25/2017 | Senate Committee on Transportation Postpone Indefinitely,0,"Rep. J. Singer, Rep. J. Arndt, Sen. D. Moreno, Sen. D. Coram",Transportation & Motor Vehicles,2017 Regular Session,Type:Bill,2017-04-25
674,HB17-1207,No Detention Facility Requirement Youth Ages 10-12,/bills/hb17-1207,"Concerning the requirement for the department of human services to place a juvenile who is ten years of age and older but less than thirteen years of age in a detention facility unless the juvenile is charged with a serious offense, and, in connection therewith, reducing an appropriation.",Last Action:05/30/2017 | Governor Signed,1,"Rep. P. Lee, Sen. K. Priola","Children & Domestic MattersCourts & JudicialCrimes, Corrections, & EnforcementHuman Services",2017 Regular Session,Type:Bill,2017-05-30
675,HB17-1208,Record Sealing Clarifications,/bills/hb17-1208,Concerning clarifications to the criminal justice records sealing process.,Last Action:06/5/2017 | Governor Signed,1,"Rep. M. Weissman, Sen. B. Gardner","Crimes, Corrections, & Enforcement",2017 Regular Session,Type:Bill,2017-06-05
676,HB17-1209,Peace Officer Status Head Of Office Prevention & Security,/bills/hb17-1209,Concerning peace officer designation for the manager of the office of prevention and security within the division of homeland security and emergency management in the department of public safety.,Last Action:05/25/2017 | Governor Signed,1,"Rep. J. Melton, Rep. T. Carver, Sen. J. Cooke, Sen. R. Fields","Crimes, Corrections, & EnforcementState Government",2017 Regular Session,Type:Bill,2017-05-25
677,HB17-1210,School Discipline For Preschool Through 2nd Grade,/bills/hb17-1210,Concerning the discipline of preschool through second grade students enrolled in publicly funded education programs.,"Last Action:04/17/2017 | Senate Committee on State, Veterans, & Military Affairs Postpone Indefinitely",0,"Rep. S. Lontine, Rep. J. Buckner, Sen. K. Priola, Sen. R. Fields",Education & School Finance (Pre & K-12),2017 Regular Session,Type:Bill,2017-04-17
678,HB17-1211,Educators Professional Development Discipline Strategies,/bills/hb17-1211,Concerning professional development for educators regarding disciplinary strategies for young students.,Last Action:05/18/2017 | Governor Signed,1,"Rep. J. Coleman, Sen. K. Priola",Education & School Finance (Pre & K-12),2017 Regular Session,Type:Bill,2017-05-18
679,HB17-1212,Colorado Aviation Special License Plate,/bills/hb17-1212,Concerning the creation of an aviation special license plate.,Last Action:06/6/2017 | Governor Signed,1,"Rep. P. Rosenthal, Rep. L. Sias, Sen. B. Gardner, Sen. D. Kagan",Transportation & Motor Vehicles,2017 Regular Session,Type:Bill,2017-06-06
680,HB17-1213,Transfers Of Automobile Titles Upon Death,/bills/hb17-1213,Concerning the transfer of a vehicle title upon the death of the vehicle's owner.,Last Action:05/3/2017 | Governor Signed,1,"Rep. K. Van Winkle, Sen. C. Holbert",Transportation & Motor Vehicles,2017 Regular Session,Type:Bill,2017-05-03
681,HB17-1214,Encourage Employee Ownership Of Existing Small Business,/bills/hb17-1214,Concerning efforts to encourage employee ownership of the state's existing small businesses.,Last Action:05/18/2017 | Governor Signed,1,"Rep. J. Coleman, Sen. J. Tate",Business & Economic Development,2017 Regular Session,Type:Bill,2017-05-18
682,HB17-1215,Mental Health Support For Peace Officers,/bills/hb17-1215,Concerning mental health support for peace officers.,Last Action:04/24/2017 | Governor Signed,1,"Rep. J. Coleman, Sen. B. Gardner, Sen. D. Kagan","Crimes, Corrections, & Enforcement",2017 Regular Session,Type:Bill,2017-04-24
683,HB17-1216,Sales And Use Tax Simplification Task Force,/bills/hb17-1216,"Concerning the creation of the sales and use tax simplification task force, and, in connection therewith, making an appropriation.",Last Action:06/5/2017 | Governor Signed,1,"Rep. T. Kraft-Tharp, Rep. L. Sias, Sen. T. Neville, Sen. C. Jahn",Fiscal Policy & Taxes,2017 Regular Session,Type:Bill,2017-06-05
684,HB17-1217,State Historical Society Governance,/bills/hb17-1217,Concerning the governance structure of the state historical society.,Last Action:05/3/2017 | Governor Signed,1,"Rep. F. Winter, Rep. L. Saine, Sen. K. Donovan, Sen. J. Smallwood",State Government,2017 Regular Session,Type:Bill,2017-05-03
685,HB17-1218,Share Financial Institution Information Other Regulators,/bills/hb17-1218,Concerning an expansion of the state's ability to share information about state financial institutions with other governmental regulators.,Last Action:04/28/2017 | Governor Signed,1,"Rep. A. Garnett, Sen. K. Priola",Financial Services & Commerce,2017 Regular Session,Type:Bill,2017-04-28
686,HB17-1219,Extend Colorado Water Conservation Board Fallowing And Leasing Pilot Program,/bills/hb17-1219,Concerning an extension of the agricultural water leasing pilot program administered by the Colorado water conservation board.,Last Action:05/3/2017 | Governor Signed,1,"Rep. J. Arndt, Rep. B. McLachlan, Sen. L. Crowder, Sen. K. Donovan",Water,2017 Regular Session,Type:Bill,2017-05-03
687,HB17-1220,Prevent Marijuana Diversion To Illegal Market,/bills/hb17-1220,Concerning measures to stop diversion of legal marijuana to the illegal market.,Last Action:06/8/2017 | Governor Signed,1,"Rep. K. Becker, Rep. C. Wist, Sen. B. Gardner, Sen. R. Fields","Crimes, Corrections, & Enforcement",2017 Regular Session,Type:Bill,2017-06-08
688,HB17-1221,Grey And Black Market Marijuana Enforcement Efforts,/bills/hb17-1221,"Concerning gray and black market marijuana enforcement efforts, and, in connection therewith, making an appropriation.",Last Action:06/8/2017 | Governor Signed,1,"Rep. Y. Willett, Rep. D. Pabon, Sen. I. Aguilar, Sen. J. Cooke",,2017 Regular Session,Type:Bill,2017-06-08
689,HB17-1222,Create Family Caregiver Support Fund Tax Check-off,/bills/hb17-1222,Concerning a voluntary contribution designation benefiting the family caregiver support fund that appears on the state individual tax return forms.,Last Action:06/5/2017 | Governor Signed,1,"Rep. L. Landgraf, Sen. B. Gardner",Fiscal Policy & Taxes,2017 Regular Session,Type:Bill,2017-06-05
690,HB17-1223,OSA Office of the State Auditor Fraud Hotline,/bills/hb17-1223,"Concerning the creation of a fraud reporting hotline to be administered by the state auditor, and, in connection therewith, establishing referral and reporting processes and state auditor investigative authority.",Last Action:05/25/2017 | Governor Signed,1,"Rep. L. Saine, Rep. T. Kraft-Tharp, Sen. T. Neville, Sen. C. Jahn",State Government,2017 Regular Session,Type:Bill,2017-05-25
691,HB17-1224,Misbranded Adulterated Counterfeit Drugs Penalty,/bills/hb17-1224,"Concerning penalties for accessing drugs in a manner that violates the""Colorado Food and Drug Act"".",Last Action:06/5/2017 | Governor Signed,1,"Rep. T. Kraft-Tharp, Sen. B. Gardner",Health Care & Health Insurance,2017 Regular Session,Type:Bill,2017-06-05
692,HB17-1225,Electric Regional Transmission Organization Hearing,/bills/hb17-1225,Concerning a transportation legislation review committee hearing on the effects that a retail electric service provider's participation in a regional transmission organization would have in Colorado.,Last Action:04/28/2017 | Senate Committee on Legislative Council Postpone Indefinitely,0,"Rep. C. Hansen, Sen. R. Baumgardner",Energy,2017 Regular Session,Type:Bill,2017-04-28
693,HB17-1226,Make Daylight Saving Time Year-round Standard Time,/bills/hb17-1226,Concerning the designation of daylight saving time as the standard year-round time within the state.,"Last Action:03/13/2017 | House Committee on Agriculture, Livestock, & Natural Resources Postpone Indefinitely",0,"Rep. D. Pabon, Rep. P. Covarrubias",State Government,2017 Regular Session,Type:Bill,2017-03-13
694,HB17-1227,Electric Demand-side Management Program Extension,/bills/hb17-1227,Concerning an extension of demand-side management goals for investor-owned utilities as set by the public utilities commission.,Last Action:05/18/2017 | Governor Signed,1,"Rep. F. Winter, Rep. P. Lawrence, Sen. K. Priola, Sen. S. Fenberg",Energy,2017 Regular Session,Type:Bill,2017-05-18
695,HB17-1228,Pet Animal Care Technology Platform Regulation,/bills/hb17-1228,"Concerning licensing exemptions related to pet animal facilities, including those utilizing technology in their business models.",Last Action:06/5/2017 | Governor Signed,1,"Rep. D. Pabon, Rep. L. Landgraf, Sen. K. Priola",Agriculture,2017 Regular Session,Type:Bill,2017-06-05
696,HB17-1229,Workers' Compensation For Mental Impairment,/bills/hb17-1229,Concerning a clarification of when a worker may be compensated for a claim of mental impairment for a psychologically traumatic event under workers' compensation.,Last Action:06/5/2017 | Governor Signed,1,"Rep. J. Singer, Rep. J. Becker, Sen. J. Cooke, Sen. N. Todd",Labor & Employment,2017 Regular Session,Type:Bill,2017-06-05
697,HB17-1230,Protect Colorado Residents From Federal Government Overreach,/bills/hb17-1230,Concerning protection for Colorado residents from federal government overreach based on a person's status.,Last Action:04/10/2017 | Senate Committee on Judiciary Postpone Indefinitely,0,"Rep. J. Salazar, Rep. D. Esgar, Sen. L. Guzman, Sen. D. Kagan","Crimes, Corrections, & EnforcementImmigrationState Government",2017 Regular Session,Type:Bill,2017-04-10
698,HB17-1231,Market Conduct Examinations Insurance Companies,/bills/hb17-1231,Concerning a reorganization of statutes governing the authority of the commissioner of insurance to examine companies engaged in the business of insurance in this state.,Last Action:06/1/2017 | Governor Signed,1,"Rep. J. Arndt, Rep. P. Lawrence, Sen. J. Tate, Sen. J. Smallwood",Insurance,2017 Regular Session,Type:Bill,2017-06-01
699,HB17-1232,Public Utilities Alternative Fuel Motor Vehicles,/bills/hb17-1232,"Concerning public utilities providing infrastructure to serve alternative fuel motor vehicles, and, in connection therewith, establishing a process at the Colorado public utilities commission whereby a public utility may undertake implementation of an alternative fuel motor vehicle infrastructure program within the area covered by the utility's certificate of public convenience and necessity.","Last Action:04/26/2017 | Senate Committee on State, Veterans, & Military Affairs Postpone Indefinitely",0,"Rep. J. Danielson, Sen. K. Priola",EnergyTransportation & Motor Vehicles,2017 Regular Session,Type:Bill,2017-04-26
700,HB17-1233,Protect Water Historical Consumptive Use Analysis,/bills/hb17-1233,Concerning protection of the historical consumptive use analysis of a water right involved in a water conservation program.,Last Action:05/3/2017 | Governor Signed,1,"Rep. J. Arndt, Sen. L. Crowder",Water,2017 Regular Session,Type:Bill,2017-05-03
701,HB17-1234,Beef Country Of Origin Retail Placard,/bills/hb17-1234,Concerning a requirement that a retailer indicate the country of origin of beef sold to the public.,"Last Action:04/25/2017 | House Committee on Agriculture, Livestock, & Natural Resources Postpone Indefinitely",0,"Rep. K. Lewis, Sen. V. Marble",Agriculture,2017 Regular Session,Type:Bill,2017-04-25
702,HB17-1235,Financial Relief Defray Individual Health Plan Cost,/bills/hb17-1235,"Concerning a financial relief program to provide financial assistance to individuals earning a household income of not more than five hundred percent of the federal poverty line of which they spend more than fifteen percent on health insurance premiums for individual health insurance purchased through the Colorado health benefit exchange, and, in connection therewith, making an appropriation.","Last Action:04/24/2017 | Senate Committee on State, Veterans, & Military Affairs Postpone Indefinitely",0,"Rep. M. Hamner, Sen. D. Coram, Sen. L. Crowder",Health Care & Health InsuranceInsurance,2017 Regular Session,Type:Bill,2017-04-24
703,HB17-1236,Health Care Policy And Financing Annual Report On Hospital Expenditures,/bills/hb17-1236,Concerning preparation by the department of health care policy and financing of health care provider expenditure reports.,"Last Action:04/24/2017 | Senate Committee on State, Veterans, & Military Affairs Postpone Indefinitely",0,"Rep. C. Kennedy, Sen. D. Coram, Sen. J. Smallwood",Public Health,2017 Regular Session,Type:Bill,2017-04-24
704,HB17-1237,State Employee Group Benefit Plans For Local Government,/bills/hb17-1237,Concerning the state personnel director's authority to allow a local government to provide health benefits to its employees through the state employee group benefit plans.,"Last Action:05/3/2017 | Senate Committee on State, Veterans, & Military Affairs Postpone Indefinitely",0,"Rep. M. Hamner, Sen. D. Coram",State Government,2017 Regular Session,Type:Bill,2017-05-03
705,HB17-1238,Relocate Title 12 Credit Debt Services,/bills/hb17-1238,"Concerning the nonsubstantive relocation of laws related to debt management and collection services from title 12, Colorado Revised Statutes, as part of the organizational recodification of title 12.",Last Action:05/25/2017 | Governor Signed,1,"Rep. P. Lee, Sen. C. Holbert",Financial Services & Commerce,2017 Regular Session,Type:Bill,2017-05-25
706,HB17-1239,Relocate Title 12 Private Occupational Schools,/bills/hb17-1239,"Concerning the nonsubstantive relocation of laws related to private occupational schools from title 12, Colorado Revised Statutes, as part of the organizational recodification of title 12.",Last Action:05/25/2017 | Governor Signed,1,"Rep. C. Wist, Sen. L. Guzman",Higher Education,2017 Regular Session,Type:Bill,2017-05-25
707,HB17-1240,Relocate Title 12 Colorado Department Of Public Health And Environment,/bills/hb17-1240,"Concerning the nonsubstantive relocation of the laws related to the department of public health and environment from title 12, Colorado Revised Statutes, as part of the organizational recodification of title 12.",Last Action:05/25/2017 | Governor Signed,1,"Rep. C. Wist, Sen. J. Cooke",Health Care & Health Insurance,2017 Regular Session,Type:Bill,2017-05-25
708,HB17-1241,Relocate Title 12 Indian Arts And Crafts Sales,/bills/hb17-1241,"Concerning the nonsubstantive relocation of laws related to Indian arts and crafts sales from title 12, Colorado Revised Statutes, as part of the organizational recodification of title 12.",Last Action:04/28/2017 | Governor Signed,1,"Rep. L. Herod, Sen. B. Gardner",Civil LawFinancial Services & Commerce,2017 Regular Session,Type:Bill,2017-04-28
709,HB17-1242,New Transportation Infrastructure Funding Revenue,/bills/hb17-1242,"Concerning transportation funding, and in connection therewith, making an appropriation.",Last Action:04/25/2017 | Senate Committee on Finance Postpone Indefinitely,0,"Rep. C. Duran, Sen. K. Grantham, Sen. R. Baumgardner",Transportation & Motor Vehicles,2017 Regular Session,Type:Bill,2017-04-25
710,HB17-1243,Relocate Title 12 Wholesale Sales Representatives,/bills/hb17-1243,"Concerning the nonsubstantive relocation of the laws related to wholesale sales representatives from title 12, Colorado Revised Statutes, as part of the organizational recodification of title 12.",Last Action:05/25/2017 | Governor Signed,1,"Rep. Y. Willett, Sen. L. Guzman",Business & Economic Development,2017 Regular Session,Type:Bill,2017-05-25
711,HB17-1244,Relocate Title 12 Cemeteries,/bills/hb17-1244,"Concerning the nonsubstantive relocation of the laws related to cemeteries from title 12, Colorado Revised Statutes, as part of the organizational recodification of title 12.",Last Action:05/25/2017 | Governor Signed,1,"Rep. L. Herod, Sen. B. Gardner",State Government,2017 Regular Session,Type:Bill,2017-05-25
712,HB17-1245,Relocate Title 12 Public Establishments,/bills/hb17-1245,"Concerning the nonsubstantive relocation of the laws related to public establishments from title 12, Colorado Revised Statutes, as part of the organizational recodification of title 12.",Last Action:05/25/2017 | Governor Signed,1,"Rep. M. Foote, Sen. D. Kagan",Financial Services & Commerce,2017 Regular Session,Type:Bill,2017-05-25
713,HB17-1246,ST-elevation Myocardial Infarction Task Force Recommendations Heart Attack Care,/bills/hb17-1246,Concerning implementation of the STEMI task force recommendations relating to reporting confirmed heart attack incidents in the state.,Last Action:05/18/2017 | Governor Signed,1,"Rep. T. Kraft-Tharp, Sen. J. Tate, Sen. L. Garcia",Health Care & Health InsurancePublic Health,2017 Regular Session,Type:Bill,2017-05-18
714,HB17-1247,Patient Choice Health Care Provider,/bills/hb17-1247,Concerning the ability of a covered person to receive health care services from a health care provider of the covered person's choice.,"Last Action:04/13/2017 | House Committee on Health, Insurance, & Environment Postpone Indefinitely",0,"Rep. J. Danielson, Rep. J. Becker, Sen. J. Sonnenberg",Health Care & Health Insurance,2017 Regular Session,Type:Bill,2017-04-13
715,HB17-1248,Colorado Water Conservation Board Construction Fund Project,/bills/hb17-1248,"Concerning the funding of Colorado water conservation board projects, and, in connection therewith, making appropriations.",Last Action:05/23/2017 | Governor Signed,1,"Rep. J. Arndt, Sen. J. Cooke",Water,2017 Regular Session,Type:Bill,2017-05-23
716,HB17-1249,Penalties For Unlicensed Motor Vehicle Sales,/bills/hb17-1249,"Concerning the unlicensed selling of motor vehicles, and, in connection therewith, making an appropriation.",Last Action:06/6/2017 | Governor Signed,1,"Rep. J. Melton, Sen. J. Tate",Transportation & Motor Vehicles,2017 Regular Session,Type:Bill,2017-06-06
717,HB17-1250,Renew And Expand Tax Check-off To Benefit Wildlife,/bills/hb17-1250,"Concerning the voluntary contribution designation that benefits wildlife, and, in connection therewith, changing the nongame and endangered wildlife tax check-off to the Colorado nongame conservation and wildlife restoration tax check-off, providing for the allocation of moneys received through the check-off, creating a grant program that uses moneys contributed through the check-off to finance wildlife rehabilitation efforts, and making an appropriation.",Last Action:06/5/2017 | Governor Signed,1,"Rep. S. Lebsock, Sen. D. Coram, Sen. K. Donovan",Fiscal Policy & Taxes,2017 Regular Session,Type:Bill,2017-06-05
718,HB17-1251,Reporting Requirements By Higher Education Agencies To General Assembly,/bills/hb17-1251,Concerning the scheduled repeal of reports by higher education agencies to the general assembly.,Last Action:05/25/2017 | Governor Signed,1,"Rep. D. Nordberg, Sen. D. Moreno",Higher Education,2017 Regular Session,Type:Bill,2017-05-25
719,HB17-1252,Courts Collect Costs From Criminal Offenders,/bills/hb17-1252,Concerning the collection of court costs from persons who are convicted of criminal offenses.,Last Action:06/6/2017 | Governor Signed,1,"Rep. J. Ginal, Sen. O. Hill",Courts & Judicial,2017 Regular Session,Type:Bill,2017-06-06
720,HB17-1253,Protect Seniors From Financial Abuse,/bills/hb17-1253,"Concerning the ""Protection of Vulnerable Adults from Financial Exploitation Act"".",Last Action:06/2/2017 | Governor Signed,1,"Rep. J. Danielson, Sen. L. Crowder",Financial Services & Commerce,2017 Regular Session,Type:Bill,2017-06-02
721,HB17-1254,Noneconomic Damages Cap Wrongful Death Of Child,/bills/hb17-1254,Concerning the elimination of the cap on noneconomic damages for the wrongful death of a minor child.,"Last Action:05/3/2017 | Senate Committee on State, Veterans, & Military Affairs Postpone Indefinitely",0,"Rep. K. Becker, Rep. J. Salazar, Sen. D. Kagan",Courts & Judicial,2017 Regular Session,Type:Bill,2017-05-03
722,HB17-1255,Reporting Requirements By State Veterans Military Affairs To General Assembly,/bills/hb17-1255,Concerning the scheduled repeal of a report by the board of veterans affairs to the general assembly.,Last Action:05/25/2017 | Governor Signed,1,"Rep. D. Nordberg, Sen. A. Kerr",Military & VeteransState Government,2017 Regular Session,Type:Bill,2017-05-25
723,HB17-1256,Oil And Gas Facilities Distance From School Property,/bills/hb17-1256,Concerning a clarification of the minimum distance from which certain oil and gas facilities must be located from any school.,"Last Action:04/12/2017 | Senate Committee on Agriculture, Natural Resources, & Energy Postpone Indefinitely",0,"Rep. M. Foote, Sen. I. Aguilar, Sen. M. Jones",EnergyNatural Resources & Environment,2017 Regular Session,Type:Bill,2017-04-12
724,HB17-1257,Reporting Requirements By Department Of Natural Resources To General Assembly,/bills/hb17-1257,Concerning the scheduled repeal of reports by the department of natural resources to the general assembly.,Last Action:05/25/2017 | Governor Signed,1,"Rep. J. Arndt, Sen. J. Tate",Natural Resources & Environment,2017 Regular Session,Type:Bill,2017-05-25
725,HB17-1258,Renaming Delta-Montrose Technical College,/bills/hb17-1258,Concerning renaming Delta-Montrose technical college to technical college of the Rockies.,Last Action:05/20/2017 | Governor Signed,1,"Rep. M. Hamner, Rep. Y. Willett, Sen. D. Coram, Sen. K. Donovan",Higher Education,2017 Regular Session,Type:Bill,2017-05-20
726,HB17-1259,Independent Expenditure Committees And Candidates,/bills/hb17-1259,Concerning a requirement that an independent expenditure committee created by a candidate for public office is subject to constitutional requirements governing limits on contributions to such candidates.,"Last Action:05/4/2017 | Senate Committee on State, Veterans, & Military Affairs Postpone Indefinitely",0,"Rep. M. Weissman, Sen. S. Fenberg",Elections & Redistricting,2017 Regular Session,Type:Bill,2017-05-04
727,HB17-1260,Contribution Limits For County Offices,/bills/hb17-1260,"Concerning the establishment of contribution limits under the ""Fair Campaign Practices Act"" for candidates for county offices, and, in connection therewith, making an appropriation.","Last Action:05/1/2017 | Senate Committee on State, Veterans, & Military Affairs Postpone Indefinitely",0,"Rep. C. Kennedy, Sen. S. Fenberg",Elections & Redistricting,2017 Regular Session,Type:Bill,2017-05-01
728,HB17-1261,Disclaimers Large Electioneering Communications,/bills/hb17-1261,Concerning disclaimer requirements applicable to large electioneering communications.,"Last Action:04/26/2017 | Senate Committee on State, Veterans, & Military Affairs Postpone Indefinitely",0,"Rep. J. Bridges, Rep. K. Becker, Sen. R. Zenzinger",Elections & Redistricting,2017 Regular Session,Type:Bill,2017-04-26
729,HB17-1262,Expand Disclosure Electioneering Communications,/bills/hb17-1262,Concerning the expanded disclosure of electioneering communications to include the period between the primary election and the general election.,"Last Action:04/26/2017 | Senate Committee on State, Veterans, & Military Affairs Postpone Indefinitely",0,"Rep. J. Bridges, Rep. K. Becker, Sen. R. Zenzinger",Elections & Redistricting,2017 Regular Session,Type:Bill,2017-04-26
730,HB17-1263,Limited Lines Self-storage Insurance License,/bills/hb17-1263,Concerning an authorization for the commissioner of insurance to issue a license that allows a limited lines producer to sell limited lines self-storage insurance.,Last Action:06/6/2017 | Governor Signed,1,"Rep. H. McKean, Rep. C. Hansen, Sen. B. Gardner",Insurance,2017 Regular Session,Type:Bill,2017-06-06
731,HB17-1264,PACE Ombudsman Program Add Local Ombudsmen,/bills/hb17-1264,"Concerning expanding the ombudsman program for persons receiving services pursuant to the program of all-inclusive care for the elderly to include local ombudsmen, and, in connection therewith, making an appropriation.",Last Action:06/5/2017 | Governor Signed,1,"Rep. J. Ginal, Rep. P. Lawrence, Sen. B. Martinez Humenik, Sen. C. Jahn",Health Care & Health Insurance,2017 Regular Session,Type:Bill,2017-06-05
732,HB17-1265,PERA Public Employees' Retirement Association Judicial Division Total Employer Contribution,/bills/hb17-1265,Concerning an increase in the total employer contribution for employers in the judicial division of the public employees' retirement association.,Last Action:05/25/2017 | Governor Signed,1,"Rep. K. Becker, Rep. D. Nordberg, Sen. K. Priola, Sen. A. Kerr",State Government,2017 Regular Session,Type:Bill,2017-05-25
733,HB17-1266,Seal Misdemeanor Marijuana Conviction Records,/bills/hb17-1266,Concerning allowing persons who were convicted of misdemeanors for marijuana-related behaviors that are no longer illegal to petition for the sealing of criminal records relating to such convictions.,Last Action:06/6/2017 | Governor Signed,1,"Rep. E. Hooton, Rep. J. Melton, Sen. S. Fenberg, Sen. V. Marble","Courts & JudicialCrimes, Corrections, & Enforcement",2017 Regular Session,Type:Bill,2017-06-06
734,HB17-1267,Reporting Requirements By Education Agencies To General Assembly,/bills/hb17-1267,Concerning the scheduled repeal of reports by educational agencies to the general assembly.,Last Action:05/25/2017 | Governor Signed,1,"Rep. J. Arndt, Sen. D. Moreno",Education & School Finance (Pre & K-12)State Government,2017 Regular Session,Type:Bill,2017-05-25
735,HB17-1268,Change Maximum Criminal Penalty One Year To 364 Days,/bills/hb17-1268,Concerning changing the maximum jail sentence for certain crimes from one year to three hundred sixty-four days.,"Last Action:05/3/2017 | Senate Committee on State, Veterans, & Military Affairs Postpone Indefinitely",0,"Rep. L. Herod, Sen. D. Coram","Crimes, Corrections, & Enforcement",2017 Regular Session,Type:Bill,2017-05-03
736,HB17-1269,Repeal Prohibition Of Wage Sharing Information,/bills/hb17-1269,Concerning the repeal of the prohibition of an action against an employee for sharing wage information.,Last Action:06/2/2017 | Governor Signed,1,"Rep. J. Danielson, Rep. D. Nordberg, Sen. B. Martinez Humenik, Sen. K. Donovan",Labor & Employment,2017 Regular Session,Type:Bill,2017-06-02
737,HB17-1270,Agency Discretion Enforcing Rules Small Business,/bills/hb17-1270,Concerning agency discretion in enforcement procedures for minor violations of certain state rules by small businesses employing no more than fifty employees.,Last Action:05/9/2017 | Senate Committee on Appropriations Postpone Indefinitely,0,"Rep. T. Kraft-Tharp, Rep. P. Lawrence, Sen. A. Williams, Sen. D. Coram",Business & Economic Development,2017 Regular Session,Type:Bill,2017-05-09
738,HB17-1271,Standards For Innovation District Waivers,/bills/hb17-1271,Concerning waivers granted to school districts of innovation.,Last Action:06/5/2017 | Governor Signed,1,"Rep. B. Pettersen, Sen. K. Priola",Education & School Finance (Pre & K-12),2017 Regular Session,Type:Bill,2017-06-05
739,HB17-1272,Reporting Requirements By CDLE To General Assembly,/bills/hb17-1272,Concerning the scheduled repeal of reports by the department of labor and employment to the general assembly.,Last Action:04/28/2017 | Governor Signed,1,"Rep. E. Hooton, Sen. D. Moreno",State Government,2017 Regular Session,Type:Bill,2017-04-28
740,HB17-1273,Real Estate Development Demonstrate Water Conservation,/bills/hb17-1273,Concerning a requirement that an applicant for a real estate development permit demonstrate water conservation measures that will be implemented in the development.,"Last Action:04/24/2017 | Senate Committee on State, Veterans, & Military Affairs Postpone Indefinitely",0,"Rep. C. Hansen, Rep. H. McKean, Sen. D. Coram, Sen. M. Jones",Local GovernmentWater,2017 Regular Session,Type:Bill,2017-04-24
741,HB17-1274,Veterinary Pharmaceutical Compounding Animal Patient,/bills/hb17-1274,Concerning the limited circumstances under which a veterinarian may use a compounded pharmaceutical drug for the treatment of an animal patient that is a food animal.,Last Action:06/6/2017 | Governor Signed,1,"Rep. J. Ginal, Sen. R. Baumgardner",Agriculture,2017 Regular Session,Type:Bill,2017-06-06
742,HB17-1275,Increase Solid Waste Diversion,/bills/hb17-1275,"Concerning additional measures to increase waste diversion, and, in connection therewith, making an appropriation.","Last Action:05/1/2017 | Senate Committee on State, Veterans, & Military Affairs Postpone Indefinitely",0,"Rep. F. Winter, Sen. K. Priola",Local GovernmentNatural Resources & Environment,2017 Regular Session,Type:Bill,2017-05-01
743,HB17-1276,Restrict Restraints On Public School Students,/bills/hb17-1276,"Concerning prohibiting the use of certain restraints upon public school students, and, in connection therewith, making an appropriation.",Last Action:05/30/2017 | Governor Signed,1,"Rep. S. Lontine, Sen. R. Fields, Sen. B. Gardner",Children & Domestic MattersEducation & School Finance (Pre & K-12)Human Services,2017 Regular Session,Type:Bill,2017-05-30
744,HB17-1277,Driver's License Suspension Leaving Accident Scene,/bills/hb17-1277,Concerning the authority of the department of revenue to suspend the driver's license of a driver who leaves the scene of an accident involving serious bodily injury.,Last Action:06/5/2017 | Governor Signed,1,Sen. B. Martinez Humenik,Transportation & Motor Vehicles,2017 Regular Session,Type:Bill,2017-06-05
745,HB17-1278,Insurance Premium Tax Deposit To Local Firefighter Fund,/bills/hb17-1278,Concerning deposit of proceeds from the tax on insurance premiums to the local firefighter safety and disease prevention fund.,Last Action:05/9/2017 | Senate Committee on Appropriations Postpone Indefinitely,0,"Rep. T. Exum, Rep. B. Pettersen, Sen. L. Garcia, Sen. L. Guzman",Local Government,2017 Regular Session,Type:Bill,2017-05-09
746,HB17-1279,Construction Defect Actions Notice Vote Approval,/bills/hb17-1279,Concerning the requirement that a unit owners' association obtain approval through a vote of unit owners before filing a construction defect action.,Last Action:05/23/2017 | Governor Signed,1,"Rep. A. Garnett, Rep. L. Saine, Sen. J. Tate, Sen. L. Guzman",,2017 Regular Session,Type:Bill,2017-05-23
747,HB17-1280,Disability Trusts 21st Century Cures Act Language,/bills/hb17-1280,"Concerning conforming Colorado statutory language related to disability trusts to the federal ""21st Century Cures Act"".",Last Action:05/23/2017 | Governor Signed,1,"Rep. D. Michaelson Jenet, Rep. D. Young, Sen. B. Gardner",Civil Law,2017 Regular Session,Type:Bill,2017-05-23
748,HB17-1281,Approval Voting Optional Use Nonpartisan Elections,/bills/hb17-1281,Concerning the optional use of alternative voting methods by local governments in nonpartisan elections.,Last Action:04/28/2017 | House Committee on Appropriations Postpone Indefinitely,0,"Rep. J. Singer, Sen. J. Kefalas",Elections & Redistricting,2017 Regular Session,Type:Bill,2017-04-28
749,HB17-1282,Rural Veterinary Education Loan Repayment Program,/bills/hb17-1282,Concerning the creation of a veterinary education loan repayment program to assist veterinarians with education loan repayments in exchange for providing veterinary services in rural areas of the state in need of veterinary services.,Last Action:06/5/2017 | Governor Signed,1,"Rep. J. Ginal, Sen. J. Sonnenberg",Agriculture,2017 Regular Session,Type:Bill,2017-06-05
750,HB17-1283,Task Force Child Welfare Worker Resiliency Program,/bills/hb17-1283,Concerning the creation of a task force to examine workforce resiliency in the child welfare system.,Last Action:05/22/2017 | Governor Signed,1,"Rep. J. Singer, Rep. D. Nordberg, Sen. L. Garcia, Sen. J. Cooke",Children & Domestic MattersHuman ServicesLabor & Employment,2017 Regular Session,Type:Bill,2017-05-22
751,HB17-1284,Data System Check For Employees Serving At-risk Adults,/bills/hb17-1284,"Concerning protecting at-risk adults from mistreatment by establishing a check of the Colorado adult protective services data system for persons employed to provide direct care to at-risk adults, and, in connection therewith, making an appropriation.",Last Action:05/30/2017 | Governor Signed,1,"Rep. S. Lontine, Sen. I. Aguilar, Sen. B. Gardner",Human Services,2017 Regular Session,Type:Bill,2017-05-30
752,HB17-1285,Refinance Water Pollution Control Program,/bills/hb17-1285,"Concerning the financing of the water pollution control program, and, in connection therewith, making and reducing appropriations.",Last Action:06/5/2017 | Governor Signed,1,"Rep. P. Lawrence, Sen. J. Cooke, Sen. C. Jahn",Natural Resources & Environment,2017 Regular Session,Type:Bill,2017-06-05
753,HB17-1286,State Employee Health Carrier Requirements,/bills/hb17-1286,Concerning contract requirements for health insurance carriers that offer health benefits to state employees.,"Last Action:05/3/2017 | Senate Committee on State, Veterans, & Military Affairs Postpone Indefinitely",0,"Rep. D. Esgar, Sen. L. Crowder",State Government,2017 Regular Session,Type:Bill,2017-05-03
754,HB17-1287,Achieving A Vision For Education In Colorado,/bills/hb17-1287,"Concerning achieving a vision for education in Colorado, and, in connection therewith, making an appropriation.","Last Action:04/26/2017 | Senate Committee on State, Veterans, & Military Affairs Postpone Indefinitely",0,"Rep. M. Hamner, Rep. B. Rankin, Sen. K. Priola, Sen. A. Kerr",Education & School Finance (Pre & K-12),2017 Regular Session,Type:Bill,2017-04-26
755,HB17-1288,Penalties For Felony DUI Offenders,/bills/hb17-1288,Concerning the penalties for DUI offenders who commit their fourth and subsequent DUI offenses.,Last Action:06/6/2017 | Governor Signed,1,"Rep. L. Saine, Rep. M. Foote, Sen. J. Cooke, Sen. L. Court","Crimes, Corrections, & EnforcementTransportation & Motor Vehicles",2017 Regular Session,Type:Bill,2017-06-06
756,HB17-1289,State Engineer Rules Historical Consumptive Use,/bills/hb17-1289,Concerning a requirement that the state engineer promulgate rules that establish an optional streamlined approach to calculate the historical consumptive use of a water right.,Last Action:05/22/2017 | Governor Signed,1,"Rep. D. Valdez, Rep. C. Hansen, Sen. D. Coram, Sen. L. Crowder",Water,2017 Regular Session,Type:Bill,2017-05-22
757,HB17-1290,Colorado Secure Savings Plan,/bills/hb17-1290,Concerning the creation of the Colorado secure savings plan.,"Last Action:04/26/2017 | Senate Committee on State, Veterans, & Military Affairs Postpone Indefinitely",0,"Rep. B. Pettersen, Rep. J. Buckner, Sen. K. Donovan, Sen. N. Todd",State Government,2017 Regular Session,Type:Bill,2017-04-26
758,HB17-1291,Alternate Storage Not Change If Already Quantified,/bills/hb17-1291,Concerning the ability to store water at an alternate place of storage if the historical consumptive use of the water right has already been quantified in a previous change of the water right.,Last Action:06/5/2017 | Governor Signed,1,"Rep. J. Arndt, Rep. J. Becker, Sen. D. Coram",Water,2017 Regular Session,Type:Bill,2017-06-05
759,HB17-1292,Child Welfare Provider Rates,/bills/hb17-1292,"Concerning child welfare licensed out-of-home placement provider rates, and, in connection therewith, making an appropriation.",Last Action:06/6/2017 | Governor Signed,1,"Rep. D. Young, Sen. K. Lundberg",Children & Domestic MattersHuman Services,2017 Regular Session,Type:Bill,2017-06-06
760,HB17-1293,Local Government Officials On Nonprofit Boards,/bills/hb17-1293,Concerning the ability of a local government official to serve on a nonprofit entity's board of directors.,Last Action:06/2/2017 | Governor Signed,1,"Rep. J. Melton, Sen. N. Todd",Local GovernmentState Government,2017 Regular Session,Type:Bill,2017-06-02
761,HB17-1294,Counting ASCENT Program Students In Graduation Rate,/bills/hb17-1294,Concerning counting a high school student who participates in the accelerating students through concurrent enrollment program in the enrolling education entity's high school graduation rate in the school year in which the student completes the high school graduation requirements.,Last Action:06/5/2017 | Governor Signed,1,"Rep. M. Weissman, Sen. N. Todd",Education & School Finance (Pre & K-12),2017 Regular Session,Type:Bill,2017-06-05
762,HB17-1295,Repeal Governor's Office Of Marijuana Coordination,/bills/hb17-1295,Concerning the repeal of the governor's office of marijuana coordination.,Last Action:05/25/2017 | Governor Signed,1,"Rep. B. Rankin, Sen. D. Moreno",State Government,2017 Regular Session,Type:Bill,2017-05-25
763,HB17-1296,Assignment Of State-owned Vehicles,/bills/hb17-1296,"Concerning the assignment of state-owned motor vehicles, and, in connection therewith, making an appropriation.",Last Action:06/2/2017 | Governor Signed,1,"Rep. D. Nordberg, Rep. T. Kraft-Tharp, Sen. J. Smallwood, Sen. C. Jahn",State Government,2017 Regular Session,Type:Bill,2017-06-02
764,HB17-1297,Special District Meeting Compensation,/bills/hb17-1297,Concerning meetings for which a special district director may be compensated for attending.,Last Action:06/5/2017 | Governor Signed,1,"Rep. M. Gray, Sen. B. Gardner",Local Government,2017 Regular Session,Type:Bill,2017-06-05
765,HB17-1298,Annual Compensation Report Submission Deadline,/bills/hb17-1298,Concerning the date by which the state personnel director is required to submit the annual compensation report.,Last Action:05/25/2017 | Governor Signed,1,"Rep. M. Hamner, Sen. K. Lundberg",State Government,2017 Regular Session,Type:Bill,2017-05-25
766,HB17-1299,Transportation Legislation Review Committee Interim Hearing Electric Utility Energy Storage,/bills/hb17-1299,Concerning a transportation legislation review committee hearing on the integration of energy storage into the electric resource planning process for public utilities.,"Last Action:04/26/2017 | Senate Committee on State, Veterans, & Military Affairs Postpone Indefinitely",0,"Rep. C. Hansen, Rep. J. Coleman, Sen. K. Donovan, Sen. S. Fenberg",Business & Economic DevelopmentEnergy,2017 Regular Session,Type:Bill,2017-04-26
767,HB17-1300,Apprentice Utilization In Public Projects,/bills/hb17-1300,Concerning a requirement that contractors for public projects over five hundred thousand dollars that are not funded using federal moneys use apprentices for the parts of the project that are performed by workers in an apprenticeable occupation.,"Last Action:05/1/2017 | Senate Committee on State, Veterans, & Military Affairs Postpone Indefinitely",0,"Rep. A. Benavidez, Sen. D. Moreno",State Government,2017 Regular Session,Type:Bill,2017-05-01
768,HB17-1301,No Withholding Student Transcripts For Library Fines,/bills/hb17-1301,Concerning protecting a student's access to school records necessary for enrollment in another educational institution despite outstanding payments due to the school.,Last Action:05/17/2017 | Governor Signed,1,"Rep. D. Michaelson Jenet, Sen. C. Holbert, Sen. R. Fields",Education & School Finance (Pre & K-12),2017 Regular Session,Type:Bill,2017-05-17
769,HB17-1302,Juvenile Sexting Crime,/bills/hb17-1302,"Concerning matters related to sexually explicit images of a juvenile, and, in connection therewith, requiring a post-enactment review of the implementation of this act.",Last Action:06/6/2017 | Governor Signed,1,"Rep. P. Lee, Rep. Y. Willett, Sen. B. Gardner, Sen. R. Fields","Crimes, Corrections, & Enforcement",2017 Regular Session,Type:Bill,2017-06-06
770,HB17-1303,Judicial Performance Evaluation System And Commissions,/bills/hb17-1303,"Concerning the judicial performance evaluation system, and, in connection therewith, making an appropriation.",Last Action:06/5/2017 | Governor Signed,1,"Rep. C. Wist, Rep. P. Lee, Sen. B. Gardner, Sen. D. Kagan",Courts & Judicial,2017 Regular Session,Type:Bill,2017-06-05
771,HB17-1304,Adoptee Present In-state Exception,/bills/hb17-1304,Concerning allowing the adoption of a child under the jurisdiction of a court in Colorado who is not present in Colorado.,Last Action:06/5/2017 | Governor Signed,1,"Rep. J. Singer, Rep. K. Ransom, Sen. J. Smallwood, Sen. J. Kefalas",Children & Domestic Matters,2017 Regular Session,Type:Bill,2017-06-05
772,HB17-1305,Limits On Job Applicant Criminal History Inquiries,/bills/hb17-1305,Concerning the timing of an inquiry into a job applicant's criminal history.,"Last Action:05/1/2017 | Senate Committee on State, Veterans, & Military Affairs Postpone Indefinitely",0,"Rep. M. Foote, Rep. J. Melton, Sen. L. Guzman",Labor & Employment,2017 Regular Session,Type:Bill,2017-05-01
773,HB17-1306,Test Lead In Public Schools' Drinking Water,/bills/hb17-1306,"Concerning the financing of testing for lead in public schools' drinking water, and, in connection therewith, making an appropriation.",Last Action:06/8/2017 | Governor Signed,1,"Rep. B. McLachlan, Rep. T. Exum, Sen. D. Coram, Sen. K. Donovan",Natural Resources & Environment,2017 Regular Session,Type:Bill,2017-06-08
774,HB17-1307,Family And Medical Leave Insurance Program Wage Replacement,/bills/hb17-1307,Concerning the creation of a family and medical leave insurance program.,"Last Action:05/3/2017 | Senate Committee on State, Veterans, & Military Affairs Postpone Indefinitely",0,"Rep. F. Winter, Sen. D. Moreno, Sen. R. Fields",Labor & Employment,2017 Regular Session,Type:Bill,2017-05-03
775,HB17-1308,Individualized Conditions Of Parole,/bills/hb17-1308,Concerning allowing individualized conditions of parole.,Last Action:06/6/2017 | Governor Signed,1,"Rep. J. Salazar, Rep. L. Sias, Sen. D. Kagan, Sen. J. Cooke","Crimes, Corrections, & Enforcement",2017 Regular Session,Type:Bill,2017-06-06
776,HB17-1309,Documentary Fee To Fund Affordable Housing,/bills/hb17-1309,Concerning modifications to the documentary fee imposed by counties for the purpose of financing a statewide affordable housing investment fund.,"Last Action:05/3/2017 | Senate Committee on State, Veterans, & Military Affairs Postpone Indefinitely",0,"Rep. D. Jackson, Rep. F. Winter, Sen. D. Coram, Sen. L. Guzman",HousingLocal Government,2017 Regular Session,Type:Bill,2017-05-03
777,HB17-1310,Residential Landlord Application Screening Fee,/bills/hb17-1310,Concerning an application screening fee that a residential landlord charges a prospective tenant.,"Last Action:05/1/2017 | Senate Committee on State, Veterans, & Military Affairs Postpone Indefinitely",0,"Rep. C. Kennedy, Rep. D. Jackson, Sen. S. Fenberg",Housing,2017 Regular Session,Type:Bill,2017-05-01
778,HB17-1311,Seller's Disclosure Estimated Future Property Tax,/bills/hb17-1311,Concerning the disclosure of future estimated property taxes for the sale of a newly constructed residence.,Last Action:05/4/2017 | Senate Committee on Finance Postpone Indefinitely,0,"Rep. M. Weissman, Rep. D. Michaelson Jenet, Sen. A. Williams",Housing,2017 Regular Session,Type:Bill,2017-05-04
779,HB17-1312,Residential Lease Copy And Rent Receipt,/bills/hb17-1312,Concerning documents that a residential landlord is required to provide a tenant.,"Last Action:05/4/2017 | Senate Committee on State, Veterans, & Military Affairs Postpone Indefinitely",0,"Rep. T. Exum, Rep. A. Benavidez, Sen. D. Moreno, Sen. B. Martinez Humenik",Housing,2017 Regular Session,Type:Bill,2017-05-04
780,HB17-1313,Civil Forfeiture Reform,/bills/hb17-1313,"Concerning civil forfeiture reform, and, in connection therewith, making an appropriation.",Last Action:06/9/2017 | Governor Signed,1,"Rep. L. Herod, Rep. S. Humphrey, Sen. T. Neville, Sen. D. Kagan","Crimes, Corrections, & Enforcement",2017 Regular Session,Type:Bill,2017-06-09
781,HB17-1314,Colorado Right To Rest Act,/bills/hb17-1314,"Concerning the creation of the ""Colorado Right to Rest Act"".",Last Action:04/19/2017 | House Committee on Local Government Postpone Indefinitely,0,"Rep. J. Melton, Rep. J. Salazar",Civil LawHousingHuman ServicesLocal Government,2017 Regular Session,Type:Bill,2017-04-19
782,HB17-1315,Require Division Of Criminal Justice To Report Driving Under The Influence Of Drugs and Alcohol Data,/bills/hb17-1315,"Concerning the acquisition of data to analyze the types of DUI offenses being committed by offenders and, in connection therewith, making an appropriation.",Last Action:06/1/2017 | Governor Signed,1,"Rep. J. Singer, Rep. P. Lawrence, Sen. B. Gardner, Sen. R. Fields","Crimes, Corrections, & EnforcementTransportation & Motor Vehicles",2017 Regular Session,Type:Bill,2017-06-01
783,HB17-1316,Delay Implementation Of House Bill 16-1309,/bills/hb17-1316,Concerning delaying the implementation of House Bill 16-1309.,Last Action:04/28/2017 | Governor Signed,1,"Rep. S. Lontine, Sen. V. Marble",Courts & Judicial,2017 Regular Session,Type:Bill,2017-04-28
784,HB17-1317,State Historical Society Authority To Sell Property,/bills/hb17-1317,Concerning the authority of the state historical society to dispose of real property located on the former Lowry Air Force base.,Last Action:05/24/2017 | Governor Signed,1,"Rep. D. Esgar, Rep. C. Hansen, Sen. R. Baumgardner, Sen. J. Kefalas",Capital Construction,2017 Regular Session,Type:Bill,2017-05-24
785,HB17-1318,Division Of Insurance Annual Report Pharmaceutical Costs Data,/bills/hb17-1318,Concerning an annual report on pharmaceutical costs.,"Last Action:05/3/2017 | Senate Committee on State, Veterans, & Military Affairs Postpone Indefinitely",0,"Rep. J. Ginal, Sen. D. Coram, Sen. J. Kefalas",Health Care & Health InsuranceInsurance,2017 Regular Session,Type:Bill,2017-05-03
786,HB17-1319,Appraisals For Insurance Claims,/bills/hb17-1319,Concerning the neutrality of appraisers retained to help the parties to an insurance claim establish the appropriate valuation.,Last Action:05/2/2017 | House Committee on Judiciary Postpone Indefinitely,0,Rep. L. Sias,Civil LawInsurance,2017 Regular Session,Type:Bill,2017-05-02
787,HB17-1320,Age Of Consent Outpatient Psychotherapy For Minors,/bills/hb17-1320,Concerning lowering the age of consent for minors seeking outpatient psychotherapy.,"Last Action:05/1/2017 | Senate Committee on State, Veterans, & Military Affairs Postpone Indefinitely",0,"Rep. D. Michaelson Jenet, Sen. D. Coram, Sen. S. Fenberg",Children & Domestic MattersHealth Care & Health Insurance,2017 Regular Session,Type:Bill,2017-05-01
788,HB17-1321,Parks And Wildlife Financial Sustainability,/bills/hb17-1321,"Concerning the parks and wildlife commission's authority to set certain charges assessed on people engaging in activities regulated by the division of parks and wildlife, and, in connection therewith, setting certain hunting, fishing, parks, and recreation fees and fines, creating an aquatic nuisance species sticker and associated fee structure, and requiring reporting by the division of parks and wildlife on fee amounts and the use of division-managed lands by nonconsumptive users.",Last Action:05/4/2017 | Senate Committee on Finance Postpone Indefinitely,0,"Rep. J. Arndt, Rep. J. Wilson, Sen. D. Coram, Sen. S. Fenberg",Natural Resources & Environment,2017 Regular Session,Type:Bill,2017-05-04
789,HB17-1322,Domestic Violence Reports By Medical Professionals,/bills/hb17-1322,concerning injuries resulting from domestic violence.,Last Action:06/5/2017 | Governor Signed,1,"Rep. D. Esgar, Rep. L. Landgraf, Sen. K. Donovan, Sen. K. Lundberg",Children & Domestic MattersHealth Care & Health Insurance,2017 Regular Session,Type:Bill,2017-06-05
790,HB17-1323,PUC Ethics Add Consumer Protection,/bills/hb17-1323,"Concerning measures to enhance the consumer protection mission of the Colorado public utilities commission, and, in connection therewith, prohibiting a person with recent connections to a regulated utility from serving on the commission, requiring the appointment of an ethics ombudsman,       providing for periodic performance audits, and, making an appropriation.","Last Action:05/4/2017 | Senate Committee on State, Veterans, & Military Affairs Postpone Indefinitely",0,"Rep. D. Esgar, Sen. J. Cooke, Sen. L. Garcia",Business & Economic DevelopmentEnergyState Government,2017 Regular Session,Type:Bill,2017-05-04
791,HB17-1324,Educational Opportunity Tax Incentives,/bills/hb17-1324,"Concerning educational opportunity tax incentives, and, in connection therewith, modifying the existing state income tax deductions for contributions to and distributions of investment earnings from the qualified state tuition program established by collegeinvest and creating new state income tax credits for qualifying teachers and student teachers who teach in rural schools.",Last Action:05/5/2017 | Senate Committee on Finance Postpone Indefinitely,0,"Rep. B. Pettersen, Rep. B. McLachlan, Sen. N. Todd",Education & School Finance (Pre & K-12)Fiscal Policy & Taxes,2017 Regular Session,Type:Bill,2017-05-05
792,HB17-1325,Use Peace Officers Standards And Training Cash Fund For Military Police Training,/bills/hb17-1325,Concerning clarifying that money in the P.O.S.T. board cash fund may be used to train military law enforcement personnel stationed in Colorado.,Last Action:04/18/2017 | House Committee on Judiciary Postpone Indefinitely,0,Rep. L. Landgraf,"Crimes, Corrections, & Enforcement",2017 Regular Session,Type:Bill,2017-04-18
793,HB17-1326,Justice Reinvestment Crime Prevention Initiative,/bills/hb17-1326,"Concerning creation of the justice reinvestment crime prevention initiative, and, in connection therewith, funding the initiative through savings created by parole reforms and making and reducing an appropriation.",Last Action:06/6/2017 | Governor Signed,1,"Rep. P. Lee, Sen. B. Gardner, Sen. D. Kagan","Business & Economic DevelopmentCrimes, Corrections, & Enforcement",2017 Regular Session,Type:Bill,2017-06-06
794,HB17-1327,Repeal Columbus Day As State Legal Holiday,/bills/hb17-1327,"Concerning the repeal of Columbus day as a legal holiday, and, in connection therewith, granting state employees a floating holiday day off each October.",Last Action:05/3/2017 | House Committee on Local Government Postpone Indefinitely,0,Rep. J. Salazar,State Government,2017 Regular Session,Type:Bill,2017-05-03
795,HB17-1328,Require Candidates To Disclose Income Tax Returns,/bills/hb17-1328,Concerning a requirement that candidates for certain federal executive offices file income tax returns with the secretary of state.,"Last Action:05/1/2017 | Senate Committee on State, Veterans, & Military Affairs Postpone Indefinitely",0,"Rep. E. Hooton, Rep. C. Hansen, Sen. M. Jones, Sen. A. Kerr",Elections & Redistricting,2017 Regular Session,Type:Bill,2017-05-01
796,HB17-1329,Reform Division Of Youth Corrections,/bills/hb17-1329,"concerning critical incidents, renaming and expanding the role of the youth seclusion working group, requiring an independent assessment of the division, creating community boards in each region of the division, requiring the state auditor to audit certain reports of the division, and making an appropriation.",Last Action:06/6/2017 | Governor Signed,1,"Rep. P. Lee, Rep. L. Landgraf, Sen. D. Kagan, Sen. D. Coram","Children & Domestic MattersCrimes, Corrections, & EnforcementHuman Services",2017 Regular Session,Type:Bill,2017-06-06
797,HB17-1330,No Escape Convictions For Habitual Criminals,/bills/hb17-1330,Concerning disallowing the use of certain convictions for the purpose of adjudicating a person an habitual criminal.,Last Action:06/6/2017 | Governor Signed,1,"Rep. P. Lee, Rep. C. Wist, Sen. R. Fields, Sen. J. Cooke","Crimes, Corrections, & Enforcement",2017 Regular Session,Type:Bill,2017-06-06
798,HB17-1331,Protect Colorado Constitutional Rights,/bills/hb17-1331,Concerning protecting Colorado citizens who are engaged in an act that is protected by the Colorado constitution from outside agencies.,Last Action:05/1/2017 | Senate Committee on Judiciary Postpone Indefinitely,0,"Rep. S. Lebsock, Sen. T. Neville",State Government,2017 Regular Session,Type:Bill,2017-05-01
799,HB17-1332,Teachers Nonpublic Child Care & Preschool Facility,/bills/hb17-1332,Concerning state board of education authorization for an alternative teacher license for a person who participates in an alternative teacher program provided by a designated agency working with a nonpublic early child care facility.,Last Action:05/30/2017 | Governor Signed,1,"Rep. J. Bridges, Rep. J. Wilson, Sen. S. Fenberg, Sen. J. Smallwood",Children & Domestic MattersEducation & School Finance (Pre & K-12),2017 Regular Session,Type:Bill,2017-05-30
800,HB17-1333,Seal Criminal Records Of Marijuana Offenses,/bills/hb17-1333,Concerning the sealing of criminal records relating to marijuana-related offenses that are no longer illegal.,Last Action:04/25/2017 | House Committee on Judiciary Postpone Indefinitely,0,"Rep. E. Hooton, Rep. J. Melton","Courts & JudicialCrimes, Corrections, & Enforcement",2017 Regular Session,Type:Bill,2017-04-25
801,HB17-1334,Registration Process Servers,/bills/hb17-1334,Concerning the regulation of process servers.,Last Action:04/20/2017 | House Committee on Business Affairs and Labor Postpone Indefinitely,0,Rep. J. Melton,Courts & JudicialLabor & Employment,2017 Regular Session,Type:Bill,2017-04-20
802,HB17-1335,Liquor Licensee Wine Sales,/bills/hb17-1335,Concerning the ability of certain liquor licensees to allow a customer to remove vinous liquor from the licensed premises.,Last Action:04/20/2017 | House Committee on Business Affairs and Labor Postpone Indefinitely,0,Rep. J. Melton,"Civil LawLiquor, Tobacco, & Marijuana",2017 Regular Session,Type:Bill,2017-04-20
803,HB17-1336,Additional Protections Forced Pooling Order,/bills/hb17-1336,Concerning additional protections for oil and gas interest owners subject to       pooling of oil and gas resources.,"Last Action:05/3/2017 | Senate Committee on State, Veterans, & Military Affairs Postpone Indefinitely",0,"Rep. M. Foote, Rep. D. Young, Sen. M. Jones, Sen. I. Aguilar",Natural Resources & Environment,2017 Regular Session,Type:Bill,2017-05-03
804,HB17-1337,Liquor License Renewal Application Fees,/bills/hb17-1337,Concerning the authority of the department of revenue to establish a renewal application fee for each liquor license that the department issues.,Last Action:05/2/2017 | Senate Committee on Finance Postpone Indefinitely,0,"Rep. M. Hamner, Sen. D. Moreno","Liquor, Tobacco, & Marijuana",2017 Regular Session,Type:Bill,2017-05-02
805,HB17-1338,Municipal Court Bond Hold Notification and Hearing,/bills/hb17-1338,Concerning a requirement for a timely hearing for a defendant in jail with a municipal court hold.,Last Action:06/6/2017 | Governor Signed,1,"Rep. J. Bridges, Rep. L. Liston, Sen. V. Marble, Sen. D. Kagan",Courts & Judicial,2017 Regular Session,Type:Bill,2017-06-06
806,HB17-1339,Colorado Energy Impact Assistance Act,/bills/hb17-1339,"Concerning authorization for the issuance of low-cost ratepayer-backed bonds, and creation of the Colorado energy impact assistance authority to mitigate the impacts of power plant retirements on Colorado workers and communities.","Last Action:05/3/2017 | Senate Committee on State, Veterans, & Military Affairs Postpone Indefinitely",0,"Rep. C. Hansen, Rep. D. Esgar, Sen. A. Kerr, Sen. M. Jones",Energy,2017 Regular Session,Type:Bill,2017-05-03
807,HB17-1340,Legislative Interim Committee On School Finance,/bills/hb17-1340,"Concerning creation of a legislative interim committee to study school finance issues, and, in connection therewith, making an appropriation.",Last Action:06/2/2017 | Governor Signed,1,"Rep. P. Lundeen, Rep. A. Garnett, Sen. O. Hill, Sen. D. Moreno",Education & School Finance (Pre & K-12),2017 Regular Session,Type:Bill,2017-06-02
808,HB17-1341,Major IT Information Technology Project Procurement Timeline,/bills/hb17-1341,Concerning the procurement timeline for a state agency that intends to submit a budget request to the joint technology committee for a major information technology project.,Last Action:05/1/2017 | House Committee on Finance Postpone Indefinitely,0,"Rep. J. Singer, Rep. D. Pabon, Sen. J. Tate, Sen. A. Williams",State GovernmentState Revenue & Budget,2017 Regular Session,Type:Bill,2017-05-01
809,HB17-1342,County Public Safety Improvements Tax Elections,/bills/hb17-1342,Concerning authorization for a county to submit a ballot question for a county public safety improvements tax at a biennial county or November odd-year election.,Last Action:05/24/2017 | Governor Signed,1,"Rep. A. Benavidez, Sen. L. Crowder",Elections & RedistrictingLocal Government,2017 Regular Session,Type:Bill,2017-05-24
810,HB17-1343,Implement Conflict-free Case Management,/bills/hb17-1343,"Concerning implementation of conflict-free case management for persons with intellectual and developmental disabilities who are eligible for home- and community-based services under the medicaid program, and, in connection therewith, making an appropriation.",Last Action:06/5/2017 | Governor Signed,1,"Rep. D. Young, Sen. D. Moreno",,2017 Regular Session,Type:Bill,2017-06-05
811,HB17-1344,Innovative Teacher Preparation Pilot Programs,/bills/hb17-1344,Concerning measures to support innovative teacher preparation programs.,Last Action:05/8/2017 | House Committee on Education Postpone Indefinitely,0,"Rep. J. Bridges, Rep. B. Pettersen, Sen. K. Priola, Sen. N. Todd",,2017 Regular Session,Type:Bill,2017-05-08
812,HB17-1345,Retail Marijuana Sales Tax Rate,/bills/hb17-1345,Concerning the continuation of the current retail marijuana sales tax rate.,Last Action:05/4/2017 | Senate Committee on Finance Postpone Indefinitely,0,"Rep. B. Rankin, Sen. D. Moreno","Liquor, Tobacco, & Marijuana",2017 Regular Session,Type:Bill,2017-05-04
813,HB17-1346,Land Sale To Fort Logan Cemetery,/bills/hb17-1346,Concerning the sale of more than fifteen acres of land at the Colorado mental health institute at Fort Logan to the United States department of veterans affairs for the expansion of Fort Logan national cemetery.,Last Action:05/25/2017 | Governor Signed,1,"Rep. S. Lontine, Sen. O. Hill",,2017 Regular Session,Type:Bill,2017-05-25
814,HB17-1347,Transfer Student Threat And Suicide Assessment Documents,/bills/hb17-1347,Concerning the requirement that student records that document safety threats made by a student are transferred with the student's other records when the student transfers to a new public school.,Last Action:05/4/2017 | House Second Reading Laid Over to 05/11/2017 - No Amendments,0,"Rep. A. Garnett, Sen. K. Priola",Children & Domestic MattersEducation & School Finance (Pre & K-12),2017 Regular Session,Type:Bill,2017-05-04
815,HB17-1348,Prohibit HOV High Occupancy Vehicle 3 Requirement North I-25 Express Lanes,/bills/hb17-1348,"Concerning free use of any north interstate highway 25 express lane for any motor vehicle that is occupied by two or more individuals, including the driver.",Last Action:05/4/2017 | House Committee on Transportation & Energy Postpone Indefinitely,0,"Rep. S. Lebsock, Sen. R. Scott",Transportation & Motor Vehicles,2017 Regular Session,Type:Bill,2017-05-04
816,HB17-1349,Assessment Ratio For Residential Real Property,/bills/hb17-1349,Concerning the establishment of the ratio of valuation for assessment for residential real property.,Last Action:06/5/2017 | Governor Signed,1,"Rep. D. Pabon, Rep. K. Van Winkle, Sen. T. Neville, Sen. L. Court",Fiscal Policy & Taxes,2017 Regular Session,Type:Bill,2017-06-05
817,HB17-1350,Pharmacist Partial Fill Opioid Prescription,/bills/hb17-1350,Concerning the ability of a pharmacist to partially fill prescriptions for opioids.,"Last Action:05/4/2017 | Senate Committee on State, Veterans, & Military Affairs Postpone Indefinitely",0,"Rep. B. Pettersen, Rep. L. Liston, Sen. C. Jahn, Sen. J. Smallwood",,2017 Regular Session,Type:Bill,2017-05-04
818,HB17-1351,Study Inpatient Substance Use Disorder Treatment,/bills/hb17-1351,"Concerning utilizing information to improve treatment for substance use disorders under the medicaid program, and, in connection therewith, making an appropriation.",Last Action:06/2/2017 | Governor Signed,1,"Rep. B. Pettersen, Rep. B. Rankin, Sen. L. Crowder, Sen. C. Jahn",Health Care & Health Insurance,2017 Regular Session,Type:Bill,2017-06-02
819,HB17-1352,Regulate Student Education Loan Servicers,/bills/hb17-1352,Concerning the regulation of student loan servicers.,"Last Action:05/8/2017 | Senate Committee on State, Veterans, & Military Affairs Postpone Indefinitely",0,"Rep. F. Winter, Sen. D. Moreno",,2017 Regular Session,Type:Bill,2017-05-08
820,HB17-1353,Implement Medicaid Delivery & Payment Initiatives,/bills/hb17-1353,"Concerning implementing medicaid initiatives that create higher value in the medicaid program leading to better health outcomes for medicaid clients, and, in connection therewith, continuing the implementation of the accountable care collaborative and authorizing performance-based provider payments.",Last Action:05/23/2017 | Governor Signed,1,"Rep. D. Young, Sen. K. Lundberg",,2017 Regular Session,Type:Bill,2017-05-23
821,HB17-1354,Collection Of Delinquent Taxes On Mobile Homes,/bills/hb17-1354,Concerning the collection of delinquent taxes on certain mobile homes.,Last Action:05/24/2017 | Governor Signed,1,"Rep. K. Becker, Sen. K. Priola, Sen. J. Kefalas",Fiscal Policy & TaxesLocal Government,2017 Regular Session,Type:Bill,2017-05-24
822,HB17-1355,County Block Grant Money To Child Care Quality Programs,/bills/hb17-1355,Concerning the use of money from the county block grant temporary assistance for needy families program for child care quality improvement activities.,Last Action:06/5/2017 | Governor Signed,1,"Rep. D. Young, Sen. K. Lundberg",Children & Domestic MattersHuman Services,2017 Regular Session,Type:Bill,2017-06-05
823,HB17-1356,Treat Economic Development Income Tax Credits Differently,/bills/hb17-1356,Concerning the temporary authority of the Colorado economic development commission to allow certain businesses to treat specific existing income tax credits differently.,Last Action:05/24/2017 | Governor Signed,1,"Rep. C. Duran, Rep. D. Esgar, Sen. J. Tate, Sen. L. Garcia",Fiscal Policy & Taxes,2017 Regular Session,Type:Bill,2017-05-24
824,HB17-1357,Extend Colorado Department Labor Employment Worker Outreach Recruitment Key Grant Program,/bills/hb17-1357,Concerning modifications to the skilled worker training program administered by the department of labor and employment.,Last Action:06/5/2017 | Governor Signed,1,"Rep. D. Pabon, Sen. J. Cooke, Sen. A. Williams",Labor & Employment,2017 Regular Session,Type:Bill,2017-06-05
825,HB17-1358,Disclose Amounts Payable To Real Estate Brokers,/bills/hb17-1358,Concerning transparency in the fees to be paid to the parties' agents in a real estate transaction.,Last Action:04/27/2017 | House Committee on Business Affairs and Labor Postpone Indefinitely,0,Rep. P. Rosenthal,Business & Economic DevelopmentFinancial Services & CommerceHousing,2017 Regular Session,Type:Bill,2017-04-27
826,HB17-1359,CDE Colorado Department of Education Positions Exempt From State Personnel System,/bills/hb17-1359,Concerning positions in the department of education that are exempt from the state personnel system.,Last Action:06/2/2017 | Governor Signed,1,"Rep. D. Young, Sen. B. Gardner",State Government,2017 Regular Session,Type:Bill,2017-06-02
827,HB17-1360,Allow Criminal Record Sealing Subsequent Offense,/bills/hb17-1360,Concerning allowing a person with a subsequent criminal case to seal a low-level offense.,Last Action:06/6/2017 | Governor Signed,1,"Rep. D. Pabon, Sen. D. Moreno","Courts & JudicialCrimes, Corrections, & Enforcement",2017 Regular Session,Type:Bill,2017-06-06
828,HB17-1361,Evaluate State Information Technology Resources,/bills/hb17-1361,"Concerning an independent evaluation of the state's information technology resources, and, in connection therewith, making an appropriation.",Last Action:06/5/2017 | Governor Signed,1,"Rep. B. Rankin, Sen. K. Lambert",State GovernmentTelecommunications & Information Technology,2017 Regular Session,Type:Bill,2017-06-05
829,HB17-1362,Plan For Addressing Statewide Infrastructure Needs,/bills/hb17-1362,Concerning a plan for addressing statewide infrastructure needs.,Last Action:05/4/2017 | Senate Committee on Finance Postpone Indefinitely,0,"Rep. D. Mitsch Bush, Sen. R. Baumgardner, Sen. N. Todd",,2017 Regular Session,Type:Bill,2017-05-04
830,HB17-1363,Exempt New Energy Requirement If Not Subordinate Lien,/bills/hb17-1363,Concerning an exemption from otherwise applicable requirements for financing from the Colorado new energy improvement district if a residential property owner is not seeking to subordinate the priority of existing mortgages.,Last Action:06/5/2017 | Governor Signed,1,"Rep. C. Hansen, Sen. B. Martinez Humenik",EnergyLocal Government,2017 Regular Session,Type:Bill,2017-06-05
831,HB17-1364,Authority Local Government Master Plan Include Water Plan Goal,/bills/hb17-1364,Concerning the authority of a local government master plan to include policies to implement state water plan goals as a condition of development approvals.,"Last Action:05/1/2017 | House Committee on Agriculture, Livestock, & Natural Resources Postpone Indefinitely",0,"Rep. J. Arndt, Rep. C. Hansen",Local GovernmentWater,2017 Regular Session,Type:Bill,2017-05-01
832,HB17-1365,Liquor-licensed Drugstores Electronic Benefit Transfers,/bills/hb17-1365,Concerning an exemption from the prohibition against having electronic benefits transfer services available through an automated teller machine located on a liquor-licensed premises for an establishment licensed as a liquor-licensed drugstore.,Last Action:06/6/2017 | Governor Signed,1,"Rep. A. Garnett, Rep. D. Nordberg, Sen. J. Kefalas, Sen. J. Smallwood","Human ServicesLiquor, Tobacco, & Marijuana",2017 Regular Session,Type:Bill,2017-06-06
833,HB17-1366,Measurable Goals Deadlines Colorado Climate Action Plan,/bills/hb17-1366,Concerning a requirement to include measurable goals that are subject to deadlines in Colorado's climate action plan.,"Last Action:05/8/2017 | Senate Committee on State, Veterans, & Military Affairs Postpone Indefinitely",0,"Rep. J. Arndt, Rep. F. Winter, Sen. J. Kefalas",Natural Resources & Environment,2017 Regular Session,Type:Bill,2017-05-08
834,HB17-1367,Authorize Marijuana Clinical Research,/bills/hb17-1367,"Concerning marijuana research authorization, and, in connection therewith, making an appropriation.",Last Action:06/7/2017 | Governor Became Law,0,"Rep. D. Pabon, Rep. J. Arndt, Sen. C. Jahn, Sen. R. Baumgardner","Liquor, Tobacco, & Marijuana",2017 Regular Session,Type:Bill,2017-06-07
835,HB17-1368,End-of-life Death Certificate Signature,/bills/hb17-1368,"Concerning a change from ""shall"" to ""may"" in the ""Colorado End-of-life Options Act"" death certificate signature requirement to allow, rather than require, the attending physician or hospice medical director to sign the death certificate of a qualified individual who obtained and self-administered aid-in-dying medication.","Last Action:05/4/2017 | House Committee on Health, Insurance, & Environment Postpone Indefinitely",0,"Rep. J. Ginal, Sen. L. Court",Health Care & Health InsurancePublic Health,2017 Regular Session,Type:Bill,2017-05-04
836,HB17-1369,Bonds Persons Fail Appear Due Immigration Issues,/bills/hb17-1369,Concerning bond procedures for persons not appearing in court due to immigration-related issues.,Last Action:06/6/2017 | Governor Signed,1,"Rep. D. Pabon, Sen. V. Marble","Crimes, Corrections, & EnforcementImmigration",2017 Regular Session,Type:Bill,2017-06-06
837,HB17-1370,Retail Sales Of Alcohol Beverages,/bills/hb17-1370,Concerning the retail sale of alcohol beverages.,Last Action:05/5/2017 | House Committee on Appropriations Postpone Indefinitely,0,"Rep. F. Winter, Rep. L. Liston, Sen. T. Neville, Sen. A. Kerr","Liquor, Tobacco, & Marijuana",2017 Regular Session,Type:Bill,2017-05-05
838,HB17-1371,Distribution Of Medications To Certain Outlets,/bills/hb17-1371,Concerning the distribution of medications to outlets that are under common ownership of certain entities.,Last Action:06/2/2017 | Governor Signed,1,"Rep. P. Lee, Sen. J. Cooke",,2017 Regular Session,Type:Bill,2017-06-02
839,HB17-1372,Oil Gas Operators Disclose Pipe Location Development Plans,/bills/hb17-1372,"Concerning additional disclosures of information by oil and gas operators, and, in connection therewith, requiring the disclosure of the location of subsurface facilities and the sharing of oil and gas operators' development plans with affected local governments.",Last Action:05/10/2017 | House Second Reading Special Order - Laid Over Daily - No Amendments,0,"Rep. M. Foote, Rep. S. Lebsock",Natural Resources & Environment,2017 Regular Session,Type:Bill,2017-05-10
840,HB17-1373,General Fund Transfers For CO Colorado Energy Office Cash Funds,/bills/hb17-1373,Concerning general fund transfers to two Colorado energy office cash funds.,"Last Action:05/9/2017 | Senate Committee on State, Veterans, & Military Affairs Postpone Indefinitely",0,"Rep. C. Hansen, Rep. J. Bridges, Sen. D. Moreno",EnergyState Government,2017 Regular Session,Type:Bill,2017-05-09
841,HB17-1374,Colorado Heroes Hunting & Fishing Act,/bills/hb17-1374,Concerning granting certain licenses to take wildlife to Colorado residents who have served for at least two years in the United States armed forces.,"Last Action:05/8/2017 | House Committee on State, Veterans, & Military Affairs Refer Unamended to Appropriations",0,"Rep. B. McLachlan, Rep. J. Danielson",Natural Resources & Environment,2017 Regular Session,Type:Bill,2017-05-08
842,HB17-1375,Distributing Mill Levy Override Revenue To Schools,/bills/hb17-1375,"Concerning measures to increase transparent equity in educating students in public schools, and, in connection therewith, requiring school districts to distribute mill levy revenue to meet the needs of students, creating a fund to provide equalizing money to institute charter schools, and requiring school districts and charter schools to post a list of statutory waivers received.",Last Action:06/2/2017 | Governor Signed,1,"Rep. B. Pettersen, Rep. L. Sias, Sen. O. Hill, Sen. A. Williams",Education & School Finance (Pre & K-12),2017 Regular Session,Type:Bill,2017-06-02
843,HB17B-1001,Taxation Of Retail Marijuana Sales,/bills/hb17b-1001,Concerning clarification that retail marijuana sales are subject to sales taxes levied by certain limited purpose governmental entities.,Last Action:10/3/2017 | Senate Committee on Transportation Postpone Indefinitely,0,"Rep. K. Becker, Sen. K. Donovan",,2017 Extraordinary Session,Type:Bill,2017-10-03
844,HB18-1001,FAMLI Family Medical Leave Insurance Program,/bills/hb18-1001,Concerning the creation of a family and medical leave insurance program.,"Last Action:04/30/2018 | Senate Committee on State, Veterans, & Military Affairs Postpone Indefinitely",0,"Rep. F. Winter, Rep. M. Gray, Sen. K. Donovan, Sen. R. Fields",Labor & Employment,2018 Regular Session,Type:Bill,2018-04-30
845,HB18-1002,Rural School District Teaching Fellowship Programs,/bills/hb18-1002,"Concerning teaching fellowship programs to assist rural school districts in hiring high-quality teachers, and, in connection therewith, creating the ""Rural Colorado Grow Your Own Educator Act"" and making an appropriation.",Last Action:05/25/2018 | Governor Signed,1,"Rep. M. Hamner, Rep. B. Rankin, Sen. D. Coram, Sen. N. Todd",Higher Education,2018 Regular Session,Type:Bill,2018-05-25
846,HB18-1003,Opioid Misuse Prevention,/bills/hb18-1003,"Concerning measures to prevent opioid misuse in Colorado, and, in connection therewith, making an appropriation.",Last Action:05/21/2018 | Governor Signed,1,"Rep. B. Pettersen, Sen. K. Priola, Sen. C. Jahn",Health Care & Health Insurance,2018 Regular Session,Type:Bill,2018-05-21
847,HB18-1004,Continue Child Care Contribution Tax Credit,/bills/hb18-1004,Concerning the continuation of the income tax credit for a qualifying contribution to promote child care in the state.,Last Action:05/30/2018 | Governor Signed,1,"Rep. J. Coleman, Rep. J. Wilson, Sen. J. Tate, Sen. J. Kefalas",Fiscal Policy & Taxes,2018 Regular Session,Type:Bill,2018-05-30
848,HB18-1005,Notice To Students Of Postsecondary Courses,/bills/hb18-1005,Concerning notice of postsecondary course enrollment options available to high school students.,Last Action:03/22/2018 | Governor Signed,1,"Rep. B. Pettersen, Rep. J. Becker, Sen. K. Priola",Education & School Finance (Pre & K-12)Higher Education,2018 Regular Session,Type:Bill,2018-03-22
849,HB18-1006,Infant Newborn Screening,/bills/hb18-1006,"Concerning modifications to the newborn screening program administered by the department of public health and environment, and, in connection therewith, making an appropriation.",Last Action:06/4/2018 | Governor Signed,1,"Rep. M. Hamner, Rep. L. Liston, Sen. B. Gardner, Sen. D. Moreno",Health Care & Health InsurancePublic Health,2018 Regular Session,Type:Bill,2018-06-04
850,HB18-1007,Substance Use Disorder Payment And Coverage,/bills/hb18-1007,Concerning payment issues related to substance use disorders.,Last Action:05/21/2018 | Governor Signed,1,"Rep. C. Kennedy, Rep. J. Singer, Sen. K. Lambert, Sen. C. Jahn",Health Care & Health Insurance,2018 Regular Session,Type:Bill,2018-05-21
851,HB18-1008,Mussel-free Colorado Act,/bills/hb18-1008,"Concerning the financing of the division of parks and wildlife's aquatic nuisance species program, and, in connection therewith, creating an aquatic nuisance species stamp for the operation of motorboats and sailboats in waters of the state, increasing penalties related to the introduction of aquatic nuisance species into the waters of the state, and combining two separate funds related to the aquatic nuisance species program into one fund.",Last Action:04/23/2018 | Governor Signed,1,"Rep. D. Esgar, Rep. J. Arndt, Sen. K. Donovan, Sen. D. Coram",Natural Resources & EnvironmentWater,2018 Regular Session,Type:Bill,2018-04-23
852,HB18-1009,Diabetes Drug Pricing Transparency Act 2018,/bills/hb18-1009,"Concerning transparency in diabetes prescription drugs pricing, and, in connection therewith, making an appropriation.","Last Action:05/2/2018 | Senate Committee on State, Veterans, & Military Affairs Postpone Indefinitely",0,"Rep. D. Roberts, Sen. K. Donovan",Health Care & Health Insurance,2018 Regular Session,Type:Bill,2018-05-02
853,HB18-1010,Department Of Human Services Report Data And Add MembersTo Working Group,/bills/hb18-1010,"Concerning youth committed to the department of human services, and, in connection therewith, requiring the department to report certain data and adding members to the youth restraint and seclusion working group.",Last Action:03/7/2018 | Governor Signed,1,"Rep. P. Lee, Rep. J. Wilson, Sen. D. Coram",Children & Domestic MattersHuman Services,2018 Regular Session,Type:Bill,2018-03-07
854,HB18-1011,Marijuana Business Allow Publicly Traded Owners,/bills/hb18-1011,"Concerning measures to allow greater investment flexibility in marijuana businesses, and, in connection therewith, making an appropriation.",Last Action:06/5/2018 | Governor Vetoed,0,"Rep. D. Pabon, Rep. K. Van Winkle, Sen. T. Neville, Sen. C. Jahn","Liquor, Tobacco, & Marijuana",2018 Regular Session,Type:Bill,2018-06-05
855,HB18-1012,Vision Care Plans Carriers Eye Care Providers,/bills/hb18-1012,Concerning vision care plans for eye care services.,Last Action:03/29/2018 | Governor Signed,1,"Rep. J. Becker, Rep. S. Lontine, Sen. K. Lundberg, Sen. I. Aguilar",Health Care & Health Insurance,2018 Regular Session,Type:Bill,2018-03-29
856,HB18-1013,Income Tax Credit For Endowment Contributions,/bills/hb18-1013,Concerning an income tax credit for charitable contributions to an eligible endowment fund.,Last Action:05/10/2018 | House Committee on Appropriations Postpone Indefinitely,0,"Rep. A. Garnett, Sen. K. Priola",Fiscal Policy & Taxes,2018 Regular Session,Type:Bill,2018-05-10
857,HB18-1014,Social Studies Assessment In High Schools,/bills/hb18-1014,Concerning removing the requirement that the social studies assessment be administered in high school.,Last Action:02/28/2018 | House Committee on Education Postpone Indefinitely,0,Rep. P. Buck,,2018 Regular Session,Type:Bill,2018-02-28
858,HB18-1015,Repeal Ammunition Magazine Prohibition,/bills/hb18-1015,Concerning the repeal of certain provisions concerning ammunition magazines.,"Last Action:02/21/2018 | House Committee on State, Veterans, & Military Affairs Postpone Indefinitely",0,"Rep. S. Humphrey, Rep. L. Saine, Sen. O. Hill","Crimes, Corrections, & Enforcement",2018 Regular Session,Type:Bill,2018-02-21
859,HB18-1016,Honor The Service Of The Seabees,/bills/hb18-1016,"Concerning the creation of a Seabees license plate to honor the Seabees tradition, and, in connection therewith, making an appropriation.",Last Action:03/20/2018 | Senate Committee on Finance Postpone Indefinitely,0,"Rep. J. Danielson, Sen. R. Fields",Military & VeteransTransportation & Motor Vehicles,2018 Regular Session,Type:Bill,2018-03-20
860,HB18-1017,Psychology Interjurisdictional Compact,/bills/hb18-1017,"Concerning the adoption of an interstate compact to allow a person authorized to practice psychology in a compact state in which the person is not licensed, and, in connection therewith, making an appropriation.",Last Action:04/12/2018 | Governor Signed,1,"Rep. D. Michaelson Jenet, Sen. B. Gardner, Sen. S. Fenberg",Health Care & Health InsurancePublic Health,2018 Regular Session,Type:Bill,2018-04-12
861,HB18-1018,Human Trafficking Commercial Driver's License,/bills/hb18-1018,Concerning a requirement that education to prevent human trafficking be included in the training to obtain a commercial driver's license.,Last Action:04/12/2018 | Governor Signed,1,"Rep. T. Carver, Rep. D. Jackson, Sen. R. Zenzinger, Sen. J. Cooke",Transportation & Motor Vehicles,2018 Regular Session,Type:Bill,2018-04-12
862,HB18-1019,Kindergarten Through Twelfth Grade Accreditation Weighted Factors,/bills/hb18-1019,"Concerning criteria applied in determining performance ratings for entities in the elementary and secondary public education system, and, in connection therewith, making an appropriation.",Last Action:05/29/2018 | Governor Signed,1,"Rep. M. Foote, Sen. K. Priola",Education & School Finance (Pre & K-12),2018 Regular Session,Type:Bill,2018-05-29
863,HB18-1020,Civil Forfeiture Reforms,/bills/hb18-1020,"Concerning civil forfeiture reform, and, in connection therewith, changing the entity required to report on forfeitures, expanding the scope of the forfeitures to be reported, establishing grant programs, changing the disbursement of net forfeiture proceeds, and making an appropriation.",Last Action:05/29/2018 | Governor Signed,1,"Rep. L. Herod, Sen. D. Kagan, Sen. B. Gardner","Crimes, Corrections, & Enforcement",2018 Regular Session,Type:Bill,2018-05-29
864,HB18-1021,Task Force For Youth Experiencing Homelessness,/bills/hb18-1021,"Concerning addressing the issue of youth who are experiencing homelessness in Colorado, and, in connection therewith, making an appropriation.","Last Action:03/21/2018 | Senate Committee on State, Veterans, & Military Affairs Postpone Indefinitely",0,"Rep. E. Hooton, Rep. L. Landgraf, Sen. J. Kefalas",Children & Domestic Matters,2018 Regular Session,Type:Bill,2018-03-21
865,HB18-1022,DOR Department Of Revenue Issue Sales Tax Request For Information,/bills/hb18-1022,Concerning a requirement that the department of revenue issue a request for information for an electronic sales and use tax simplification system.,Last Action:03/1/2018 | Governor Signed,1,"Rep. L. Sias, Rep. T. Kraft-Tharp, Sen. C. Jahn, Sen. T. Neville",Fiscal Policy & Taxes,2018 Regular Session,Type:Bill,2018-03-01
866,HB18-1023,Relocate Title 12 Marijuana To New Title 44,/bills/hb18-1023,"Concerning the nonsubstantive relocation of laws related to legalized marijuana from title 12, Colorado Revised Statutes, as part of the organizational recodification of title 12.",Last Action:03/22/2018 | Governor Signed,1,"Rep. L. Herod, Sen. B. Gardner","Liquor, Tobacco, & Marijuana",2018 Regular Session,Type:Bill,2018-03-22
867,HB18-1024,Relocate Title 12 Racing to New Title 44,/bills/hb18-1024,"Concerning the nonsubstantive relocation of laws related to the regulation of racing from title 12, Colorado Revised Statutes, to a new title 44 as part of the organizational recodification of title 12.",Last Action:03/7/2018 | Governor Signed,1,"Rep. P. Lee, Sen. D. Kagan",State GovernmentState Revenue & Budget,2018 Regular Session,Type:Bill,2018-03-07
868,HB18-1025,Relocate Title 12 Liquor Laws To Title 44,/bills/hb18-1025,"Concerning the nonsubstantive relocation of laws related to the regulation of alcohol beverages from title 12, Colorado Revised Statutes, to a new title 44 as part of the organizational recodification of title 12, and, in connection therewith, making an appropriation.",Last Action:04/23/2018 | Governor Signed,1,"Rep. L. Herod, Sen. J. Cooke, Sen. B. Gardner","Liquor, Tobacco, & Marijuana",2018 Regular Session,Type:Bill,2018-04-23
869,HB18-1026,Relocate Title 12 Liquor Division Fund To Title 44,/bills/hb18-1026,"Concerning the nonsubstantive relocation of the law creating the liquor enforcement division and state licensing authority cash fund from title 24, Colorado Revised Statutes, to a new title 44 as part of the organizational recodification of title 12.",Last Action:03/7/2018 | Governor Signed,1,"Rep. L. Herod, Sen. J. Cooke, Sen. B. Gardner","Courts & JudicialLiquor, Tobacco, & MarijuanaState Government",2018 Regular Session,Type:Bill,2018-03-07
870,HB18-1027,Relocate Title 24 Lottery To New Title 44,/bills/hb18-1027,"Concerning the nonsubstantive relocation of laws related to the regulation of the lottery from title 24, Colorado Revised Statutes, to a new title 44 as part of the organizational recodification of title 12.",Last Action:03/15/2018 | Governor Signed,1,"Rep. C. Wist, Sen. D. Kagan",State Government,2018 Regular Session,Type:Bill,2018-03-15
871,HB18-1028,Attorney General Deceptive Practice Court Order,/bills/hb18-1028,Concerning clarification of the standard required for applications for a court order to require compliance with investigations of deceptive trade practices.,Last Action:03/15/2018 | Governor Signed,1,"Rep. T. Kraft-Tharp, Rep. C. Wist, Sen. L. Court, Sen. J. Tate",Courts & Judicial,2018 Regular Session,Type:Bill,2018-03-15
872,HB18-1029,Lowering Mandatory Parole From 5 Years To 3 Years,/bills/hb18-1029,Concerning lowering the period of mandatory parole from five years to three years for certain felony offenses.,Last Action:04/23/2018 | Governor Signed,1,"Rep. M. Weissman, Sen. K. Lundberg","Crimes, Corrections, & Enforcement",2018 Regular Session,Type:Bill,2018-04-23
873,HB18-1030,Prohibit Discrimination Labor Union Participation,/bills/hb18-1030,Concerning the prohibition of discrimination against employees based on labor union participation.,"Last Action:01/24/2018 | House Committee on State, Veterans, & Military Affairs Postpone Indefinitely",0,"Rep. J. Everett, Sen. T. Neville",Labor & Employment,2018 Regular Session,Type:Bill,2018-01-24
874,HB18-1031,Employer Entry FPPA Fire And Police Pension Association Defined Benefit System,/bills/hb18-1031,Concerning employer entry into the fire and police pension association defined benefit system.,Last Action:03/1/2018 | Governor Signed,1,"Rep. J. Melton, Rep. K. Ransom, Sen. J. Cooke, Sen. M. Jones",State Government,2018 Regular Session,Type:Bill,2018-03-01
875,HB18-1032,Access Medical Records State Emergency Medical Services Patient Care Database,/bills/hb18-1032,Concerning access to medical records from the department of public health and environment's EMS agency patient care database by health information organization networks.,Last Action:03/22/2018 | Governor Signed,1,"Rep. C. Kennedy, Rep. D. Thurlow, Sen. R. Fields, Sen. J. Tate",Public Health,2018 Regular Session,Type:Bill,2018-03-22
876,HB18-1033,Employee Leave To Participate In Elections,/bills/hb18-1033,Concerning the time in which employees are entitled to take leave to participate in elections.,"Last Action:02/28/2018 | Senate Committee on State, Veterans, & Military Affairs Postpone Indefinitely",0,"Rep. M. Weissman, Sen. D. Coram",Elections & Redistricting,2018 Regular Session,Type:Bill,2018-02-28
877,HB18-1034,Career And Technical Education Capital Grant Program,/bills/hb18-1034,Concerning creation of a grant program for capital costs relating to career and technical education.,Last Action:05/7/2018 | House Committee on Appropriations Postpone Indefinitely,0,"Rep. P. Covarrubias, Rep. H. McKean, Sen. K. Priola",Higher Education,2018 Regular Session,Type:Bill,2018-05-07
878,HB18-1035,Increase General Fund Reserve,/bills/hb18-1035,Concerning an increase in the amount of the general fund reserve.,Last Action:01/24/2018 | House Committee on Finance Postpone Indefinitely,0,Rep. S. Lebsock,Fiscal Policy & Taxes,2018 Regular Session,Type:Bill,2018-01-24
879,HB18-1036,Reduce Business Personal Property Taxes,/bills/hb18-1036,Concerning the reduction of business personal property taxes.,"Last Action:02/1/2018 | House Committee on State, Veterans, & Military Affairs Postpone Indefinitely",0,"Rep. T. Leonard, Sen. T. Neville",Local Government,2018 Regular Session,Type:Bill,2018-02-01
880,HB18-1037,Concealed Handguns On School Grounds,/bills/hb18-1037,Concerning allowing concealed handgun permit holders to carry concealed handguns on school grounds.,"Last Action:02/21/2018 | House Committee on State, Veterans, & Military Affairs Postpone Indefinitely",0,"Rep. P. Neville, Sen. T. Neville","Crimes, Corrections, & EnforcementEducation & School Finance (Pre & K-12)",2018 Regular Session,Type:Bill,2018-02-21
881,HB18-1038,Land Surveyors Continuing Education Requirement,/bills/hb18-1038,Concerning establishing a continuing education requirement for professional land surveyors.,"Last Action:02/28/2018 | Senate Committee on State, Veterans, & Military Affairs Postpone Indefinitely",0,"Rep. D. Valdez, Sen. D. Coram, Sen. K. Donovan",Business & Economic Development,2018 Regular Session,Type:Bill,2018-02-28
882,HB18-1039,Change Date Of Regular Special District Elections,/bills/hb18-1039,"Concerning changing regular special district elections to May of each odd-numbered year, and, in connection therewith, adjusting the length of terms served by directors elected in 2020 and 2022 in order to implement the new election schedule.",Last Action:03/15/2018 | Governor Signed,1,"Rep. K. Ransom, Sen. B. Gardner",Elections & Redistricting,2018 Regular Session,Type:Bill,2018-03-15
883,HB18-1040,Inmate Treatment Incentive Plans,/bills/hb18-1040,Concerning incentives for provision of sex offender services in the department of corrections.,Last Action:05/4/2018 | Governor Signed,1,"Rep. A. Benavidez, Sen. R. Fields","Crimes, Corrections, & Enforcement",2018 Regular Session,Type:Bill,2018-05-04
884,HB18-1041,Crime Of Cruelty To Certified Police Working Horse,/bills/hb18-1041,Concerning adding certified police working horses to the crime of cruelty to a service animal or a certified police working dog.,Last Action:03/7/2018 | Governor Signed,1,"Rep. M. Catlin, Sen. D. Coram","Crimes, Corrections, & Enforcement",2018 Regular Session,Type:Bill,2018-03-07
885,HB18-1042,Private Interstate Commercial Vehicle Registration,/bills/hb18-1042,"Concerning the creation of a program to authorize private providers to register commercial vehicles as Class A personal property, and, in connection therewith, making and reducing an appropriation.",Last Action:06/6/2018 | Governor Signed,1,"Rep. J. Becker, Rep. J. Ginal, Sen. R. Scott, Sen. R. Zenzinger","Crimes, Corrections, & EnforcementTransportation & Motor Vehicles",2018 Regular Session,Type:Bill,2018-06-06
886,HB18-1043,Beef Country Of Origin Recognition System,/bills/hb18-1043,Concerning a requirement that a retailer indicate the country of origin of beef sold to the public.,"Last Action:01/29/2018 | House Committee on Agriculture, Livestock, & Natural Resources Postpone Indefinitely",0,"Rep. K. Lewis, Sen. V. Marble",AgriculturePublic Health,2018 Regular Session,Type:Bill,2018-01-29
887,HB18-1044,Colorado Children's Trust Fund Act,/bills/hb18-1044,"Concerning the ""Colorado Children's Trust Fund Act"".","Last Action:02/26/2018 | Senate Committee on State, Veterans, & Military Affairs Postpone Indefinitely",0,"Rep. T. Kraft-Tharp, Sen. K. Priola",Children & Domestic MattersHuman ServicesPublic Health,2018 Regular Session,Type:Bill,2018-02-26
888,HB18-1045,Dental Hygienist Apply Silver Diamine Fluoride,/bills/hb18-1045,Concerning the application of silver diamine fluoride to dental patients.,Last Action:03/22/2018 | Governor Signed,1,"Rep. J. Singer, Sen. J. Tate",Health Care & Health Insurance,2018 Regular Session,Type:Bill,2018-03-22
889,HB18-1046,New Birth Certificate To Reflect Gender Change,/bills/hb18-1046,Concerning the issuance of a new birth certificate with a gender designation that differs from the gender designated on the person's original birth certificate.,"Last Action:03/28/2018 | Senate Committee on State, Veterans, & Military Affairs Postpone Indefinitely",0,"Rep. D. Esgar, Sen. D. Moreno",Public Health,2018 Regular Session,Type:Bill,2018-03-28
890,HB18-1047,Fair Campaign Practices Act Technical Changes,/bills/hb18-1047,"Concerning technical modifications to the ""Fair Campaign Practices Act"" to facilitate its administration.",Last Action:04/23/2018 | Governor Signed,1,"Rep. S. Lontine, Sen. B. Gardner",Elections & Redistricting,2018 Regular Session,Type:Bill,2018-04-23
891,HB18-1048,Fort Lewis College Spending Hesperus Account,/bills/hb18-1048,Concerning the expenditure of money from the Hesperus account by the board of trustees of Fort Lewis college.,Last Action:03/7/2018 | Governor Signed,1,"Rep. B. McLachlan, Sen. D. Coram",Higher Education,2018 Regular Session,Type:Bill,2018-03-07
892,HB18-1049,DHS Department of Human Services Authority To Lease Grand Junction Regional Center,/bills/hb18-1049,Concerning the department of human services' authority to continue to lease portions of the Grand Junction regional center campus to third-party behavioral health providers.,Last Action:04/12/2018 | Governor Signed,1,"Rep. D. Thurlow, Sen. R. Scott",Capital ConstructionHuman Services,2018 Regular Session,Type:Bill,2018-04-12
893,HB18-1050,Competency To Proceed Juvenile Justice System,/bills/hb18-1050,Concerning competency to proceed for juveniles involved in the juvenile justice system.,Last Action:03/22/2018 | Governor Signed,1,"Rep. J. Singer, Sen. R. Fields",Children & Domestic MattersCourts & Judicial,2018 Regular Session,Type:Bill,2018-03-22
894,HB18-1051,Statutory Provisions Extinguish Unattended Fires,/bills/hb18-1051,Concerning statutory provisions enacted to promote the extinguishment of unattended fires.,Last Action:03/22/2018 | Governor Signed,1,"Rep. M. Hamner, Rep. T. Carver, Sen. D. Coram, Sen. M. Merrifield",Local Government,2018 Regular Session,Type:Bill,2018-03-22
895,HB18-1052,Exception To 2-year Higher Education Service Areas,/bills/hb18-1052,Concerning local education providers' receipt of concurrent enrollment courses from a two-year institution of higher education outside of the institution's approved service area when the institution approved to serve the local education provider declines to provide concurrent enrollment courses.,Last Action:03/22/2018 | Governor Signed,1,"Rep. P. Lundeen, Rep. J. Bridges, Sen. N. Todd",Higher Education,2018 Regular Session,Type:Bill,2018-03-22
896,HB18-1053,Reclaimed Water Use For Marijuana Cultivation,/bills/hb18-1053,"Concerning the allowable uses of reclaimed domestic wastewater, and, in connection therewith, allowing reclaimed domestic wastewater to be used for marijuana cultivation.",Last Action:05/2/2018 | Senate Committee on Finance Postpone Indefinitely,0,"Rep. J. Arndt, Rep. C. Hansen, Sen. K. Donovan",Public HealthWater,2018 Regular Session,Type:Bill,2018-05-02
897,HB18-1054,Affordable Housing Plastic Shopping Bag Tax,/bills/hb18-1054,Concerning an increase in funding for affordable housing through a tax on plastic shopping bags.,Last Action:01/31/2018 | House Committee on Local Government Postpone Indefinitely,0,"Rep. P. Rosenthal, Sen. L. Court",Fiscal Policy & Taxes,2018 Regular Session,Type:Bill,2018-01-31
898,HB18-1055,Increase Surcharge For Court Security Cash Fund,/bills/hb18-1055,"Concerning increasing a certain surcharge on court fees, and, in connection therewith, awarding the amount of the increase to each court that collects a fee upon which the surcharge is assessed.",Last Action:01/23/2018 | House Committee on Judiciary Postpone Indefinitely,0,Rep. A. Benavidez,Courts & Judicial,2018 Regular Session,Type:Bill,2018-01-23
899,HB18-1056,FPPA Fire And Police Pension Association Statewide Standard Health History Form,/bills/hb18-1056,Concerning the statewide standard health history form that members of the fire and police pension association complete when commencing employment.,Last Action:04/12/2018 | Governor Signed,1,"Rep. K. Van Winkle, Rep. D. Williams, Sen. J. Cooke",State Government,2018 Regular Session,Type:Bill,2018-04-12
900,HB18-1057,Disclosure Of Information For Asset Recovery,/bills/hb18-1057,"Concerning the collection of debts, and, in connection therewith, allowing collection agents to add certain expenses to amounts due for collection.",Last Action:05/29/2018 | Governor Signed,1,"Rep. H. McKean, Sen. D. Coram",Courts & JudicialLabor & Employment,2018 Regular Session,Type:Bill,2018-05-29
901,HB18-1058,Financial Assistance For County Jails And Courts,/bills/hb18-1058,Concerning the provision of financial assistance to counties for county facilities.,Last Action:03/8/2018 | House Committee on Judiciary Postpone Indefinitely,0,"Rep. S. Beckman, Sen. D. Coram","Crimes, Corrections, & EnforcementState Government",2018 Regular Session,Type:Bill,2018-03-08
902,HB18-1059,Require 911 Call,/bills/hb18-1059,Concerning a failure to summon emergency assistance.,Last Action:02/6/2018 | House Committee on Judiciary Postpone Indefinitely,0,Rep. J. Wilson,"Crimes, Corrections, & Enforcement",2018 Regular Session,Type:Bill,2018-02-06
903,HB18-1060,Income Tax Deduction For Military Retirement Benefits,/bills/hb18-1060,Concerning a state income tax deduction for military retirement benefits for an individual who is under fifty-five years of age.,Last Action:05/29/2018 | Governor Signed,1,"Rep. J. Danielson, Rep. L. Landgraf, Sen. L. Crowder, Sen. A. Williams",Fiscal Policy & Taxes,2018 Regular Session,Type:Bill,2018-05-29
904,HB18-1061,No Encryption Of Dispatch Radio Communications,/bills/hb18-1061,Concerning dispatch radio communications by government entities.,"Last Action:01/18/2018 | House Committee on State, Veterans, & Military Affairs Postpone Indefinitely",0,Rep. K. Van Winkle,"Crimes, Corrections, & EnforcementLocal GovernmentState Government",2018 Regular Session,Type:Bill,2018-01-18
905,HB18-1062,Sales Tax On Retail Marijuana,/bills/hb18-1062,"Concerning the sales tax imposed on sales of retail marijuana, and, in connection therewith, reducing the retail marijuana sales tax rate by two and nine-tenths percent and repealing the general state sales tax exemption for sales of retail marijuana.",Last Action:02/7/2018 | House Committee on Finance Postpone Indefinitely,0,Rep. S. Lebsock,"Fiscal Policy & TaxesGaming, Lottery, & Racing",2018 Regular Session,Type:Bill,2018-02-07
906,HB18-1063,Consumer Control Of Consumer Credit Information,/bills/hb18-1063,Concerning a consumer's right to control the information contained in the file that a consumer reporting agency has on the consumer.,"Last Action:02/14/2018 | House Committee on State, Veterans, & Military Affairs Postpone Indefinitely",0,Rep. D. Williams,Financial Services & Commerce,2018 Regular Session,Type:Bill,2018-02-14
907,HB18-1064,Training Program Prevention Child Sexual Abuse,/bills/hb18-1064,"Concerning a training program to prevent child sexual abuse for persons who work with young children in some capacity as part of their employment, and, in connection therewith, making an appropriation.",Last Action:05/24/2018 | Governor Signed,1,"Rep. D. Michaelson Jenet, Sen. D. Coram, Sen. R. Fields",Children & Domestic Matters,2018 Regular Session,Type:Bill,2018-05-24
908,HB18-1065,DHS Department of Human Services Employee Discipline Harm To Vulnerable Persons,/bills/hb18-1065,Concerning discipline of a department of human services employee when the employee is found to have mistreated a vulnerable person.,Last Action:04/23/2018 | Governor Signed,1,"Rep. S. Beckman, Rep. J. Buckner, Sen. K. Lambert",State Government,2018 Regular Session,Type:Bill,2018-04-23
909,HB18-1066,Clarify Sexually Exploitative Material Discovery,/bills/hb18-1066,Concerning clarifying that the law enforcement and defense counsel exemption for sexual exploitation of a child crime does not change the discovery procedures for sexually exploitative material.,Last Action:03/22/2018 | Governor Signed,1,"Rep. Y. Willett, Rep. M. Foote, Sen. J. Cooke","Crimes, Corrections, & Enforcement",2018 Regular Session,Type:Bill,2018-03-22
910,HB18-1067,Right To Rest Act,/bills/hb18-1067,"Concerning the creation of the ""Colorado Right to Rest Act"".",Last Action:03/14/2018 | House Committee on Local Government Postpone Indefinitely,0,"Rep. J. Melton, Rep. J. Salazar","Civil LawCrimes, Corrections, & EnforcementHousingLocal Government",2018 Regular Session,Type:Bill,2018-03-14
911,HB18-1068,Eliminate Registered In Naturopathic Doctor Title,/bills/hb18-1068,"Concerning the elimination of ""registered"" in the title of a naturopathic doctor.","Last Action:02/26/2018 | Senate Committee on Business, Labor, & Technology Postpone Indefinitely",0,"Rep. J. Ginal, Rep. L. Landgraf, Sen. L. Crowder, Sen. D. Coram",Health Care & Health Insurance,2018 Regular Session,Type:Bill,2018-02-26
912,HB18-1069,Reclaimed Water Use For Toilet Flushing,/bills/hb18-1069,"Concerning the allowable uses of reclaimed domestic wastewater, and, in connection therewith, allowing reclaimed domestic wastewater to be used for toilet flushing and making an appropriation.",Last Action:04/30/2018 | Governor Signed,1,"Rep. J. Arndt, Rep. D. Thurlow, Sen. D. Coram",Public HealthWater,2018 Regular Session,Type:Bill,2018-04-30
913,HB18-1070,Additional Public School Capital Construction Funding,/bills/hb18-1070,"Concerning an increase in the amount of financial assistance that can be provided for public school capital construction under the ""Building Excellent Schools Today Act"", and, in connection therewith, increasing the amount of retail marijuana excise tax revenue that is credited to the public school capital construction assistance fund and making an appropriation.",Last Action:05/30/2018 | Governor Signed,1,"Rep. D. Young, Rep. C. Wist, Sen. R. Scott, Sen. R. Zenzinger",Capital ConstructionEducation & School Finance (Pre & K-12),2018 Regular Session,Type:Bill,2018-05-30
914,HB18-1071,Regulate Oil Gas Operations Protect Public Safety,/bills/hb18-1071,Concerning the regulation of oil and gas operations in a manner consistent with the protection of public safety.,"Last Action:03/7/2018 | Senate Committee on Agriculture, Natural Resources, & Energy Postpone Indefinitely",0,"Rep. J. Salazar, Sen. D. Moreno",Natural Resources & Environment,2018 Regular Session,Type:Bill,2018-03-07
915,HB18-1072,Red Light Camera Repeal,/bills/hb18-1072,Concerning the elimination of the use of automated vehicle identification systems for traffic law enforcement.,Last Action:02/14/2018 | House Committee on Transportation & Energy Postpone Indefinitely,0,"Rep. S. Humphrey, Sen. T. Neville",Transportation & Motor Vehicles,2018 Regular Session,Type:Bill,2018-02-14
916,HB18-1073,Water District Ability Contract Water Assets,/bills/hb18-1073,Concerning water districts' ability to enter into contracts regarding their water-related assets.,Last Action:03/22/2018 | Governor Signed,1,"Rep. M. Gray, Sen. B. Gardner",Water,2018 Regular Session,Type:Bill,2018-03-22
917,HB18-1074,Deadly Force Against Intruder At A Business,/bills/hb18-1074,Concerning the use of deadly physical force against a person who has made an illegal entry into a place of business.,"Last Action:02/21/2018 | House Committee on State, Veterans, & Military Affairs Postpone Indefinitely",0,"Rep. J. Everett, Sen. V. Marble","Crimes, Corrections, & Enforcement",2018 Regular Session,Type:Bill,2018-02-21
918,HB18-1075,Enactment of CRS 2017,/bills/hb18-1075,Concerning the enactment of Colorado Revised Statutes 2017 as the positive and statutory law of the state of Colorado.,Last Action:03/1/2018 | Governor Signed,1,"Rep. P. Lee, Rep. L. Herod, Sen. D. Kagan, Sen. J. Cooke",State Government,2018 Regular Session,Type:Bill,2018-03-01
919,HB18-1076,Peace Officers Standards and Training Board Revoke Certification For Untruthful Statement,/bills/hb18-1076,"Concerning the P.O.S.T. board revoking the certification of a peace officer who is found to have made an untruthful statement, and, in connection therewith, making an appropriation.",Last Action:05/9/2018 | Senate Committee on Appropriations Postpone Indefinitely,0,"Rep. J. Salazar, Sen. D. Moreno, Sen. D. Coram",State Government,2018 Regular Session,Type:Bill,2018-05-09
920,HB18-1077,Penalty For Burglary Of Firearms,/bills/hb18-1077,"Concerning the penalty for a person who commits burglary to acquire firearms, and, in connection therewith, making an appropriation.",Last Action:06/6/2018 | Governor Signed,1,"Rep. L. Liston, Rep. D. Valdez, Sen. L. Garcia, Sen. R. Scott","Crimes, Corrections, & Enforcement",2018 Regular Session,Type:Bill,2018-06-06
921,HB18-1078,Court Programs For Veterans,/bills/hb18-1078,Concerning court programs for defendants who have served in the armed forces.,Last Action:04/12/2018 | Governor Signed,1,"Rep. L. Landgraf, Rep. T. Exum, Sen. B. Gardner",Courts & JudicialMilitary & Veterans,2018 Regular Session,Type:Bill,2018-04-12
922,HB18-1079,Recommend Use Of State's Long-term Works Reserve,/bills/hb18-1079,Concerning a requirement that the works allocation committee prepare annual recommendations for the use of the Colorado long-term works reserve.,Last Action:03/1/2018 | Governor Signed,1,"Rep. S. Beckman, Sen. L. Crowder",Human ServicesLocal Government,2018 Regular Session,Type:Bill,2018-03-01
923,HB18-1080,Climate Leadership Awards Program,/bills/hb18-1080,Concerning development of a Colorado climate leadership awards program.,Last Action:02/7/2018 | House Committee on Transportation & Energy Postpone Indefinitely,0,Rep. E. Hooton,Natural Resources & Environment,2018 Regular Session,Type:Bill,2018-02-07
924,HB18-1081,State Court Administrator Reminder Call Center,/bills/hb18-1081,"Concerning requiring the state court administrator to administer a division to remind criminal defendants to appear in court as scheduled, and, in connection therewith, making an appropriation.","Last Action:05/4/2018 | Senate Committee on State, Veterans, & Military Affairs Postpone Indefinitely",0,"Rep. A. Benavidez, Rep. P. Lee, Sen. J. Cooke",Courts & Judicial,2018 Regular Session,Type:Bill,2018-05-04
925,HB18-1082,A Woman's Right To Accurate Health Care Information,/bills/hb18-1082,"Concerning the creation of the ""Women's Reproductive Information Guarantee for Health and Transparency (RIGHT) Act"".","Last Action:02/22/2018 | House Committee on Health, Insurance, & Environment Postpone Indefinitely",0,"Rep. L. Saine, Sen. V. Marble",Health Care & Health Insurance,2018 Regular Session,Type:Bill,2018-02-22
926,HB18-1083,On-demand Air Carriers Sales And Use Tax Exemption,/bills/hb18-1083,Concerning a sales and use tax exemption for aircraft to be used by on-demand air carriers.,Last Action:06/5/2018 | Governor Vetoed,0,"Rep. T. Kraft-Tharp, Rep. L. Sias, Sen. J. Tate, Sen. A. Williams",Local GovernmentState Government,2018 Regular Session,Type:Bill,2018-06-05
927,HB18-1084,County Lodging Tax Revenue Allowable Uses,/bills/hb18-1084,Concerning the expansion of the allowable uses of county lodging tax revenue.,Last Action:02/14/2018 | House Committee on Finance Postpone Indefinitely,0,"Rep. D. Thurlow, Rep. M. Hamner, Sen. D. Coram",Local Government,2018 Regular Session,Type:Bill,2018-02-14
928,HB18-1085,Health Effects Industrial Wind Turbines,/bills/hb18-1085,Concerning research on the health effects of industrial wind energy turbines.,Last Action:02/8/2018 | House Committee on Transportation & Energy Postpone Indefinitely,0,Rep. P. Lundeen,Public Health,2018 Regular Session,Type:Bill,2018-02-08
929,HB18-1086,Community College Bachelor Science Degree Nursing,/bills/hb18-1086,Concerning allowing community colleges to offer a bachelor of science degree in nursing.,Last Action:03/24/2018 | Governor Became Law,0,"Rep. J. Buckner, Rep. P. Lundeen, Sen. T. Neville, Sen. I. Aguilar",Higher Education,2018 Regular Session,Type:Bill,2018-03-24
930,HB18-1087,Colorado Department Of Public Safety Authority To Repeal Rules,/bills/hb18-1087,Concerning department of public safety authority to repeal rules relating to defunct boards.,Last Action:03/15/2018 | Governor Signed,1,"Rep. D. Thurlow, Sen. D. Kagan, Sen. D. Coram",State Government,2018 Regular Session,Type:Bill,2018-03-15
931,HB18-1088,Funding For Full-day Kindergarten,/bills/hb18-1088,Concerning increasing the supplemental kindergarten enrollment for purposes of calculating public school finance.,Last Action:05/7/2018 | House Committee on Appropriations Postpone Indefinitely,0,Rep. J. Wilson,Education & School Finance (Pre & K-12),2018 Regular Session,Type:Bill,2018-05-07
932,HB18-1089,No Monetary Conditions Of Bond For Misdemeanors,/bills/hb18-1089,"Concerning reform of pretrial criminal procedures, and, in connection therewith, prohibiting the use of monetary bonding except for certain defendants and requiring courts to conduct timely hearings to reconsider monetary conditions of bond under certain circumstances.","Last Action:04/16/2018 | Senate Committee on State, Veterans, & Military Affairs Postpone Indefinitely",0,"Rep. A. Benavidez, Sen. R. Fields","Courts & JudicialCrimes, Corrections, & Enforcement",2018 Regular Session,Type:Bill,2018-04-16
933,HB18-1090,Credit Security Freeze For Minors And At-risk Adults,/bills/hb18-1090,Concerning the placement of a security freeze by a consumer reporting agency on the consumer report of a consumer who is under the charge of a guardian.,"Last Action:02/7/2018 | House Committee on State, Veterans, & Military Affairs Postpone Indefinitely",0,"Rep. C. Duran, Rep. K. Ransom",Financial Services & Commerce,2018 Regular Session,Type:Bill,2018-02-07
934,HB18-1091,Dementia Diseases And Related Disabilities,/bills/hb18-1091,"Concerning dementia diseases, and, in connection therewith, updating statutory references to dementia diseases and related disabilities.",Last Action:03/29/2018 | Governor Signed,1,"Rep. S. Beckman, Rep. J. Ginal, Sen. J. Smallwood, Sen. N. Todd",Health Care & Health Insurance,2018 Regular Session,Type:Bill,2018-03-29
935,HB18-1092,Marijuana Delivery Pilot Project,/bills/hb18-1092,"Concerning a pilot program for marijuana delivery, and, in connection therewith, making an appropriation.",Last Action:04/18/2018 | Senate Committee on Judiciary Postpone Indefinitely,0,"Rep. J. Melton, Rep. J. Singer, Sen. T. Neville","Liquor, Tobacco, & Marijuana",2018 Regular Session,Type:Bill,2018-04-18
936,HB18-1093,Reclaimed Water Use For Edible Crops,/bills/hb18-1093,"Concerning the allowable uses of reclaimed domestic wastewater, and, in connection therewith, allowing reclaimed domestic wastewater to be used for food crops and making an appropriation.",Last Action:04/28/2018 | Governor Became Law,0,"Rep. J. Arndt, Sen. D. Coram",Public HealthWater,2018 Regular Session,Type:Bill,2018-04-28
937,HB18-1094,Children And Youth Mental Health Treatment Act,/bills/hb18-1094,"Concerning the reauthorization of the ""Child Mental Health Treatment Act"", and, in connection therewith, making an appropriation.",Last Action:05/30/2018 | Governor Signed,1,"Rep. L. Herod, Rep. C. Wist, Sen. B. Martinez Humenik, Sen. D. Moreno",Children & Domestic MattersHealth Care & Health InsurancePublic Health,2018 Regular Session,Type:Bill,2018-05-30
938,HB18-1095,Educator License Requirements Military Spouses,/bills/hb18-1095,Concerning educator licenses issued to military spouses.,Last Action:03/22/2018 | Governor Signed,1,"Rep. T. Carver, Rep. J. Arndt, Sen. B. Gardner, Sen. N. Todd",Education & School Finance (Pre & K-12),2018 Regular Session,Type:Bill,2018-03-22
939,HB18-1096,Special Event Permit Alcohol Beverages,/bills/hb18-1096,Concerning the eligibility of certain entities to apply for a special event permit to sell alcohol beverages.,Last Action:03/15/2018 | Governor Signed,1,"Rep. M. Gray, Sen. K. Priola","Liquor, Tobacco, & Marijuana",2018 Regular Session,Type:Bill,2018-03-15
940,HB18-1097,Patient Choice Of Pharmacy,/bills/hb18-1097,Concerning the ability of a person eligible for prescription drug benefits to choose the pharmacy at which to fill a prescription drug order.,"Last Action:03/19/2018 | Senate Committee on Business, Labor, & Technology Postpone Indefinitely",0,"Rep. M. Catlin, Rep. J. Danielson, Sen. D. Coram, Sen. N. Todd",Health Care & Health Insurance,2018 Regular Session,Type:Bill,2018-03-19
941,HB18-1098,Roll Over Year-end Balance Envtl Response Account,/bills/hb18-1098,Concerning the expanded ability of the Colorado oil and gas conservation commission to finance the remediation of oil and gas locations.,Last Action:04/9/2018 | Governor Signed,1,"Rep. L. Saine, Rep. M. Gray, Sen. V. Marble",Natural Resources & Environment,2018 Regular Session,Type:Bill,2018-04-09
942,HB18-1099,Broadband Deployment Level Playing Field,/bills/hb18-1099,Concerning criteria that the broadband deployment board is required to develop with regard to an incumbent telecommunications provider's exercise of a right to implement a broadband deployment project in an unserved area of the state upon a nonincumbent provider's application to the broadband deployment board to implement a proposed broadband deployment project in the unserved area.,Last Action:04/2/2018 | Governor Signed,1,"Rep. M. Catlin, Rep. B. McLachlan, Sen. D. Coram",Telecommunications & Information Technology,2018 Regular Session,Type:Bill,2018-04-02
943,HB18-1100,Educator Licensure Cash Fund,/bills/hb18-1100,Concerning the continuous appropriation of money in the educator licensure cash fund.,Last Action:03/15/2018 | Governor Signed,1,"Rep. M. Hamner, Sen. K. Lambert",State Revenue & Budget,2018 Regular Session,Type:Bill,2018-03-15
944,HB18-1101,Retail Marijuana Sales Tax Appropriations For Schools,/bills/hb18-1101,Concerning modification of the manner in which gross retail marijuana tax revenue that is transferred from the general fund to the state public school fund as required by current law is appropriated from the state public school fund.,Last Action:03/15/2018 | Governor Signed,1,"Rep. M. Hamner, Sen. K. Lambert",Capital ConstructionEducation & School Finance (Pre & K-12),2018 Regular Session,Type:Bill,2018-03-15
945,HB18-1102,Extend District Attorney Fellowships To 18 Months,/bills/hb18-1102,"Concerning extending the length of prosecution fellowships from one year to fifteen months, and, in connection therewith, making an appropriation.",Last Action:05/7/2018 | Senate Committee on Finance Postpone Indefinitely,0,"Rep. D. Roberts, Rep. C. Wist, Sen. J. Cooke","Crimes, Corrections, & EnforcementLocal Government",2018 Regular Session,Type:Bill,2018-05-07
946,HB18-1103,Local Government Off-highway Vehicle Regulation,/bills/hb18-1103,Concerning the ability of a local government to require a driver to meet safety standards for the use of an off-highway vehicle.,Last Action:03/29/2018 | Governor Signed,1,"Rep. B. McLachlan, Sen. D. Coram",Natural Resources & EnvironmentTransportation & Motor Vehicles,2018 Regular Session,Type:Bill,2018-03-29
947,HB18-1104,Family Preservation For Parents With Disability,/bills/hb18-1104,Concerning family preservation safeguards for parents with disabilities.,Last Action:04/25/2018 | Governor Signed,1,"Rep. J. Danielson, Sen. D. Moreno, Sen. K. Lambert",Children & Domestic Matters,2018 Regular Session,Type:Bill,2018-04-25
948,HB18-1105,Motor And Powersports Vehicle License Requirement,/bills/hb18-1105,Concerning the unlicensed sale of vehicles.,Last Action:03/7/2018 | Governor Signed,1,"Rep. L. Liston, Rep. J. Melton, Sen. J. Tate",Business & Economic DevelopmentTransportation & Motor Vehicles,2018 Regular Session,Type:Bill,2018-03-07
949,HB18-1106,Minimum Wage Requirement Waiver,/bills/hb18-1106,Concerning the ability to waive minimum wage requirements.,"Last Action:01/24/2018 | House Committee on State, Veterans, & Military Affairs Postpone Indefinitely",0,Rep. D. Williams,Labor & Employment,2018 Regular Session,Type:Bill,2018-01-24
950,HB18-1107,Prewire Residence For Electric Vehicle Charging Port,/bills/hb18-1107,Concerning a requirement that builders of new residences offer buyers the option to accommodate electric vehicle charging systems.,Last Action:03/20/2018 | Senate Committee on Transportation Postpone Indefinitely,0,"Rep. M. Weissman, Sen. K. Priola",Business & Economic DevelopmentEnergyHousingNatural Resources & EnvironmentTransportation & Motor Vehicles,2018 Regular Session,Type:Bill,2018-03-20
951,HB18-1108,Commission Deaf Hard Of Hearing Deafblind,/bills/hb18-1108,"Concerning the Colorado commission for the deaf and hard of hearing, and, in connection therewith, renaming the commission the Colorado commission for the deaf, hard of hearing, and deafblind; creating the Colorado deafblind citizens council to advise the commission on deafblind issues; clarifying and expanding the commission's duties to provide services to the deaf, hard of hearing, and deafblind; and changing the membership of the committee charged with reviewing grant applications.",Last Action:05/29/2018 | Governor Signed,1,"Rep. J. Danielson, Sen. N. Todd",State Government,2018 Regular Session,Type:Bill,2018-05-29
952,HB18-1109,Discretionary Parole Of Special Needs Offenders,/bills/hb18-1109,Concerning discretionary parole of special needs offenders.,Last Action:04/23/2018 | Governor Signed,1,"Rep. M. Weissman, Sen. J. Cooke","Crimes, Corrections, & Enforcement",2018 Regular Session,Type:Bill,2018-04-23
953,HB18-1110,Colorado Constitutional Right,/bills/hb18-1110,Concerning protecting persons lawfully present in Colorado who are engaged in an act that is protected by the Colorado constitution from a federal agency.,Last Action:02/1/2018 | House Committee on Judiciary Postpone Indefinitely,0,Rep. S. Lebsock,State Government,2018 Regular Session,Type:Bill,2018-02-01
954,HB18-1111,Modifications To PERA Public Employees' Retirement Association Board Of Trustees,/bills/hb18-1111,Concerning the board of trustees of the public employees' retirement association.,"Last Action:02/14/2018 | House Committee on State, Veterans, & Military Affairs Postpone Indefinitely",0,"Rep. J. Everett, Sen. T. Neville",State Government,2018 Regular Session,Type:Bill,2018-02-14
955,HB18-1112,Pharmacist Health Care Services Coverage,/bills/hb18-1112,Concerning covered health care services provided by a pharmacist.,Last Action:04/9/2018 | Governor Signed,1,"Rep. J. Becker, Rep. D. Esgar, Sen. L. Crowder",Health Care & Health Insurance,2018 Regular Session,Type:Bill,2018-04-09
956,HB18-1113,Small Business Regulatory Reform,/bills/hb18-1113,"Concerning state agency requirements for the enforcement of new regulatory requirements on small businesses, and, in connection therewith, enacting the ""Regulatory Reform Act of 2018"".","Last Action:02/14/2018 | House Committee on State, Veterans, & Military Affairs Postpone Indefinitely",0,"Rep. P. Neville, Sen. T. Neville, Sen. V. Marble",Business & Economic Development,2018 Regular Session,Type:Bill,2018-02-14
957,HB18-1114,Require License Practice Genetic Counseling,/bills/hb18-1114,"Concerning the regulation of genetic counselors, and, in connection therewith, making an appropriation.","Last Action:04/24/2018 | Senate Committee on State, Veterans, & Military Affairs Postpone Indefinitely",0,"Rep. J. Ginal, Rep. J. Buckner, Sen. N. Todd",Business & Economic Development,2018 Regular Session,Type:Bill,2018-04-24
958,HB18-1115,Department of Public Safety Human Trafficking-related Training,/bills/hb18-1115,"Concerning the provision of training materials related to human trafficking by the department of public safety, and, in connection therewith, making an appropriation.",Last Action:05/8/2018 | Senate Committee on Appropriations Postpone Indefinitely,0,"Rep. T. Carver, Rep. J. Ginal, Sen. J. Cooke, Sen. L. Garcia","Crimes, Corrections, & EnforcementState Government",2018 Regular Session,Type:Bill,2018-05-08
959,HB18-1116,Broadband Deployment Board Apply For Federal Funds,/bills/hb18-1116,Concerning measures authorizing the broadband deployment board to seek federal money earmarked for financing broadband deployment.,Last Action:01/29/2018 | Sent to the Governor,0,"Rep. B. Rankin, Sen. D. Moreno",Telecommunications & Information Technology,2018 Regular Session,Type:Bill,2018-01-29
960,HB18-1117,Self-service Storage Facility Personal Property Liens,/bills/hb18-1117,Concerning liens that attach to personal property that is stored at a self-service storage facility.,Last Action:03/22/2018 | Governor Signed,1,"Rep. K. Van Winkle, Rep. J. Coleman, Sen. J. Tate",Business & Economic Development,2018 Regular Session,Type:Bill,2018-03-22
961,HB18-1118,Create Health Care Legislative Review Committee,/bills/hb18-1118,"Concerning the creation of the statewide health care review committee to study health care issues that affect Colorado residents throughout the state, and, in connection therewith, making an appropriation.","Last Action:04/2/2018 | Senate Committee on State, Veterans, & Military Affairs Postpone Indefinitely",0,"Rep. J. Ginal, Rep. S. Beckman, Sen. I. Aguilar, Sen. L. Crowder",Health Care & Health InsuranceInsurancePublic Health,2018 Regular Session,Type:Bill,2018-04-02
962,HB18-1119,Highway Building & Maintenance Funding,/bills/hb18-1119,"Concerning sustainable rural highway building and maintenance funding, and, in connection therewith, requiring a specified percentage of net revenue generated by the existing state sales and use tax to be credited to the state highway fund; requiring the transportation commission to submit to the voters of the state at the November 2018 general election a ballot question, which, if approved, will, without raising taxes, authorize the state to issue transportation revenue anticipation notes for the purpose of funding the construction of specified high-priority highway projects, will require all of the notes to be issued and projects commenced within three years of the notes being authorized, will exclude note proceeds and investment earnings on note proceeds from state fiscal year spending limits, and will repeal an existing requirement that the state treasurer execute lease-purchase agreements for the purpose of funding transportation projects; and requiring the sales and use tax net revenue credited to the state highway fund to be used to repay any notes issued and to fund maintenance on qualified federal aid highways.",Last Action:02/21/2018 | House Committee on Transportation & Energy Postpone Indefinitely,0,"Rep. T. Leonard, Sen. T. Neville",Transportation & Motor Vehicles,2018 Regular Session,Type:Bill,2018-02-21
963,HB18-1120,The Prohibition Of Dismemberment Abortions,/bills/hb18-1120,Concerning the prohibition of dismemberment abortions.,"Last Action:02/28/2018 | House Committee on State, Veterans, & Military Affairs Postpone Indefinitely",0,"Rep. P. Neville, Sen. T. Neville, Sen. V. Marble","Crimes, Corrections, & Enforcement",2018 Regular Session,Type:Bill,2018-02-28
964,HB18-1121,No Funding Trafficking Aborted Human Body Parts,/bills/hb18-1121,Concerning the termination of state funding for higher education institutions that engage in the trafficking of aborted human body parts.,"Last Action:02/28/2018 | House Committee on State, Veterans, & Military Affairs Postpone Indefinitely",0,"Rep. T. Leonard, Sen. T. Neville, Sen. V. Marble",Higher EducationState Government,2018 Regular Session,Type:Bill,2018-02-28
965,HB18-1122,Accounting Of Conservation Easements In The State,/bills/hb18-1122,Concerning a public accounting of conservation easements created in the state.,"Last Action:03/15/2018 | House Committee on Health, Insurance, & Environment Postpone Indefinitely",0,"Rep. K. Lewis, Sen. J. Sonnenberg, Sen. V. Marble",Fiscal Policy & Taxes,2018 Regular Session,Type:Bill,2018-03-15
966,HB18-1123,Conservation Easement Tax Credit Time Out,/bills/hb18-1123,"Concerning measures to enforce a reduction in the abuse of conservation easements in the state, and, in connection therewith, placing a temporary moratorium on the ability of a taxpayer to claim a state income tax credit for the donation of an easement.","Last Action:03/15/2018 | House Committee on Health, Insurance, & Environment Postpone Indefinitely",0,"Rep. K. Lewis, Sen. J. Sonnenberg, Sen. V. Marble",Fiscal Policy & Taxes,2018 Regular Session,Type:Bill,2018-03-15
967,HB18-1124,General Assembly Legislative Aides,/bills/hb18-1124,Concerning support staff for members of the general assembly.,Last Action:05/4/2018 | House Committee on Appropriations Postpone Indefinitely,0,Rep. C. Hansen,State Government,2018 Regular Session,Type:Bill,2018-05-04
968,HB18-1125,Tax Credit Employer-assisted Housing Pilot Program,/bills/hb18-1125,Concerning the creation of a credit against the state income tax as a pilot program to promote employer-assisted housing projects in rural areas.,Last Action:02/26/2018 | House Committee on Finance Postpone Indefinitely,0,Rep. J. Wilson,Fiscal Policy & Taxes,2018 Regular Session,Type:Bill,2018-02-26
969,HB18-1126,Limit Homeowners' Association Regulation Of Dogs By Size Or Breed,/bills/hb18-1126,Concerning the permissible regulation of dogs in common interest communities.,Last Action:02/26/2018 | House Third Reading Lost - No Amendments,0,Rep. P. Rosenthal,Civil LawHousing,2018 Regular Session,Type:Bill,2018-02-26
970,HB18-1127,Residential Landlord Rental Application,/bills/hb18-1127,Concerning the rental application process for prospective tenants.,"Last Action:03/14/2018 | Senate Committee on State, Veterans, & Military Affairs Postpone Indefinitely",0,"Rep. D. Jackson, Rep. C. Kennedy, Sen. S. Fenberg",Housing,2018 Regular Session,Type:Bill,2018-03-14
971,HB18-1128,Protections For Consumer Data Privacy,/bills/hb18-1128,Concerning strengthening protections for consumer data privacy.,Last Action:05/29/2018 | Governor Signed,1,"Rep. C. Wist, Rep. J. Bridges, Sen. K. Lambert, Sen. L. Court",Telecommunications & Information Technology,2018 Regular Session,Type:Bill,2018-05-29
972,HB18-1129,Consumer Report Security Freeze For Protected Consumers,/bills/hb18-1129,Concerning a consumer reporting agency's placement of a security freeze on the consumer report of a consumer who is under the charge of a guardian at the request of the consumer's guardian.,"Last Action:02/7/2018 | House Committee on State, Veterans, & Military Affairs Postpone Indefinitely",0,"Rep. P. Lawrence, Sen. J. Tate",Financial Services & Commerce,2018 Regular Session,Type:Bill,2018-02-07
973,HB18-1130,School District-authorized Instructors,/bills/hb18-1130,Concerning increasing the availability of qualified personnel who are licensed in another state to teach in public schools.,Last Action:03/29/2018 | Governor Signed,1,"Rep. D. Williams, Rep. J. Arndt, Sen. B. Gardner",Education & School Finance (Pre & K-12),2018 Regular Session,Type:Bill,2018-03-29
974,HB18-1131,Court System For Remote Participation In Hearings,/bills/hb18-1131,Concerning a program to facilitate conducting judicial proceedings via networking technology.,"Last Action:04/16/2018 | Senate Committee on State, Veterans, & Military Affairs Postpone Indefinitely",0,"Rep. D. Michaelson Jenet, Sen. L. Crowder, Sen. R. Fields","Courts & JudicialCrimes, Corrections, & Enforcement",2018 Regular Session,Type:Bill,2018-04-16
975,HB18-1132,Increase Department Of Corrections Reimbursement To County Jails,/bills/hb18-1132,Concerning the amount that the department of corrections is required to reimburse a county or city and county for the confinement and maintenance in a local jail of any person who is sentenced to a term of imprisonment in a correctional facility.,Last Action:04/25/2018 | Governor Signed,1,"Rep. D. Michaelson Jenet, Sen. L. Crowder","Crimes, Corrections, & Enforcement",2018 Regular Session,Type:Bill,2018-04-25
976,HB18-1133,Marijuana Processor Registration,/bills/hb18-1133,Concerning registration for marijuana fibrous waste recycling facilities.,"Last Action:02/23/2018 | House Committee on Agriculture, Livestock, & Natural Resources Postpone Indefinitely",0,"Rep. S. Lebsock, Sen. V. Marble","Liquor, Tobacco, & Marijuana",2018 Regular Session,Type:Bill,2018-02-23
977,HB18-1134,Use Of Colorado Preschool Program Positions,/bills/hb18-1134,Concerning eligibility of kindergarten students funded through early childhood at-risk enhancement positions.,Last Action:04/9/2018 | Governor Signed,1,"Rep. B. Pettersen, Rep. J. Wilson, Sen. M. Merrifield, Sen. B. Martinez Humenik",Education & School Finance (Pre & K-12),2018 Regular Session,Type:Bill,2018-04-09
978,HB18-1135,Extend Advanced Industry Export Acceleration Program,/bills/hb18-1135,"Concerning the extension of the advanced industries export acceleration program, and, in connection therewith, making an appropriation.",Last Action:05/29/2018 | Governor Signed,1,"Rep. T. Kraft-Tharp, Rep. J. Wilson, Sen. J. Tate",State Government,2018 Regular Session,Type:Bill,2018-05-29
979,HB18-1136,Substance Use Disorder Treatment,/bills/hb18-1136,"Concerning treatment for individuals with substance use disorders, and, in connection therewith, adding residential and inpatient treatment to the Colorado medical assistance program and making an appropriation.",Last Action:06/5/2018 | Governor Signed,1,"Rep. B. Pettersen, Sen. K. Priola, Sen. C. Jahn",Health Care & Health Insurance,2018 Regular Session,Type:Bill,2018-06-05
980,HB18-1137,Reporting Requirements Department Of Transportation And Department Of Public Safety To General Assembly,/bills/hb18-1137,"Concerning the scheduled repeal of reports to the general assembly, and, in connection therewith, continuing the requirements for reports by the department of transportation and the department of public safety.",Last Action:03/29/2018 | Governor Signed,1,"Rep. H. McKean, Sen. R. Zenzinger",State Government,2018 Regular Session,Type:Bill,2018-03-29
981,HB18-1138,Public Official Oaths And Affirmations,/bills/hb18-1138,"Concerning standardizing public official oaths of office, and, in connection therewith, providing a uniform oath text and establishing requirements for taking, subscribing, administering, and filing public oaths of office.",Last Action:04/2/2018 | Governor Signed,1,"Rep. J. Arndt, Sen. R. Zenzinger",State Government,2018 Regular Session,Type:Bill,2018-04-02
982,HB18-1139,Reporting Requirements For Park Fees Set By Rule,/bills/hb18-1139,Concerning the removal of outdated statutory references to repealed reporting requirements that were previously imposed on the parks and wildlife commission with regard to its rule-making authority to set fees.,Last Action:03/29/2018 | Governor Signed,1,"Rep. E. Hooton, Sen. R. Zenzinger",Natural Resources & Environment,2018 Regular Session,Type:Bill,2018-03-29
983,HB18-1140,Public Official Personal Surety Bonds,/bills/hb18-1140,"Concerning public official personal surety bonds, and, in connection therewith, repealing obsolete provisions and authorizing the purchase of insurance in lieu of public official personal surety bonds.",Last Action:03/15/2018 | Governor Signed,1,"Rep. H. McKean, Sen. D. Moreno",Local GovernmentState Government,2018 Regular Session,Type:Bill,2018-03-15
984,HB18-1141,Modernize Early Childhood Council Language,/bills/hb18-1141,"Concerning the removal of outdated references in statute to ""early childhood care and education councils"".",Last Action:03/22/2018 | Governor Signed,1,"Rep. E. Hooton, Sen. R. Zenzinger",Children & Domestic MattersEducation & School Finance (Pre & K-12)Human Services,2018 Regular Session,Type:Bill,2018-03-22
985,HB18-1142,"Remove Term ""Pauper"" From Colorado Revised Statutes",/bills/hb18-1142,Concerning modernizing language in statutory sections that refer to paupers.,Last Action:03/22/2018 | Governor Signed,1,"Rep. E. Hooton, Rep. D. Thurlow, Sen. B. Martinez Humenik, Sen. R. Zenzinger",Local Government,2018 Regular Session,Type:Bill,2018-03-22
986,HB18-1143,Unconstitutional Part Sexually Explicit Materials,/bills/hb18-1143,Concerning the repeal of statutory provisions relating to sexually explicit materials harmful to children that were ruled unconstitutional by the Colorado supreme court.,Last Action:05/2/2018 | House Second Reading Special Order - Laid Over to 05/09/2018 - No Amendments,0,"Rep. J. Arndt, Rep. D. Thurlow, Sen. D. Moreno, Sen. B. Martinez Humenik","Crimes, Corrections, & Enforcement",2018 Regular Session,Type:Bill,2018-05-02
987,HB18-1144,Update Publishing Requirement DOR Department Of Revenue Taxes Paid Table,/bills/hb18-1144,"Concerning certain publishing requirements for the department of revenue's ""Disclosure of Average Taxes Paid"" table.",Last Action:03/1/2018 | Governor Signed,1,"Rep. D. Thurlow, Sen. J. Tate",State Government,2018 Regular Session,Type:Bill,2018-03-01
988,HB18-1145,Enjoined Laws On Ballot Issue Petition Circulators,/bills/hb18-1145,Concerning the repeal of laws regulating ballot issue petition circulators that have been permanently enjoined from enforcement.,Last Action:04/9/2018 | Governor Signed,1,"Rep. E. Hooton, Sen. D. Moreno",Elections & Redistricting,2018 Regular Session,Type:Bill,2018-04-09
989,HB18-1146,Sunset Measurement Standards Law,/bills/hb18-1146,Concerning the continuation under the sunset law of the measurement standards law.,Last Action:06/6/2018 | Governor Signed,1,"Rep. J. Melton, Sen. D. Coram",Agriculture,2018 Regular Session,Type:Bill,2018-06-06
990,HB18-1147,Sunset Process Weather Modification,/bills/hb18-1147,"Concerning the continuation of the regulation of people who modify the weather, and, in connection therewith, implementing the sunset review recommendations of the department of regulatory agencies.",Last Action:04/26/2018 | Governor Signed,1,"Rep. J. Ginal, Rep. K. Ransom, Sen. D. Coram",Business & Economic DevelopmentNatural Resources & EnvironmentWater,2018 Regular Session,Type:Bill,2018-04-26
991,HB18-1148,Stage Four Advanced Metastatic Cancer Step Therapy,/bills/hb18-1148,Concerning the prohibition against a carrier requiring step therapy for covered persons with stage four advanced metastatic cancer.,Last Action:04/9/2018 | Governor Signed,1,"Rep. D. Michaelson Jenet, Sen. L. Crowder",Health Care & Health Insurance,2018 Regular Session,Type:Bill,2018-04-09
992,HB18-1149,Sunset Continue Consumer Insurance Council,/bills/hb18-1149,Concerning continuation of the consumer insurance council.,"Last Action:04/11/2018 | Senate Committee on Business, Labor, & Technology Postpone Indefinitely",0,"Rep. C. Kennedy, Sen. T. Neville",Health Care & Health Insurance,2018 Regular Session,Type:Bill,2018-04-11
993,HB18-1150,Local Government Liable Fracking Ban Oil And Gas Moratorium,/bills/hb18-1150,Concerning a requirement that a local government that interferes with oil and gas operations compensate persons damaged by the interference.,"Last Action:03/7/2018 | House Committee on State, Veterans, & Military Affairs Postpone Indefinitely",0,Rep. P. Buck,Natural Resources & Environment,2018 Regular Session,Type:Bill,2018-03-07
994,HB18-1151,Colorado Water Conservation Board Approve Deficit Irrigation Pilot Projects,/bills/hb18-1151,Concerning the authorization of deficit irrigation pilot projects approved by the Colorado water conservation board.,"Last Action:03/20/2018 | Senate Committee on State, Veterans, & Military Affairs Postpone Indefinitely",0,"Rep. J. Arndt, Rep. M. Catlin, Sen. L. Crowder",Water,2018 Regular Session,Type:Bill,2018-03-20
995,HB18-1152,Judicial Administrative And Budget Records Subject to Colorado Open Records Act,/bills/hb18-1152,Concerning making certain records of the state judicial department relating to sexual harassment investigations subject to the Colorado open records act.,Last Action:05/29/2018 | Governor Signed,1,"Rep. P. Lawrence, Sen. J. Cooke",Courts & Judicial,2018 Regular Session,Type:Bill,2018-05-29
996,HB18-1153,Property Casualty Insurance Claim Appraisal Procedures,/bills/hb18-1153,"Concerning the conduct of appraisals of the value of property covered by property and casualty insurance, and, in connection therewith, specifying the qualifications and rules of conduct for appraisers and umpires engaged in the appraisal process.",Last Action:03/19/2018 | House Committee on Finance Postpone Indefinitely,0,"Rep. J. Becker, Sen. D. Coram",Business & Economic DevelopmentCivil LawInsurance,2018 Regular Session,Type:Bill,2018-03-19
997,HB18-1154,Protect Consumer Solicit Public Record Copy For Fee,/bills/hb18-1154,Concerning consumer protections relating to a solicitation to provide a copy of a public record for a fee.,Last Action:04/12/2018 | Governor Signed,1,"Rep. E. Hooton, Rep. K. Van Winkle, Sen. C. Jahn",Financial Services & Commerce,2018 Regular Session,Type:Bill,2018-04-12
998,HB18-1155,Sunset Continue Physical Therapy Board Functions,/bills/hb18-1155,"Concerning the continuation of the physical therapy board, and, in connection therewith, implementing the recommendations contained in the 2017 sunset review and report by the department of regulatory agencies.",Last Action:05/29/2018 | Governor Signed,1,"Rep. J. Singer, Rep. L. Liston, Sen. B. Martinez Humenik",Health Care & Health Insurance,2018 Regular Session,Type:Bill,2018-05-29
999,HB18-1156,Limit Penalties For Juvenile Truancy,/bills/hb18-1156,Concerning limitations on penalties for truancy.,Last Action:06/6/2018 | Governor Signed,1,"Rep. P. Lee, Sen. C. Holbert","Children & Domestic MattersCourts & JudicialCrimes, Corrections, & EnforcementEducation & School Finance (Pre & K-12)Human Services",2018 Regular Session,Type:Bill,2018-06-06
1000,HB18-1157,Increased Reporting Oil And Gas Incidents,/bills/hb18-1157,Concerning increased reporting of oil and gas incidents.,"Last Action:04/19/2018 | Senate Committee on Agriculture, Natural Resources, & Energy Postpone Indefinitely",0,"Rep. K. Becker, Rep. J. Singer, Sen. S. Fenberg",Natural Resources & Environment,2018 Regular Session,Type:Bill,2018-04-19
1001,HB18-1158,Supplemental Appropriation - Dept Of Corrections,/bills/hb18-1158,Concerning a supplemental appropriation to the department of corrections.,Last Action:03/29/2018 | Governor Signed,1,"Rep. M. Hamner, Sen. K. Lambert",State Revenue & Budget,2018 Regular Session,Type:Bill,2018-03-29
1002,HB18-1159,Supplemental Appropriation - Dept Of Education,/bills/hb18-1159,Concerning a supplemental appropriation to the department of education.,Last Action:03/1/2018 | Governor Signed,1,"Rep. M. Hamner, Sen. K. Lambert",State Revenue & Budget,2018 Regular Session,Type:Bill,2018-03-01
1003,HB18-1160,"Supplemental Appropriation - Department Of Governor Lt. Governor, & Office State Planning & Budgetting",/bills/hb18-1160,"Concerning a supplemental appropriation to the offices of the governor, lieutenant governor, and state planning and budgeting.",Last Action:03/1/2018 | Governor Signed,1,"Rep. M. Hamner, Sen. K. Lambert",State Revenue & Budget,2018 Regular Session,Type:Bill,2018-03-01
1004,HB18-1161,Supplemental Appropriation - Dept Of Health Care Policy & Financing,/bills/hb18-1161,Concerning a supplemental appropriation to the department of health care policy and financing.,Last Action:03/1/2018 | Governor Signed,1,"Rep. M. Hamner, Sen. K. Lambert",State Revenue & Budget,2018 Regular Session,Type:Bill,2018-03-01
1005,HB18-1162,Supplemental Appropriation - Department Of Human Services,/bills/hb18-1162,Concerning a supplemental appropriation to the department of human services.,Last Action:03/1/2018 | Governor Signed,1,"Rep. M. Hamner, Sen. K. Lambert",State Revenue & Budget,2018 Regular Session,Type:Bill,2018-03-01
1006,HB18-1163,Supplemental Appropriation - Judicial Department,/bills/hb18-1163,Concerning a supplemental appropriation to the judicial department.,Last Action:03/1/2018 | Governor Signed,1,"Rep. M. Hamner, Sen. K. Lambert",State Revenue & Budget,2018 Regular Session,Type:Bill,2018-03-01
1007,HB18-1164,Supplemental Appropriation - Department Of Personnel,/bills/hb18-1164,Concerning a supplemental appropriation to the department of personnel.,Last Action:03/1/2018 | Governor Signed,1,"Rep. M. Hamner, Sen. K. Lambert",State Revenue & Budget,2018 Regular Session,Type:Bill,2018-03-01
1008,HB18-1165,Supplemental Appropriation - Department Of Public Safety,/bills/hb18-1165,Concerning a supplemental appropriation to the department of public safety.,Last Action:03/1/2018 | Governor Signed,1,"Rep. M. Hamner, Sen. K. Lambert",State Revenue & Budget,2018 Regular Session,Type:Bill,2018-03-01
1009,HB18-1166,Supplemental Appropriation - Department Of Regulatory Agencies,/bills/hb18-1166,Concerning a supplemental appropriation to the department of regulatory agencies.,Last Action:03/1/2018 | Governor Signed,1,"Rep. M. Hamner, Sen. K. Lambert",State Revenue & Budget,2018 Regular Session,Type:Bill,2018-03-01
1010,HB18-1167,Supplemental Appropriation - Dept Of Revenue,/bills/hb18-1167,Concerning a supplemental appropriation to the department of revenue.,Last Action:03/1/2018 | Governor Signed,1,"Rep. M. Hamner, Sen. K. Lambert",State Revenue & Budget,2018 Regular Session,Type:Bill,2018-03-01
1011,HB18-1168,Supplemental Appropriation - Department Of State,/bills/hb18-1168,Concerning a supplemental appropriation to the department of state.,Last Action:03/1/2018 | Governor Signed,1,"Rep. M. Hamner, Sen. K. Lambert",State Revenue & Budget,2018 Regular Session,Type:Bill,2018-03-01
1012,HB18-1169,Supplemental Appropriation - Department Of Treasury,/bills/hb18-1169,Concerning a supplemental appropriation to the department of the treasury.,Last Action:03/1/2018 | Governor Signed,1,"Rep. M. Hamner, Sen. K. Lambert",State Revenue & Budget,2018 Regular Session,Type:Bill,2018-03-01
1013,HB18-1170,Supplemental Appropriation - Capital Construction,/bills/hb18-1170,"Concerning funding for capital construction, and making supplemental appropriations in connection therewith.",Last Action:03/1/2018 | Governor Signed,1,"Rep. M. Hamner, Sen. K. Lambert",State Revenue & Budget,2018 Regular Session,Type:Bill,2018-03-01
1014,HB18-1171,School Finance Mid-year Adjustment To Funding,/bills/hb18-1171,"Concerning adjustments in the amount of total program funding for public schools for the 2017-18 budget year, and, in connection therewith, making and reducing an appropriation.",Last Action:03/29/2018 | Governor Signed,1,"Rep. M. Hamner, Sen. K. Lundberg",Education & School Finance (Pre & K-12),2018 Regular Session,Type:Bill,2018-03-29
1015,HB18-1172,Money Allocated To Designated Managed Service Organization,/bills/hb18-1172,Concerning money allocated from an appropriation from the marijuana tax cash fund to a designated managed service organization to implement its community action plan.,Last Action:04/9/2018 | Governor Signed,1,"Rep. D. Young, Sen. K. Lambert",State GovernmentState Revenue & Budget,2018 Regular Session,Type:Bill,2018-04-09
1016,HB18-1173,Supplemental General Fund Transfer Information Technology Capital Construction Account,/bills/hb18-1173,Concerning a supplemental transfer of money from the general fund to the information technology capital account of the capital construction fund for the 2017-18 state fiscal year.,Last Action:03/1/2018 | Governor Signed,1,"Rep. B. Rankin, Sen. K. Lambert",Capital ConstructionFiscal Policy & Taxes,2018 Regular Session,Type:Bill,2018-03-01
1017,HB18-1174,Sunset Continue Board Of Mortgage Loan Originators,/bills/hb18-1174,"Concerning the continuation under the sunset law of the board of mortgage loan originators, and, in connection therewith, adopting the legislative recommendations of the department of regulatory agencies as contained in the department's sunset report.",Last Action:05/29/2018 | Governor Signed,1,"Rep. J. Arndt, Rep. M. Gray, Sen. K. Priola",Business & Economic DevelopmentFinancial Services & CommerceHousing,2018 Regular Session,Type:Bill,2018-05-29
1018,HB18-1175,Sunset Community Association Managers,/bills/hb18-1175,"Concerning the continuation under the sunset law of the regulation of community association managers by the director of the division of real estate, and, in connection therewith, implementing the recommendations contained in the 2017 sunset report of the department of regulatory agencies.",Last Action:04/10/2018 | Senate Committee on Finance Postpone Indefinitely,0,"Rep. T. Kraft-Tharp, Rep. D. Thurlow, Sen. B. Gardner",Business & Economic DevelopmentHousing,2018 Regular Session,Type:Bill,2018-04-10
1019,HB18-1176,Sunset Offender Reentry Grant Program,/bills/hb18-1176,"Concerning continuation of the grant program in the department of corrections to provide funding to eligible community-based organizations that provide reentry services to offenders, and, in connection therewith, implementing the recommendations in the 2017 report of the department of regulatory agencies.",Last Action:05/30/2018 | Governor Signed,1,"Rep. P. Lee, Rep. C. Wist, Sen. J. Cooke","Crimes, Corrections, & Enforcement",2018 Regular Session,Type:Bill,2018-05-30
1020,HB18-1177,Youth Suicide Prevention,/bills/hb18-1177,"Concerning multiple approaches to help prevent youth suicide, and, in connection therewith, making an appropriation.","Last Action:05/1/2018 | Senate Committee on State, Veterans, & Military Affairs Postpone Indefinitely",0,"Rep. D. Michaelson Jenet, Sen. S. Fenberg, Sen. D. Coram",Children & Domestic MattersHealth Care & Health InsurancePublic Health,2018 Regular Session,Type:Bill,2018-05-01
1021,HB18-1178,Hold Colorado Governments Accountable Sanctuary Jurisdictions,/bills/hb18-1178,Concerning holding Colorado governments accountable for creating sanctuary jurisdiction policies.,"Last Action:03/14/2018 | House Committee on State, Veterans, & Military Affairs Postpone Indefinitely",0,"Rep. D. Williams, Sen. K. Lundberg, Sen. V. Marble",Civil Law,2018 Regular Session,Type:Bill,2018-03-14
1022,HB18-1179,Prohibit Price Gouging On Prescription Drugs,/bills/hb18-1179,Concerning a prohibition against price gouging on certain prescription drugs.,Last Action:05/2/2018 | House Second Reading Laid Over to 08/31/2018 - No Amendments,0,Rep. J. Salazar,Health Care & Health Insurance,2018 Regular Session,Type:Bill,2018-05-02
1023,HB18-1180,Mental Health Professional Dismissed Complaint Colorado Open Records Act Access,/bills/hb18-1180,Concerning access by a mental health professional to the files of a regulatory board regarding a dismissed complaint filed against the mental health professional.,Last Action:03/21/2018 | Senate Committee on Health & Human Services Postpone Indefinitely,0,"Rep. J. Melton, Sen. J. Smallwood",Courts & JudicialState Government,2018 Regular Session,Type:Bill,2018-03-21
1024,HB18-1181,Nonresident Electors And Special Districts,/bills/hb18-1181,"Concerning measures to expand the ability of nonresident electors to participate in the governance of special districts, and, in connection therewith, allowing nonresident electors who own taxable property within the special district to vote in special district elections and allowing such electors to serve on special district boards in a nonvoting capacity.",Last Action:06/1/2018 | Governor Vetoed,0,"Rep. L. Liston, Sen. J. Tate",Elections & RedistrictingLocal Government,2018 Regular Session,Type:Bill,2018-06-01
1025,HB18-1182,Statewide System For Advance Directives,/bills/hb18-1182,Concerning a statewide system of advance directives.,"Last Action:03/29/2018 | House Committee on Health, Insurance, & Environment Postpone Indefinitely",0,"Rep. J. Ginal, Rep. L. Landgraf, Sen. L. Court, Sen. D. Coram",Health Care & Health InsuranceState Government,2018 Regular Session,Type:Bill,2018-03-29
1026,HB18-1183,Sunset Repeal Dept Agriculture Regulation Home Sale Of Meat,/bills/hb18-1183,"Concerning the continuation of the regulation of home food service plans pursuant to the ""Sale of Meat Act"", and, in connection therewith, implementing the department of regulatory agencies' sunset review recommendation to repeal the act.",Last Action:03/22/2018 | Governor Signed,1,"Rep. E. Hooton, Rep. K. Ransom, Sen. R. Baumgardner",Public Health,2018 Regular Session,Type:Bill,2018-03-22
1027,HB18-1184,Create Next Generation 911 Board,/bills/hb18-1184,"Concerning the creation of a report on 911 service in Colorado, and, in connection therewith, requiring consideration of issues related to the implementation of next generation 911.",Last Action:05/29/2018 | Governor Signed,1,"Rep. T. Exum, Rep. P. Lawrence, Sen. I. Aguilar, Sen. B. Gardner",Local GovernmentState Government,2018 Regular Session,Type:Bill,2018-05-29
1028,HB18-1185,Market Sourcing For Business Income Tax Apportionment,/bills/hb18-1185,Concerning changes to the state income tax apportionment statute based on the most recent multistate tax commission's uniform model of the uniform division of income for tax purposes act.,Last Action:06/4/2018 | Governor Signed,1,"Rep. T. Kraft-Tharp, Rep. C. Wist, Sen. T. Neville, Sen. D. Moreno",Fiscal Policy & Taxes,2018 Regular Session,Type:Bill,2018-06-04
1029,HB18-1186,Sunset Review Colorado Youth Advisory Council,/bills/hb18-1186,"Concerning the continuation of the Colorado youth advisory council, and, in connection therewith, implementing the sunset review recommendations of the department of regulatory agencies and making an appropriation.",Last Action:04/30/2018 | Governor Signed,1,"Rep. J. Wilson, Rep. J. Reyher, Sen. V. Marble",Local GovernmentState Government,2018 Regular Session,Type:Bill,2018-04-30
1030,HB18-1187,Food And Drug Administration Cannabidiol Drug Use,/bills/hb18-1187,Concerning the lawful use of a prescription drug that contains cannabidiol that is approved by the United States food and drug administration.,Last Action:06/4/2018 | Governor Signed,1,"Rep. J. Buckner, Rep. L. Landgraf, Sen. J. Cooke, Sen. D. Moreno",Health Care & Health Insurance,2018 Regular Session,Type:Bill,2018-06-04
1031,HB18-1188,Electronic Data Transportation Infrastructure,/bills/hb18-1188,Concerning authorization for the Colorado department of transportation to use location information from an electronic device.,Last Action:04/10/2018 | Senate Committee on Transportation Postpone Indefinitely,0,"Rep. D. Jackson, Sen. O. Hill",Transportation & Motor Vehicles,2018 Regular Session,Type:Bill,2018-04-10
1032,HB18-1189,Expanding Effective Teacher Residency Programs,/bills/hb18-1189,"Concerning pilot programs to expand effective teacher residency programs across the state, and, in connection therewith, making an appropriation.",Last Action:05/30/2018 | Governor Signed,1,"Rep. B. Pettersen, Rep. L. Sias, Sen. O. Hill, Sen. N. Todd",Education & School Finance (Pre & K-12),2018 Regular Session,Type:Bill,2018-05-30
1033,HB18-1190,Modify Job Creation Main Street Revitalization Act,/bills/hb18-1190,"Concerning modifications to the ""Colorado Job Creation and Main Street Revitalization Act"".",Last Action:05/30/2018 | Governor Signed,1,"Rep. D. Esgar, Rep. H. McKean, Sen. J. Tate, Sen. L. Garcia",Fiscal Policy & Taxes,2018 Regular Session,Type:Bill,2018-05-30
1034,HB18-1191,Local Government Alter Speed Limits,/bills/hb18-1191,Concerning a local authority's ability to alter speed limits within the local authority's jurisdiction.,Last Action:04/23/2018 | Governor Signed,1,"Rep. F. Winter, Sen. B. Martinez Humenik, Sen. J. Kefalas",Local GovernmentTransportation & Motor Vehicles,2018 Regular Session,Type:Bill,2018-04-23
1035,HB18-1192,Application Assistance Federal Disability Benefits,/bills/hb18-1192,Concerning application assistance for persons seeking federal disability benefits.,Last Action:03/9/2018 | House Committee on Public Health Care & Human Services Postpone Indefinitely,0,"Rep. L. Landgraf, Rep. D. Michaelson Jenet, Sen. D. Coram",Human Services,2018 Regular Session,Type:Bill,2018-03-09
1036,HB18-1193,Extend Advanced Placement Incentives Program,/bills/hb18-1193,"Concerning the advanced placement incentives pilot program, and, in connection therewith, making an appropriation.",Last Action:05/3/2018 | Governor Signed,1,"Rep. J. Wilson, Rep. B. McLachlan, Sen. R. Scott, Sen. R. Zenzinger",Education & School Finance (Pre & K-12),2018 Regular Session,Type:Bill,2018-05-03
1037,HB18-1194,Conservation Easement Transparency,/bills/hb18-1194,Concerning measures to protect the interests of landowners who create conservation easements on their property.,"Last Action:03/15/2018 | House Committee on Health, Insurance, & Environment Postpone Indefinitely",0,"Rep. K. Lewis, Sen. J. Sonnenberg, Sen. V. Marble",State Government,2018 Regular Session,Type:Bill,2018-03-15
1038,HB18-1195,Tax Credit Contributions Organizations Affordable Housing,/bills/hb18-1195,Concerning the creation of a credit against the state income tax to promote contributions to nonprofit organizations engaged in the development of affordable housing for home ownership.,"Last Action:05/7/2018 | Senate Committee on State, Veterans, & Military Affairs Postpone Indefinitely",0,"Rep. D. Pabon, Rep. J. Bridges, Sen. J. Tate",Fiscal Policy & Taxes,2018 Regular Session,Type:Bill,2018-05-07
1039,HB18-1196,Applications For Aid To The Needy Disabled Program,/bills/hb18-1196,Concerning authorization to verify the disability of an applicant to the aid to the needy disabled program.,Last Action:03/29/2018 | Governor Signed,1,"Rep. T. Exum, Sen. N. Todd, Sen. B. Martinez Humenik",Human Services,2018 Regular Session,Type:Bill,2018-03-29
1040,HB18-1197,Student-centered Pilot Accountability Systems,/bills/hb18-1197,"Concerning authorizing local education providers to operate student-centered accountability system pilot programs, and, in connection therewith, making an appropriation.","Last Action:05/2/2018 | Senate Committee on State, Veterans, & Military Affairs Postpone Indefinitely",0,"Rep. D. Young, Rep. J. Wilson, Sen. D. Moreno",Education & School Finance (Pre & K-12),2018 Regular Session,Type:Bill,2018-05-02
1041,HB18-1198,Best Practices For State Boards And Commissions,/bills/hb18-1198,Concerning the establishment of best practices for state boards and commissions.,Last Action:04/23/2018 | Governor Signed,1,"Rep. L. Saine, Rep. T. Kraft-Tharp, Sen. K. Donovan, Sen. J. Smallwood",State Government,2018 Regular Session,Type:Bill,2018-04-23
1042,HB18-1199,Aquifer Storage-and-recovery Plans,/bills/hb18-1199,"Concerning a process for the ground water commission to use for approving aquifer storage-and-recovery plans, and, in connection therewith, requiring that the ground water commission promulgate rules governing its implementation of the process.",Last Action:04/9/2018 | Governor Signed,1,"Rep. M. Catlin, Rep. B. McLachlan, Sen. D. Coram",Water,2018 Regular Session,Type:Bill,2018-04-09
1043,HB18-1200,Cybercrime Changes,/bills/hb18-1200,"Concerning cybercrime, and, in connection therewith, criminalizing using a computer to engage in prostitution of a minor, criminalizing skimming payment cards, making changes to the penalty structure for cybercrime, and making an appropriation.",Last Action:06/6/2018 | Governor Signed,1,"Rep. P. Lundeen, Rep. A. Garnett, Sen. D. Coram, Sen. R. Fields","Crimes, Corrections, & EnforcementTelecommunications & Information Technology",2018 Regular Session,Type:Bill,2018-06-06
1044,HB18-1201,Severance Tax Voter-approved Revenue Change,/bills/hb18-1201,Concerning a voter-approved revenue change to allow the state to retain and spend an amount equal to state severance tax revenues.,Last Action:04/9/2018 | House Committee on Finance Postpone Indefinitely,0,"Rep. D. Thurlow, Sen. D. Coram",State Revenue & Budget,2018 Regular Session,Type:Bill,2018-04-09
1045,HB18-1202,Income Tax Credit Leave Of Absence Organ Donation,/bills/hb18-1202,"Concerning an income tax credit for an employer related to an employee's paid leave of absence for the purpose of making an organ donation, and, in connection therewith, enacting the ""Living Organ Donor Support Act"".",Last Action:05/29/2018 | Governor Signed,1,"Rep. A. Garnett, Sen. B. Gardner",Fiscal Policy & Taxes,2018 Regular Session,Type:Bill,2018-05-29
1046,HB18-1203,Reduce State Income Tax,/bills/hb18-1203,Concerning a reduction of the state income tax rate.,"Last Action:03/8/2018 | House Committee on State, Veterans, & Military Affairs Postpone Indefinitely",0,"Rep. P. Neville, Sen. T. Neville",Fiscal Policy & Taxes,2018 Regular Session,Type:Bill,2018-03-08
1047,HB18-1204,Financial Responsibility Drivers Motor Vehicles,/bills/hb18-1204,Concerning measures to reduce the number of people who drive a vehicle without providing for financial responsibility.,Last Action:03/8/2018 | House Committee on Judiciary Postpone Indefinitely,0,Rep. S. Beckman,Transportation & Motor Vehicles,2018 Regular Session,Type:Bill,2018-03-08
1048,HB18-1205,Financial Relief Defray Individual Health Plan Costs,/bills/hb18-1205,"Concerning a financial relief program to provide financial assistance to an individual earning a household income of not more than five hundred percent of the federal poverty line of which the individual spends more than twenty percent on health insurance premiums for individual health insurance purchased through the Colorado health benefit exchange, and, in connection therewith, making an appropriation.","Last Action:05/3/2018 | Senate Committee on State, Veterans, & Military Affairs Postpone Indefinitely",0,"Rep. D. Roberts, Sen. K. Donovan",Health Care & Health InsuranceInsurance,2018 Regular Session,Type:Bill,2018-05-03
1049,HB18-1206,Live & Let Live Act,/bills/hb18-1206,"Concerning the establishment of the ""Live and Let Live Act"" in Colorado.",Last Action:03/27/2018 | House Committee on Judiciary Postpone Indefinitely,0,"Rep. S. Humphrey, Sen. K. Lundberg",State Government,2018 Regular Session,Type:Bill,2018-03-27
1050,HB18-1207,Hospital Financial Transparency Measures,/bills/hb18-1207,Concerning hospital transparency measures required to analyze the efficacy of hospital delivery system reform incentive payments.,"Last Action:04/30/2018 | Senate Committee on State, Veterans, & Military Affairs Postpone Indefinitely",0,"Rep. C. Kennedy, Rep. B. Rankin, Sen. D. Moreno, Sen. J. Smallwood",Health Care & Health Insurance,2018 Regular Session,Type:Bill,2018-04-30
1051,HB18-1208,Expand Child Care Expenses Income Tax Credit,/bills/hb18-1208,Concerning the expansion of the income tax credit for child care expenses that is a percentage of a similar federal income tax credit.,Last Action:05/22/2018 | Governor Signed,1,"Rep. C. Duran, Rep. F. Winter, Sen. B. Martinez Humenik",Fiscal Policy & Taxes,2018 Regular Session,Type:Bill,2018-05-22
1052,HB18-1209,No 529 Account Income Tax Deduction For K-12 Kindergarten Through Twelfth Expenses,/bills/hb18-1209,"Concerning amendments to the state income tax deduction for contributions to a qualified 529 account to ensure that the state income tax deduction is not aligned with the changes in the federal ""Tax Cuts and Jobs Act"" of 2017 that allow tax-free distributions for elementary and secondary school expenses.",Last Action:04/19/2018 | Senate Committee on Finance Postpone Indefinitely,0,"Rep. B. Pettersen, Rep. A. Garnett, Sen. K. Donovan",Education & School Finance (Pre & K-12)Fiscal Policy & Taxes,2018 Regular Session,Type:Bill,2018-04-19
1053,HB18-1210,Administrator Of Judicial Security Peace Officer Status,/bills/hb18-1210,Concerning peace officer status for the administrator of judicial security in the Colorado judicial department.,Last Action:03/22/2018 | Governor Signed,1,"Rep. M. Foote, Sen. J. Cooke",Courts & Judicial,2018 Regular Session,Type:Bill,2018-03-22
1054,HB18-1211,Medicaid Fraud Control Unit,/bills/hb18-1211,Concerning controlling medicaid fraud.,Last Action:04/25/2018 | Governor Signed,1,"Rep. C. Wist, Rep. M. Foote, Sen. J. Smallwood, Sen. I. Aguilar",Health Care & Health Insurance,2018 Regular Session,Type:Bill,2018-04-25
1055,HB18-1212,Freestanding Emergency Departments Licensure,/bills/hb18-1212,"Concerning the licensing of freestanding emergency departments, and, in connection therewith, making an appropriation.","Last Action:05/1/2018 | Senate Committee on State, Veterans, & Military Affairs Postpone Indefinitely",0,"Rep. C. Kennedy, Rep. L. Landgraf, Sen. J. Kefalas",Health Care & Health InsurancePublic Health,2018 Regular Session,Type:Bill,2018-05-01
1056,HB18-1213,Declare Party Affiliation School District Director,/bills/hb18-1213,Concerning a clarification that a candidate for school district director may declare a political party affiliation.,"Last Action:03/21/2018 | House Committee on State, Veterans, & Military Affairs Postpone Indefinitely",0,Rep. T. Leonard,Elections & Redistricting,2018 Regular Session,Type:Bill,2018-03-21
1057,HB18-1214,State Board Land Commissioners Telecommunications Tower Leases,/bills/hb18-1214,Concerning lease rates for telecommunications tower ground leases on state land managed by the state board of land commissioners in rural areas.,Last Action:04/10/2018 | House Committee on Business Affairs and Labor Postpone Indefinitely,0,"Rep. D. Valdez, Rep. M. Catlin, Sen. J. Sonnenberg",State Government,2018 Regular Session,Type:Bill,2018-04-10
1058,HB18-1215,Safe Disposal Naturally Occur Radioactive Material,/bills/hb18-1215,"Concerning enhanced protections regarding the disposal of naturally occurring radioactive materials, and, in connection therewith, making an appropriation.","Last Action:05/3/2018 | Senate Committee on State, Veterans, & Military Affairs Postpone Indefinitely",0,"Rep. J. Arndt, Sen. M. Jones",Natural Resources & Environment,2018 Regular Session,Type:Bill,2018-05-03
1059,HB18-1216,Youth Shooting Light Geese Hunting Permit,/bills/hb18-1216,Concerning a special permit for youth to hunt light geese as members of a youth shooting sports organization.,"Last Action:04/12/2018 | House Committee on State, Veterans, & Military Affairs Postpone Indefinitely",0,Rep. J. Reyher,Natural Resources & Environment,2018 Regular Session,Type:Bill,2018-04-12
1060,HB18-1217,Income Tax Credit For Employer 529 Contributions,/bills/hb18-1217,"Concerning a temporary income tax credit for employers that make contributions to 529 qualified state tuition program accounts owned by their employees, and, in connection therewith, enacting the ""Working Families College Savings Act"".",Last Action:05/29/2018 | Governor Signed,1,"Rep. K. Van Winkle, Rep. A. Garnett, Sen. B. Gardner",Fiscal Policy & Taxes,2018 Regular Session,Type:Bill,2018-05-29
1061,HB18-1218,Definition Of Veterans' Organizations For Sales And Use Tax,/bills/hb18-1218,"Concerning the definition of a charitable organization for purposes of state sales and use tax, and, in connection therewith, removing the limitation that a veterans' organization only gets the charitable organization exemption for purposes of sponsoring a special event, meeting, or other function in the state, so long as such event, meeting, or function is not part of the organization's regular activities in the state.",Last Action:06/6/2018 | Governor Signed,1,"Rep. T. Carver, Rep. J. Melton, Sen. L. Crowder, Sen. N. Todd",Military & VeteransState Government,2018 Regular Session,Type:Bill,2018-06-06
1062,HB18-1219,Provider Access To Colorado Benefits Management System,/bills/hb18-1219,Concerning providing access to the Colorado benefits management system for providers of services pursuant to the program of all-inclusive care for the elderly.,Last Action:04/24/2018 | House Committee on Public Health Care & Human Services Postpone Indefinitely,0,"Rep. H. McKean, Sen. C. Jahn",Health Care & Health InsuranceHuman Services,2018 Regular Session,Type:Bill,2018-04-24
1063,HB18-1220,Bitcoin Dealers Licensed As Money Transmitters,/bills/hb18-1220,Concerning a requirement that persons who deal in cryptocurrency be regulated under the laws regulating money transmitters.,"Last Action:04/30/2018 | Senate Committee on Business, Labor, & Technology Postpone Indefinitely",0,"Rep. J. Melton, Sen. J. Tate",Business & Economic DevelopmentFinancial Services & Commerce,2018 Regular Session,Type:Bill,2018-04-30
1064,HB18-1221,Income Tax Deduction For 529 Account Kindergarten Through Twelfth Grade Expenses,/bills/hb18-1221,"Concerning the alignment of the state income tax deduction for contributions to a qualified 529 account with the changes in the federal ""Tax Cuts and Jobs Act"" of 2017 that allow tax-free distributions for kindergarten through twelfth grade school expenses.",Last Action:03/26/2018 | House Committee on Education Postpone Indefinitely,0,"Rep. T. Leonard, Sen. T. Neville",Education & School Finance (Pre & K-12)State Government,2018 Regular Session,Type:Bill,2018-03-26
1065,HB18-1222,Systematic Review Of Education Programs,/bills/hb18-1222,Concerning the systematic review of education programs enacted by the general assembly for the preschool through secondary public education system.,Last Action:03/12/2018 | House Committee on Education Postpone Indefinitely,0,Rep. J. Becker,Education & School Finance (Pre & K-12),2018 Regular Session,Type:Bill,2018-03-12
1066,HB18-1223,Declare Autism Epidemic In Colorado,/bills/hb18-1223,Concerning declaring an autism epidemic in Colorado.,"Last Action:04/26/2018 | House Committee on Health, Insurance, & Environment Postpone Indefinitely",0,"Rep. J. Reyher, Sen. L. Crowder",Public Health,2018 Regular Session,Type:Bill,2018-04-26
1067,HB18-1224,Licensee Discipline Mediation State Agency,/bills/hb18-1224,"Concerning the process that is due for the imposition of discipline that affects a person's ability to practice an occupation, and, in connection therewith, requiring the parties to submit to mediation and making an appropriation.",Last Action:05/29/2018 | Governor Signed,1,"Rep. Y. Willett, Sen. B. Gardner",Business & Economic DevelopmentCourts & Judicial,2018 Regular Session,Type:Bill,2018-05-29
1068,HB18-1225,Protect Human Life At Conception,/bills/hb18-1225,Concerning the protection of human life beginning at conception.,"Last Action:02/22/2018 | House Committee on Health, Insurance, & Environment Postpone Indefinitely",0,"Rep. S. Humphrey, Sen. K. Lundberg","Crimes, Corrections, & EnforcementHealth Care & Health Insurance",2018 Regular Session,Type:Bill,2018-02-22
1069,HB18-1226,Higher Education Review Degree Program Costs And Outcomes,/bills/hb18-1226,"Concerning the review of degree programs offered by state institutions of higher education, and, in connection therewith, making an appropriation.",Last Action:05/24/2018 | Governor Signed,1,"Rep. J. Everett, Rep. J. Bridges, Sen. J. Smallwood, Sen. S. Fenberg",Higher Education,2018 Regular Session,Type:Bill,2018-05-24
1070,HB18-1227,Real Estate Commission Flexibility In License Periods,/bills/hb18-1227,Concerning the authority of the real estate commission to issue licenses for an initial period of less than three years.,Last Action:04/23/2018 | Governor Signed,1,"Rep. L. Herod, Rep. C. Wist, Sen. J. Cooke",Business & Economic DevelopmentFinancial Services & CommerceHousing,2018 Regular Session,Type:Bill,2018-04-23
1071,HB18-1228,Transparency In Military Higher Education Statutes,/bills/hb18-1228,Concerning increasing transparency in higher education statutes relating to military service.,Last Action:04/9/2018 | Governor Signed,1,"Rep. J. Everett, Rep. D. Michaelson Jenet, Sen. L. Garcia",Higher EducationMilitary & Veterans,2018 Regular Session,Type:Bill,2018-04-09
1072,HB18-1229,Joint Committee Of Reference Review Of Department Budget Request,/bills/hb18-1229,"Concerning the joint committee of reference review of departmental budget requests as part of the ""State Measurement for Accountable, Responsive, and Transparent (SMART) Government Act"" hearings.","Last Action:02/28/2018 | House Committee on State, Veterans, & Military Affairs Postpone Indefinitely",0,"Rep. P. Neville, Sen. T. Neville, Sen. J. Smallwood",State Government,2018 Regular Session,Type:Bill,2018-02-28
1073,HB18-1230,Creation Of Work Status For Immigrants,/bills/hb18-1230,"Concerning the creation of a purple card program to allow persons who came to the United States without legal documentation to apply for legal work status in Colorado, and, in connection therewith, making an appropriation.","Last Action:05/7/2018 | Senate Committee on State, Veterans, & Military Affairs Postpone Indefinitely",0,"Rep. D. Pabon, Sen. I. Aguilar",ImmigrationLabor & Employment,2018 Regular Session,Type:Bill,2018-05-07
1074,HB18-1231,Repeal Columbus Day As State Legal Holiday,/bills/hb18-1231,"Concerning the repeal of Columbus day as a legal holiday, and, in connection therewith, making election day a legal holiday.",Last Action:04/23/2018 | House Committee on Appropriations Postpone Indefinitely,0,Rep. A. Benavidez,State Government,2018 Regular Session,Type:Bill,2018-04-23
1075,HB18-1232,New School Funding Distribution Formula,/bills/hb18-1232,Concerning the creation of a new public school funding distribution formula for the preschool through secondary public education system.,Last Action:04/25/2018 | House Committee on Education Postpone Indefinitely,0,"Rep. D. Young, Sen. D. Coram, Sen. A. Kerr",Education & School Finance (Pre & K-12),2018 Regular Session,Type:Bill,2018-04-25
1076,HB18-1233,Consumer Reporting Agency Security Freeze Minors,/bills/hb18-1233,Concerning a consumer reporting agency's placement of a security freeze on the consumer report of a consumer who is under the charge of a representative at the request of the consumer's representative.,Last Action:03/29/2018 | Governor Signed,1,"Rep. C. Duran, Rep. P. Lawrence, Sen. S. Fenberg, Sen. B. Gardner",Financial Services & Commerce,2018 Regular Session,Type:Bill,2018-03-29
1077,HB18-1234,Internet Sweepstakes Caf Revise Legal Terms,/bills/hb18-1234,Concerning clarification of the laws governing simulated gambling activity.,Last Action:06/6/2018 | Governor Signed,1,"Rep. K. Becker, Rep. P. Lundeen, Sen. B. Gardner","Business & Economic DevelopmentCrimes, Corrections, & EnforcementGaming, Lottery, & Racing",2018 Regular Session,Type:Bill,2018-06-06
1078,HB18-1235,Sunset Custom Meat Processing,/bills/hb18-1235,"Concerning the continuation of the regulation of custom meat processors, and, in connection therewith, implementing the recommendations of the 2017 sunset report of the department of regulatory agencies.",Last Action:05/4/2018 | Governor Signed,1,"Rep. C. Hansen, Rep. H. McKean, Sen. R. Scott",Agriculture,2018 Regular Session,Type:Bill,2018-05-04
1079,HB18-1236,Sunset Food Systems Advisory Council,/bills/hb18-1236,"Concerning the continuation of the Colorado food systems advisory council, and, in connection therewith, implementing the recommendations in the department of regulatory agencies' sunset report.",Last Action:05/30/2018 | Governor Signed,1,"Rep. B. McLachlan, Rep. J. Becker, Sen. R. Baumgardner",Agriculture,2018 Regular Session,Type:Bill,2018-05-30
1080,HB18-1237,Sunset Continue Cost-benefit Analysis For Rules,/bills/hb18-1237,"Concerning the continuation of the requirements regarding the preparation of a cost-benefit analysis as administered by the department of regulatory agencies, and, in connection therewith, implementing the recommendations contained in the 2017 sunset report by the department of regulatory agencies.",Last Action:04/25/2018 | Governor Signed,1,"Rep. T. Kraft-Tharp, Rep. K. Van Winkle, Sen. T. Neville",Business & Economic DevelopmentState Government,2018 Regular Session,Type:Bill,2018-04-25
1081,HB18-1238,Sunset Wildland-urban Interface Training Advisory Board,/bills/hb18-1238,"Concerning the continuation of the wildland-urban interface training advisory board, and, in connection therewith, implementing the recommendations of the 2017 sunset report by the department of regulatory agencies.",Last Action:04/9/2018 | Governor Signed,1,"Rep. D. Jackson, Rep. M. Catlin, Sen. V. Marble",State Government,2018 Regular Session,Type:Bill,2018-04-09
1082,HB18-1239,Sunset Environmental Management System Permit Program,/bills/hb18-1239,"Concerning continuation under the sunset law of the environmental management system permit program, and, in connection therewith, implementing the recommendations of the sunset report by the department of regulatory agencies by allowing the program to repeal.",Last Action:04/12/2018 | Governor Signed,1,"Rep. L. Landgraf, Sen. R. Scott",Natural Resources & Environment,2018 Regular Session,Type:Bill,2018-04-12
1083,HB18-1240,Sunset Auto Theft Prevention Authority And Board,/bills/hb18-1240,"Concerning the continuation of a grant program to prevent motor vehicle theft, and, in connection therewith, implementing the sunset review recommendations of the department of regulatory agencies.",Last Action:05/4/2018 | Governor Signed,1,"Rep. J. Bridges, Rep. J. Becker, Sen. J. Cooke","Crimes, Corrections, & EnforcementTransportation & Motor Vehicles",2018 Regular Session,Type:Bill,2018-05-04
1084,HB18-1241,Reimburse Expenses Restorative Justice Council,/bills/hb18-1241,Concerning allowing reimbursement for expenses for members of the restorative justice coordinating council.,Last Action:04/24/2018 | Senate Committee on Appropriations Postpone Indefinitely,0,"Rep. J. Arndt, Sen. D. Coram",Courts & Judicial,2018 Regular Session,Type:Bill,2018-04-24
1085,HB18-1242,Change Salary Categorizations For Certain Counties,/bills/hb18-1242,Concerning the salary categorization of locally elected officers in specified counties.,Last Action:04/23/2018 | Governor Signed,1,"Rep. K. Becker, Rep. D. Valdez, Sen. L. Crowder, Sen. R. Baumgardner",Local Government,2018 Regular Session,Type:Bill,2018-04-23
1086,HB18-1243,Civil Rape Shield Law,/bills/hb18-1243,Concerning enactment of a civil rape shield law.,Last Action:04/25/2018 | Governor Signed,1,"Rep. M. Foote, Rep. C. Wist, Sen. D. Coram, Sen. R. Fields",Civil Law,2018 Regular Session,Type:Bill,2018-04-25
1087,HB18-1244,Honor The Service Of Submarine Veterans,/bills/hb18-1244,"Concerning the creation of a submarine service license plate to honor the service of submarine veterans, and, in connection therewith, making an appropriation.",Last Action:06/1/2018 | Governor Signed,1,"Rep. J. Danielson, Sen. N. Todd, Sen. B. Gardner",Transportation & Motor Vehicles,2018 Regular Session,Type:Bill,2018-06-01
1088,HB18-1245,Prohibit Conversion Therapy Mental Health Provider,/bills/hb18-1245,Concerning a prohibition against a mental health care provider engaging in conversion therapy with a patient under eighteen years of age.,"Last Action:04/23/2018 | Senate Committee on State, Veterans, & Military Affairs Postpone Indefinitely",0,"Rep. P. Rosenthal, Rep. D. Michaelson Jenet, Sen. S. Fenberg, Sen. L. Guzman",Business & Economic DevelopmentChildren & Domestic Matters,2018 Regular Session,Type:Bill,2018-04-23
1089,HB18-1246,Modernization Of The Nursery Act,/bills/hb18-1246,"Concerning updates to the ""Colorado Nursery Act"", and, in connection therewith, modernizing the act and protecting agriculture from pests, diseases, and noxious weeds.",Last Action:04/9/2018 | Governor Signed,1,"Rep. J. Danielson, Sen. D. Coram",Agriculture,2018 Regular Session,Type:Bill,2018-04-09
1090,HB18-1247,Frequency Of Salary Payment For Legislative Department,/bills/hb18-1247,Concerning an exemption for the legislative department from the pending change in the payment of salaries from monthly to twice monthly.,Last Action:04/23/2018 | House Committee on Appropriations Postpone Indefinitely,0,"Rep. C. Duran, Rep. P. Neville, Sen. K. Grantham, Sen. L. Guzman",State Government,2018 Regular Session,Type:Bill,2018-04-23
1091,HB18-1248,Unauthorized Funds Transfers Consumer Protection,/bills/hb18-1248,Concerning unauthorized electronic funds transfers.,Last Action:04/2/2018 | House Second Reading Laid Over to 05/10/2018 - No Amendments,0,"Rep. T. Kraft-Tharp, Rep. L. Sias, Sen. K. Priola, Sen. A. Williams","Crimes, Corrections, & EnforcementFinancial Services & Commerce",2018 Regular Session,Type:Bill,2018-04-02
1092,HB18-1249,Anvil Points Federal Mineral Lease Distribution,/bills/hb18-1249,Concerning the requirement that the state treasurer distribute any federal funds related to the naval oil shale reserve land to specified counties or their federal mineral lease districts.,Last Action:03/22/2018 | Governor Signed,1,"Rep. B. Rankin, Rep. M. Hamner, Sen. K. Lundberg",Fiscal Policy & TaxesState Government,2018 Regular Session,Type:Bill,2018-03-22
1093,HB18-1250,Analysis To Improve Compliance With Rules By Businesses.,/bills/hb18-1250,Concerning an analysis to improve compliance with departmental rules by regulated businesses.,Last Action:05/3/2018 | Governor Signed,1,"Rep. T. Kraft-Tharp, Rep. L. Sias, Sen. K. Priola",State Government,2018 Regular Session,Type:Bill,2018-05-03
1094,HB18-1251,Community Corrections Transition Placements,/bills/hb18-1251,"Concerning measures to improve the efficiency of the community corrections transition placements, and, in connection therewith, making an appropriation.",Last Action:05/29/2018 | Governor Signed,1,"Rep. P. Lee, Rep. C. Wist, Sen. D. Kagan, Sen. B. Gardner","Crimes, Corrections, & Enforcement",2018 Regular Session,Type:Bill,2018-05-29
1095,HB18-1252,Unlawful Sale Of Academic Assignments,/bills/hb18-1252,Concerning unlawful sale of academic materials for submission to an institution of higher education.,Last Action:05/29/2018 | Governor Signed,1,"Rep. D. Roberts, Rep. J. Wilson, Sen. K. Priola","Crimes, Corrections, & EnforcementEducation & School Finance (Pre & K-12)",2018 Regular Session,Type:Bill,2018-05-29
1096,HB18-1253,Rule Review Bill,/bills/hb18-1253,Concerning implementation of recommendations of the committee on legal services in connection with legislative review of rules of state agencies.,Last Action:05/11/2018 | Governor Signed,1,"Rep. P. Lee, Rep. L. Herod, Sen. B. Gardner",State Government,2018 Regular Session,Type:Bill,2018-05-11
1097,HB18-1254,Public Trustee Deed Of Trust Foreclosure Sales,/bills/hb18-1254,Concerning the modification of the foreclosure process on property that is encumbered by a deed of trust.,Last Action:04/23/2018 | Governor Signed,1,"Rep. K. Van Winkle, Sen. J. Smallwood",Fiscal Policy & Taxes,2018 Regular Session,Type:Bill,2018-04-23
1098,HB18-1255,Childhood Cancer Awareness Special License Plate,/bills/hb18-1255,"Concerning the creation of a childhood cancer awareness license plate, and, in connection therewith, making an appropriation.",Last Action:05/22/2018 | Governor Signed,1,"Rep. C. Duran, Rep. T. Carver, Sen. J. Cooke, Sen. J. Kefalas",Transportation & Motor Vehicles,2018 Regular Session,Type:Bill,2018-05-22
1099,HB18-1256,Sunset Continue Civil Rights Division And Commission,/bills/hb18-1256,"Concerning continuation of the regulation of civil rights issues, and, in connection therewith, implementing the recommendation in the department of regulatory agencies' 2017 sunset review and report on the Colorado civil rights division and the Colorado civil rights commission to continue the division and commission and making an appropriation.",Last Action:05/22/2018 | Governor Signed,1,"Rep. C. Duran, Rep. L. Herod, Sen. B. Gardner",Business & Economic DevelopmentFinancial Services & CommerceHousingLabor & EmploymentState Government,2018 Regular Session,Type:Bill,2018-05-22
1100,HB18-1257,"Correction To House Bill16-1316 Reinsert ""Not""",/bills/hb18-1257,"Concerning a correction to House Bill 16-1316 by reinserting the word ""not"".",Last Action:05/3/2018 | Governor Signed,1,"Rep. P. Rosenthal, Sen. J. Cooke",Children & Domestic MattersCourts & Judicial,2018 Regular Session,Type:Bill,2018-05-03
1101,HB18-1258,Marijuana Accessory Consumption Establishments,/bills/hb18-1258,"Concerning authorization for an endorsement to an existing marijuana license to allow for a marijuana accessory consumption establishment for the purposes of consumer education, and, in connection therewith, making an appropriation.",Last Action:06/4/2018 | Governor Vetoed,0,"Rep. J. Singer, Rep. J. Melton, Sen. T. Neville, Sen. S. Fenberg","Liquor, Tobacco, & Marijuana",2018 Regular Session,Type:Bill,2018-06-04
1102,HB18-1259,Marijuana Sample For Quality Product Development,/bills/hb18-1259,Concerning providing marijuana samples to employees for business purposes.,Last Action:04/30/2018 | Governor Signed,1,"Rep. M. Gray, Sen. V. Marble","Liquor, Tobacco, & Marijuana",2018 Regular Session,Type:Bill,2018-04-30
1103,HB18-1260,Prescription Drug Price Transparency,/bills/hb18-1260,Concerning prescription drug price transparency.,"Last Action:04/30/2018 | Senate Committee on State, Veterans, & Military Affairs Postpone Indefinitely",0,"Rep. J. Ginal, Rep. D. Jackson, Sen. D. Moreno",Health Care & Health Insurance,2018 Regular Session,Type:Bill,2018-04-30
1104,HB18-1261,Colorado Arbitration Fairness Act,/bills/hb18-1261,"Concerning the ""Colorado Arbitration Fairness Act"".","Last Action:04/18/2018 | Senate Committee on State, Veterans, & Military Affairs Postpone Indefinitely",0,"Rep. M. Weissman, Sen. D. Kagan",Civil Law,2018 Regular Session,Type:Bill,2018-04-18
1105,HB18-1262,Arbitration Services Provider Transparency Act,/bills/hb18-1262,"Concerning the ""Arbitration Services Provider Transparency Act"".","Last Action:04/18/2018 | Senate Committee on State, Veterans, & Military Affairs Postpone Indefinitely",0,"Rep. D. Jackson, Rep. D. Roberts, Sen. D. Kagan",Civil Law,2018 Regular Session,Type:Bill,2018-04-18
1106,HB18-1263,Medical Marijuana Use For Autism And Acute Pain,/bills/hb18-1263,"Concerning adding certain conditions to the list of disabling medical conditions for medical marijuana use, and, in connection therewith, adding autism spectrum disorders.",Last Action:06/5/2018 | Governor Vetoed,0,"Rep. E. Hooton, Rep. J. Melton, Sen. D. Coram, Sen. S. Fenberg","Liquor, Tobacco, & Marijuana",2018 Regular Session,Type:Bill,2018-06-05
1107,HB18-1264,Changes To Revenge Pornography Crimes,/bills/hb18-1264,Concerning measures to clarify the scope of revenge porn criminal offenses.,Last Action:05/3/2018 | Governor Signed,1,"Rep. D. Jackson, Rep. T. Carver, Sen. J. Cooke, Sen. R. Fields","Crimes, Corrections, & Enforcement",2018 Regular Session,Type:Bill,2018-05-03
1108,HB18-1265,Sunset Continue Stroke Advisory Board,/bills/hb18-1265,Concerning the continuation of the stroke advisory board in accordance with the recommendation in the department of regulatory agencies' 2017 sunset report.,Last Action:05/4/2018 | Governor Signed,1,"Rep. S. Lontine, Rep. S. Beckman, Sen. L. Crowder",Health Care & Health Insurance,2018 Regular Session,Type:Bill,2018-05-04
1109,HB18-1266,Career Development Success Program Expansion,/bills/hb18-1266,Concerning expanding the career development success pilot program.,Last Action:06/5/2018 | Governor Signed,1,"Rep. D. Esgar, Rep. J. Wilson, Sen. O. Hill, Sen. N. Todd",Education & School Finance (Pre & K-12),2018 Regular Session,Type:Bill,2018-06-05
1110,HB18-1267,Income Tax Credit For Retrofitting Home For Health,/bills/hb18-1267,"Concerning an income tax credit for retrofitting a residence to increase the residence's visitability, and, in connection therewith, making an appropriation.",Last Action:05/30/2018 | Governor Signed,1,"Rep. M. Gray, Rep. H. McKean, Sen. J. Tate",Fiscal Policy & Taxes,2018 Regular Session,Type:Bill,2018-05-30
1111,HB18-1268,Recall Petition Election Special District Director,/bills/hb18-1268,Concerning the procedures to recall a director of a special district.,Last Action:05/4/2018 | Governor Signed,1,"Rep. M. Gray, Sen. B. Gardner",Elections & Redistricting,2018 Regular Session,Type:Bill,2018-05-04
1112,HB18-1269,Parent Notice For Student Safety And Protection,/bills/hb18-1269,"Concerning notification to parents of charges brought against public school employees for alleged felony offenses that would result in the revocation of an educator license pursuant to title 22, Colorado Revised Statutes.",Last Action:05/29/2018 | Governor Signed,1,"Rep. P. Lundeen, Rep. B. Pettersen, Sen. O. Hill, Sen. R. Fields",Education & School Finance (Pre & K-12),2018 Regular Session,Type:Bill,2018-05-29
1113,HB18-1270,Public Utilities Commission Evaluation Of Energy Storage Systems,/bills/hb18-1270,"Concerning energy storage, and, in connection therewith, requiring the public utilities commission to establish mechanisms for investor-owned electric utilities to procure energy storage systems if certain criteria are satisfied.",Last Action:06/1/2018 | Governor Signed,1,"Rep. C. Hansen, Rep. J. Becker, Sen. J. Tate",Business & Economic DevelopmentEnergy,2018 Regular Session,Type:Bill,2018-06-01
1114,HB18-1271,Public Utilities Commission Electric Utilities Economic Development Rates,/bills/hb18-1271,Concerning the authorization of economic development rates to be charged by electric utilities to qualifying nonresidential customers.,Last Action:06/1/2018 | Governor Signed,1,"Rep. M. Gray, Rep. Y. Willett, Sen. J. Tate",Business & Economic DevelopmentEnergy,2018 Regular Session,Type:Bill,2018-06-01
1115,HB18-1272,Network-level Distracted Driving Control Technology,/bills/hb18-1272,Concerning the availability of network-level mobile phone distracted driving prevention technology.,"Last Action:04/25/2018 | Senate Committee on State, Veterans, & Military Affairs Postpone Indefinitely",0,"Rep. M. Foote, Rep. J. Melton, Sen. L. Court",Telecommunications & Information TechnologyTransportation & Motor Vehicles,2018 Regular Session,Type:Bill,2018-04-25
1116,HB18-1273,Protect Colorado Residents From Federal Government Overreach,/bills/hb18-1273,Concerning protection for Colorado residents from federal government overreach based on a person's status.,"Last Action:04/30/2018 | Senate Committee on State, Veterans, & Military Affairs Postpone Indefinitely",0,"Rep. J. Salazar, Rep. D. Esgar, Sen. M. Merrifield",State Government,2018 Regular Session,Type:Bill,2018-04-30
1117,HB18-1274,Reduce Greenhouse Gas Emissions by 2050,/bills/hb18-1274,"Concerning a reduction in greenhouse gas emissions in Colorado, and, in connection therewith, requiring that, by the year 2050, statewide greenhouse gas emissions be reduced by eighty percent of the levels of greenhouse gas emissions that existed in the year 2005.","Last Action:04/11/2018 | Senate Committee on State, Veterans, & Military Affairs Postpone Indefinitely",0,"Rep. K. Becker, Rep. J. Bridges, Sen. A. Kerr",Natural Resources & EnvironmentPublic Health,2018 Regular Session,Type:Bill,2018-04-11
1118,HB18-1275,Repeal Craig Hospital License Plate Donation,/bills/hb18-1275,Concerning the repeal of the Craig hospital license plate donation requirement.,Last Action:04/26/2018 | Governor Signed,1,"Rep. J. Bridges, Sen. D. Kagan",Transportation & Motor Vehicles,2018 Regular Session,Type:Bill,2018-04-26
1119,HB18-1276,Teaching Competent History In Public Schools,/bills/hb18-1276,"Concerning teaching civil government in public schools, and, in connection therewith, establishing the history, culture, and civil government in education commission to make recommendations to include the history, culture, and contributions of American Indians, Hispanic Americans, African Americans, and Asian Americans in the teaching and content standards for history and civics, and making an appropriation.","Last Action:05/3/2018 | Senate Committee on State, Veterans, & Military Affairs Postpone Indefinitely",0,"Rep. J. Salazar, Sen. R. Fields",Education & School Finance (Pre & K-12),2018 Regular Session,Type:Bill,2018-05-03
1120,HB18-1277,BEST Building Excellent Schools Today Financial Assistance Grant Application Requirements,/bills/hb18-1277,"Concerning a requirement that an application for a ""Building Excellent Schools Today Act"" grant of financial assistance for public school capital construction include a plan for the future use or disposition of any existing public school facility that the applicant will stop using for its current use if it receives the grant.",Last Action:05/29/2018 | Governor Signed,1,"Rep. J. Becker, Rep. D. Esgar, Sen. R. Baumgardner, Sen. J. Kefalas",Capital ConstructionEducation & School Finance (Pre & K-12),2018 Regular Session,Type:Bill,2018-05-29
1121,HB18-1278,Apprentice Utilization In Public Projects,/bills/hb18-1278,Concerning a requirement that contractors for public projects over five hundred thousand dollars that are not funded using federal money use apprentices for the parts of the project that are performed by workers in an apprenticeable occupation.,"Last Action:04/16/2018 | Senate Committee on State, Veterans, & Military Affairs Postpone Indefinitely",0,"Rep. A. Benavidez, Sen. D. Moreno",Business & Economic Development,2018 Regular Session,Type:Bill,2018-04-16
1122,HB18-1279,Electronic Prescribing Controlled Substances,/bills/hb18-1279,Concerning a requirement that certain practitioners prescribe controlled substances electronically.,"Last Action:04/25/2018 | Senate Committee on State, Veterans, & Military Affairs Postpone Indefinitely",0,"Rep. D. Esgar, Sen. K. Priola, Sen. D. Moreno",Health Care & Health Insurance,2018 Regular Session,Type:Bill,2018-04-25
1123,HB18-1280,Court Appointees For Marijuana Businesses,/bills/hb18-1280,"Concerning regulatory procedures related to the appointment of a court appointee for a regulated marijuana business, and, in connection therewith, making an appropriation.",Last Action:05/15/2018 | Governor Signed,1,"Rep. J. Melton, Sen. D. Coram","Liquor, Tobacco, & Marijuana",2018 Regular Session,Type:Bill,2018-05-15
1124,HB18-1281,Public Utilities Commission Ethics And Improved Public Information Reporting,/bills/hb18-1281,"Concerning measures to enhance the consumer protection mission of the Colorado public utilities commission, and, in connection therewith, prohibiting a person with recent connections to a regulated utility from serving on the commission and providing for periodic performance audits.","Last Action:04/30/2018 | Senate Committee on State, Veterans, & Military Affairs Postpone Indefinitely",0,"Rep. D. Esgar, Sen. L. Garcia",Business & Economic DevelopmentEnergyState Government,2018 Regular Session,Type:Bill,2018-04-30
1125,HB18-1282,Health Care Provider Unique Identification Per Site Or Service,/bills/hb18-1282,Concerning a requirement that a health care provider include certain identifying information on all claims for reimbursement for health care services.,Last Action:04/25/2018 | Governor Signed,1,"Rep. S. Lontine, Rep. L. Sias, Sen. J. Smallwood, Sen. J. Kefalas",Health Care & Health InsuranceInsurancePublic Health,2018 Regular Session,Type:Bill,2018-04-25
1126,HB18-1283,Classify Residential Land Change In Improvements,/bills/hb18-1283,Concerning the classification of residential land for property tax purposes resulting from a significant change in the residential improvements located upon the land.,Last Action:05/29/2018 | Governor Signed,1,"Rep. A. Benavidez, Sen. T. Neville",Fiscal Policy & Taxes,2018 Regular Session,Type:Bill,2018-05-29
1127,HB18-1284,Disclosure Of Prescription Costs At Pharmacies,/bills/hb18-1284,Concerning the cost of prescription drugs purchased at a pharmacy.,Last Action:04/30/2018 | Governor Signed,1,"Rep. J. Buckner, Rep. J. Wilson, Sen. B. Martinez Humenik, Sen. J. Kefalas",Health Care & Health Insurance,2018 Regular Session,Type:Bill,2018-04-30
1128,HB18-1285,Remuneration-exempt Disability Parking Placard,/bills/hb18-1285,"Concerning parking for people with certain disabilities, and, in connection therewith, making an appropriation.",Last Action:05/29/2018 | Governor Signed,1,"Rep. D. Pabon, Sen. J. Smallwood, Sen. N. Todd",Transportation & Motor Vehicles,2018 Regular Session,Type:Bill,2018-05-29
1129,HB18-1286,School Nurse Give Medical Marijuana At School,/bills/hb18-1286,Concerning allowing school personnel to give medical marijuana to a student with a medical marijuana registry card while at school.,Last Action:06/4/2018 | Governor Signed,1,"Rep. D. Roberts, Sen. I. Aguilar, Sen. V. Marble","Education & School Finance (Pre & K-12)Health Care & Health InsuranceLiquor, Tobacco, & Marijuana",2018 Regular Session,Type:Bill,2018-06-04
1130,HB18-1287,Reauthorize Commission Criminal And Juvenile Justice,/bills/hb18-1287,"Concerning the extension of the repeal of the Colorado commission on criminal and juvenile justice, and, in connection therewith, making an appropriation.",Last Action:05/30/2018 | Governor Signed,1,"Rep. M. Weissman, Sen. J. Cooke, Sen. D. Kagan","Crimes, Corrections, & Enforcement",2018 Regular Session,Type:Bill,2018-05-30
1131,HB18-1288,Conflict-free Case Management,/bills/hb18-1288,Concerning the implementation of conflict-free case management for individuals receiving home- and community-based services under the medical assistance program.,"Last Action:04/24/2018 | Senate Committee on State, Veterans, & Military Affairs Postpone Indefinitely",0,"Rep. D. Young, Rep. F. Winter, Sen. B. Martinez Humenik",Health Care & Health InsurancePublic Health,2018 Regular Session,Type:Bill,2018-04-24
1132,HB18-1289,Exempt Local Government School Districts Forced Pooling,/bills/hb18-1289,Concerning an exemption from forced pooling of certain governmental entities that own mineral rights.,"Last Action:05/2/2018 | Senate Committee on State, Veterans, & Military Affairs Postpone Indefinitely",0,"Rep. M. Foote, Rep. D. Young, Sen. M. Jones",EnergyNatural Resources & Environment,2018 Regular Session,Type:Bill,2018-05-02
1133,HB18-1290,Sunset Certification Of Conservation Easement Holders,/bills/hb18-1290,"Concerning the continuation of the certification of conservation easement holders, and, in connection therewith, implementing the recommendations of the 2017 sunset report by the department of regulatory agencies.","Last Action:05/2/2018 | Senate Committee on State, Veterans, & Military Affairs Postpone Indefinitely",0,"Rep. D. Roberts, Rep. P. Lawrence, Sen. J. Sonnenberg",Fiscal Policy & Taxes,2018 Regular Session,Type:Bill,2018-05-02
1134,HB18-1291,Sunset Conservation Easement Oversight Commission,/bills/hb18-1291,"Concerning the continuation of the conservation easement oversight commission, and, in connection therewith, implementing the recommendations of the 2017 sunset report by the department of regulatory agencies.",Last Action:05/29/2018 | Governor Signed,1,"Rep. F. Winter, Rep. D. Thurlow, Sen. J. Sonnenberg",Fiscal Policy & Taxes,2018 Regular Session,Type:Bill,2018-05-29
1135,HB18-1292,Pilot Program Assistance Person Experiencing Homelessness,/bills/hb18-1292,"Concerning the creation of the pilot state access to resources and training (START) grant program for persons experiencing homelessness, and, in connection therewith, making an appropriation.","Last Action:05/2/2018 | Senate Committee on State, Veterans, & Military Affairs Postpone Indefinitely",0,"Rep. H. McKean, Rep. P. Rosenthal, Sen. L. Court, Sen. K. Priola",Civil LawLocal GovernmentPublic Health,2018 Regular Session,Type:Bill,2018-05-02
1136,HB18-1293,Fiscal Year 18-19 Legislative Appropriation Bill,/bills/hb18-1293,Concerning payment of expenses of the legislative department.,Last Action:04/9/2018 | Governor Signed,1,"Rep. C. Duran, Rep. P. Neville, Sen. K. Grantham, Sen. L. Guzman",State GovernmentState Revenue & Budget,2018 Regular Session,Type:Bill,2018-04-09
1137,HB18-1294,Sunset Continue Regulation Nursing Home Administrators,/bills/hb18-1294,"Concerning the continuation of the regulation of nursing home administrators by the board of examiners of nursing home administrators in the division of professions and occupations in the department of regulatory agencies, and, in connection therewith, requiring the board to record by board member each vote regarding licensee discipline.",Last Action:05/29/2018 | Governor Signed,1,"Rep. S. Lontine, Rep. J. Buckner, Sen. L. Crowder",Health Care & Health Insurance,2018 Regular Session,Type:Bill,2018-05-29
1138,HB18-1295,Hemp Products Deemed Not Adulterated Or Misbranded,/bills/hb18-1295,"Concerning modifications to the ""Colorado Food and Drug Act"" to allow products containing industrial hemp, and, in connection therewith, establishing that products containing industrial hemp are not adulterated or misbranded by virtue of containing industrial hemp.",Last Action:05/30/2018 | Governor Signed,1,"Rep. J. Salazar, Rep. D. Esgar, Sen. D. Coram",Agriculture,2018 Regular Session,Type:Bill,2018-05-30
1139,HB18-1296,Unattended Motor Vehicles Remote Starter Systems,/bills/hb18-1296,Concerning an expansion of the ability to leave a motor vehicle unattended in certain circumstances.,Last Action:05/29/2018 | Governor Signed,1,"Rep. J. Melton, Rep. J. Everett, Sen. V. Marble, Sen. D. Moreno",Transportation & Motor Vehicles,2018 Regular Session,Type:Bill,2018-05-29
1140,HB18-1297,Climate Change Preparedness And Resiliency,/bills/hb18-1297,"Concerning a comprehensive plan to proactively address the anticipated impacts on Colorado of global climate change, and, in connection therewith, making an appropriation.","Last Action:05/1/2018 | Senate Committee on State, Veterans, & Military Affairs Postpone Indefinitely",0,"Rep. F. Winter, Rep. B. Pettersen, Sen. K. Donovan",Natural Resources & Environment,2018 Regular Session,Type:Bill,2018-05-01
1141,HB18-1298,Colorado Secure Savings Plan,/bills/hb18-1298,Concerning the creation of the Colorado secure savings plan.,"Last Action:05/1/2018 | Senate Committee on State, Veterans, & Military Affairs Postpone Indefinitely",0,"Rep. B. Pettersen, Rep. J. Bridges, Sen. K. Donovan, Sen. N. Todd",State Government,2018 Regular Session,Type:Bill,2018-05-01
1142,HB18-1299,Electronic Filing Title Registration Motor Vehicle,/bills/hb18-1299,"Concerning electronic documents related to the ownership of a vehicle that is regulated by the department of revenue, and, in connection therewith, making an appropriation.",Last Action:05/29/2018 | Governor Signed,1,"Rep. J. Bridges, Rep. P. Neville, Sen. R. Scott, Sen. R. Zenzinger",Transportation & Motor Vehicles,2018 Regular Session,Type:Bill,2018-05-29
1143,HB18-1300,Bachelor Nursing Completion Degree Local District College,/bills/hb18-1300,Concerning granting authority for local district colleges to provide a bachelor of science degree in nursing program as a completion degree to students who have or are pursuing an associate degree in nursing.,Last Action:05/29/2018 | Governor Signed,1,"Rep. D. Young, Rep. P. Buck, Sen. V. Marble, Sen. J. Cooke",Health Care & Health InsuranceHigher Education,2018 Regular Session,Type:Bill,2018-05-29
1144,HB18-1301,Protect Water Quality Adverse Mining Impacts,/bills/hb18-1301,Concerning the protection of water quality from adverse impacts caused by mineral mining.,"Last Action:04/25/2018 | Senate Committee on State, Veterans, & Military Affairs Postpone Indefinitely",0,"Rep. D. Roberts, Rep. B. McLachlan, Sen. S. Fenberg, Sen. K. Donovan",Natural Resources & Environment,2018 Regular Session,Type:Bill,2018-04-25
1145,HB18-1302,Toxicology Lab Certification Waiver Colorado Department Of Public Health And Environment,/bills/hb18-1302,Concerning the allowance of the department of public health and environment to waive certification requirements for toxicology laboratories that have been accredited by an entity using recognized forensic standards.,Last Action:06/6/2018 | Governor Signed,1,"Rep. J. Ginal, Rep. L. Landgraf, Sen. V. Marble",Health Care & Health Insurance,2018 Regular Session,Type:Bill,2018-06-06
1146,HB18-1303,Youth Sports Coach Exempt Employment Security Act,/bills/hb18-1303,"Concerning exemption of nonprofit youth sports organization coaches from the ""Colorado Employment Security Act"".",Last Action:06/6/2018 | Governor Signed,1,"Rep. C. Wist, Rep. A. Garnett, Sen. J. Tate",Labor & Employment,2018 Regular Session,Type:Bill,2018-06-06
1147,HB18-1304,DOR Department Of Revenue Enforcement Measures Collection Of Tax Owed,/bills/hb18-1304,Concerning enforcement measures available to the department of revenue for the collection of delinquent taxes.,"Last Action:04/18/2018 | Senate Committee on State, Veterans, & Military Affairs Postpone Indefinitely",0,"Rep. A. Benavidez, Sen. L. Court",Fiscal Policy & Taxes,2018 Regular Session,Type:Bill,2018-04-18
1148,HB18-1305,Income Tax Check-off Young Americans Financial Education,/bills/hb18-1305,Concerning a voluntary contribution designation benefiting the Young Americans Center for Financial Education fund that appears on the state individual tax return forms.,Last Action:05/4/2018 | Governor Signed,1,"Rep. J. Coleman, Rep. P. Neville, Sen. T. Neville",Fiscal Policy & Taxes,2018 Regular Session,Type:Bill,2018-05-04
1149,HB18-1306,Improving Educational Stability For Foster Youth,/bills/hb18-1306,"Concerning ensuring educational stability for students in out-of-home placement, and, in connection therewith, making an appropriation.",Last Action:06/1/2018 | Governor Signed,1,"Rep. D. Michaelson Jenet, Sen. D. Coram, Sen. D. Moreno",Education & School Finance (Pre & K-12)Human Services,2018 Regular Session,Type:Bill,2018-06-01
1150,HB18-1307,Limit Access To Products With Dextromethorphan,/bills/hb18-1307,Concerning restricting the availability to children of products that contain dextromethorphan.,Last Action:05/11/2018 | Governor Signed,1,"Rep. J. Singer, Rep. P. Lee, Sen. B. Gardner, Sen. J. Cooke","Children & Domestic MattersCrimes, Corrections, & EnforcementPublic Health",2018 Regular Session,Type:Bill,2018-05-11
1151,HB18-1308,Workers' Compensation Out-of-state Workers Temporarily In Colorado,/bills/hb18-1308,"Concerning an exemption from the ""Workers' Compensation Act of Colorado"" for nonresident employers whose employees are temporarily working in Colorado.",Last Action:04/30/2018 | Governor Signed,1,"Rep. T. Kraft-Tharp, Rep. J. Becker, Sen. O. Hill, Sen. D. Kagan",Labor & Employment,2018 Regular Session,Type:Bill,2018-04-30
1152,HB18-1309,Programs Addressing Educator Shortages,/bills/hb18-1309,"Concerning programs addressing educator shortages, and, in connection therewith, making an appropriation.",Last Action:05/29/2018 | Governor Signed,1,"Rep. J. Coleman, Rep. J. Wilson, Sen. O. Hill",Education & School Finance (Pre & K-12)Higher Education,2018 Regular Session,Type:Bill,2018-05-29
1153,HB18-1310,Emergency Employment Support Services Pilot Program DOLA,/bills/hb18-1310,Concerning the creation of a pilot program for emergency employment support services.,"Last Action:05/2/2018 | Senate Committee on State, Veterans, & Military Affairs Postpone Indefinitely",0,"Rep. J. Coleman, Rep. P. Covarrubias, Sen. R. Fields, Sen. K. Priola",Labor & Employment,2018 Regular Session,Type:Bill,2018-05-02
1154,HB18-1311,Single Geographic Rating Area Individual Health Plan,/bills/hb18-1311,Concerning the method for setting rates for individual health insurance plans offered in the state.,"Last Action:04/19/2018 | House Committee on Health, Insurance, & Environment Postpone Indefinitely",0,"Rep. B. Rankin, Rep. M. Hamner",Health Care & Health Insurance,2018 Regular Session,Type:Bill,2018-04-19
1155,HB18-1312,Open Internet Customer Protections In Colorado,/bills/hb18-1312,"Concerning the protection of the open internet, and, in connection therewith, disqualifying an internet service provider from receiving high cost support mechanism money or other money received to finance broadband deployment if the internet service provider engages in certain practices that interfere with the open internet and requiring an internet service provider that engages in such practices to refund any such money received.","Last Action:04/23/2018 | Senate Committee on State, Veterans, & Military Affairs Postpone Indefinitely",0,"Rep. C. Hansen, Rep. L. Herod, Sen. K. Donovan",Telecommunications & Information Technology,2018 Regular Session,Type:Bill,2018-04-23
1156,HB18-1313,Pharmacists To Serve As Practitioners,/bills/hb18-1313,Concerning the allowance of a pharmacist to serve as a practitioner under certain circumstances.,Last Action:06/6/2018 | Governor Signed,1,"Rep. J. Ginal, Rep. J. Becker, Sen. I. Aguilar, Sen. K. Priola",Health Care & Health Insurance,2018 Regular Session,Type:Bill,2018-06-06
1157,HB18-1314,Drone Interference With Public Safety Operations,/bills/hb18-1314,Concerning prohibiting the use of unmanned aircraft systems to obstruct public safety operations.,Last Action:06/6/2018 | Governor Signed,1,"Rep. J. Ginal, Rep. P. Lawrence, Sen. J. Cooke","Crimes, Corrections, & Enforcement",2018 Regular Session,Type:Bill,2018-06-06
1158,HB18-1315,Manufactured Home Sales Tax Exemption,/bills/hb18-1315,Concerning the expansion of the sales and use tax exemption for manufactured homes constructed in compliance with a federal safety act.,Last Action:05/24/2018 | Governor Signed,1,"Rep. B. McLachlan, Rep. J. Becker, Sen. J. Kefalas, Sen. K. Lundberg",Fiscal Policy & Taxes,2018 Regular Session,Type:Bill,2018-05-24
1159,HB18-1316,"Extend Colorado Department Of Labor And Employment Skilled Worker, Outreach, Recruitment, and Key Training Grant Program",/bills/hb18-1316,"Concerning modifications to the skilled worker training program administered by the department of labor and employment, and, in connection therewith, making an appropriation.",Last Action:05/24/2018 | Governor Signed,1,"Rep. D. Pabon, Rep. T. Exum, Sen. J. Cooke, Sen. A. Williams",Labor & Employment,2018 Regular Session,Type:Bill,2018-05-24
1160,HB18-1317,Exempt Nonprofits For Use Of Electronic Gaming Machines,/bills/hb18-1317,"Concerning an exemption from the prohibition on the use of an electronic gaming machine for nonprofit entities licensed under the ""Bingo and Raffles Law"".",Last Action:04/3/2018 | House Committee on Business Affairs and Labor Postpone Indefinitely,0,Rep. J. Reyher,"Business & Economic DevelopmentCrimes, Corrections, & EnforcementGaming, Lottery, & Racing",2018 Regular Session,Type:Bill,2018-04-03
1161,HB18-1318,Require Presidential Candidate Disclose Tax Return,/bills/hb18-1318,Concerning a requirement that candidates for certain federal executive offices file income tax returns with the secretary of state.,"Last Action:05/3/2018 | Senate Committee on State, Veterans, & Military Affairs Postpone Indefinitely",0,"Rep. E. Hooton, Rep. C. Hansen, Sen. A. Kerr",Elections & Redistricting,2018 Regular Session,Type:Bill,2018-05-03
1162,HB18-1319,Services Successful Adulthood Former Foster Youth,/bills/hb18-1319,"Concerning the extension of services for a successful adulthood for former foster care youth who are between the ages of eighteen years and twenty-one years, and, in connection therewith, making an appropriation.",Last Action:05/18/2018 | Governor Signed,1,"Rep. J. Singer, Rep. D. Young, Sen. B. Gardner",Children & Domestic MattersHuman Services,2018 Regular Session,Type:Bill,2018-05-18
1163,HB18-1320,Deregulation Of Large-market Taxicab Service,/bills/hb18-1320,Concerning a reduction in regulation of large-market taxicab service from regulation as a common carrier to regulation as a motor carrier of passengers.,Last Action:06/1/2018 | Governor Signed,1,"Rep. D. Pabon, Sen. C. Jahn",Transportation & Motor Vehicles,2018 Regular Session,Type:Bill,2018-06-01
1164,HB18-1321,Efficient Administration Medicaid Transportation,/bills/hb18-1321,"Concerning efficient administration of nonemergency medical transportation within the existing benefit under the medical assistance program, and, in connection therewith, making and reducing an appropriation.",Last Action:05/30/2018 | Governor Signed,1,"Rep. H. McKean, Rep. J. Arndt, Sen. D. Moreno, Sen. B. Martinez Humenik",Health Care & Health Insurance,2018 Regular Session,Type:Bill,2018-05-30
1165,HB18-1322,2018-19 Long Appropriation Act,/bills/hb18-1322,"Concerning the provision for payment of the expenses of the executive, legislative, and judicial departments of the state of Colorado, and of its agencies and institutions, for and during the fiscal year beginning July 1, 2018, except as otherwise noted.",Last Action:04/30/2018 | Governor Signed,1,"Rep. M. Hamner, Sen. K. Lambert",State Revenue & Budget,2018 Regular Session,Type:Bill,2018-04-30
1166,HB18-1323,Pay For Success Contracts Pilot Program Funding,/bills/hb18-1323,"Concerning transfers of money to a newly created office of state planning and budgeting youth pay for success initiatives account within the pay for success contracts fund, and, in connection therewith, making an appropriation.",Last Action:04/30/2018 | Governor Signed,1,"Rep. B. Rankin, Sen. D. Moreno",State Government,2018 Regular Session,Type:Bill,2018-04-30
1167,HB18-1324,Codify Governor's Commission On Community Service,/bills/hb18-1324,"Concerning the continuation of the governor's commission on community service, and, in connection therewith, making an appropriation.",Last Action:04/30/2018 | Governor Signed,1,"Rep. M. Hamner, Sen. K. Lundberg",State Government,2018 Regular Session,Type:Bill,2018-04-30
1168,HB18-1325,Digital Trunked Radio System Coverage Gaps,/bills/hb18-1325,"Concerning measures to address coverage gaps in the statewide digital trunked radio system, and, in connection therewith, making an appropriation.",Last Action:04/30/2018 | Governor Signed,1,"Rep. M. Hamner, Rep. B. Rankin, Sen. K. Lambert",State Government,2018 Regular Session,Type:Bill,2018-04-30
1169,HB18-1326,Support For Transition From Institutional Settings,/bills/hb18-1326,"Concerning support for persons interested in transitioning from an institutional setting, and, in connection therewith, making and reducing appropriations.",Last Action:04/30/2018 | Governor Signed,1,"Rep. D. Young, Sen. K. Lambert",Health Care & Health Insurance,2018 Regular Session,Type:Bill,2018-04-30
1170,HB18-1327,All-payer Health Claims Database,/bills/hb18-1327,"Concerning the all-payer health claims database, and, in connection therewith, making an appropriation.",Last Action:04/23/2018 | Governor Signed,1,"Rep. D. Young, Sen. D. Moreno",Health Care & Health Insurance,2018 Regular Session,Type:Bill,2018-04-23
1171,HB18-1328,Redesign Residential Child Health Care Waiver,/bills/hb18-1328,"Concerning the children's habilitation residential waiver program, and, in connection therewith, making and reducing an appropriation.",Last Action:04/30/2018 | Governor Signed,1,"Rep. D. Young, Sen. K. Lambert, Sen. D. Moreno",Health Care & Health Insurance,2018 Regular Session,Type:Bill,2018-04-30
1172,HB18-1329,Supplemental Payment Durable Medical Equipment,/bills/hb18-1329,"Concerning a supplemental state payment to qualified providers of durable medical equipment who experienced a decrease in reimbursement in the 2017-18 state fiscal year as a result of the implementation of the federal ""21st Century Cures Act"", and, in connection therewith, making an appropriation.",Last Action:05/4/2018 | Governor Signed,1,"Rep. B. Rankin, Sen. D. Moreno",Health Care & Health Insurance,2018 Regular Session,Type:Bill,2018-05-04
1173,HB18-1330,Supplemental Payment Office-administered Drugs Medicaid,/bills/hb18-1330,"Concerning a supplemental state payment relating to certain office-administered oncology-related drugs for qualified providers under the medical assistance program who experienced a reduction in reimbursement payments in the 2017-18 state fiscal year as a result of the implementation of the federal final rules for covered outpatient drugs, and, in connection therewith, making an appropriation.",Last Action:04/23/2018 | Governor Signed,1,"Rep. D. Young, Sen. D. Moreno",Health Care & Health Insurance,2018 Regular Session,Type:Bill,2018-04-23
1174,HB18-1331,Higher Education Open Educational Resources,/bills/hb18-1331,"Concerning expanding the use of open educational resources at public institutions of higher education, and, in connection therewith, creating the Colorado open educational resources council, creating a grant program to support the creation and use of open educational resources, and making an appropriation.",Last Action:04/30/2018 | Governor Signed,1,"Rep. D. Young, Rep. B. Rankin, Sen. K. Lundberg",Higher Education,2018 Regular Session,Type:Bill,2018-04-30
1175,HB18-1332,Collaborative Educator Preparation Program Grants,/bills/hb18-1332,"Concerning creation of a grant program to support collaborative educator preparation initiatives to address the teacher shortage in Colorado, and, in connection therewith, making an appropriation.",Last Action:04/30/2018 | Governor Signed,1,"Rep. M. Hamner, Rep. B. Rankin, Sen. D. Moreno",Higher Education,2018 Regular Session,Type:Bill,2018-04-30
1176,HB18-1333,"Concerning part C child find responsibilities of state departments, and, in connection therewith, making an appropriation.",/bills/hb18-1333,"Concerning part C child find responsibilities of state departments, and, in connection therewith, making an appropriation.",Last Action:04/30/2018 | Governor Signed,1,"Rep. D. Young, Sen. K. Lambert",Education & School Finance (Pre & K-12)Human Services,2018 Regular Session,Type:Bill,2018-04-30
1177,HB18-1334,Extend Transitional Jobs Program,/bills/hb18-1334,"Concerning an extension of the transitional jobs program, and, in connection therewith, making an appropriation.",Last Action:04/30/2018 | Governor Signed,1,"Rep. M. Hamner, Sen. K. Lambert",Human Services,2018 Regular Session,Type:Bill,2018-04-30
1178,HB18-1335,County Child Care Assistance Program Block Grants,/bills/hb18-1335,"Concerning the Colorado child care assistance program, and, in connection therewith, establishing eligibility requirements for all counties and creating a new formula to determine the amount of block grants to counties.",Last Action:06/6/2018 | Governor Signed,1,"Rep. D. Young, Sen. K. Lundberg",Human Services,2018 Regular Session,Type:Bill,2018-06-06
1179,HB18-1336,Repeal Local Government Retail Marijuana Impact Grant Program,/bills/hb18-1336,Concerning the repeal of the local government retail marijuana impact grant program.,Last Action:04/30/2018 | Governor Signed,1,"Rep. D. Young, Sen. K. Lambert",Local Government,2018 Regular Session,Type:Bill,2018-04-30
1180,HB18-1337,Veterans One-stop Center In Grand Junction,/bills/hb18-1337,"Concerning a veterans one-stop center in Grand Junction, and, in connection therewith, making an appropriation.",Last Action:04/30/2018 | Governor Signed,1,"Rep. M. Hamner, Rep. B. Rankin, Sen. K. Lambert",Military & Veterans,2018 Regular Session,Type:Bill,2018-04-30
1181,HB18-1338,Reduced Revenue Severance Tax Operational Fund Transfers,/bills/hb18-1338,Concerning transfers to address the reduction of revenues in the severance tax operational fund.,Last Action:05/4/2018 | Governor Signed,1,"Rep. B. Rankin, Sen. K. Lambert",State Government,2018 Regular Session,Type:Bill,2018-05-04
1182,HB18-1339,Background Checks Employees Access Federal Tax Information,/bills/hb18-1339,"Concerning a requirement for fingerprint-based criminal history record checks for individuals with access to federal tax information, and, in connection therewith, making an appropriation.",Last Action:04/30/2018 | Governor Signed,1,"Rep. B. Rankin, Sen. K. Lambert",Fiscal Policy & TaxesState Government,2018 Regular Session,Type:Bill,2018-04-30
1183,HB18-1340,Transfers Of Money For State's Infrastructure,/bills/hb18-1340,Concerning transfers of money to be used for the state's infrastructure.,Last Action:05/30/2018 | Governor Signed,1,"Rep. M. Hamner, Sen. K. Lambert",Capital ConstructionState GovernmentTransportation & Motor Vehicles,2018 Regular Session,Type:Bill,2018-05-30
1184,HB18-1341,Apprenticeship And Vocational Technical Training,/bills/hb18-1341,"Concerning creation of the Colorado state apprenticeship resource directory, and, in connection therewith, making an appropriation.","Last Action:04/25/2018 | Senate Committee on State, Veterans, & Military Affairs Postpone Indefinitely",0,"Rep. J. Danielson, Rep. P. Covarrubias, Sen. S. Fenberg, Sen. D. Coram",Business & Economic Development,2018 Regular Session,Type:Bill,2018-04-25
1185,HB18-1342,Allow Pre-Colorado Common Interest Ownership Act Homeowners' Association Members to Veto Homeowners' Association Budget,/bills/hb18-1342,"Concerning a requirement that a common interest community created in Colorado before July 1, 1992, comply with a provision of the ""Colorado Common Interest Ownership Act"" that allows a majority of the unit owners in a common interest community to veto a budget proposed by the executive board of the common interest community.",Last Action:06/6/2018 | Governor Signed,1,"Rep. J. Melton, Sen. N. Todd",Housing,2018 Regular Session,Type:Bill,2018-06-06
1186,HB18-1343,Veterans' Service-to-career Program,/bills/hb18-1343,"Concerning the continuation of the ""Colorado Veterans' Service-to-career Program"", and, in connection therewith, making an appropriation.",Last Action:05/24/2018 | Governor Signed,1,"Rep. P. Lee, Rep. T. Carver, Sen. K. Lambert, Sen. N. Todd",Labor & Employment,2018 Regular Session,Type:Bill,2018-05-24
1187,HB18-1344,Relief From Criminal Collateral Consequences,/bills/hb18-1344,Concerning relief from collateral consequences of criminal actions.,Last Action:05/29/2018 | Governor Signed,1,"Rep. M. Weissman, Rep. L. Sias, Sen. D. Coram, Sen. D. Moreno","Crimes, Corrections, & Enforcement",2018 Regular Session,Type:Bill,2018-05-29
1188,HB18-1345,Electric Transmission Lines Right Of First Refusal,/bills/hb18-1345,Concerning a process by which an incumbent electric utility may exercise a right of first refusal to construct an electric transmission line that has been approved for construction pursuant to a federal regional transmission planning requirement.,Last Action:04/26/2018 | House Committee on Transportation & Energy Postpone Indefinitely,0,"Rep. J. Arndt, Rep. C. Hansen, Sen. D. Coram, Sen. D. Moreno",Energy,2018 Regular Session,Type:Bill,2018-04-26
1189,HB18-1346,Abuse Of Youth Under 21 In Care Of Institution,/bills/hb18-1346,Concerning child abuse related to youth who are under the continuing jurisdiction of the court in an out-of-home placement when they are younger than twenty-one years of age.,Last Action:05/30/2018 | Governor Signed,1,"Rep. J. Singer, Rep. L. Landgraf, Sen. J. Smallwood, Sen. J. Kefalas",Children & Domestic MattersHuman Services,2018 Regular Session,Type:Bill,2018-05-30
1190,HB18-1347,Biennial Registration Motor Vehicles Department Revenue,/bills/hb18-1347,Concerning the biennial registration of motor vehicles with the department of revenue.,Last Action:04/25/2018 | House Committee on Transportation & Energy Postpone Indefinitely,0,Rep. S. Sandridge,Transportation & Motor Vehicles,2018 Regular Session,Type:Bill,2018-04-25
1191,HB18-1348,Child Welfare Information And Services,/bills/hb18-1348,"Concerning families involved in the child welfare system, and, in connection therewith, prioritizing services and providing support for foster parents.",Last Action:05/30/2018 | Governor Signed,1,"Rep. J. Singer, Rep. L. Landgraf, Sen. B. Gardner, Sen. J. Kefalas",Human Services,2018 Regular Session,Type:Bill,2018-05-30
1192,HB18-1349,Department Of Transportation Waiver Valuations,/bills/hb18-1349,"Concerning the use of waiver valuations by the department of transportation, and, in connection therewith, extending the department's existing authority under state law to use waiver valuations when valuing property that it owns and seeks to dispose of to the maximum extent permitted by federal law and regulations and clarifying that a waiver valuation is not an appraisal and that an individual, including a licensed or certified real estate appraiser, is not an appraiser for purposes of the state laws regulating appraisers when the individual performs a waiver valuation.",Last Action:05/24/2018 | Governor Signed,1,"Rep. J. Ginal, Sen. J. Cooke",Transportation & Motor Vehicles,2018 Regular Session,Type:Bill,2018-05-24
1193,HB18-1350,Machine Tool Sales Tax Exemption For Scrap Metal,/bills/hb18-1350,"Concerning the sales and use tax treatment of equipment used to manufacture new metal stock from scrap or end-of-life-cycle metals, and, in connection therewith, making an appropriation.",Last Action:06/6/2018 | Governor Signed,1,"Rep. T. Kraft-Tharp, Sen. K. Priola",Fiscal Policy & Taxes,2018 Regular Session,Type:Bill,2018-06-06
1194,HB18-1351,Signage For Old Spanish National Historic Trail,/bills/hb18-1351,Concerning signage for the old Spanish trail.,Last Action:05/29/2018 | Governor Signed,1,"Rep. D. Valdez, Rep. P. Covarrubias, Sen. L. Crowder, Sen. L. Garcia",State GovernmentTransportation & Motor Vehicles,2018 Regular Session,Type:Bill,2018-05-29
1195,HB18-1352,Oil And Gas Facilities Distance From School Property,/bills/hb18-1352,Concerning a clarification of the minimum distance from which certain oil and gas facilities must be located from any school.,"Last Action:05/2/2018 | Senate Committee on State, Veterans, & Military Affairs Postpone Indefinitely",0,"Rep. M. Foote, Rep. M. Gray, Sen. M. Jones, Sen. I. Aguilar",EnergyNatural Resources & Environment,2018 Regular Session,Type:Bill,2018-05-02
1196,HB18-1353,Defense Counsel In Municipal Court Grant Program,/bills/hb18-1353,"Concerning the creation of a grant program to reimburse local governments for costs associated with the provision of defense counsel to certain defendants at their first appearances in municipal courts, and, in connection therewith, making an appropriation.",Last Action:05/30/2018 | Governor Signed,1,"Rep. S. Lontine, Rep. T. Carver, Sen. V. Marble",Courts & JudicialLocal Government,2018 Regular Session,Type:Bill,2018-05-30
1197,HB18-1354,Powersports Vehicle Written Warranties,/bills/hb18-1354,Concerning a requirement that written warranties for powersports vehicles be honored.,Last Action:05/30/2018 | Governor Signed,1,"Rep. H. McKean, Sen. R. Zenzinger",Business & Economic DevelopmentTransportation & Motor Vehicles,2018 Regular Session,Type:Bill,2018-05-30
1198,HB18-1355,Public Education Accountability System,/bills/hb18-1355,Concerning changes to the accountability system for the elementary and secondary public education system to strengthen the accountability system for the benefit of students.,Last Action:05/30/2018 | Governor Signed,1,"Rep. B. Pettersen, Rep. L. Sias, Sen. B. Gardner, Sen. D. Moreno",Education & School Finance (Pre & K-12),2018 Regular Session,Type:Bill,2018-05-30
1199,HB18-1356,Add Cross Reference to Failure To Register Crime,/bills/hb18-1356,Concerning adding a nonsubstantive cross reference to the crime of failure to register as a sex offender.,Last Action:05/24/2018 | Governor Signed,1,"Rep. D. Thurlow, Sen. D. Moreno","Crimes, Corrections, & Enforcement",2018 Regular Session,Type:Bill,2018-05-24
1200,HB18-1357,Behavioral Health Care Ombudsperson Parity Reports,/bills/hb18-1357,"Concerning access to behavioral health care services, and, in connection therewith, establishing an ombudsman for behavioral health access to care to assist consumers in accessing care, requiring the commissioner of insurance to report on compliance with mental health parity laws, and making an appropriation.",Last Action:05/24/2018 | Governor Signed,1,"Rep. D. Michaelson Jenet, Sen. B. Gardner, Sen. A. Williams",Health Care & Health InsurancePublic Health,2018 Regular Session,Type:Bill,2018-05-24
1201,HB18-1358,Health Care Charges Billing Required Disclosures,/bills/hb18-1358,Concerning required disclosures pertaining to charges for health care.,"Last Action:04/27/2018 | House Committee on Health, Insurance, & Environment Postpone Indefinitely",0,"Rep. M. Foote, Rep. S. Beckman, Sen. K. Lundberg, Sen. I. Aguilar",Health Care & Health InsuranceInsurance,2018 Regular Session,Type:Bill,2018-04-27
1202,HB18-1359,Colorado Charitable Contribution Income Tax Deduction,/bills/hb18-1359,Concerning the removal of the current calculation threshold that limits the Colorado charitable contribution income tax deduction.,Last Action:05/7/2018 | House Committee on Appropriations Postpone Indefinitely,0,"Rep. A. Benavidez, Rep. D. Pabon",Fiscal Policy & Taxes,2018 Regular Session,Type:Bill,2018-05-07
1203,HB18-1360,Increase Number Historical Society Board Members,/bills/hb18-1360,Concerning the expansion of the number of directors on the board of directors of the state historical society.,Last Action:05/21/2018 | Governor Signed,1,"Rep. F. Winter, Rep. P. Lawrence, Sen. B. Martinez Humenik, Sen. N. Todd",State Government,2018 Regular Session,Type:Bill,2018-05-21
1204,HB18-1361,Eligibility For Veteran Vietnam War License Plate,/bills/hb18-1361,Concerning expanded eligibility for a veteran of the Vietnam war specialty license plate.,Last Action:05/30/2018 | Governor Signed,1,"Rep. T. Exum, Rep. D. Valdez, Sen. A. Williams",Transportation & Motor Vehicles,2018 Regular Session,Type:Bill,2018-05-30
1205,HB18-1362,Drunk And Impaired Driving Task Force Membership,/bills/hb18-1362,Concerning the membership expansion of the Colorado task force on drunk and impaired driving.,Last Action:05/29/2018 | Governor Signed,1,"Rep. J. Arndt, Sen. J. Tate","Crimes, Corrections, & EnforcementTransportation & Motor Vehicles",2018 Regular Session,Type:Bill,2018-05-29
1206,HB18-1363,Recommendations Of Child Support Commission,/bills/hb18-1363,"Concerning legislative recommendations of the child support commission, and, in connection therewith, making an appropriation.",Last Action:06/6/2018 | Governor Signed,1,"Rep. J. Singer, Rep. L. Landgraf, Sen. L. Crowder",Children & Domestic Matters,2018 Regular Session,Type:Bill,2018-06-06
1207,HB18-1364,Sunset Colorado Council Persons With Disabilities,/bills/hb18-1364,"Concerning the continuation of the Colorado advisory council for persons with disabilities, and, in connection therewith, implementing the sunset review recommendations of the department of regulatory agencies, and making an appropriation.",Last Action:05/30/2018 | Governor Signed,1,"Rep. D. Michaelson Jenet, Rep. L. Landgraf, Sen. B. Martinez Humenik, Sen. R. Zenzinger",State Government,2018 Regular Session,Type:Bill,2018-05-30
1208,HB18-1365,Primary Care Infrastructure Creation,/bills/hb18-1365,Concerning a primary care payment reform collaborative to evaluate investment in primary care.,Last Action:05/10/2018 | House Committee on Legislative Council Postpone Indefinitely,0,"Rep. J. Ginal, Rep. L. Sias, Sen. K. Priola, Sen. D. Moreno",Health Care & Health Insurance,2018 Regular Session,Type:Bill,2018-05-10
1209,HB18-1366,Allow Local College District To Sell Or Lease Property,/bills/hb18-1366,Concerning a local college district's authority to manage district property.,Last Action:05/25/2018 | Governor Signed,1,"Rep. D. Roberts, Sen. K. Donovan",Higher Education,2018 Regular Session,Type:Bill,2018-05-25
1210,HB18-1367,Leadership Professional Development For School Principals,/bills/hb18-1367,"Concerning professional development in leadership for public school principals, and, in connection therewith, creating the school leadership pilot program and making an appropriation.","Last Action:05/2/2018 | Senate Committee on State, Veterans, & Military Affairs Postpone Indefinitely",0,"Rep. B. McLachlan, Rep. J. Wilson, Sen. K. Priola",Education & School Finance (Pre & K-12),2018 Regular Session,Type:Bill,2018-05-02
1211,HB18-1368,Local Control Of Minimum Wage,/bills/hb18-1368,Concerning the repeal of the prohibitions on local governments enacting minimum wage laws.,"Last Action:05/3/2018 | Senate Committee on State, Veterans, & Military Affairs Postpone Indefinitely",0,"Rep. J. Danielson, Rep. J. Melton, Sen. M. Merrifield, Sen. D. Moreno",Children & Domestic MattersLabor & Employment,2018 Regular Session,Type:Bill,2018-05-03
1212,HB18-1369,Obsolete References Proposition AA Refund Account,/bills/hb18-1369,Concerning repealing obsolete statutory references to the repealed proposition AA refund account.,Last Action:05/24/2018 | Governor Signed,1,"Rep. E. Hooton, Sen. D. Moreno",State Government,2018 Regular Session,Type:Bill,2018-05-24
1213,HB18-1370,Drug Coverage Health Plan,/bills/hb18-1370,Concerning a prohibition against excluding a drug from a health coverage plan if the drug was approved by the plan for coverage of the covered person at the time the covered person enrolled in the plan.,"Last Action:05/3/2018 | House Committee on Health, Insurance, & Environment Postpone Indefinitely",0,"Rep. D. Esgar, Rep. J. Singer, Sen. C. Jahn",Health Care & Health InsuranceInsurance,2018 Regular Session,Type:Bill,2018-05-03
1214,HB18-1371,Capital Construction Budget Items,/bills/hb18-1371,"Concerning capital construction budget items, and, in connection therewith, codifying the three-year period that capital construction budget items remain available and clarifying the deadlines for the submission of capital construction budget requests, budget request amendments, and budget request amendments that are related to a request for a supplemental appropriation.",Last Action:05/29/2018 | Governor Signed,1,"Rep. D. Esgar, Rep. J. Becker, Sen. J. Kefalas, Sen. R. Baumgardner",Capital Construction,2018 Regular Session,Type:Bill,2018-05-29
1215,HB18-1372,Exempt Fund From Capital Construction Funding Mechanism,/bills/hb18-1372,Concerning an exemption of the regional center depreciation account in the capital construction fund from the definition of cash fund for purposes of the requirements under the automatic cash fund funding mechanism for payment of future costs attributable to certain of the state's capital assets.,Last Action:05/29/2018 | Governor Signed,1,"Rep. D. Esgar, Rep. J. Becker, Sen. J. Kefalas",Capital ConstructionState Government,2018 Regular Session,Type:Bill,2018-05-29
1216,HB18-1373,Private Entities Use State Telecommunications Network,/bills/hb18-1373,"Concerning the use of the state telecommunications network by private entities through public-private partnerships, and, in connection therewith, relocating laws related to the state telecommunications network from the department of public safety's statutes to the statutes regarding telecommunications coordination within state government.",Last Action:06/6/2018 | Governor Signed,1,"Rep. J. Becker, Rep. C. Hansen, Sen. R. Baumgardner, Sen. J. Kefalas",Capital ConstructionState GovernmentTelecommunications & Information Technology,2018 Regular Session,Type:Bill,2018-06-06
1217,HB18-1374,Controlled Maintenance Financed Acquired Prop,/bills/hb18-1374,Concerning controlled maintenance needs of real property acquired through a lease-purchase agreement.,Last Action:05/24/2018 | Governor Signed,1,"Rep. C. Hansen, Rep. D. Esgar, Sen. J. Kefalas, Sen. R. Baumgardner",Capital ConstructionState Government,2018 Regular Session,Type:Bill,2018-05-24
1218,HB18-1375,Revisor's Bill,/bills/hb18-1375,"Concerning the nonsubstantive revision of statutes in the Colorado Revised Statutes, as amended, and, in connection therewith, amending or repealing obsolete, imperfect, and inoperative law to preserve the legislative intent, effect, and meaning of the law.",Last Action:05/29/2018 | Governor Signed,1,"Rep. Y. Willett, Rep. P. Lee, Sen. B. Gardner",State Government,2018 Regular Session,Type:Bill,2018-05-29
